{
  "@odata.context": "https://lcdelevator.crm.dynamics.com/api/data/v9.2/$metadata#fsip_maintenancecontracts",
  "value": [
    {
      "@odata.etag": "W/\"126309631\"",
      "lcd_cancellationnotes": null,
      "fsip_po": null,
      "fsip_billingfrequency": null,
      "lcd_cat1annualprice": null,
      "fsip_expireson": null,
      "fsip_won@OData.Community.Display.V1.FormattedValue": "No",
      "fsip_won": false,
      "fsip_schedulinginprogress@OData.Community.Display.V1.FormattedValue": "No",
      "fsip_schedulinginprogress": false,
      "_fsip_sortbyaccount_value@OData.Community.Display.V1.FormattedValue": "Aecom Tishman",
      "_fsip_sortbyaccount_value": "5eedfb01-6be1-ee11-904c-000d3a59fe8f",
      "fsip_invoiced@OData.Community.Display.V1.FormattedValue": "$0.00",
      "fsip_invoiced": 0.0000000000,
      "fsip_currentannualamount_base": null,
      "fsip_currentcontractstartdate@OData.Community.Display.V1.FormattedValue": "12/16/2025",
      "fsip_currentcontractstartdate": "2025-12-16",
      "fsip_nextescalationdate": null,
      "fsip_billingstarton": null,
      "fsip_costs_base@OData.Community.Display.V1.FormattedValue": "$0.00",
      "fsip_costs_base": 0.0000000000,
      "fsip_nextcontractbillingdate": null,
      "fsip_4thyearescalation": null,
      "fsip_invoiced_date@OData.Community.Display.V1.FormattedValue": "1/12/2026 8:46 PM",
      "fsip_invoiced_date": "2026-01-12T20:46:52Z",
      "fsip_billingfrequencycode": null,
      "lcd_cat5fullloadprice": null,
      "_fsip_copydevicesfromcontract_value": null,
      "statecode@OData.Community.Display.V1.FormattedValue": "Active",
      "statecode": 0,
      "fsip_regulartimecbservice@OData.Community.Display.V1.FormattedValue": "No",
      "fsip_regulartimecbservice": false,
      "fsip_costs_date@OData.Community.Display.V1.FormattedValue": "1/12/2026 8:46 PM",
      "fsip_costs_date": "2026-01-12T20:46:52Z",
      "_fsip_copydevicesfrombuildinglocation_value": null,
      "lcd_originalcontractamount": null,
      "fsip_closedstatus": null,
      "_fsip_customerid_value@OData.Community.Display.V1.FormattedValue": "Aecom Tishman",
      "_fsip_customerid_value": "5eedfb01-6be1-ee11-904c-000d3a59fe8f",
      "fsip_contractservicelevelcode": null,
      "fsip_invoiceamount": null,
      "_modifiedby_value@OData.Community.Display.V1.FormattedValue": "# SCRIBE INTEGRATION",
      "_modifiedby_value": "910423db-6a8d-ef11-ac21-000d3a326f08",
      "modifiedon@OData.Community.Display.V1.FormattedValue": "12/31/2025 5:38 PM",
      "modifiedon": "2025-12-31T17:38:00Z",
      "lcd_cancelationnotifyoffice@OData.Community.Display.V1.FormattedValue": "No",
      "lcd_cancelationnotifyoffice": 802290001,
      "lcd_autorenewal@OData.Community.Display.V1.FormattedValue": "No",
      "lcd_autorenewal": 802290001,
      "fsip_billingnotecb": null,
      "fsip_lastinvoiced_state@OData.Community.Display.V1.FormattedValue": "1",
      "fsip_lastinvoiced_state": 1,
      "fsip_costs_state@OData.Community.Display.V1.FormattedValue": "1",
      "fsip_costs_state": 1,
      "fsip_percentageoramount": null,
      "fsip_escalationamount_base": null,
      "fsip_closecontract@OData.Community.Display.V1.FormattedValue": "No",
      "fsip_closecontract": false,
      "overriddencreatedon": null,
      "lcd_cat1annualbillable": null,
      "fsip_activemmr_date@OData.Community.Display.V1.FormattedValue": "1/12/2026 8:46 PM",
      "fsip_activemmr_date": "2026-01-12T20:46:52Z",
      "fsip_specialconditions": null,
      "fsip_currentcontractenddate@OData.Community.Display.V1.FormattedValue": "12/16/2026",
      "fsip_currentcontractenddate": "2026-12-16",
      "lcd_servicefrequencywords": "Monthly",
      "fsip_cleanpithoistwaycartops@OData.Community.Display.V1.FormattedValue": "No",
      "fsip_cleanpithoistwaycartops": false,
      "fsip_5thyearescalation": null,
      "fsip_totalcontract": null,
      "_owningteam_value": null,
      "fsip_autorenew@OData.Community.Display.V1.FormattedValue": "No",
      "fsip_autorenew": false,
      "fsip_escalationpercent": null,
      "exchangerate@OData.Community.Display.V1.FormattedValue": "1.0000000000",
      "exchangerate": 1.000000000000,
      "fsip_excludefromcontractescalations@OData.Community.Display.V1.FormattedValue": "No",
      "fsip_excludefromcontractescalations": false,
      "fsip_annualsafetytest@OData.Community.Display.V1.FormattedValue": "No",
      "fsip_annualsafetytest": false,
      "fsip_nextservicedate@OData.Community.Display.V1.FormattedValue": "2/16/2026",
      "fsip_nextservicedate": "2026-02-16T12:00:00Z",
      "fsip_onhold@OData.Community.Display.V1.FormattedValue": "No",
      "fsip_onhold": false,
      "fsip_currentannualamount": null,
      "_createdby_value@OData.Community.Display.V1.FormattedValue": "Barbara Oliveira",
      "_createdby_value": "554d6842-59b6-ef11-b8e9-000d3a5a6b66",
      "fsip_activemmr_state@OData.Community.Display.V1.FormattedValue": "1",
      "fsip_activemmr_state": 1,
      "fsip_2ndyearescalation": null,
      "_fsip_wagecategory_value": null,
      "fsip_maintenancecontractid": "5167d74b-71db-f011-8544-000d3a302e4a",
      "fsip_contractreviewdate": null,
      "fsip_lastinvoicerollup_state@OData.Community.Display.V1.FormattedValue": "0",
      "fsip_lastinvoicerollup_state": 0,
      "fsip_invoiced_state@OData.Community.Display.V1.FormattedValue": "1",
      "fsip_invoiced_state": 1,
      "fsip_2ndyearescalation_base": null,
      "fsip_5thyearescalation_base": null,
      "fsip_proratedequipment": null,
      "_fsip_originatingcontract_value": null,
      "lcd_runcancelflow@OData.Community.Display.V1.FormattedValue": "No",
      "lcd_runcancelflow": 802290001,
      "fsip_nextbillingdate": null,
      "lcd_createcontractbilling": null,
      "fsip_lastinvoicerollup": null,
      "fsip_billingnote": null,
      "_fsip_salesperson_value@OData.Community.Display.V1.FormattedValue": "Barbara Oliveira",
      "_fsip_salesperson_value": "554d6842-59b6-ef11-b8e9-000d3a5a6b66",
      "fsip_invoiceconsolidationtype@OData.Community.Display.V1.FormattedValue": "No Consolidation",
      "fsip_invoiceconsolidationtype": 683440000,
      "fsip_4thyearescalation_base": null,
      "_fsip_billtocustomer_value@OData.Community.Display.V1.FormattedValue": "Aecom Tishman",
      "_fsip_billtocustomer_value": "5eedfb01-6be1-ee11-904c-000d3a59fe8f",
      "fsip_costs@OData.Community.Display.V1.FormattedValue": "$0.00",
      "fsip_costs": 0.0000000000,
      "_owningbusinessunit_value@OData.Community.Display.V1.FormattedValue": "LCD Elevator",
      "_owningbusinessunit_value": "c9e85d8b-8fa0-ec11-b400-000d3a58d68e",
      "fsip_legacycontract": null,
      "fsip_printbillingnote@OData.Community.Display.V1.FormattedValue": "Yes",
      "fsip_printbillingnote": true,
      "timezoneruleversionnumber@OData.Community.Display.V1.FormattedValue": "4",
      "timezoneruleversionnumber": 4,
      "fsip_grossmargin@OData.Community.Display.V1.FormattedValue": "$0.00",
      "fsip_grossmargin": 0.0000000000,
      "fsip_payssafetyequipment": null,
      "_ownerid_value@OData.Community.Display.V1.FormattedValue": "Barbara Oliveira",
      "_ownerid_value": "554d6842-59b6-ef11-b8e9-000d3a5a6b66",
      "_fsip_primarybuildinglocation_value@OData.Community.Display.V1.FormattedValue": "255 East 39 St aka 729 2nd Ave",
      "_fsip_primarybuildinglocation_value": "17b36a72-6be1-ee11-904c-000d3a59fe8f",
      "fsip_lastinvoiced_date@OData.Community.Display.V1.FormattedValue": "1/12/2026 8:46 PM",
      "fsip_lastinvoiced_date": "2026-01-12T20:46:52Z",
      "fsip_invoiced_base@OData.Community.Display.V1.FormattedValue": "$0.00",
      "fsip_invoiced_base": 0.0000000000,
      "importsequencenumber": null,
      "fsip_escalationamount": null,
      "fsip_1styearescalation_base": null,
      "_owninguser_value": "554d6842-59b6-ef11-b8e9-000d3a5a6b66",
      "_transactioncurrencyid_value@OData.Community.Display.V1.FormattedValue": "US Dollar",
      "_transactioncurrencyid_value": "28c060c5-d1a0-ec11-b400-000d3a58d68e",
      "_fsip_productcb_value": null,
      "fsip_visitfrequency@OData.Community.Display.V1.FormattedValue": "30",
      "fsip_visitfrequency": 683440000,
      "fsip_3rdyearescalation_base": null,
      "_fsip_project_value": null,
      "_fsip_division_value@OData.Community.Display.V1.FormattedValue": "Maintenance",
      "_fsip_division_value": "9316e0ff-55a5-ec11-9840-000d3a5c16ba",
      "_fsip_contracttype_value@OData.Community.Display.V1.FormattedValue": "Free Maintenance (Warranty)",
      "_fsip_contracttype_value": "fd3ce9c0-42a9-ec11-9840-000d3a307669",
      "fsip_sendescalationletter@OData.Community.Display.V1.FormattedValue": "No",
      "fsip_sendescalationletter": false,
      "lcd_braketestprice": null,
      "utcconversiontimezonecode": null,
      "_createdonbehalfby_value": null,
      "fsip_numberofvisits": "1",
      "fsip_totalcontract_base": null,
      "fsip_grossmarginpercent": null,
      "fsip_certificateofinsurance@OData.Community.Display.V1.FormattedValue": "No",
      "fsip_certificateofinsurance": false,
      "fsip_permitfeesbillable@OData.Community.Display.V1.FormattedValue": "No",
      "fsip_permitfeesbillable": false,
      "fsip_billingendon": null,
      "fsip_lastinvoiced": null,
      "fsip_internalnote": null,
      "fsip_escalationfrequency": null,
      "fsip_name": "255 East 39 St aka 729 2nd Ave",
      "fsip_workorderconsolidationtype@OData.Community.Display.V1.FormattedValue": "By Contract",
      "fsip_workorderconsolidationtype": 683440000,
      "fsip_addalldevicescontractbillings@OData.Community.Display.V1.FormattedValue": "No",
      "fsip_addalldevicescontractbillings": false,
      "fsip_lastescalationlettersent": null,
      "fsip_otminoradjustmentscbservice@OData.Community.Display.V1.FormattedValue": "No",
      "fsip_otminoradjustmentscbservice": false,
      "fsip_duration": null,
      "lcd_daystoexpire@OData.Community.Display.V1.FormattedValue": "-338.00",
      "lcd_daystoexpire": -338.0000000000,
      "fsip_3rdyearescalation": null,
      "fsip_invoicingmethod@OData.Community.Display.V1.FormattedValue": "Work Order Billing",
      "fsip_invoicingmethod": 683440001,
      "lcd_cat5fullloadbillable": null,
      "fsip_cancelon": null,
      "fsip_originalcontractstartdate@OData.Community.Display.V1.FormattedValue": "12/16/2025",
      "fsip_originalcontractstartdate": "2025-12-16",
      "fsip_contractnumber": "MC-0003164",
      "fsip_exclusions": null,
      "_fsip_product_value": null,
      "fsip_quantity": null,
      "fsip_usediscountaspercentage@OData.Community.Display.V1.FormattedValue": "Amount",
      "fsip_usediscountaspercentage": false,
      "fsip_contractlanguage": null,
      "fsip_currentcontractyear": null,
      "lcd_originalcontractamount_base": null,
      "_modifiedonbehalfby_value": null,
      "fsip_fiveyearsafetytest@OData.Community.Display.V1.FormattedValue": "No",
      "fsip_fiveyearsafetytest": false,
      "fsip_closedate": null,
      "fsip_invoiceamount_base": null,
      "versionnumber@OData.Community.Display.V1.FormattedValue": "126,309,631",
      "versionnumber": 126309631,
      "fsip_description": null,
      "fsip_activeon": null,
      "fsip_billingenddate": null,
      "fsip_activemmr_base@OData.Community.Display.V1.FormattedValue": "$0.00",
      "fsip_activemmr_base": 0.0000000000,
      "statuscode@OData.Community.Display.V1.FormattedValue": "Active",
      "statuscode": 683440001,
      "fsip_testbillable@OData.Community.Display.V1.FormattedValue": "No",
      "fsip_testbillable": false,
      "createdon@OData.Community.Display.V1.FormattedValue": "12/17/2025 5:53 PM",
      "createdon": "2025-12-17T17:53:33Z",
      "fsip_holdnote": null,
      "fsip_grossmargin_base@OData.Community.Display.V1.FormattedValue": "$0.00",
      "fsip_grossmargin_base": 0.0000000000,
      "_fsip_serviceaddress_value": null,
      "fsip_activemmr@OData.Community.Display.V1.FormattedValue": "$0.00",
      "fsip_activemmr": 0.0000000000,
      "lcd_braketestbillable": null,
      "fsip_1styearescalation": null,
      "fsip_currentactualprofitpercent": null,
      "fsip_lastinvoicerollup_date@OData.Community.Display.V1.FormattedValue": "1/12/2026 8:46 PM",
      "fsip_lastinvoicerollup_date": "2026-01-12T20:46:52Z",
      "fsip_billinginprogress@OData.Community.Display.V1.FormattedValue": "No",
      "fsip_billinginprogress": false
    },
    {
      "@odata.etag": "W/\"126384495\"",
      "lcd_cancellationnotes": null,
      "fsip_po": null,
      "fsip_billingfrequency": null,
      "lcd_cat1annualprice": null,
      "fsip_expireson": null,
      "fsip_won@OData.Community.Display.V1.FormattedValue": "No",
      "fsip_won": false,
      "fsip_schedulinginprogress@OData.Community.Display.V1.FormattedValue": "No",
      "fsip_schedulinginprogress": false,
      "_fsip_sortbyaccount_value@OData.Community.Display.V1.FormattedValue": "BLDG Management Company, Inc.",
      "_fsip_sortbyaccount_value": "8c0f9b18-45a9-ec11-9840-000d3a307669",
      "fsip_invoiced@OData.Community.Display.V1.FormattedValue": "$364.00",
      "fsip_invoiced": 364.0000000000,
      "fsip_currentannualamount_base": null,
      "fsip_currentcontractstartdate@OData.Community.Display.V1.FormattedValue": "1/1/2026",
      "fsip_currentcontractstartdate": "2026-01-01",
      "fsip_nextescalationdate": null,
      "fsip_billingstarton": null,
      "fsip_costs_base@OData.Community.Display.V1.FormattedValue": "$0.00",
      "fsip_costs_base": 0.0000000000,
      "fsip_nextcontractbillingdate@OData.Community.Display.V1.FormattedValue": "2/1/2026",
      "fsip_nextcontractbillingdate": "2026-02-01",
      "fsip_4thyearescalation": null,
      "fsip_invoiced_date@OData.Community.Display.V1.FormattedValue": "1/12/2026 8:46 PM",
      "fsip_invoiced_date": "2026-01-12T20:46:52Z",
      "fsip_billingfrequencycode": null,
      "lcd_cat5fullloadprice": null,
      "_fsip_copydevicesfromcontract_value": null,
      "statecode@OData.Community.Display.V1.FormattedValue": "Active",
      "statecode": 0,
      "fsip_regulartimecbservice@OData.Community.Display.V1.FormattedValue": "No",
      "fsip_regulartimecbservice": false,
      "fsip_costs_date@OData.Community.Display.V1.FormattedValue": "1/12/2026 8:46 PM",
      "fsip_costs_date": "2026-01-12T20:46:52Z",
      "_fsip_copydevicesfrombuildinglocation_value": null,
      "lcd_originalcontractamount": null,
      "fsip_closedstatus": null,
      "_fsip_customerid_value@OData.Community.Display.V1.FormattedValue": "BLDG Management Company, Inc.",
      "_fsip_customerid_value": "8c0f9b18-45a9-ec11-9840-000d3a307669",
      "fsip_contractservicelevelcode": null,
      "fsip_invoiceamount": null,
      "_modifiedby_value@OData.Community.Display.V1.FormattedValue": "# SCRIBE INTEGRATION",
      "_modifiedby_value": "910423db-6a8d-ef11-ac21-000d3a326f08",
      "modifiedon@OData.Community.Display.V1.FormattedValue": "1/5/2026 2:54 PM",
      "modifiedon": "2026-01-05T14:54:12Z",
      "lcd_cancelationnotifyoffice@OData.Community.Display.V1.FormattedValue": "No",
      "lcd_cancelationnotifyoffice": 802290001,
      "lcd_autorenewal@OData.Community.Display.V1.FormattedValue": "Yes",
      "lcd_autorenewal": 802290000,
      "fsip_billingnotecb": null,
      "fsip_lastinvoiced_state@OData.Community.Display.V1.FormattedValue": "1",
      "fsip_lastinvoiced_state": 1,
      "fsip_costs_state@OData.Community.Display.V1.FormattedValue": "1",
      "fsip_costs_state": 1,
      "fsip_percentageoramount": null,
      "fsip_escalationamount_base": null,
      "fsip_closecontract@OData.Community.Display.V1.FormattedValue": "No",
      "fsip_closecontract": false,
      "overriddencreatedon": null,
      "lcd_cat1annualbillable@OData.Community.Display.V1.FormattedValue": "No",
      "lcd_cat1annualbillable": 802290001,
      "fsip_activemmr_date@OData.Community.Display.V1.FormattedValue": "1/12/2026 8:46 PM",
      "fsip_activemmr_date": "2026-01-12T20:46:52Z",
      "fsip_specialconditions": null,
      "fsip_currentcontractenddate@OData.Community.Display.V1.FormattedValue": "1/1/2027",
      "fsip_currentcontractenddate": "2027-01-01",
      "lcd_servicefrequencywords": "Monthly",
      "fsip_cleanpithoistwaycartops@OData.Community.Display.V1.FormattedValue": "No",
      "fsip_cleanpithoistwaycartops": false,
      "fsip_5thyearescalation": null,
      "fsip_totalcontract": null,
      "_owningteam_value": null,
      "fsip_autorenew@OData.Community.Display.V1.FormattedValue": "No",
      "fsip_autorenew": false,
      "fsip_escalationpercent": null,
      "exchangerate@OData.Community.Display.V1.FormattedValue": "1.0000000000",
      "exchangerate": 1.000000000000,
      "fsip_excludefromcontractescalations@OData.Community.Display.V1.FormattedValue": "No",
      "fsip_excludefromcontractescalations": false,
      "fsip_annualsafetytest@OData.Community.Display.V1.FormattedValue": "No",
      "fsip_annualsafetytest": false,
      "fsip_nextservicedate@OData.Community.Display.V1.FormattedValue": "2/1/2026",
      "fsip_nextservicedate": "2026-02-01T12:00:00Z",
      "fsip_onhold@OData.Community.Display.V1.FormattedValue": "No",
      "fsip_onhold": false,
      "fsip_currentannualamount": null,
      "_createdby_value@OData.Community.Display.V1.FormattedValue": "Barbara Oliveira",
      "_createdby_value": "554d6842-59b6-ef11-b8e9-000d3a5a6b66",
      "fsip_activemmr_state@OData.Community.Display.V1.FormattedValue": "1",
      "fsip_activemmr_state": 1,
      "fsip_2ndyearescalation": null,
      "_fsip_wagecategory_value": null,
      "fsip_maintenancecontractid": "c0b3c688-1bdc-f011-8544-000d3a302e4a",
      "fsip_contractreviewdate": null,
      "fsip_lastinvoicerollup_state@OData.Community.Display.V1.FormattedValue": "1",
      "fsip_lastinvoicerollup_state": 1,
      "fsip_invoiced_state@OData.Community.Display.V1.FormattedValue": "1",
      "fsip_invoiced_state": 1,
      "fsip_2ndyearescalation_base": null,
      "fsip_5thyearescalation_base": null,
      "fsip_proratedequipment": null,
      "_fsip_originatingcontract_value": null,
      "lcd_runcancelflow@OData.Community.Display.V1.FormattedValue": "No",
      "lcd_runcancelflow": 802290001,
      "fsip_nextbillingdate": null,
      "lcd_createcontractbilling": null,
      "fsip_lastinvoicerollup@OData.Community.Display.V1.FormattedValue": "1/1/2026",
      "fsip_lastinvoicerollup": "2026-01-01",
      "fsip_billingnote": null,
      "_fsip_salesperson_value@OData.Community.Display.V1.FormattedValue": "Barbara Oliveira",
      "_fsip_salesperson_value": "554d6842-59b6-ef11-b8e9-000d3a5a6b66",
      "fsip_invoiceconsolidationtype@OData.Community.Display.V1.FormattedValue": "By Contract",
      "fsip_invoiceconsolidationtype": 683440002,
      "fsip_4thyearescalation_base": null,
      "_fsip_billtocustomer_value@OData.Community.Display.V1.FormattedValue": "BLDG Management Company, Inc.",
      "_fsip_billtocustomer_value": "8c0f9b18-45a9-ec11-9840-000d3a307669",
      "fsip_costs@OData.Community.Display.V1.FormattedValue": "$0.00",
      "fsip_costs": 0.0000000000,
      "_owningbusinessunit_value@OData.Community.Display.V1.FormattedValue": "LCD Elevator",
      "_owningbusinessunit_value": "c9e85d8b-8fa0-ec11-b400-000d3a58d68e",
      "fsip_legacycontract": null,
      "fsip_printbillingnote@OData.Community.Display.V1.FormattedValue": "Yes",
      "fsip_printbillingnote": true,
      "timezoneruleversionnumber@OData.Community.Display.V1.FormattedValue": "4",
      "timezoneruleversionnumber": 4,
      "fsip_grossmargin@OData.Community.Display.V1.FormattedValue": "$364.00",
      "fsip_grossmargin": 364.0000000000,
      "fsip_payssafetyequipment": null,
      "_ownerid_value@OData.Community.Display.V1.FormattedValue": "Barbara Oliveira",
      "_ownerid_value": "554d6842-59b6-ef11-b8e9-000d3a5a6b66",
      "_fsip_primarybuildinglocation_value@OData.Community.Display.V1.FormattedValue": "520 West 135th Street",
      "_fsip_primarybuildinglocation_value": "1f6574e1-a213-ef11-9f8a-6045bd0954f0",
      "fsip_lastinvoiced_date@OData.Community.Display.V1.FormattedValue": "1/12/2026 8:46 PM",
      "fsip_lastinvoiced_date": "2026-01-12T20:46:52Z",
      "fsip_invoiced_base@OData.Community.Display.V1.FormattedValue": "$364.00",
      "fsip_invoiced_base": 364.0000000000,
      "importsequencenumber": null,
      "fsip_escalationamount": null,
      "fsip_1styearescalation_base": null,
      "_owninguser_value": "554d6842-59b6-ef11-b8e9-000d3a5a6b66",
      "_transactioncurrencyid_value@OData.Community.Display.V1.FormattedValue": "US Dollar",
      "_transactioncurrencyid_value": "28c060c5-d1a0-ec11-b400-000d3a58d68e",
      "_fsip_productcb_value": null,
      "fsip_visitfrequency@OData.Community.Display.V1.FormattedValue": "30",
      "fsip_visitfrequency": 683440000,
      "fsip_3rdyearescalation_base": null,
      "_fsip_project_value": null,
      "_fsip_division_value@OData.Community.Display.V1.FormattedValue": "Maintenance",
      "_fsip_division_value": "9316e0ff-55a5-ec11-9840-000d3a5c16ba",
      "_fsip_contracttype_value@OData.Community.Display.V1.FormattedValue": "Limited Service w/ Insp.",
      "_fsip_contracttype_value": "f33ce9c0-42a9-ec11-9840-000d3a307669",
      "fsip_sendescalationletter@OData.Community.Display.V1.FormattedValue": "No",
      "fsip_sendescalationletter": false,
      "lcd_braketestprice": null,
      "utcconversiontimezonecode": null,
      "_createdonbehalfby_value": null,
      "fsip_numberofvisits": "1",
      "fsip_totalcontract_base": null,
      "fsip_grossmarginpercent@OData.Community.Display.V1.FormattedValue": "100.00",
      "fsip_grossmarginpercent": 100.00,
      "fsip_certificateofinsurance@OData.Community.Display.V1.FormattedValue": "No",
      "fsip_certificateofinsurance": false,
      "fsip_permitfeesbillable@OData.Community.Display.V1.FormattedValue": "No",
      "fsip_permitfeesbillable": false,
      "fsip_billingendon": null,
      "fsip_lastinvoiced@OData.Community.Display.V1.FormattedValue": "1/5/2026",
      "fsip_lastinvoiced": "2026-01-05T12:56:43Z",
      "fsip_internalnote": null,
      "fsip_escalationfrequency": null,
      "fsip_name": "520 West 135th Street",
      "fsip_workorderconsolidationtype@OData.Community.Display.V1.FormattedValue": "By Contract",
      "fsip_workorderconsolidationtype": 683440000,
      "fsip_addalldevicescontractbillings@OData.Community.Display.V1.FormattedValue": "No",
      "fsip_addalldevicescontractbillings": false,
      "fsip_lastescalationlettersent": null,
      "fsip_otminoradjustmentscbservice@OData.Community.Display.V1.FormattedValue": "No",
      "fsip_otminoradjustmentscbservice": false,
      "fsip_duration": null,
      "lcd_daystoexpire@OData.Community.Display.V1.FormattedValue": "-354.00",
      "lcd_daystoexpire": -354.0000000000,
      "fsip_3rdyearescalation": null,
      "fsip_invoicingmethod@OData.Community.Display.V1.FormattedValue": "Work Order Billing",
      "fsip_invoicingmethod": 683440001,
      "lcd_cat5fullloadbillable@OData.Community.Display.V1.FormattedValue": "No",
      "lcd_cat5fullloadbillable": 802290001,
      "fsip_cancelon": null,
      "fsip_originalcontractstartdate@OData.Community.Display.V1.FormattedValue": "1/1/2026",
      "fsip_originalcontractstartdate": "2026-01-01",
      "fsip_contractnumber": "MC-0003165",
      "fsip_exclusions": null,
      "_fsip_product_value": null,
      "fsip_quantity": null,
      "fsip_usediscountaspercentage@OData.Community.Display.V1.FormattedValue": "Amount",
      "fsip_usediscountaspercentage": false,
      "fsip_contractlanguage": null,
      "fsip_currentcontractyear": null,
      "lcd_originalcontractamount_base": null,
      "_modifiedonbehalfby_value": null,
      "fsip_fiveyearsafetytest@OData.Community.Display.V1.FormattedValue": "No",
      "fsip_fiveyearsafetytest": false,
      "fsip_closedate": null,
      "fsip_invoiceamount_base": null,
      "versionnumber@OData.Community.Display.V1.FormattedValue": "126,384,495",
      "versionnumber": 126384495,
      "fsip_description": null,
      "fsip_activeon": null,
      "fsip_billingenddate": null,
      "fsip_activemmr_base@OData.Community.Display.V1.FormattedValue": "$364.00",
      "fsip_activemmr_base": 364.0000000000,
      "statuscode@OData.Community.Display.V1.FormattedValue": "Active",
      "statuscode": 683440001,
      "fsip_testbillable@OData.Community.Display.V1.FormattedValue": "No",
      "fsip_testbillable": false,
      "createdon@OData.Community.Display.V1.FormattedValue": "12/18/2025 2:12 PM",
      "createdon": "2025-12-18T14:12:17Z",
      "fsip_holdnote": null,
      "fsip_grossmargin_base@OData.Community.Display.V1.FormattedValue": "$364.00",
      "fsip_grossmargin_base": 364.0000000000,
      "_fsip_serviceaddress_value": null,
      "fsip_activemmr@OData.Community.Display.V1.FormattedValue": "$364.00",
      "fsip_activemmr": 364.0000000000,
      "lcd_braketestbillable@OData.Community.Display.V1.FormattedValue": "No",
      "lcd_braketestbillable": 802290001,
      "fsip_1styearescalation": null,
      "fsip_currentactualprofitpercent": null,
      "fsip_lastinvoicerollup_date@OData.Community.Display.V1.FormattedValue": "1/12/2026 8:46 PM",
      "fsip_lastinvoicerollup_date": "2026-01-12T20:46:52Z",
      "fsip_billinginprogress@OData.Community.Display.V1.FormattedValue": "No",
      "fsip_billinginprogress": false
    },
    {
      "@odata.etag": "W/\"126631912\"",
      "lcd_cancellationnotes": null,
      "fsip_po": null,
      "fsip_billingfrequency": null,
      "lcd_cat1annualprice": null,
      "fsip_expireson": null,
      "fsip_won@OData.Community.Display.V1.FormattedValue": "No",
      "fsip_won": false,
      "fsip_schedulinginprogress@OData.Community.Display.V1.FormattedValue": "No",
      "fsip_schedulinginprogress": false,
      "_fsip_sortbyaccount_value@OData.Community.Display.V1.FormattedValue": "Extell Hudson Waterfront LLC",
      "_fsip_sortbyaccount_value": "b1f81705-3b42-f011-b4ca-6045bd037c5a",
      "fsip_invoiced@OData.Community.Display.V1.FormattedValue": "$0.00",
      "fsip_invoiced": 0.0000000000,
      "fsip_currentannualamount_base": null,
      "fsip_currentcontractstartdate@OData.Community.Display.V1.FormattedValue": "6/1/2025",
      "fsip_currentcontractstartdate": "2025-06-01",
      "fsip_nextescalationdate": null,
      "fsip_billingstarton": null,
      "fsip_costs_base@OData.Community.Display.V1.FormattedValue": "$0.00",
      "fsip_costs_base": 0.0000000000,
      "fsip_nextcontractbillingdate": null,
      "fsip_4thyearescalation": null,
      "fsip_invoiced_date@OData.Community.Display.V1.FormattedValue": "1/12/2026 8:46 PM",
      "fsip_invoiced_date": "2026-01-12T20:46:52Z",
      "fsip_billingfrequencycode": null,
      "lcd_cat5fullloadprice": null,
      "_fsip_copydevicesfromcontract_value": null,
      "statecode@OData.Community.Display.V1.FormattedValue": "Active",
      "statecode": 0,
      "fsip_regulartimecbservice@OData.Community.Display.V1.FormattedValue": "No",
      "fsip_regulartimecbservice": false,
      "fsip_costs_date@OData.Community.Display.V1.FormattedValue": "1/12/2026 8:46 PM",
      "fsip_costs_date": "2026-01-12T20:46:52Z",
      "_fsip_copydevicesfrombuildinglocation_value": null,
      "lcd_originalcontractamount": null,
      "fsip_closedstatus": null,
      "_fsip_customerid_value@OData.Community.Display.V1.FormattedValue": "Extell Hudson Waterfront LLC",
      "_fsip_customerid_value": "b1f81705-3b42-f011-b4ca-6045bd037c5a",
      "fsip_contractservicelevelcode": null,
      "fsip_invoiceamount": null,
      "_modifiedby_value@OData.Community.Display.V1.FormattedValue": "# SCRIBE INTEGRATION",
      "_modifiedby_value": "910423db-6a8d-ef11-ac21-000d3a326f08",
      "modifiedon@OData.Community.Display.V1.FormattedValue": "1/8/2026 3:37 PM",
      "modifiedon": "2026-01-08T15:37:07Z",
      "lcd_cancelationnotifyoffice@OData.Community.Display.V1.FormattedValue": "No",
      "lcd_cancelationnotifyoffice": 802290001,
      "lcd_autorenewal@OData.Community.Display.V1.FormattedValue": "No",
      "lcd_autorenewal": 802290001,
      "fsip_billingnotecb": null,
      "fsip_lastinvoiced_state@OData.Community.Display.V1.FormattedValue": "1",
      "fsip_lastinvoiced_state": 1,
      "fsip_costs_state@OData.Community.Display.V1.FormattedValue": "1",
      "fsip_costs_state": 1,
      "fsip_percentageoramount": null,
      "fsip_escalationamount_base": null,
      "fsip_closecontract@OData.Community.Display.V1.FormattedValue": "No",
      "fsip_closecontract": false,
      "overriddencreatedon": null,
      "lcd_cat1annualbillable": null,
      "fsip_activemmr_date@OData.Community.Display.V1.FormattedValue": "1/12/2026 8:46 PM",
      "fsip_activemmr_date": "2026-01-12T20:46:52Z",
      "fsip_specialconditions": null,
      "fsip_currentcontractenddate@OData.Community.Display.V1.FormattedValue": "6/1/2026",
      "fsip_currentcontractenddate": "2026-06-01",
      "lcd_servicefrequencywords": "Monthly",
      "fsip_cleanpithoistwaycartops@OData.Community.Display.V1.FormattedValue": "No",
      "fsip_cleanpithoistwaycartops": false,
      "fsip_5thyearescalation": null,
      "fsip_totalcontract": null,
      "_owningteam_value": null,
      "fsip_autorenew@OData.Community.Display.V1.FormattedValue": "No",
      "fsip_autorenew": false,
      "fsip_escalationpercent": null,
      "exchangerate@OData.Community.Display.V1.FormattedValue": "1.0000000000",
      "exchangerate": 1.000000000000,
      "fsip_excludefromcontractescalations@OData.Community.Display.V1.FormattedValue": "No",
      "fsip_excludefromcontractescalations": false,
      "fsip_annualsafetytest@OData.Community.Display.V1.FormattedValue": "No",
      "fsip_annualsafetytest": false,
      "fsip_nextservicedate@OData.Community.Display.V1.FormattedValue": "2/1/2026",
      "fsip_nextservicedate": "2026-02-01T12:00:00Z",
      "fsip_onhold@OData.Community.Display.V1.FormattedValue": "No",
      "fsip_onhold": false,
      "fsip_currentannualamount": null,
      "_createdby_value@OData.Community.Display.V1.FormattedValue": "Barbara Oliveira",
      "_createdby_value": "554d6842-59b6-ef11-b8e9-000d3a5a6b66",
      "fsip_activemmr_state@OData.Community.Display.V1.FormattedValue": "1",
      "fsip_activemmr_state": 1,
      "fsip_2ndyearescalation": null,
      "_fsip_wagecategory_value": null,
      "fsip_maintenancecontractid": "9d429dbb-28dc-f011-8544-000d3a302e4a",
      "fsip_contractreviewdate": null,
      "fsip_lastinvoicerollup_state@OData.Community.Display.V1.FormattedValue": "0",
      "fsip_lastinvoicerollup_state": 0,
      "fsip_invoiced_state@OData.Community.Display.V1.FormattedValue": "1",
      "fsip_invoiced_state": 1,
      "fsip_2ndyearescalation_base": null,
      "fsip_5thyearescalation_base": null,
      "fsip_proratedequipment": null,
      "_fsip_originatingcontract_value": null,
      "lcd_runcancelflow@OData.Community.Display.V1.FormattedValue": "No",
      "lcd_runcancelflow": 802290001,
      "fsip_nextbillingdate": null,
      "lcd_createcontractbilling": null,
      "fsip_lastinvoicerollup": null,
      "fsip_billingnote": null,
      "_fsip_salesperson_value": null,
      "fsip_invoiceconsolidationtype@OData.Community.Display.V1.FormattedValue": "By Customer",
      "fsip_invoiceconsolidationtype": 683440003,
      "fsip_4thyearescalation_base": null,
      "_fsip_billtocustomer_value@OData.Community.Display.V1.FormattedValue": "Extell Hudson Waterfront LLC",
      "_fsip_billtocustomer_value": "b1f81705-3b42-f011-b4ca-6045bd037c5a",
      "fsip_costs@OData.Community.Display.V1.FormattedValue": "$0.00",
      "fsip_costs": 0.0000000000,
      "_owningbusinessunit_value@OData.Community.Display.V1.FormattedValue": "LCD Elevator",
      "_owningbusinessunit_value": "c9e85d8b-8fa0-ec11-b400-000d3a58d68e",
      "fsip_legacycontract": null,
      "fsip_printbillingnote@OData.Community.Display.V1.FormattedValue": "Yes",
      "fsip_printbillingnote": true,
      "timezoneruleversionnumber@OData.Community.Display.V1.FormattedValue": "4",
      "timezoneruleversionnumber": 4,
      "fsip_grossmargin@OData.Community.Display.V1.FormattedValue": "$0.00",
      "fsip_grossmargin": 0.0000000000,
      "fsip_payssafetyequipment": null,
      "_ownerid_value@OData.Community.Display.V1.FormattedValue": "Barbara Oliveira",
      "_ownerid_value": "554d6842-59b6-ef11-b8e9-000d3a5a6b66",
      "_fsip_primarybuildinglocation_value@OData.Community.Display.V1.FormattedValue": "45 Riverside Drive aka 159 Alexander Street (Pointe Street Landing)",
      "_fsip_primarybuildinglocation_value": "5e756810-27dc-f011-8544-000d3a302e4a",
      "fsip_lastinvoiced_date@OData.Community.Display.V1.FormattedValue": "1/12/2026 8:46 PM",
      "fsip_lastinvoiced_date": "2026-01-12T20:46:52Z",
      "fsip_invoiced_base@OData.Community.Display.V1.FormattedValue": "$0.00",
      "fsip_invoiced_base": 0.0000000000,
      "importsequencenumber": null,
      "fsip_escalationamount": null,
      "fsip_1styearescalation_base": null,
      "_owninguser_value": "554d6842-59b6-ef11-b8e9-000d3a5a6b66",
      "_transactioncurrencyid_value@OData.Community.Display.V1.FormattedValue": "US Dollar",
      "_transactioncurrencyid_value": "28c060c5-d1a0-ec11-b400-000d3a58d68e",
      "_fsip_productcb_value": null,
      "fsip_visitfrequency@OData.Community.Display.V1.FormattedValue": "30",
      "fsip_visitfrequency": 683440000,
      "fsip_3rdyearescalation_base": null,
      "_fsip_project_value": null,
      "_fsip_division_value@OData.Community.Display.V1.FormattedValue": "Maintenance",
      "_fsip_division_value": "9316e0ff-55a5-ec11-9840-000d3a5c16ba",
      "_fsip_contracttype_value@OData.Community.Display.V1.FormattedValue": "Free Maintenance (Warranty)",
      "_fsip_contracttype_value": "fd3ce9c0-42a9-ec11-9840-000d3a307669",
      "fsip_sendescalationletter@OData.Community.Display.V1.FormattedValue": "No",
      "fsip_sendescalationletter": false,
      "lcd_braketestprice": null,
      "utcconversiontimezonecode": null,
      "_createdonbehalfby_value": null,
      "fsip_numberofvisits": "1",
      "fsip_totalcontract_base": null,
      "fsip_grossmarginpercent": null,
      "fsip_certificateofinsurance@OData.Community.Display.V1.FormattedValue": "No",
      "fsip_certificateofinsurance": false,
      "fsip_permitfeesbillable@OData.Community.Display.V1.FormattedValue": "No",
      "fsip_permitfeesbillable": false,
      "fsip_billingendon": null,
      "fsip_lastinvoiced": null,
      "fsip_internalnote": null,
      "fsip_escalationfrequency": null,
      "fsip_name": "45 Riverside Drive aka 159 Alexander Street",
      "fsip_workorderconsolidationtype@OData.Community.Display.V1.FormattedValue": "By Contract",
      "fsip_workorderconsolidationtype": 683440000,
      "fsip_addalldevicescontractbillings@OData.Community.Display.V1.FormattedValue": "No",
      "fsip_addalldevicescontractbillings": false,
      "fsip_lastescalationlettersent": null,
      "fsip_otminoradjustmentscbservice@OData.Community.Display.V1.FormattedValue": "No",
      "fsip_otminoradjustmentscbservice": false,
      "fsip_duration": null,
      "lcd_daystoexpire@OData.Community.Display.V1.FormattedValue": "-140.00",
      "lcd_daystoexpire": -140.0000000000,
      "fsip_3rdyearescalation": null,
      "fsip_invoicingmethod@OData.Community.Display.V1.FormattedValue": "Work Order Billing",
      "fsip_invoicingmethod": 683440001,
      "lcd_cat5fullloadbillable": null,
      "fsip_cancelon": null,
      "fsip_originalcontractstartdate@OData.Community.Display.V1.FormattedValue": "6/1/2025",
      "fsip_originalcontractstartdate": "2025-06-01",
      "fsip_contractnumber": "MC-0003166",
      "fsip_exclusions": null,
      "_fsip_product_value": null,
      "fsip_quantity": null,
      "fsip_usediscountaspercentage@OData.Community.Display.V1.FormattedValue": "Amount",
      "fsip_usediscountaspercentage": false,
      "fsip_contractlanguage": null,
      "fsip_currentcontractyear": null,
      "lcd_originalcontractamount_base": null,
      "_modifiedonbehalfby_value": null,
      "fsip_fiveyearsafetytest@OData.Community.Display.V1.FormattedValue": "No",
      "fsip_fiveyearsafetytest": false,
      "fsip_closedate": null,
      "fsip_invoiceamount_base": null,
      "versionnumber@OData.Community.Display.V1.FormattedValue": "126,631,912",
      "versionnumber": 126631912,
      "fsip_description": null,
      "fsip_activeon": null,
      "fsip_billingenddate": null,
      "fsip_activemmr_base@OData.Community.Display.V1.FormattedValue": "$0.00",
      "fsip_activemmr_base": 0.0000000000,
      "statuscode@OData.Community.Display.V1.FormattedValue": "Active",
      "statuscode": 683440001,
      "fsip_testbillable@OData.Community.Display.V1.FormattedValue": "No",
      "fsip_testbillable": false,
      "createdon@OData.Community.Display.V1.FormattedValue": "12/18/2025 3:46 PM",
      "createdon": "2025-12-18T15:46:42Z",
      "fsip_holdnote": null,
      "fsip_grossmargin_base@OData.Community.Display.V1.FormattedValue": "$0.00",
      "fsip_grossmargin_base": 0.0000000000,
      "_fsip_serviceaddress_value": null,
      "fsip_activemmr@OData.Community.Display.V1.FormattedValue": "$0.00",
      "fsip_activemmr": 0.0000000000,
      "lcd_braketestbillable": null,
      "fsip_1styearescalation": null,
      "fsip_currentactualprofitpercent": null,
      "fsip_lastinvoicerollup_date@OData.Community.Display.V1.FormattedValue": "1/12/2026 8:46 PM",
      "fsip_lastinvoicerollup_date": "2026-01-12T20:46:52Z",
      "fsip_billinginprogress@OData.Community.Display.V1.FormattedValue": "No",
      "fsip_billinginprogress": false
    },
    {
      "@odata.etag": "W/\"126631918\"",
      "lcd_cancellationnotes": null,
      "fsip_po": null,
      "fsip_billingfrequency": null,
      "lcd_cat1annualprice": null,
      "fsip_expireson": null,
      "fsip_won@OData.Community.Display.V1.FormattedValue": "No",
      "fsip_won": false,
      "fsip_schedulinginprogress@OData.Community.Display.V1.FormattedValue": "No",
      "fsip_schedulinginprogress": false,
      "_fsip_sortbyaccount_value@OData.Community.Display.V1.FormattedValue": "Prestige Management",
      "_fsip_sortbyaccount_value": "f1119b18-45a9-ec11-9840-000d3a307669",
      "fsip_invoiced@OData.Community.Display.V1.FormattedValue": "$1,124.00",
      "fsip_invoiced": 1124.0000000000,
      "fsip_currentannualamount_base": null,
      "fsip_currentcontractstartdate@OData.Community.Display.V1.FormattedValue": "1/1/2026",
      "fsip_currentcontractstartdate": "2026-01-01",
      "fsip_nextescalationdate": null,
      "fsip_billingstarton": null,
      "fsip_costs_base@OData.Community.Display.V1.FormattedValue": "$0.00",
      "fsip_costs_base": 0.0000000000,
      "fsip_nextcontractbillingdate@OData.Community.Display.V1.FormattedValue": "2/1/2026",
      "fsip_nextcontractbillingdate": "2026-02-01",
      "fsip_4thyearescalation": null,
      "fsip_invoiced_date@OData.Community.Display.V1.FormattedValue": "1/12/2026 8:46 PM",
      "fsip_invoiced_date": "2026-01-12T20:46:52Z",
      "fsip_billingfrequencycode": null,
      "lcd_cat5fullloadprice": null,
      "_fsip_copydevicesfromcontract_value": null,
      "statecode@OData.Community.Display.V1.FormattedValue": "Active",
      "statecode": 0,
      "fsip_regulartimecbservice@OData.Community.Display.V1.FormattedValue": "No",
      "fsip_regulartimecbservice": false,
      "fsip_costs_date@OData.Community.Display.V1.FormattedValue": "1/12/2026 8:46 PM",
      "fsip_costs_date": "2026-01-12T20:46:52Z",
      "_fsip_copydevicesfrombuildinglocation_value": null,
      "lcd_originalcontractamount": null,
      "fsip_closedstatus": null,
      "_fsip_customerid_value@OData.Community.Display.V1.FormattedValue": "Prestige Management",
      "_fsip_customerid_value": "f1119b18-45a9-ec11-9840-000d3a307669",
      "fsip_contractservicelevelcode": null,
      "fsip_invoiceamount": null,
      "_modifiedby_value@OData.Community.Display.V1.FormattedValue": "# SCRIBE INTEGRATION",
      "_modifiedby_value": "910423db-6a8d-ef11-ac21-000d3a326f08",
      "modifiedon@OData.Community.Display.V1.FormattedValue": "1/8/2026 3:37 PM",
      "modifiedon": "2026-01-08T15:37:04Z",
      "lcd_cancelationnotifyoffice@OData.Community.Display.V1.FormattedValue": "No",
      "lcd_cancelationnotifyoffice": 802290001,
      "lcd_autorenewal@OData.Community.Display.V1.FormattedValue": "Yes",
      "lcd_autorenewal": 802290000,
      "fsip_billingnotecb": null,
      "fsip_lastinvoiced_state@OData.Community.Display.V1.FormattedValue": "1",
      "fsip_lastinvoiced_state": 1,
      "fsip_costs_state@OData.Community.Display.V1.FormattedValue": "1",
      "fsip_costs_state": 1,
      "fsip_percentageoramount": null,
      "fsip_escalationamount_base": null,
      "fsip_closecontract@OData.Community.Display.V1.FormattedValue": "No",
      "fsip_closecontract": false,
      "overriddencreatedon": null,
      "lcd_cat1annualbillable@OData.Community.Display.V1.FormattedValue": "No",
      "lcd_cat1annualbillable": 802290001,
      "fsip_activemmr_date@OData.Community.Display.V1.FormattedValue": "1/12/2026 8:46 PM",
      "fsip_activemmr_date": "2026-01-12T20:46:52Z",
      "fsip_specialconditions": null,
      "fsip_currentcontractenddate@OData.Community.Display.V1.FormattedValue": "1/1/2027",
      "fsip_currentcontractenddate": "2027-01-01",
      "lcd_servicefrequencywords": "Monthly",
      "fsip_cleanpithoistwaycartops@OData.Community.Display.V1.FormattedValue": "No",
      "fsip_cleanpithoistwaycartops": false,
      "fsip_5thyearescalation": null,
      "fsip_totalcontract": null,
      "_owningteam_value": null,
      "fsip_autorenew@OData.Community.Display.V1.FormattedValue": "No",
      "fsip_autorenew": false,
      "fsip_escalationpercent": null,
      "exchangerate@OData.Community.Display.V1.FormattedValue": "1.0000000000",
      "exchangerate": 1.000000000000,
      "fsip_excludefromcontractescalations@OData.Community.Display.V1.FormattedValue": "No",
      "fsip_excludefromcontractescalations": false,
      "fsip_annualsafetytest@OData.Community.Display.V1.FormattedValue": "No",
      "fsip_annualsafetytest": false,
      "fsip_nextservicedate@OData.Community.Display.V1.FormattedValue": "2/1/2026",
      "fsip_nextservicedate": "2026-02-01T12:00:00Z",
      "fsip_onhold@OData.Community.Display.V1.FormattedValue": "No",
      "fsip_onhold": false,
      "fsip_currentannualamount": null,
      "_createdby_value@OData.Community.Display.V1.FormattedValue": "Barbara Oliveira",
      "_createdby_value": "554d6842-59b6-ef11-b8e9-000d3a5a6b66",
      "fsip_activemmr_state@OData.Community.Display.V1.FormattedValue": "1",
      "fsip_activemmr_state": 1,
      "fsip_2ndyearescalation": null,
      "_fsip_wagecategory_value": null,
      "fsip_maintenancecontractid": "75fe04d6-48ea-f011-8544-000d3a302e4a",
      "fsip_contractreviewdate": null,
      "fsip_lastinvoicerollup_state@OData.Community.Display.V1.FormattedValue": "1",
      "fsip_lastinvoicerollup_state": 1,
      "fsip_invoiced_state@OData.Community.Display.V1.FormattedValue": "1",
      "fsip_invoiced_state": 1,
      "fsip_2ndyearescalation_base": null,
      "fsip_5thyearescalation_base": null,
      "fsip_proratedequipment": null,
      "_fsip_originatingcontract_value": null,
      "lcd_runcancelflow@OData.Community.Display.V1.FormattedValue": "No",
      "lcd_runcancelflow": 802290001,
      "fsip_nextbillingdate": null,
      "lcd_createcontractbilling": null,
      "fsip_lastinvoicerollup@OData.Community.Display.V1.FormattedValue": "1/1/2026",
      "fsip_lastinvoicerollup": "2026-01-01",
      "fsip_billingnote": null,
      "_fsip_salesperson_value": null,
      "fsip_invoiceconsolidationtype@OData.Community.Display.V1.FormattedValue": "By Contract",
      "fsip_invoiceconsolidationtype": 683440002,
      "fsip_4thyearescalation_base": null,
      "_fsip_billtocustomer_value@OData.Community.Display.V1.FormattedValue": "Prestige Management",
      "_fsip_billtocustomer_value": "f1119b18-45a9-ec11-9840-000d3a307669",
      "fsip_costs@OData.Community.Display.V1.FormattedValue": "$0.00",
      "fsip_costs": 0.0000000000,
      "_owningbusinessunit_value@OData.Community.Display.V1.FormattedValue": "LCD Elevator",
      "_owningbusinessunit_value": "c9e85d8b-8fa0-ec11-b400-000d3a58d68e",
      "fsip_legacycontract": null,
      "fsip_printbillingnote@OData.Community.Display.V1.FormattedValue": "Yes",
      "fsip_printbillingnote": true,
      "timezoneruleversionnumber@OData.Community.Display.V1.FormattedValue": "4",
      "timezoneruleversionnumber": 4,
      "fsip_grossmargin@OData.Community.Display.V1.FormattedValue": "$1,124.00",
      "fsip_grossmargin": 1124.0000000000,
      "fsip_payssafetyequipment": null,
      "_ownerid_value@OData.Community.Display.V1.FormattedValue": "Barbara Oliveira",
      "_ownerid_value": "554d6842-59b6-ef11-b8e9-000d3a5a6b66",
      "_fsip_primarybuildinglocation_value@OData.Community.Display.V1.FormattedValue": "890 Trinity Avenue",
      "_fsip_primarybuildinglocation_value": "a97eb9e5-3eba-f011-bbd3-000d3a597798",
      "fsip_lastinvoiced_date@OData.Community.Display.V1.FormattedValue": "1/12/2026 8:46 PM",
      "fsip_lastinvoiced_date": "2026-01-12T20:46:52Z",
      "fsip_invoiced_base@OData.Community.Display.V1.FormattedValue": "$1,124.00",
      "fsip_invoiced_base": 1124.0000000000,
      "importsequencenumber": null,
      "fsip_escalationamount": null,
      "fsip_1styearescalation_base": null,
      "_owninguser_value": "554d6842-59b6-ef11-b8e9-000d3a5a6b66",
      "_transactioncurrencyid_value@OData.Community.Display.V1.FormattedValue": "US Dollar",
      "_transactioncurrencyid_value": "28c060c5-d1a0-ec11-b400-000d3a58d68e",
      "_fsip_productcb_value": null,
      "fsip_visitfrequency@OData.Community.Display.V1.FormattedValue": "30",
      "fsip_visitfrequency": 683440000,
      "fsip_3rdyearescalation_base": null,
      "_fsip_project_value": null,
      "_fsip_division_value@OData.Community.Display.V1.FormattedValue": "Maintenance",
      "_fsip_division_value": "9316e0ff-55a5-ec11-9840-000d3a5c16ba",
      "_fsip_contracttype_value@OData.Community.Display.V1.FormattedValue": "Limited Service w/ Insp.",
      "_fsip_contracttype_value": "f33ce9c0-42a9-ec11-9840-000d3a307669",
      "fsip_sendescalationletter@OData.Community.Display.V1.FormattedValue": "No",
      "fsip_sendescalationletter": false,
      "lcd_braketestprice": null,
      "utcconversiontimezonecode": null,
      "_createdonbehalfby_value": null,
      "fsip_numberofvisits": "1",
      "fsip_totalcontract_base": null,
      "fsip_grossmarginpercent@OData.Community.Display.V1.FormattedValue": "100.00",
      "fsip_grossmarginpercent": 100.00,
      "fsip_certificateofinsurance@OData.Community.Display.V1.FormattedValue": "No",
      "fsip_certificateofinsurance": false,
      "fsip_permitfeesbillable@OData.Community.Display.V1.FormattedValue": "No",
      "fsip_permitfeesbillable": false,
      "fsip_billingendon": null,
      "fsip_lastinvoiced@OData.Community.Display.V1.FormattedValue": "1/5/2026",
      "fsip_lastinvoiced": "2026-01-05T15:58:05Z",
      "fsip_internalnote": null,
      "fsip_escalationfrequency": null,
      "fsip_name": "890 Trinity Avenue",
      "fsip_workorderconsolidationtype@OData.Community.Display.V1.FormattedValue": "By Contract",
      "fsip_workorderconsolidationtype": 683440000,
      "fsip_addalldevicescontractbillings": null,
      "fsip_lastescalationlettersent": null,
      "fsip_otminoradjustmentscbservice@OData.Community.Display.V1.FormattedValue": "No",
      "fsip_otminoradjustmentscbservice": false,
      "fsip_duration": null,
      "lcd_daystoexpire@OData.Community.Display.V1.FormattedValue": "-354.00",
      "lcd_daystoexpire": -354.0000000000,
      "fsip_3rdyearescalation": null,
      "fsip_invoicingmethod@OData.Community.Display.V1.FormattedValue": "Work Order Billing",
      "fsip_invoicingmethod": 683440001,
      "lcd_cat5fullloadbillable@OData.Community.Display.V1.FormattedValue": "No",
      "lcd_cat5fullloadbillable": 802290001,
      "fsip_cancelon": null,
      "fsip_originalcontractstartdate@OData.Community.Display.V1.FormattedValue": "1/1/2026",
      "fsip_originalcontractstartdate": "2026-01-01",
      "fsip_contractnumber": "MC-0003173",
      "fsip_exclusions": null,
      "_fsip_product_value": null,
      "fsip_quantity": null,
      "fsip_usediscountaspercentage@OData.Community.Display.V1.FormattedValue": "Amount",
      "fsip_usediscountaspercentage": false,
      "fsip_contractlanguage": null,
      "fsip_currentcontractyear": null,
      "lcd_originalcontractamount_base": null,
      "_modifiedonbehalfby_value": null,
      "fsip_fiveyearsafetytest@OData.Community.Display.V1.FormattedValue": "No",
      "fsip_fiveyearsafetytest": false,
      "fsip_closedate": null,
      "fsip_invoiceamount_base": null,
      "versionnumber@OData.Community.Display.V1.FormattedValue": "126,631,918",
      "versionnumber": 126631918,
      "fsip_description": null,
      "fsip_activeon": null,
      "fsip_billingenddate": null,
      "fsip_activemmr_base@OData.Community.Display.V1.FormattedValue": "$1,124.00",
      "fsip_activemmr_base": 1124.0000000000,
      "statuscode@OData.Community.Display.V1.FormattedValue": "Active",
      "statuscode": 683440001,
      "fsip_testbillable@OData.Community.Display.V1.FormattedValue": "No",
      "fsip_testbillable": false,
      "createdon@OData.Community.Display.V1.FormattedValue": "1/5/2026 3:11 PM",
      "createdon": "2026-01-05T15:11:46Z",
      "fsip_holdnote": null,
      "fsip_grossmargin_base@OData.Community.Display.V1.FormattedValue": "$1,124.00",
      "fsip_grossmargin_base": 1124.0000000000,
      "_fsip_serviceaddress_value": null,
      "fsip_activemmr@OData.Community.Display.V1.FormattedValue": "$1,124.00",
      "fsip_activemmr": 1124.0000000000,
      "lcd_braketestbillable@OData.Community.Display.V1.FormattedValue": "No",
      "lcd_braketestbillable": 802290001,
      "fsip_1styearescalation": null,
      "fsip_currentactualprofitpercent": null,
      "fsip_lastinvoicerollup_date@OData.Community.Display.V1.FormattedValue": "1/12/2026 8:46 PM",
      "fsip_lastinvoicerollup_date": "2026-01-12T20:46:52Z",
      "fsip_billinginprogress@OData.Community.Display.V1.FormattedValue": "No",
      "fsip_billinginprogress": false
    },
    {
      "@odata.etag": "W/\"126631919\"",
      "lcd_cancellationnotes": null,
      "fsip_po": null,
      "fsip_billingfrequency": null,
      "lcd_cat1annualprice": null,
      "fsip_expireson": null,
      "fsip_won@OData.Community.Display.V1.FormattedValue": "No",
      "fsip_won": false,
      "fsip_schedulinginprogress@OData.Community.Display.V1.FormattedValue": "No",
      "fsip_schedulinginprogress": false,
      "_fsip_sortbyaccount_value@OData.Community.Display.V1.FormattedValue": "Prestige Management",
      "_fsip_sortbyaccount_value": "f1119b18-45a9-ec11-9840-000d3a307669",
      "fsip_invoiced@OData.Community.Display.V1.FormattedValue": "$1,124.00",
      "fsip_invoiced": 1124.0000000000,
      "fsip_currentannualamount_base": null,
      "fsip_currentcontractstartdate@OData.Community.Display.V1.FormattedValue": "1/1/2026",
      "fsip_currentcontractstartdate": "2026-01-01",
      "fsip_nextescalationdate": null,
      "fsip_billingstarton": null,
      "fsip_costs_base@OData.Community.Display.V1.FormattedValue": "$0.00",
      "fsip_costs_base": 0.0000000000,
      "fsip_nextcontractbillingdate@OData.Community.Display.V1.FormattedValue": "2/1/2026",
      "fsip_nextcontractbillingdate": "2026-02-01",
      "fsip_4thyearescalation": null,
      "fsip_invoiced_date@OData.Community.Display.V1.FormattedValue": "1/12/2026 8:46 PM",
      "fsip_invoiced_date": "2026-01-12T20:46:52Z",
      "fsip_billingfrequencycode": null,
      "lcd_cat5fullloadprice": null,
      "_fsip_copydevicesfromcontract_value": null,
      "statecode@OData.Community.Display.V1.FormattedValue": "Active",
      "statecode": 0,
      "fsip_regulartimecbservice@OData.Community.Display.V1.FormattedValue": "No",
      "fsip_regulartimecbservice": false,
      "fsip_costs_date@OData.Community.Display.V1.FormattedValue": "1/12/2026 8:46 PM",
      "fsip_costs_date": "2026-01-12T20:46:52Z",
      "_fsip_copydevicesfrombuildinglocation_value": null,
      "lcd_originalcontractamount": null,
      "fsip_closedstatus": null,
      "_fsip_customerid_value@OData.Community.Display.V1.FormattedValue": "Prestige Management",
      "_fsip_customerid_value": "f1119b18-45a9-ec11-9840-000d3a307669",
      "fsip_contractservicelevelcode": null,
      "fsip_invoiceamount": null,
      "_modifiedby_value@OData.Community.Display.V1.FormattedValue": "# SCRIBE INTEGRATION",
      "_modifiedby_value": "910423db-6a8d-ef11-ac21-000d3a326f08",
      "modifiedon@OData.Community.Display.V1.FormattedValue": "1/8/2026 3:37 PM",
      "modifiedon": "2026-01-08T15:37:06Z",
      "lcd_cancelationnotifyoffice@OData.Community.Display.V1.FormattedValue": "No",
      "lcd_cancelationnotifyoffice": 802290001,
      "lcd_autorenewal@OData.Community.Display.V1.FormattedValue": "Yes",
      "lcd_autorenewal": 802290000,
      "fsip_billingnotecb": null,
      "fsip_lastinvoiced_state@OData.Community.Display.V1.FormattedValue": "1",
      "fsip_lastinvoiced_state": 1,
      "fsip_costs_state@OData.Community.Display.V1.FormattedValue": "1",
      "fsip_costs_state": 1,
      "fsip_percentageoramount": null,
      "fsip_escalationamount_base": null,
      "fsip_closecontract@OData.Community.Display.V1.FormattedValue": "No",
      "fsip_closecontract": false,
      "overriddencreatedon": null,
      "lcd_cat1annualbillable@OData.Community.Display.V1.FormattedValue": "No",
      "lcd_cat1annualbillable": 802290001,
      "fsip_activemmr_date@OData.Community.Display.V1.FormattedValue": "1/12/2026 8:46 PM",
      "fsip_activemmr_date": "2026-01-12T20:46:52Z",
      "fsip_specialconditions": null,
      "fsip_currentcontractenddate@OData.Community.Display.V1.FormattedValue": "1/1/2027",
      "fsip_currentcontractenddate": "2027-01-01",
      "lcd_servicefrequencywords": "Monthly",
      "fsip_cleanpithoistwaycartops@OData.Community.Display.V1.FormattedValue": "No",
      "fsip_cleanpithoistwaycartops": false,
      "fsip_5thyearescalation": null,
      "fsip_totalcontract": null,
      "_owningteam_value": null,
      "fsip_autorenew@OData.Community.Display.V1.FormattedValue": "No",
      "fsip_autorenew": false,
      "fsip_escalationpercent": null,
      "exchangerate@OData.Community.Display.V1.FormattedValue": "1.0000000000",
      "exchangerate": 1.000000000000,
      "fsip_excludefromcontractescalations@OData.Community.Display.V1.FormattedValue": "No",
      "fsip_excludefromcontractescalations": false,
      "fsip_annualsafetytest@OData.Community.Display.V1.FormattedValue": "No",
      "fsip_annualsafetytest": false,
      "fsip_nextservicedate@OData.Community.Display.V1.FormattedValue": "2/1/2026",
      "fsip_nextservicedate": "2026-02-01T12:00:00Z",
      "fsip_onhold@OData.Community.Display.V1.FormattedValue": "No",
      "fsip_onhold": false,
      "fsip_currentannualamount": null,
      "_createdby_value@OData.Community.Display.V1.FormattedValue": "Barbara Oliveira",
      "_createdby_value": "554d6842-59b6-ef11-b8e9-000d3a5a6b66",
      "fsip_activemmr_state@OData.Community.Display.V1.FormattedValue": "1",
      "fsip_activemmr_state": 1,
      "fsip_2ndyearescalation": null,
      "_fsip_wagecategory_value": null,
      "fsip_maintenancecontractid": "baecde55-49ea-f011-8544-000d3a302e4a",
      "fsip_contractreviewdate": null,
      "fsip_lastinvoicerollup_state@OData.Community.Display.V1.FormattedValue": "1",
      "fsip_lastinvoicerollup_state": 1,
      "fsip_invoiced_state@OData.Community.Display.V1.FormattedValue": "1",
      "fsip_invoiced_state": 1,
      "fsip_2ndyearescalation_base": null,
      "fsip_5thyearescalation_base": null,
      "fsip_proratedequipment": null,
      "_fsip_originatingcontract_value": null,
      "lcd_runcancelflow@OData.Community.Display.V1.FormattedValue": "No",
      "lcd_runcancelflow": 802290001,
      "fsip_nextbillingdate": null,
      "lcd_createcontractbilling": null,
      "fsip_lastinvoicerollup@OData.Community.Display.V1.FormattedValue": "1/1/2026",
      "fsip_lastinvoicerollup": "2026-01-01",
      "fsip_billingnote": null,
      "_fsip_salesperson_value": null,
      "fsip_invoiceconsolidationtype@OData.Community.Display.V1.FormattedValue": "By Contract",
      "fsip_invoiceconsolidationtype": 683440002,
      "fsip_4thyearescalation_base": null,
      "_fsip_billtocustomer_value@OData.Community.Display.V1.FormattedValue": "Prestige Management",
      "_fsip_billtocustomer_value": "f1119b18-45a9-ec11-9840-000d3a307669",
      "fsip_costs@OData.Community.Display.V1.FormattedValue": "$0.00",
      "fsip_costs": 0.0000000000,
      "_owningbusinessunit_value@OData.Community.Display.V1.FormattedValue": "LCD Elevator",
      "_owningbusinessunit_value": "c9e85d8b-8fa0-ec11-b400-000d3a58d68e",
      "fsip_legacycontract": null,
      "fsip_printbillingnote@OData.Community.Display.V1.FormattedValue": "Yes",
      "fsip_printbillingnote": true,
      "timezoneruleversionnumber@OData.Community.Display.V1.FormattedValue": "4",
      "timezoneruleversionnumber": 4,
      "fsip_grossmargin@OData.Community.Display.V1.FormattedValue": "$1,124.00",
      "fsip_grossmargin": 1124.0000000000,
      "fsip_payssafetyequipment": null,
      "_ownerid_value@OData.Community.Display.V1.FormattedValue": "Barbara Oliveira",
      "_ownerid_value": "554d6842-59b6-ef11-b8e9-000d3a5a6b66",
      "_fsip_primarybuildinglocation_value@OData.Community.Display.V1.FormattedValue": "920 Trinity Avenue",
      "_fsip_primarybuildinglocation_value": "43ce4e32-b863-ef11-bfe3-000d3a316b4e",
      "fsip_lastinvoiced_date@OData.Community.Display.V1.FormattedValue": "1/12/2026 8:46 PM",
      "fsip_lastinvoiced_date": "2026-01-12T20:46:52Z",
      "fsip_invoiced_base@OData.Community.Display.V1.FormattedValue": "$1,124.00",
      "fsip_invoiced_base": 1124.0000000000,
      "importsequencenumber": null,
      "fsip_escalationamount": null,
      "fsip_1styearescalation_base": null,
      "_owninguser_value": "554d6842-59b6-ef11-b8e9-000d3a5a6b66",
      "_transactioncurrencyid_value@OData.Community.Display.V1.FormattedValue": "US Dollar",
      "_transactioncurrencyid_value": "28c060c5-d1a0-ec11-b400-000d3a58d68e",
      "_fsip_productcb_value": null,
      "fsip_visitfrequency@OData.Community.Display.V1.FormattedValue": "30",
      "fsip_visitfrequency": 683440000,
      "fsip_3rdyearescalation_base": null,
      "_fsip_project_value": null,
      "_fsip_division_value@OData.Community.Display.V1.FormattedValue": "Maintenance",
      "_fsip_division_value": "9316e0ff-55a5-ec11-9840-000d3a5c16ba",
      "_fsip_contracttype_value@OData.Community.Display.V1.FormattedValue": "Limited Service w/ Insp.",
      "_fsip_contracttype_value": "f33ce9c0-42a9-ec11-9840-000d3a307669",
      "fsip_sendescalationletter@OData.Community.Display.V1.FormattedValue": "No",
      "fsip_sendescalationletter": false,
      "lcd_braketestprice": null,
      "utcconversiontimezonecode": null,
      "_createdonbehalfby_value": null,
      "fsip_numberofvisits": "1",
      "fsip_totalcontract_base": null,
      "fsip_grossmarginpercent@OData.Community.Display.V1.FormattedValue": "100.00",
      "fsip_grossmarginpercent": 100.00,
      "fsip_certificateofinsurance@OData.Community.Display.V1.FormattedValue": "No",
      "fsip_certificateofinsurance": false,
      "fsip_permitfeesbillable@OData.Community.Display.V1.FormattedValue": "No",
      "fsip_permitfeesbillable": false,
      "fsip_billingendon": null,
      "fsip_lastinvoiced@OData.Community.Display.V1.FormattedValue": "1/5/2026",
      "fsip_lastinvoiced": "2026-01-05T15:58:05Z",
      "fsip_internalnote": null,
      "fsip_escalationfrequency": null,
      "fsip_name": "920 Trinity Avenue",
      "fsip_workorderconsolidationtype@OData.Community.Display.V1.FormattedValue": "By Contract",
      "fsip_workorderconsolidationtype": 683440000,
      "fsip_addalldevicescontractbillings": null,
      "fsip_lastescalationlettersent": null,
      "fsip_otminoradjustmentscbservice@OData.Community.Display.V1.FormattedValue": "No",
      "fsip_otminoradjustmentscbservice": false,
      "fsip_duration": null,
      "lcd_daystoexpire@OData.Community.Display.V1.FormattedValue": "-354.00",
      "lcd_daystoexpire": -354.0000000000,
      "fsip_3rdyearescalation": null,
      "fsip_invoicingmethod@OData.Community.Display.V1.FormattedValue": "Work Order Billing",
      "fsip_invoicingmethod": 683440001,
      "lcd_cat5fullloadbillable@OData.Community.Display.V1.FormattedValue": "No",
      "lcd_cat5fullloadbillable": 802290001,
      "fsip_cancelon": null,
      "fsip_originalcontractstartdate@OData.Community.Display.V1.FormattedValue": "1/1/2026",
      "fsip_originalcontractstartdate": "2026-01-01",
      "fsip_contractnumber": "MC-0003174",
      "fsip_exclusions": null,
      "_fsip_product_value": null,
      "fsip_quantity": null,
      "fsip_usediscountaspercentage@OData.Community.Display.V1.FormattedValue": "Amount",
      "fsip_usediscountaspercentage": false,
      "fsip_contractlanguage": null,
      "fsip_currentcontractyear": null,
      "lcd_originalcontractamount_base": null,
      "_modifiedonbehalfby_value": null,
      "fsip_fiveyearsafetytest@OData.Community.Display.V1.FormattedValue": "No",
      "fsip_fiveyearsafetytest": false,
      "fsip_closedate": null,
      "fsip_invoiceamount_base": null,
      "versionnumber@OData.Community.Display.V1.FormattedValue": "126,631,919",
      "versionnumber": 126631919,
      "fsip_description": null,
      "fsip_activeon": null,
      "fsip_billingenddate": null,
      "fsip_activemmr_base@OData.Community.Display.V1.FormattedValue": "$1,124.00",
      "fsip_activemmr_base": 1124.0000000000,
      "statuscode@OData.Community.Display.V1.FormattedValue": "Active",
      "statuscode": 683440001,
      "fsip_testbillable@OData.Community.Display.V1.FormattedValue": "No",
      "fsip_testbillable": false,
      "createdon@OData.Community.Display.V1.FormattedValue": "1/5/2026 3:15 PM",
      "createdon": "2026-01-05T15:15:24Z",
      "fsip_holdnote": null,
      "fsip_grossmargin_base@OData.Community.Display.V1.FormattedValue": "$1,124.00",
      "fsip_grossmargin_base": 1124.0000000000,
      "_fsip_serviceaddress_value": null,
      "fsip_activemmr@OData.Community.Display.V1.FormattedValue": "$1,124.00",
      "fsip_activemmr": 1124.0000000000,
      "lcd_braketestbillable@OData.Community.Display.V1.FormattedValue": "No",
      "lcd_braketestbillable": 802290001,
      "fsip_1styearescalation": null,
      "fsip_currentactualprofitpercent": null,
      "fsip_lastinvoicerollup_date@OData.Community.Display.V1.FormattedValue": "1/12/2026 8:46 PM",
      "fsip_lastinvoicerollup_date": "2026-01-12T20:46:52Z",
      "fsip_billinginprogress@OData.Community.Display.V1.FormattedValue": "No",
      "fsip_billinginprogress": false
    },
    {
      "@odata.etag": "W/\"126475863\"",
      "lcd_cancellationnotes": null,
      "fsip_po": null,
      "fsip_billingfrequency": null,
      "lcd_cat1annualprice": "775",
      "fsip_expireson": null,
      "fsip_won@OData.Community.Display.V1.FormattedValue": "No",
      "fsip_won": false,
      "fsip_schedulinginprogress@OData.Community.Display.V1.FormattedValue": "No",
      "fsip_schedulinginprogress": false,
      "_fsip_sortbyaccount_value@OData.Community.Display.V1.FormattedValue": "Choice New York Management",
      "_fsip_sortbyaccount_value": "632b54b0-d116-f011-998a-000d3a350fde",
      "fsip_invoiced@OData.Community.Display.V1.FormattedValue": "$2,600.00",
      "fsip_invoiced": 2600.0000000000,
      "fsip_currentannualamount_base": null,
      "fsip_currentcontractstartdate@OData.Community.Display.V1.FormattedValue": "6/1/2025",
      "fsip_currentcontractstartdate": "2025-06-01",
      "fsip_nextescalationdate": null,
      "fsip_billingstarton": null,
      "fsip_costs_base@OData.Community.Display.V1.FormattedValue": "$0.00",
      "fsip_costs_base": 0.0000000000,
      "fsip_nextcontractbillingdate@OData.Community.Display.V1.FormattedValue": "2/1/2026",
      "fsip_nextcontractbillingdate": "2026-02-01",
      "fsip_4thyearescalation": null,
      "fsip_invoiced_date@OData.Community.Display.V1.FormattedValue": "1/12/2026 8:46 PM",
      "fsip_invoiced_date": "2026-01-12T20:46:52Z",
      "fsip_billingfrequencycode": null,
      "lcd_cat5fullloadprice": null,
      "_fsip_copydevicesfromcontract_value": null,
      "statecode@OData.Community.Display.V1.FormattedValue": "Active",
      "statecode": 0,
      "fsip_regulartimecbservice@OData.Community.Display.V1.FormattedValue": "No",
      "fsip_regulartimecbservice": false,
      "fsip_costs_date@OData.Community.Display.V1.FormattedValue": "1/12/2026 8:46 PM",
      "fsip_costs_date": "2026-01-12T20:46:52Z",
      "_fsip_copydevicesfrombuildinglocation_value": null,
      "lcd_originalcontractamount": null,
      "fsip_closedstatus": null,
      "_fsip_customerid_value@OData.Community.Display.V1.FormattedValue": "Choice New York Management",
      "_fsip_customerid_value": "632b54b0-d116-f011-998a-000d3a350fde",
      "fsip_contractservicelevelcode": null,
      "fsip_invoiceamount": null,
      "_modifiedby_value@OData.Community.Display.V1.FormattedValue": "# SCRIBE INTEGRATION",
      "_modifiedby_value": "910423db-6a8d-ef11-ac21-000d3a326f08",
      "modifiedon@OData.Community.Display.V1.FormattedValue": "1/5/2026 12:59 PM",
      "modifiedon": "2026-01-05T12:59:35Z",
      "lcd_cancelationnotifyoffice@OData.Community.Display.V1.FormattedValue": "No",
      "lcd_cancelationnotifyoffice": 802290001,
      "lcd_autorenewal@OData.Community.Display.V1.FormattedValue": "No",
      "lcd_autorenewal": 802290001,
      "fsip_billingnotecb": null,
      "fsip_lastinvoiced_state@OData.Community.Display.V1.FormattedValue": "1",
      "fsip_lastinvoiced_state": 1,
      "fsip_costs_state@OData.Community.Display.V1.FormattedValue": "1",
      "fsip_costs_state": 1,
      "fsip_percentageoramount": null,
      "fsip_escalationamount_base": null,
      "fsip_closecontract@OData.Community.Display.V1.FormattedValue": "No",
      "fsip_closecontract": false,
      "overriddencreatedon": null,
      "lcd_cat1annualbillable@OData.Community.Display.V1.FormattedValue": "Yes",
      "lcd_cat1annualbillable": 802290000,
      "fsip_activemmr_date@OData.Community.Display.V1.FormattedValue": "1/12/2026 8:46 PM",
      "fsip_activemmr_date": "2026-01-12T20:46:52Z",
      "fsip_specialconditions": null,
      "fsip_currentcontractenddate@OData.Community.Display.V1.FormattedValue": "7/1/2026",
      "fsip_currentcontractenddate": "2026-07-01",
      "lcd_servicefrequencywords": "Monthly",
      "fsip_cleanpithoistwaycartops@OData.Community.Display.V1.FormattedValue": "No",
      "fsip_cleanpithoistwaycartops": false,
      "fsip_5thyearescalation": null,
      "fsip_totalcontract": null,
      "_owningteam_value": null,
      "fsip_autorenew@OData.Community.Display.V1.FormattedValue": "No",
      "fsip_autorenew": false,
      "fsip_escalationpercent": null,
      "exchangerate@OData.Community.Display.V1.FormattedValue": "1.0000000000",
      "exchangerate": 1.000000000000,
      "fsip_excludefromcontractescalations@OData.Community.Display.V1.FormattedValue": "No",
      "fsip_excludefromcontractescalations": false,
      "fsip_annualsafetytest@OData.Community.Display.V1.FormattedValue": "No",
      "fsip_annualsafetytest": false,
      "fsip_nextservicedate@OData.Community.Display.V1.FormattedValue": "2/11/2026",
      "fsip_nextservicedate": "2026-02-11T12:00:00Z",
      "fsip_onhold@OData.Community.Display.V1.FormattedValue": "No",
      "fsip_onhold": false,
      "fsip_currentannualamount": null,
      "_createdby_value@OData.Community.Display.V1.FormattedValue": "Barbara Oliveira",
      "_createdby_value": "554d6842-59b6-ef11-b8e9-000d3a5a6b66",
      "fsip_activemmr_state@OData.Community.Display.V1.FormattedValue": "1",
      "fsip_activemmr_state": 1,
      "fsip_2ndyearescalation": null,
      "_fsip_wagecategory_value": null,
      "fsip_maintenancecontractid": "889179b3-c546-f011-877a-000d3a302e4a",
      "fsip_contractreviewdate": null,
      "fsip_lastinvoicerollup_state@OData.Community.Display.V1.FormattedValue": "1",
      "fsip_lastinvoicerollup_state": 1,
      "fsip_invoiced_state@OData.Community.Display.V1.FormattedValue": "1",
      "fsip_invoiced_state": 1,
      "fsip_2ndyearescalation_base": null,
      "fsip_5thyearescalation_base": null,
      "fsip_proratedequipment": null,
      "_fsip_originatingcontract_value": null,
      "lcd_runcancelflow@OData.Community.Display.V1.FormattedValue": "No",
      "lcd_runcancelflow": 802290001,
      "fsip_nextbillingdate": null,
      "lcd_createcontractbilling": null,
      "fsip_lastinvoicerollup@OData.Community.Display.V1.FormattedValue": "1/1/2026",
      "fsip_lastinvoicerollup": "2026-01-01",
      "fsip_billingnote": null,
      "_fsip_salesperson_value": null,
      "fsip_invoiceconsolidationtype@OData.Community.Display.V1.FormattedValue": "By Contract",
      "fsip_invoiceconsolidationtype": 683440002,
      "fsip_4thyearescalation_base": null,
      "_fsip_billtocustomer_value@OData.Community.Display.V1.FormattedValue": "Choice New York Management",
      "_fsip_billtocustomer_value": "632b54b0-d116-f011-998a-000d3a350fde",
      "fsip_costs@OData.Community.Display.V1.FormattedValue": "$0.00",
      "fsip_costs": 0.0000000000,
      "_owningbusinessunit_value@OData.Community.Display.V1.FormattedValue": "LCD Elevator",
      "_owningbusinessunit_value": "c9e85d8b-8fa0-ec11-b400-000d3a58d68e",
      "fsip_legacycontract": null,
      "fsip_printbillingnote@OData.Community.Display.V1.FormattedValue": "Yes",
      "fsip_printbillingnote": true,
      "timezoneruleversionnumber@OData.Community.Display.V1.FormattedValue": "4",
      "timezoneruleversionnumber": 4,
      "fsip_grossmargin@OData.Community.Display.V1.FormattedValue": "$2,600.00",
      "fsip_grossmargin": 2600.0000000000,
      "fsip_payssafetyequipment": null,
      "_ownerid_value@OData.Community.Display.V1.FormattedValue": "Barbara Oliveira",
      "_ownerid_value": "554d6842-59b6-ef11-b8e9-000d3a5a6b66",
      "_fsip_primarybuildinglocation_value@OData.Community.Display.V1.FormattedValue": "66 North 1st Street",
      "_fsip_primarybuildinglocation_value": "080a8073-c346-f011-877a-000d3a302e4a",
      "fsip_lastinvoiced_date@OData.Community.Display.V1.FormattedValue": "1/12/2026 8:46 PM",
      "fsip_lastinvoiced_date": "2026-01-12T20:46:52Z",
      "fsip_invoiced_base@OData.Community.Display.V1.FormattedValue": "$2,600.00",
      "fsip_invoiced_base": 2600.0000000000,
      "importsequencenumber": null,
      "fsip_escalationamount": null,
      "fsip_1styearescalation_base": null,
      "_owninguser_value": "554d6842-59b6-ef11-b8e9-000d3a5a6b66",
      "_transactioncurrencyid_value@OData.Community.Display.V1.FormattedValue": "US Dollar",
      "_transactioncurrencyid_value": "28c060c5-d1a0-ec11-b400-000d3a58d68e",
      "_fsip_productcb_value": null,
      "fsip_visitfrequency@OData.Community.Display.V1.FormattedValue": "30",
      "fsip_visitfrequency": 683440000,
      "fsip_3rdyearescalation_base": null,
      "_fsip_project_value": null,
      "_fsip_division_value@OData.Community.Display.V1.FormattedValue": "Maintenance",
      "_fsip_division_value": "9316e0ff-55a5-ec11-9840-000d3a5c16ba",
      "_fsip_contracttype_value@OData.Community.Display.V1.FormattedValue": "Limited Service",
      "_fsip_contracttype_value": "f13ce9c0-42a9-ec11-9840-000d3a307669",
      "fsip_sendescalationletter@OData.Community.Display.V1.FormattedValue": "No",
      "fsip_sendescalationletter": false,
      "lcd_braketestprice": null,
      "utcconversiontimezonecode": null,
      "_createdonbehalfby_value": null,
      "fsip_numberofvisits": "1",
      "fsip_totalcontract_base": null,
      "fsip_grossmarginpercent@OData.Community.Display.V1.FormattedValue": "100.00",
      "fsip_grossmarginpercent": 100.00,
      "fsip_certificateofinsurance@OData.Community.Display.V1.FormattedValue": "No",
      "fsip_certificateofinsurance": false,
      "fsip_permitfeesbillable@OData.Community.Display.V1.FormattedValue": "No",
      "fsip_permitfeesbillable": false,
      "fsip_billingendon": null,
      "fsip_lastinvoiced@OData.Community.Display.V1.FormattedValue": "1/5/2026",
      "fsip_lastinvoiced": "2026-01-05T12:56:43Z",
      "fsip_internalnote": null,
      "fsip_escalationfrequency": null,
      "fsip_name": "66 North 1st Street",
      "fsip_workorderconsolidationtype@OData.Community.Display.V1.FormattedValue": "By Contract",
      "fsip_workorderconsolidationtype": 683440000,
      "fsip_addalldevicescontractbillings@OData.Community.Display.V1.FormattedValue": "No",
      "fsip_addalldevicescontractbillings": false,
      "fsip_lastescalationlettersent": null,
      "fsip_otminoradjustmentscbservice@OData.Community.Display.V1.FormattedValue": "No",
      "fsip_otminoradjustmentscbservice": false,
      "fsip_duration": null,
      "lcd_daystoexpire@OData.Community.Display.V1.FormattedValue": "-170.00",
      "lcd_daystoexpire": -170.0000000000,
      "fsip_3rdyearescalation": null,
      "fsip_invoicingmethod@OData.Community.Display.V1.FormattedValue": "Work Order Billing",
      "fsip_invoicingmethod": 683440001,
      "lcd_cat5fullloadbillable@OData.Community.Display.V1.FormattedValue": "N/A",
      "lcd_cat5fullloadbillable": 802290003,
      "fsip_cancelon": null,
      "fsip_originalcontractstartdate@OData.Community.Display.V1.FormattedValue": "6/30/2025",
      "fsip_originalcontractstartdate": "2025-06-30",
      "fsip_contractnumber": "MC-0003008",
      "fsip_exclusions": "Please note, the disconnect means and fuses, car enclosures, car doors and hoist-way entrances are excluded. All repairs performed by LCD will use only genuine standard parts produced and manufactured for customers equipment. Maintenance does not include service calls, repair or replacement of electrical and mechanical parts of elevator equipment and apparatus which shall be performed only at additional cost billed at parts plus labor.",
      "_fsip_product_value": null,
      "fsip_quantity": null,
      "fsip_usediscountaspercentage@OData.Community.Display.V1.FormattedValue": "Amount",
      "fsip_usediscountaspercentage": false,
      "fsip_contractlanguage": null,
      "fsip_currentcontractyear": null,
      "lcd_originalcontractamount_base": null,
      "_modifiedonbehalfby_value": null,
      "fsip_fiveyearsafetytest@OData.Community.Display.V1.FormattedValue": "No",
      "fsip_fiveyearsafetytest": false,
      "fsip_closedate": null,
      "fsip_invoiceamount_base": null,
      "versionnumber@OData.Community.Display.V1.FormattedValue": "126,475,863",
      "versionnumber": 126475863,
      "fsip_description": null,
      "fsip_activeon": null,
      "fsip_billingenddate": null,
      "fsip_activemmr_base@OData.Community.Display.V1.FormattedValue": "$325.00",
      "fsip_activemmr_base": 325.0000000000,
      "statuscode@OData.Community.Display.V1.FormattedValue": "Active",
      "statuscode": 683440001,
      "fsip_testbillable@OData.Community.Display.V1.FormattedValue": "No",
      "fsip_testbillable": false,
      "createdon@OData.Community.Display.V1.FormattedValue": "6/11/2025 1:12 PM",
      "createdon": "2025-06-11T13:12:29Z",
      "fsip_holdnote": null,
      "fsip_grossmargin_base@OData.Community.Display.V1.FormattedValue": "$2,600.00",
      "fsip_grossmargin_base": 2600.0000000000,
      "_fsip_serviceaddress_value": null,
      "fsip_activemmr@OData.Community.Display.V1.FormattedValue": "$325.00",
      "fsip_activemmr": 325.0000000000,
      "lcd_braketestbillable@OData.Community.Display.V1.FormattedValue": "N/A",
      "lcd_braketestbillable": 802290003,
      "fsip_1styearescalation": null,
      "fsip_currentactualprofitpercent": null,
      "fsip_lastinvoicerollup_date@OData.Community.Display.V1.FormattedValue": "1/12/2026 8:46 PM",
      "fsip_lastinvoicerollup_date": "2026-01-12T20:46:52Z",
      "fsip_billinginprogress@OData.Community.Display.V1.FormattedValue": "No",
      "fsip_billinginprogress": false
    },
    {
      "@odata.etag": "W/\"126387569\"",
      "lcd_cancellationnotes": null,
      "fsip_po": null,
      "fsip_billingfrequency": null,
      "lcd_cat1annualprice": "775",
      "fsip_expireson": null,
      "fsip_won@OData.Community.Display.V1.FormattedValue": "No",
      "fsip_won": false,
      "fsip_schedulinginprogress@OData.Community.Display.V1.FormattedValue": "No",
      "fsip_schedulinginprogress": false,
      "_fsip_sortbyaccount_value@OData.Community.Display.V1.FormattedValue": "Streamline USA, LLC",
      "_fsip_sortbyaccount_value": "05f7e4c4-ba3f-f011-b4cb-000d3a597798",
      "fsip_invoiced@OData.Community.Display.V1.FormattedValue": "$3,115.00",
      "fsip_invoiced": 3115.0000000000,
      "fsip_currentannualamount_base": null,
      "fsip_currentcontractstartdate@OData.Community.Display.V1.FormattedValue": "6/9/2025",
      "fsip_currentcontractstartdate": "2025-06-09",
      "fsip_nextescalationdate": null,
      "fsip_billingstarton": null,
      "fsip_costs_base@OData.Community.Display.V1.FormattedValue": "$0.00",
      "fsip_costs_base": 0.0000000000,
      "fsip_nextcontractbillingdate@OData.Community.Display.V1.FormattedValue": "2/1/2026",
      "fsip_nextcontractbillingdate": "2026-02-01",
      "fsip_4thyearescalation": null,
      "fsip_invoiced_date@OData.Community.Display.V1.FormattedValue": "1/12/2026 8:46 PM",
      "fsip_invoiced_date": "2026-01-12T20:46:52Z",
      "fsip_billingfrequencycode": null,
      "lcd_cat5fullloadprice": "1550",
      "_fsip_copydevicesfromcontract_value": null,
      "statecode@OData.Community.Display.V1.FormattedValue": "Active",
      "statecode": 0,
      "fsip_regulartimecbservice@OData.Community.Display.V1.FormattedValue": "No",
      "fsip_regulartimecbservice": false,
      "fsip_costs_date@OData.Community.Display.V1.FormattedValue": "1/12/2026 8:46 PM",
      "fsip_costs_date": "2026-01-12T20:46:52Z",
      "_fsip_copydevicesfrombuildinglocation_value": null,
      "lcd_originalcontractamount": null,
      "fsip_closedstatus": null,
      "_fsip_customerid_value@OData.Community.Display.V1.FormattedValue": "Streamline USA, LLC",
      "_fsip_customerid_value": "05f7e4c4-ba3f-f011-b4cb-000d3a597798",
      "fsip_contractservicelevelcode": null,
      "fsip_invoiceamount": null,
      "_modifiedby_value@OData.Community.Display.V1.FormattedValue": "# SCRIBE INTEGRATION",
      "_modifiedby_value": "910423db-6a8d-ef11-ac21-000d3a326f08",
      "modifiedon@OData.Community.Display.V1.FormattedValue": "1/5/2026 12:59 PM",
      "modifiedon": "2026-01-05T12:59:36Z",
      "lcd_cancelationnotifyoffice@OData.Community.Display.V1.FormattedValue": "No",
      "lcd_cancelationnotifyoffice": 802290001,
      "lcd_autorenewal@OData.Community.Display.V1.FormattedValue": "Yes",
      "lcd_autorenewal": 802290000,
      "fsip_billingnotecb": null,
      "fsip_lastinvoiced_state@OData.Community.Display.V1.FormattedValue": "1",
      "fsip_lastinvoiced_state": 1,
      "fsip_costs_state@OData.Community.Display.V1.FormattedValue": "1",
      "fsip_costs_state": 1,
      "fsip_percentageoramount": null,
      "fsip_escalationamount_base": null,
      "fsip_closecontract@OData.Community.Display.V1.FormattedValue": "No",
      "fsip_closecontract": false,
      "overriddencreatedon": null,
      "lcd_cat1annualbillable@OData.Community.Display.V1.FormattedValue": "Yes",
      "lcd_cat1annualbillable": 802290000,
      "fsip_activemmr_date@OData.Community.Display.V1.FormattedValue": "1/12/2026 8:46 PM",
      "fsip_activemmr_date": "2026-01-12T20:46:52Z",
      "fsip_specialconditions": null,
      "fsip_currentcontractenddate@OData.Community.Display.V1.FormattedValue": "6/9/2026",
      "fsip_currentcontractenddate": "2026-06-09",
      "lcd_servicefrequencywords": "Monthly",
      "fsip_cleanpithoistwaycartops@OData.Community.Display.V1.FormattedValue": "No",
      "fsip_cleanpithoistwaycartops": false,
      "fsip_5thyearescalation": null,
      "fsip_totalcontract": null,
      "_owningteam_value": null,
      "fsip_autorenew@OData.Community.Display.V1.FormattedValue": "No",
      "fsip_autorenew": false,
      "fsip_escalationpercent": null,
      "exchangerate@OData.Community.Display.V1.FormattedValue": "1.0000000000",
      "exchangerate": 1.000000000000,
      "fsip_excludefromcontractescalations@OData.Community.Display.V1.FormattedValue": "No",
      "fsip_excludefromcontractescalations": false,
      "fsip_annualsafetytest@OData.Community.Display.V1.FormattedValue": "No",
      "fsip_annualsafetytest": false,
      "fsip_nextservicedate@OData.Community.Display.V1.FormattedValue": "2/9/2026",
      "fsip_nextservicedate": "2026-02-09T12:00:00Z",
      "fsip_onhold@OData.Community.Display.V1.FormattedValue": "No",
      "fsip_onhold": false,
      "fsip_currentannualamount": null,
      "_createdby_value@OData.Community.Display.V1.FormattedValue": "Barbara Oliveira",
      "_createdby_value": "554d6842-59b6-ef11-b8e9-000d3a5a6b66",
      "fsip_activemmr_state@OData.Community.Display.V1.FormattedValue": "1",
      "fsip_activemmr_state": 1,
      "fsip_2ndyearescalation": null,
      "_fsip_wagecategory_value": null,
      "fsip_maintenancecontractid": "62962b0a-c946-f011-877a-000d3a302e4a",
      "fsip_contractreviewdate": null,
      "fsip_lastinvoicerollup_state@OData.Community.Display.V1.FormattedValue": "1",
      "fsip_lastinvoicerollup_state": 1,
      "fsip_invoiced_state@OData.Community.Display.V1.FormattedValue": "1",
      "fsip_invoiced_state": 1,
      "fsip_2ndyearescalation_base": null,
      "fsip_5thyearescalation_base": null,
      "fsip_proratedequipment": null,
      "_fsip_originatingcontract_value": null,
      "lcd_runcancelflow@OData.Community.Display.V1.FormattedValue": "No",
      "lcd_runcancelflow": 802290001,
      "fsip_nextbillingdate": null,
      "lcd_createcontractbilling": null,
      "fsip_lastinvoicerollup@OData.Community.Display.V1.FormattedValue": "1/1/2026",
      "fsip_lastinvoicerollup": "2026-01-01",
      "fsip_billingnote": null,
      "_fsip_salesperson_value": null,
      "fsip_invoiceconsolidationtype@OData.Community.Display.V1.FormattedValue": "By Contract",
      "fsip_invoiceconsolidationtype": 683440002,
      "fsip_4thyearescalation_base": null,
      "_fsip_billtocustomer_value@OData.Community.Display.V1.FormattedValue": "Streamline USA, LLC",
      "_fsip_billtocustomer_value": "05f7e4c4-ba3f-f011-b4cb-000d3a597798",
      "fsip_costs@OData.Community.Display.V1.FormattedValue": "$0.00",
      "fsip_costs": 0.0000000000,
      "_owningbusinessunit_value@OData.Community.Display.V1.FormattedValue": "LCD Elevator",
      "_owningbusinessunit_value": "c9e85d8b-8fa0-ec11-b400-000d3a58d68e",
      "fsip_legacycontract": null,
      "fsip_printbillingnote@OData.Community.Display.V1.FormattedValue": "Yes",
      "fsip_printbillingnote": true,
      "timezoneruleversionnumber@OData.Community.Display.V1.FormattedValue": "4",
      "timezoneruleversionnumber": 4,
      "fsip_grossmargin@OData.Community.Display.V1.FormattedValue": "$3,115.00",
      "fsip_grossmargin": 3115.0000000000,
      "fsip_payssafetyequipment": null,
      "_ownerid_value@OData.Community.Display.V1.FormattedValue": "Barbara Oliveira",
      "_ownerid_value": "554d6842-59b6-ef11-b8e9-000d3a5a6b66",
      "_fsip_primarybuildinglocation_value@OData.Community.Display.V1.FormattedValue": "264-268 West 47th Street",
      "_fsip_primarybuildinglocation_value": "78d56c25-1caa-ec11-9840-000d3a307669",
      "fsip_lastinvoiced_date@OData.Community.Display.V1.FormattedValue": "1/12/2026 8:46 PM",
      "fsip_lastinvoiced_date": "2026-01-12T20:46:52Z",
      "fsip_invoiced_base@OData.Community.Display.V1.FormattedValue": "$3,115.00",
      "fsip_invoiced_base": 3115.0000000000,
      "importsequencenumber": null,
      "fsip_escalationamount": null,
      "fsip_1styearescalation_base": null,
      "_owninguser_value": "554d6842-59b6-ef11-b8e9-000d3a5a6b66",
      "_transactioncurrencyid_value@OData.Community.Display.V1.FormattedValue": "US Dollar",
      "_transactioncurrencyid_value": "28c060c5-d1a0-ec11-b400-000d3a58d68e",
      "_fsip_productcb_value": null,
      "fsip_visitfrequency@OData.Community.Display.V1.FormattedValue": "30",
      "fsip_visitfrequency": 683440000,
      "fsip_3rdyearescalation_base": null,
      "_fsip_project_value": null,
      "_fsip_division_value@OData.Community.Display.V1.FormattedValue": "Maintenance",
      "_fsip_division_value": "9316e0ff-55a5-ec11-9840-000d3a5c16ba",
      "_fsip_contracttype_value@OData.Community.Display.V1.FormattedValue": "Limited Service",
      "_fsip_contracttype_value": "f13ce9c0-42a9-ec11-9840-000d3a307669",
      "fsip_sendescalationletter@OData.Community.Display.V1.FormattedValue": "No",
      "fsip_sendescalationletter": false,
      "lcd_braketestprice": "850",
      "utcconversiontimezonecode": null,
      "_createdonbehalfby_value": null,
      "fsip_numberofvisits": "1",
      "fsip_totalcontract_base": null,
      "fsip_grossmarginpercent@OData.Community.Display.V1.FormattedValue": "100.00",
      "fsip_grossmarginpercent": 100.00,
      "fsip_certificateofinsurance@OData.Community.Display.V1.FormattedValue": "No",
      "fsip_certificateofinsurance": false,
      "fsip_permitfeesbillable@OData.Community.Display.V1.FormattedValue": "No",
      "fsip_permitfeesbillable": false,
      "fsip_billingendon": null,
      "fsip_lastinvoiced@OData.Community.Display.V1.FormattedValue": "1/5/2026",
      "fsip_lastinvoiced": "2026-01-05T12:56:49Z",
      "fsip_internalnote": null,
      "fsip_escalationfrequency": null,
      "fsip_name": "264-268 West 47th Street",
      "fsip_workorderconsolidationtype@OData.Community.Display.V1.FormattedValue": "By Contract",
      "fsip_workorderconsolidationtype": 683440000,
      "fsip_addalldevicescontractbillings@OData.Community.Display.V1.FormattedValue": "No",
      "fsip_addalldevicescontractbillings": false,
      "fsip_lastescalationlettersent": null,
      "fsip_otminoradjustmentscbservice@OData.Community.Display.V1.FormattedValue": "No",
      "fsip_otminoradjustmentscbservice": false,
      "fsip_duration": null,
      "lcd_daystoexpire@OData.Community.Display.V1.FormattedValue": "-148.00",
      "lcd_daystoexpire": -148.0000000000,
      "fsip_3rdyearescalation": null,
      "fsip_invoicingmethod@OData.Community.Display.V1.FormattedValue": "Work Order Billing",
      "fsip_invoicingmethod": 683440001,
      "lcd_cat5fullloadbillable@OData.Community.Display.V1.FormattedValue": "Yes",
      "lcd_cat5fullloadbillable": 802290000,
      "fsip_cancelon": null,
      "fsip_originalcontractstartdate@OData.Community.Display.V1.FormattedValue": "6/3/2025",
      "fsip_originalcontractstartdate": "2025-06-03",
      "fsip_contractnumber": "MC-0003009",
      "fsip_exclusions": null,
      "_fsip_product_value": null,
      "fsip_quantity": null,
      "fsip_usediscountaspercentage@OData.Community.Display.V1.FormattedValue": "Amount",
      "fsip_usediscountaspercentage": false,
      "fsip_contractlanguage": null,
      "fsip_currentcontractyear": null,
      "lcd_originalcontractamount_base": null,
      "_modifiedonbehalfby_value": null,
      "fsip_fiveyearsafetytest@OData.Community.Display.V1.FormattedValue": "No",
      "fsip_fiveyearsafetytest": false,
      "fsip_closedate": null,
      "fsip_invoiceamount_base": null,
      "versionnumber@OData.Community.Display.V1.FormattedValue": "126,387,569",
      "versionnumber": 126387569,
      "fsip_description": null,
      "fsip_activeon": null,
      "fsip_billingenddate": null,
      "fsip_activemmr_base@OData.Community.Display.V1.FormattedValue": "$445.00",
      "fsip_activemmr_base": 445.0000000000,
      "statuscode@OData.Community.Display.V1.FormattedValue": "Active",
      "statuscode": 683440001,
      "fsip_testbillable@OData.Community.Display.V1.FormattedValue": "No",
      "fsip_testbillable": false,
      "createdon@OData.Community.Display.V1.FormattedValue": "6/11/2025 1:36 PM",
      "createdon": "2025-06-11T13:36:22Z",
      "fsip_holdnote": null,
      "fsip_grossmargin_base@OData.Community.Display.V1.FormattedValue": "$3,115.00",
      "fsip_grossmargin_base": 3115.0000000000,
      "_fsip_serviceaddress_value": null,
      "fsip_activemmr@OData.Community.Display.V1.FormattedValue": "$445.00",
      "fsip_activemmr": 445.0000000000,
      "lcd_braketestbillable@OData.Community.Display.V1.FormattedValue": "Yes",
      "lcd_braketestbillable": 802290000,
      "fsip_1styearescalation": null,
      "fsip_currentactualprofitpercent": null,
      "fsip_lastinvoicerollup_date@OData.Community.Display.V1.FormattedValue": "1/12/2026 8:46 PM",
      "fsip_lastinvoicerollup_date": "2026-01-12T20:46:52Z",
      "fsip_billinginprogress@OData.Community.Display.V1.FormattedValue": "No",
      "fsip_billinginprogress": false
    },
    {
      "@odata.etag": "W/\"108773077\"",
      "lcd_cancellationnotes": "Merging maintenance contract to 264-268 west 27th street due to history attached to building",
      "fsip_po": null,
      "fsip_billingfrequency": null,
      "lcd_cat1annualprice": "775",
      "fsip_expireson": null,
      "fsip_won@OData.Community.Display.V1.FormattedValue": "No",
      "fsip_won": false,
      "fsip_schedulinginprogress": null,
      "_fsip_sortbyaccount_value@OData.Community.Display.V1.FormattedValue": "Streamline USA, LLC",
      "_fsip_sortbyaccount_value": "05f7e4c4-ba3f-f011-b4cb-000d3a597798",
      "fsip_invoiced@OData.Community.Display.V1.FormattedValue": "$445.00",
      "fsip_invoiced": 445.0000000000,
      "fsip_currentannualamount_base": null,
      "fsip_currentcontractstartdate@OData.Community.Display.V1.FormattedValue": "6/9/2025",
      "fsip_currentcontractstartdate": "2025-06-09",
      "fsip_nextescalationdate": null,
      "fsip_billingstarton": null,
      "fsip_costs_base@OData.Community.Display.V1.FormattedValue": "$0.00",
      "fsip_costs_base": 0.0000000000,
      "fsip_nextcontractbillingdate@OData.Community.Display.V1.FormattedValue": "7/1/2025",
      "fsip_nextcontractbillingdate": "2025-07-01",
      "fsip_4thyearescalation": null,
      "fsip_invoiced_date@OData.Community.Display.V1.FormattedValue": "1/12/2026 8:46 PM",
      "fsip_invoiced_date": "2026-01-12T20:46:52Z",
      "fsip_billingfrequencycode": null,
      "lcd_cat5fullloadprice": "1550",
      "_fsip_copydevicesfromcontract_value": null,
      "statecode@OData.Community.Display.V1.FormattedValue": "Inactive",
      "statecode": 1,
      "fsip_regulartimecbservice@OData.Community.Display.V1.FormattedValue": "No",
      "fsip_regulartimecbservice": false,
      "fsip_costs_date@OData.Community.Display.V1.FormattedValue": "1/12/2026 8:46 PM",
      "fsip_costs_date": "2026-01-12T20:46:52Z",
      "_fsip_copydevicesfrombuildinglocation_value": null,
      "lcd_originalcontractamount": null,
      "fsip_closedstatus@OData.Community.Display.V1.FormattedValue": "Cancelled",
      "fsip_closedstatus": 2,
      "_fsip_customerid_value@OData.Community.Display.V1.FormattedValue": "Streamline USA, LLC",
      "_fsip_customerid_value": "05f7e4c4-ba3f-f011-b4cb-000d3a597798",
      "fsip_contractservicelevelcode": null,
      "fsip_invoiceamount": null,
      "_modifiedby_value@OData.Community.Display.V1.FormattedValue": "Alondra Lope",
      "_modifiedby_value": "026d1bc6-a8c6-ee11-9079-6045bd07e840",
      "modifiedon@OData.Community.Display.V1.FormattedValue": "6/11/2025 2:14 PM",
      "modifiedon": "2025-06-11T14:14:12Z",
      "lcd_cancelationnotifyoffice@OData.Community.Display.V1.FormattedValue": "No",
      "lcd_cancelationnotifyoffice": 802290001,
      "lcd_autorenewal@OData.Community.Display.V1.FormattedValue": "Yes",
      "lcd_autorenewal": 802290000,
      "fsip_billingnotecb": null,
      "fsip_lastinvoiced_state@OData.Community.Display.V1.FormattedValue": "1",
      "fsip_lastinvoiced_state": 1,
      "fsip_costs_state@OData.Community.Display.V1.FormattedValue": "1",
      "fsip_costs_state": 1,
      "fsip_percentageoramount": null,
      "fsip_escalationamount_base": null,
      "fsip_closecontract@OData.Community.Display.V1.FormattedValue": "No",
      "fsip_closecontract": false,
      "overriddencreatedon": null,
      "lcd_cat1annualbillable@OData.Community.Display.V1.FormattedValue": "Yes",
      "lcd_cat1annualbillable": 802290000,
      "fsip_activemmr_date@OData.Community.Display.V1.FormattedValue": "1/12/2026 8:46 PM",
      "fsip_activemmr_date": "2026-01-12T20:46:52Z",
      "fsip_specialconditions": null,
      "fsip_currentcontractenddate@OData.Community.Display.V1.FormattedValue": "6/3/2026",
      "fsip_currentcontractenddate": "2026-06-03",
      "lcd_servicefrequencywords": "Monthly",
      "fsip_cleanpithoistwaycartops@OData.Community.Display.V1.FormattedValue": "No",
      "fsip_cleanpithoistwaycartops": false,
      "fsip_5thyearescalation": null,
      "fsip_totalcontract": null,
      "_owningteam_value": null,
      "fsip_autorenew@OData.Community.Display.V1.FormattedValue": "No",
      "fsip_autorenew": false,
      "fsip_escalationpercent": null,
      "exchangerate@OData.Community.Display.V1.FormattedValue": "1.0000000000",
      "exchangerate": 1.000000000000,
      "fsip_excludefromcontractescalations@OData.Community.Display.V1.FormattedValue": "No",
      "fsip_excludefromcontractescalations": false,
      "fsip_annualsafetytest@OData.Community.Display.V1.FormattedValue": "No",
      "fsip_annualsafetytest": false,
      "fsip_nextservicedate@OData.Community.Display.V1.FormattedValue": "6/3/2025",
      "fsip_nextservicedate": "2025-06-03T12:00:00Z",
      "fsip_onhold@OData.Community.Display.V1.FormattedValue": "No",
      "fsip_onhold": false,
      "fsip_currentannualamount": null,
      "_createdby_value@OData.Community.Display.V1.FormattedValue": "Barbara Oliveira",
      "_createdby_value": "554d6842-59b6-ef11-b8e9-000d3a5a6b66",
      "fsip_activemmr_state@OData.Community.Display.V1.FormattedValue": "1",
      "fsip_activemmr_state": 1,
      "fsip_2ndyearescalation": null,
      "_fsip_wagecategory_value": null,
      "fsip_maintenancecontractid": "5e0b7fb8-a940-f011-b4ca-000d3a302e4a",
      "fsip_contractreviewdate": null,
      "fsip_lastinvoicerollup_state@OData.Community.Display.V1.FormattedValue": "1",
      "fsip_lastinvoicerollup_state": 1,
      "fsip_invoiced_state@OData.Community.Display.V1.FormattedValue": "1",
      "fsip_invoiced_state": 1,
      "fsip_2ndyearescalation_base": null,
      "fsip_5thyearescalation_base": null,
      "fsip_proratedequipment": null,
      "_fsip_originatingcontract_value": null,
      "lcd_runcancelflow@OData.Community.Display.V1.FormattedValue": "No",
      "lcd_runcancelflow": 802290001,
      "fsip_nextbillingdate": null,
      "lcd_createcontractbilling": null,
      "fsip_lastinvoicerollup@OData.Community.Display.V1.FormattedValue": "6/1/2025",
      "fsip_lastinvoicerollup": "2025-06-01",
      "fsip_billingnote": null,
      "_fsip_salesperson_value": null,
      "fsip_invoiceconsolidationtype@OData.Community.Display.V1.FormattedValue": "By Contract",
      "fsip_invoiceconsolidationtype": 683440002,
      "fsip_4thyearescalation_base": null,
      "_fsip_billtocustomer_value@OData.Community.Display.V1.FormattedValue": "Streamline USA, LLC",
      "_fsip_billtocustomer_value": "05f7e4c4-ba3f-f011-b4cb-000d3a597798",
      "fsip_costs@OData.Community.Display.V1.FormattedValue": "$0.00",
      "fsip_costs": 0.0000000000,
      "_owningbusinessunit_value@OData.Community.Display.V1.FormattedValue": "LCD Elevator",
      "_owningbusinessunit_value": "c9e85d8b-8fa0-ec11-b400-000d3a58d68e",
      "fsip_legacycontract": null,
      "fsip_printbillingnote@OData.Community.Display.V1.FormattedValue": "Yes",
      "fsip_printbillingnote": true,
      "timezoneruleversionnumber@OData.Community.Display.V1.FormattedValue": "0",
      "timezoneruleversionnumber": 0,
      "fsip_grossmargin@OData.Community.Display.V1.FormattedValue": "$445.00",
      "fsip_grossmargin": 445.0000000000,
      "fsip_payssafetyequipment": null,
      "_ownerid_value@OData.Community.Display.V1.FormattedValue": "Barbara Oliveira",
      "_ownerid_value": "554d6842-59b6-ef11-b8e9-000d3a5a6b66",
      "_fsip_primarybuildinglocation_value@OData.Community.Display.V1.FormattedValue": "268 West 47th Street",
      "_fsip_primarybuildinglocation_value": "cea8b7e3-ba3f-f011-b4cb-000d3a597798",
      "fsip_lastinvoiced_date@OData.Community.Display.V1.FormattedValue": "1/12/2026 8:46 PM",
      "fsip_lastinvoiced_date": "2026-01-12T20:46:52Z",
      "fsip_invoiced_base@OData.Community.Display.V1.FormattedValue": "$445.00",
      "fsip_invoiced_base": 445.0000000000,
      "importsequencenumber": null,
      "fsip_escalationamount": null,
      "fsip_1styearescalation_base": null,
      "_owninguser_value": "554d6842-59b6-ef11-b8e9-000d3a5a6b66",
      "_transactioncurrencyid_value@OData.Community.Display.V1.FormattedValue": "US Dollar",
      "_transactioncurrencyid_value": "28c060c5-d1a0-ec11-b400-000d3a58d68e",
      "_fsip_productcb_value": null,
      "fsip_visitfrequency@OData.Community.Display.V1.FormattedValue": "30",
      "fsip_visitfrequency": 683440000,
      "fsip_3rdyearescalation_base": null,
      "_fsip_project_value": null,
      "_fsip_division_value@OData.Community.Display.V1.FormattedValue": "Maintenance",
      "_fsip_division_value": "9316e0ff-55a5-ec11-9840-000d3a5c16ba",
      "_fsip_contracttype_value@OData.Community.Display.V1.FormattedValue": "Limited Service",
      "_fsip_contracttype_value": "f13ce9c0-42a9-ec11-9840-000d3a307669",
      "fsip_sendescalationletter@OData.Community.Display.V1.FormattedValue": "No",
      "fsip_sendescalationletter": false,
      "lcd_braketestprice": "850",
      "utcconversiontimezonecode": null,
      "_createdonbehalfby_value": null,
      "fsip_numberofvisits": "1",
      "fsip_totalcontract_base": null,
      "fsip_grossmarginpercent@OData.Community.Display.V1.FormattedValue": "100.00",
      "fsip_grossmarginpercent": 100.00,
      "fsip_certificateofinsurance@OData.Community.Display.V1.FormattedValue": "No",
      "fsip_certificateofinsurance": false,
      "fsip_permitfeesbillable@OData.Community.Display.V1.FormattedValue": "No",
      "fsip_permitfeesbillable": false,
      "fsip_billingendon": null,
      "fsip_lastinvoiced@OData.Community.Display.V1.FormattedValue": "6/4/2025",
      "fsip_lastinvoiced": "2025-06-04T19:39:12Z",
      "fsip_internalnote": null,
      "fsip_escalationfrequency": null,
      "fsip_name": "268 West 47th Street",
      "fsip_workorderconsolidationtype@OData.Community.Display.V1.FormattedValue": "By Contract",
      "fsip_workorderconsolidationtype": 683440000,
      "fsip_addalldevicescontractbillings@OData.Community.Display.V1.FormattedValue": "No",
      "fsip_addalldevicescontractbillings": false,
      "fsip_lastescalationlettersent": null,
      "fsip_otminoradjustmentscbservice@OData.Community.Display.V1.FormattedValue": "No",
      "fsip_otminoradjustmentscbservice": false,
      "fsip_duration": null,
      "lcd_daystoexpire@OData.Community.Display.V1.FormattedValue": "-142.00",
      "lcd_daystoexpire": -142.0000000000,
      "fsip_3rdyearescalation": null,
      "fsip_invoicingmethod@OData.Community.Display.V1.FormattedValue": "Work Order Billing",
      "fsip_invoicingmethod": 683440001,
      "lcd_cat5fullloadbillable@OData.Community.Display.V1.FormattedValue": "Yes",
      "lcd_cat5fullloadbillable": 802290000,
      "fsip_cancelon@OData.Community.Display.V1.FormattedValue": "6/11/2025",
      "fsip_cancelon": "2025-06-11",
      "fsip_originalcontractstartdate@OData.Community.Display.V1.FormattedValue": "6/3/2025",
      "fsip_originalcontractstartdate": "2025-06-03",
      "fsip_contractnumber": "MC-0002998",
      "fsip_exclusions": null,
      "_fsip_product_value": null,
      "fsip_quantity": null,
      "fsip_usediscountaspercentage@OData.Community.Display.V1.FormattedValue": "Amount",
      "fsip_usediscountaspercentage": false,
      "fsip_contractlanguage": null,
      "fsip_currentcontractyear": null,
      "lcd_originalcontractamount_base": null,
      "_modifiedonbehalfby_value": null,
      "fsip_fiveyearsafetytest@OData.Community.Display.V1.FormattedValue": "No",
      "fsip_fiveyearsafetytest": false,
      "fsip_closedate@OData.Community.Display.V1.FormattedValue": "6/11/2025",
      "fsip_closedate": "2025-06-11",
      "fsip_invoiceamount_base": null,
      "versionnumber@OData.Community.Display.V1.FormattedValue": "108,773,077",
      "versionnumber": 108773077,
      "fsip_description": null,
      "fsip_activeon": null,
      "fsip_billingenddate": null,
      "fsip_activemmr_base@OData.Community.Display.V1.FormattedValue": "$0.00",
      "fsip_activemmr_base": 0.0000000000,
      "statuscode@OData.Community.Display.V1.FormattedValue": "Cancelled",
      "statuscode": 2,
      "fsip_testbillable@OData.Community.Display.V1.FormattedValue": "No",
      "fsip_testbillable": false,
      "createdon@OData.Community.Display.V1.FormattedValue": "6/3/2025 6:36 PM",
      "createdon": "2025-06-03T18:36:54Z",
      "fsip_holdnote": null,
      "fsip_grossmargin_base@OData.Community.Display.V1.FormattedValue": "$445.00",
      "fsip_grossmargin_base": 445.0000000000,
      "_fsip_serviceaddress_value": null,
      "fsip_activemmr@OData.Community.Display.V1.FormattedValue": "$0.00",
      "fsip_activemmr": 0.0000000000,
      "lcd_braketestbillable@OData.Community.Display.V1.FormattedValue": "Yes",
      "lcd_braketestbillable": 802290000,
      "fsip_1styearescalation": null,
      "fsip_currentactualprofitpercent": null,
      "fsip_lastinvoicerollup_date@OData.Community.Display.V1.FormattedValue": "1/12/2026 8:46 PM",
      "fsip_lastinvoicerollup_date": "2026-01-12T20:46:52Z",
      "fsip_billinginprogress": null
    },
    {
      "@odata.etag": "W/\"126387503\"",
      "lcd_cancellationnotes": null,
      "fsip_po": null,
      "fsip_billingfrequency": null,
      "lcd_cat1annualprice": "625",
      "fsip_expireson": null,
      "fsip_won@OData.Community.Display.V1.FormattedValue": "No",
      "fsip_won": false,
      "fsip_schedulinginprogress@OData.Community.Display.V1.FormattedValue": "No",
      "fsip_schedulinginprogress": false,
      "_fsip_sortbyaccount_value@OData.Community.Display.V1.FormattedValue": "Towbar Apartments, Inc c/o Einsidler Management, Inc",
      "_fsip_sortbyaccount_value": "c00e9b18-45a9-ec11-9840-000d3a307669",
      "fsip_invoiced@OData.Community.Display.V1.FormattedValue": "$2,680.00",
      "fsip_invoiced": 2680.0000000000,
      "fsip_currentannualamount_base": null,
      "fsip_currentcontractstartdate@OData.Community.Display.V1.FormattedValue": "6/1/2025",
      "fsip_currentcontractstartdate": "2025-06-01",
      "fsip_nextescalationdate": null,
      "fsip_billingstarton": null,
      "fsip_costs_base@OData.Community.Display.V1.FormattedValue": "$0.00",
      "fsip_costs_base": 0.0000000000,
      "fsip_nextcontractbillingdate@OData.Community.Display.V1.FormattedValue": "2/1/2026",
      "fsip_nextcontractbillingdate": "2026-02-01",
      "fsip_4thyearescalation": null,
      "fsip_invoiced_date@OData.Community.Display.V1.FormattedValue": "1/12/2026 8:46 PM",
      "fsip_invoiced_date": "2026-01-12T20:46:52Z",
      "fsip_billingfrequencycode": null,
      "lcd_cat5fullloadprice": "1550",
      "_fsip_copydevicesfromcontract_value": null,
      "statecode@OData.Community.Display.V1.FormattedValue": "Active",
      "statecode": 0,
      "fsip_regulartimecbservice@OData.Community.Display.V1.FormattedValue": "No",
      "fsip_regulartimecbservice": false,
      "fsip_costs_date@OData.Community.Display.V1.FormattedValue": "1/12/2026 8:46 PM",
      "fsip_costs_date": "2026-01-12T20:46:52Z",
      "_fsip_copydevicesfrombuildinglocation_value": null,
      "lcd_originalcontractamount": null,
      "fsip_closedstatus": null,
      "_fsip_customerid_value@OData.Community.Display.V1.FormattedValue": "Towbar Apartments, Inc c/o Einsidler Management, Inc",
      "_fsip_customerid_value": "c00e9b18-45a9-ec11-9840-000d3a307669",
      "fsip_contractservicelevelcode": null,
      "fsip_invoiceamount": null,
      "_modifiedby_value@OData.Community.Display.V1.FormattedValue": "# SCRIBE INTEGRATION",
      "_modifiedby_value": "910423db-6a8d-ef11-ac21-000d3a326f08",
      "modifiedon@OData.Community.Display.V1.FormattedValue": "1/5/2026 12:59 PM",
      "modifiedon": "2026-01-05T12:59:36Z",
      "lcd_cancelationnotifyoffice@OData.Community.Display.V1.FormattedValue": "No",
      "lcd_cancelationnotifyoffice": 802290001,
      "lcd_autorenewal@OData.Community.Display.V1.FormattedValue": "Yes",
      "lcd_autorenewal": 802290000,
      "fsip_billingnotecb": null,
      "fsip_lastinvoiced_state@OData.Community.Display.V1.FormattedValue": "1",
      "fsip_lastinvoiced_state": 1,
      "fsip_costs_state@OData.Community.Display.V1.FormattedValue": "1",
      "fsip_costs_state": 1,
      "fsip_percentageoramount": null,
      "fsip_escalationamount_base": null,
      "fsip_closecontract@OData.Community.Display.V1.FormattedValue": "No",
      "fsip_closecontract": false,
      "overriddencreatedon": null,
      "lcd_cat1annualbillable@OData.Community.Display.V1.FormattedValue": "Yes",
      "lcd_cat1annualbillable": 802290000,
      "fsip_activemmr_date@OData.Community.Display.V1.FormattedValue": "1/12/2026 8:46 PM",
      "fsip_activemmr_date": "2026-01-12T20:46:52Z",
      "fsip_specialconditions": null,
      "fsip_currentcontractenddate@OData.Community.Display.V1.FormattedValue": "6/1/2026",
      "fsip_currentcontractenddate": "2026-06-01",
      "lcd_servicefrequencywords": "Monthly",
      "fsip_cleanpithoistwaycartops@OData.Community.Display.V1.FormattedValue": "No",
      "fsip_cleanpithoistwaycartops": false,
      "fsip_5thyearescalation": null,
      "fsip_totalcontract": null,
      "_owningteam_value": null,
      "fsip_autorenew@OData.Community.Display.V1.FormattedValue": "No",
      "fsip_autorenew": false,
      "fsip_escalationpercent": null,
      "exchangerate@OData.Community.Display.V1.FormattedValue": "1.0000000000",
      "exchangerate": 1.000000000000,
      "fsip_excludefromcontractescalations@OData.Community.Display.V1.FormattedValue": "No",
      "fsip_excludefromcontractescalations": false,
      "fsip_annualsafetytest@OData.Community.Display.V1.FormattedValue": "No",
      "fsip_annualsafetytest": false,
      "fsip_nextservicedate@OData.Community.Display.V1.FormattedValue": "2/1/2026",
      "fsip_nextservicedate": "2026-02-01T12:00:00Z",
      "fsip_onhold@OData.Community.Display.V1.FormattedValue": "No",
      "fsip_onhold": false,
      "fsip_currentannualamount": null,
      "_createdby_value@OData.Community.Display.V1.FormattedValue": "Barbara Oliveira",
      "_createdby_value": "554d6842-59b6-ef11-b8e9-000d3a5a6b66",
      "fsip_activemmr_state@OData.Community.Display.V1.FormattedValue": "1",
      "fsip_activemmr_state": 1,
      "fsip_2ndyearescalation": null,
      "_fsip_wagecategory_value": null,
      "fsip_maintenancecontractid": "11cbbf7f-4d41-f011-b4ca-000d3a302e4a",
      "fsip_contractreviewdate": null,
      "fsip_lastinvoicerollup_state@OData.Community.Display.V1.FormattedValue": "1",
      "fsip_lastinvoicerollup_state": 1,
      "fsip_invoiced_state@OData.Community.Display.V1.FormattedValue": "1",
      "fsip_invoiced_state": 1,
      "fsip_2ndyearescalation_base": null,
      "fsip_5thyearescalation_base": null,
      "fsip_proratedequipment": null,
      "_fsip_originatingcontract_value": null,
      "lcd_runcancelflow@OData.Community.Display.V1.FormattedValue": "No",
      "lcd_runcancelflow": 802290001,
      "fsip_nextbillingdate": null,
      "lcd_createcontractbilling": null,
      "fsip_lastinvoicerollup@OData.Community.Display.V1.FormattedValue": "1/1/2026",
      "fsip_lastinvoicerollup": "2026-01-01",
      "fsip_billingnote": null,
      "_fsip_salesperson_value": null,
      "fsip_invoiceconsolidationtype@OData.Community.Display.V1.FormattedValue": "By Contract",
      "fsip_invoiceconsolidationtype": 683440002,
      "fsip_4thyearescalation_base": null,
      "_fsip_billtocustomer_value@OData.Community.Display.V1.FormattedValue": "Towbar Apartments, Inc c/o Einsidler Management, Inc",
      "_fsip_billtocustomer_value": "c00e9b18-45a9-ec11-9840-000d3a307669",
      "fsip_costs@OData.Community.Display.V1.FormattedValue": "$0.00",
      "fsip_costs": 0.0000000000,
      "_owningbusinessunit_value@OData.Community.Display.V1.FormattedValue": "LCD Elevator",
      "_owningbusinessunit_value": "c9e85d8b-8fa0-ec11-b400-000d3a58d68e",
      "fsip_legacycontract": null,
      "fsip_printbillingnote@OData.Community.Display.V1.FormattedValue": "Yes",
      "fsip_printbillingnote": true,
      "timezoneruleversionnumber@OData.Community.Display.V1.FormattedValue": "4",
      "timezoneruleversionnumber": 4,
      "fsip_grossmargin@OData.Community.Display.V1.FormattedValue": "$2,680.00",
      "fsip_grossmargin": 2680.0000000000,
      "fsip_payssafetyequipment": null,
      "_ownerid_value@OData.Community.Display.V1.FormattedValue": "Barbara Oliveira",
      "_ownerid_value": "554d6842-59b6-ef11-b8e9-000d3a5a6b66",
      "_fsip_primarybuildinglocation_value@OData.Community.Display.V1.FormattedValue": "38 Barstow Road",
      "_fsip_primarybuildinglocation_value": "b0d46c25-1caa-ec11-9840-000d3a307669",
      "fsip_lastinvoiced_date@OData.Community.Display.V1.FormattedValue": "1/12/2026 8:46 PM",
      "fsip_lastinvoiced_date": "2026-01-12T20:46:52Z",
      "fsip_invoiced_base@OData.Community.Display.V1.FormattedValue": "$2,680.00",
      "fsip_invoiced_base": 2680.0000000000,
      "importsequencenumber": null,
      "fsip_escalationamount": null,
      "fsip_1styearescalation_base": null,
      "_owninguser_value": "554d6842-59b6-ef11-b8e9-000d3a5a6b66",
      "_transactioncurrencyid_value@OData.Community.Display.V1.FormattedValue": "US Dollar",
      "_transactioncurrencyid_value": "28c060c5-d1a0-ec11-b400-000d3a58d68e",
      "_fsip_productcb_value": null,
      "fsip_visitfrequency@OData.Community.Display.V1.FormattedValue": "30",
      "fsip_visitfrequency": 683440000,
      "fsip_3rdyearescalation_base": null,
      "_fsip_project_value": null,
      "_fsip_division_value@OData.Community.Display.V1.FormattedValue": "Maintenance",
      "_fsip_division_value": "9316e0ff-55a5-ec11-9840-000d3a5c16ba",
      "_fsip_contracttype_value@OData.Community.Display.V1.FormattedValue": "Limited Service",
      "_fsip_contracttype_value": "f13ce9c0-42a9-ec11-9840-000d3a307669",
      "fsip_sendescalationletter@OData.Community.Display.V1.FormattedValue": "No",
      "fsip_sendescalationletter": false,
      "lcd_braketestprice": "850",
      "utcconversiontimezonecode": null,
      "_createdonbehalfby_value": null,
      "fsip_numberofvisits": "1",
      "fsip_totalcontract_base": null,
      "fsip_grossmarginpercent@OData.Community.Display.V1.FormattedValue": "100.00",
      "fsip_grossmarginpercent": 100.00,
      "fsip_certificateofinsurance@OData.Community.Display.V1.FormattedValue": "No",
      "fsip_certificateofinsurance": false,
      "fsip_permitfeesbillable@OData.Community.Display.V1.FormattedValue": "No",
      "fsip_permitfeesbillable": false,
      "fsip_billingendon": null,
      "fsip_lastinvoiced@OData.Community.Display.V1.FormattedValue": "1/5/2026",
      "fsip_lastinvoiced": "2026-01-05T12:56:49Z",
      "fsip_internalnote": null,
      "fsip_escalationfrequency": null,
      "fsip_name": "38 Barstow Road",
      "fsip_workorderconsolidationtype@OData.Community.Display.V1.FormattedValue": "By Contract",
      "fsip_workorderconsolidationtype": 683440000,
      "fsip_addalldevicescontractbillings@OData.Community.Display.V1.FormattedValue": "No",
      "fsip_addalldevicescontractbillings": false,
      "fsip_lastescalationlettersent": null,
      "fsip_otminoradjustmentscbservice@OData.Community.Display.V1.FormattedValue": "No",
      "fsip_otminoradjustmentscbservice": false,
      "fsip_duration": null,
      "lcd_daystoexpire@OData.Community.Display.V1.FormattedValue": "-140.00",
      "lcd_daystoexpire": -140.0000000000,
      "fsip_3rdyearescalation": null,
      "fsip_invoicingmethod@OData.Community.Display.V1.FormattedValue": "Work Order Billing",
      "fsip_invoicingmethod": 683440001,
      "lcd_cat5fullloadbillable@OData.Community.Display.V1.FormattedValue": "Yes",
      "lcd_cat5fullloadbillable": 802290000,
      "fsip_cancelon": null,
      "fsip_originalcontractstartdate@OData.Community.Display.V1.FormattedValue": "6/1/2025",
      "fsip_originalcontractstartdate": "2025-06-01",
      "fsip_contractnumber": "MC-0002999",
      "fsip_exclusions": null,
      "_fsip_product_value": null,
      "fsip_quantity": null,
      "fsip_usediscountaspercentage@OData.Community.Display.V1.FormattedValue": "Amount",
      "fsip_usediscountaspercentage": false,
      "fsip_contractlanguage": null,
      "fsip_currentcontractyear": null,
      "lcd_originalcontractamount_base": null,
      "_modifiedonbehalfby_value": null,
      "fsip_fiveyearsafetytest@OData.Community.Display.V1.FormattedValue": "No",
      "fsip_fiveyearsafetytest": false,
      "fsip_closedate": null,
      "fsip_invoiceamount_base": null,
      "versionnumber@OData.Community.Display.V1.FormattedValue": "126,387,503",
      "versionnumber": 126387503,
      "fsip_description": null,
      "fsip_activeon": null,
      "fsip_billingenddate": null,
      "fsip_activemmr_base@OData.Community.Display.V1.FormattedValue": "$335.00",
      "fsip_activemmr_base": 335.0000000000,
      "statuscode@OData.Community.Display.V1.FormattedValue": "Active",
      "statuscode": 683440001,
      "fsip_testbillable@OData.Community.Display.V1.FormattedValue": "No",
      "fsip_testbillable": false,
      "createdon@OData.Community.Display.V1.FormattedValue": "6/4/2025 2:09 PM",
      "createdon": "2025-06-04T14:09:26Z",
      "fsip_holdnote": null,
      "fsip_grossmargin_base@OData.Community.Display.V1.FormattedValue": "$2,680.00",
      "fsip_grossmargin_base": 2680.0000000000,
      "_fsip_serviceaddress_value": null,
      "fsip_activemmr@OData.Community.Display.V1.FormattedValue": "$335.00",
      "fsip_activemmr": 335.0000000000,
      "lcd_braketestbillable@OData.Community.Display.V1.FormattedValue": "Yes",
      "lcd_braketestbillable": 802290000,
      "fsip_1styearescalation": null,
      "fsip_currentactualprofitpercent": null,
      "fsip_lastinvoicerollup_date@OData.Community.Display.V1.FormattedValue": "1/12/2026 8:46 PM",
      "fsip_lastinvoicerollup_date": "2026-01-12T20:46:52Z",
      "fsip_billinginprogress@OData.Community.Display.V1.FormattedValue": "No",
      "fsip_billinginprogress": false
    },
    {
      "@odata.etag": "W/\"126960364\"",
      "lcd_cancellationnotes": null,
      "fsip_po": null,
      "fsip_billingfrequency": null,
      "lcd_cat1annualprice": "775",
      "fsip_expireson": null,
      "fsip_won@OData.Community.Display.V1.FormattedValue": "No",
      "fsip_won": false,
      "fsip_schedulinginprogress@OData.Community.Display.V1.FormattedValue": "No",
      "fsip_schedulinginprogress": false,
      "_fsip_sortbyaccount_value@OData.Community.Display.V1.FormattedValue": "KP Developers",
      "_fsip_sortbyaccount_value": "1b119b18-45a9-ec11-9840-000d3a307669",
      "fsip_invoiced@OData.Community.Display.V1.FormattedValue": "$3,600.00",
      "fsip_invoiced": 3600.0000000000,
      "fsip_currentannualamount_base": null,
      "fsip_currentcontractstartdate@OData.Community.Display.V1.FormattedValue": "6/1/2025",
      "fsip_currentcontractstartdate": "2025-06-01",
      "fsip_nextescalationdate": null,
      "fsip_billingstarton": null,
      "fsip_costs_base@OData.Community.Display.V1.FormattedValue": "$0.00",
      "fsip_costs_base": 0.0000000000,
      "fsip_nextcontractbillingdate@OData.Community.Display.V1.FormattedValue": "2/1/2026",
      "fsip_nextcontractbillingdate": "2026-02-01",
      "fsip_4thyearescalation": null,
      "fsip_invoiced_date@OData.Community.Display.V1.FormattedValue": "1/12/2026 8:46 PM",
      "fsip_invoiced_date": "2026-01-12T20:46:52Z",
      "fsip_billingfrequencycode": null,
      "lcd_cat5fullloadprice": "1550",
      "_fsip_copydevicesfromcontract_value": null,
      "statecode@OData.Community.Display.V1.FormattedValue": "Active",
      "statecode": 0,
      "fsip_regulartimecbservice@OData.Community.Display.V1.FormattedValue": "No",
      "fsip_regulartimecbservice": false,
      "fsip_costs_date@OData.Community.Display.V1.FormattedValue": "1/12/2026 8:46 PM",
      "fsip_costs_date": "2026-01-12T20:46:52Z",
      "_fsip_copydevicesfrombuildinglocation_value": null,
      "lcd_originalcontractamount": null,
      "fsip_closedstatus": null,
      "_fsip_customerid_value@OData.Community.Display.V1.FormattedValue": "KP Developers",
      "_fsip_customerid_value": "1b119b18-45a9-ec11-9840-000d3a307669",
      "fsip_contractservicelevelcode": null,
      "fsip_invoiceamount": null,
      "_modifiedby_value@OData.Community.Display.V1.FormattedValue": "Alexander Buffolino",
      "_modifiedby_value": "721e05c5-9e60-ef11-bfe3-000d3a316b4e",
      "modifiedon@OData.Community.Display.V1.FormattedValue": "1/12/2026 7:38 PM",
      "modifiedon": "2026-01-12T19:38:30Z",
      "lcd_cancelationnotifyoffice@OData.Community.Display.V1.FormattedValue": "No",
      "lcd_cancelationnotifyoffice": 802290001,
      "lcd_autorenewal@OData.Community.Display.V1.FormattedValue": "Yes",
      "lcd_autorenewal": 802290000,
      "fsip_billingnotecb": null,
      "fsip_lastinvoiced_state@OData.Community.Display.V1.FormattedValue": "1",
      "fsip_lastinvoiced_state": 1,
      "fsip_costs_state@OData.Community.Display.V1.FormattedValue": "1",
      "fsip_costs_state": 1,
      "fsip_percentageoramount": null,
      "fsip_escalationamount_base": null,
      "fsip_closecontract@OData.Community.Display.V1.FormattedValue": "No",
      "fsip_closecontract": false,
      "overriddencreatedon": null,
      "lcd_cat1annualbillable@OData.Community.Display.V1.FormattedValue": "Yes",
      "lcd_cat1annualbillable": 802290000,
      "fsip_activemmr_date@OData.Community.Display.V1.FormattedValue": "1/12/2026 8:46 PM",
      "fsip_activemmr_date": "2026-01-12T20:46:52Z",
      "fsip_specialconditions": null,
      "fsip_currentcontractenddate@OData.Community.Display.V1.FormattedValue": "6/1/2026",
      "fsip_currentcontractenddate": "2026-06-01",
      "lcd_servicefrequencywords": "Monthly",
      "fsip_cleanpithoistwaycartops@OData.Community.Display.V1.FormattedValue": "No",
      "fsip_cleanpithoistwaycartops": false,
      "fsip_5thyearescalation": null,
      "fsip_totalcontract": null,
      "_owningteam_value": null,
      "fsip_autorenew@OData.Community.Display.V1.FormattedValue": "No",
      "fsip_autorenew": false,
      "fsip_escalationpercent": null,
      "exchangerate@OData.Community.Display.V1.FormattedValue": "1.0000000000",
      "exchangerate": 1.000000000000,
      "fsip_excludefromcontractescalations@OData.Community.Display.V1.FormattedValue": "No",
      "fsip_excludefromcontractescalations": false,
      "fsip_annualsafetytest@OData.Community.Display.V1.FormattedValue": "No",
      "fsip_annualsafetytest": false,
      "fsip_nextservicedate@OData.Community.Display.V1.FormattedValue": "2/1/2026",
      "fsip_nextservicedate": "2026-02-01T12:00:00Z",
      "fsip_onhold@OData.Community.Display.V1.FormattedValue": "No",
      "fsip_onhold": false,
      "fsip_currentannualamount": null,
      "_createdby_value@OData.Community.Display.V1.FormattedValue": "Barbara Oliveira",
      "_createdby_value": "554d6842-59b6-ef11-b8e9-000d3a5a6b66",
      "fsip_activemmr_state@OData.Community.Display.V1.FormattedValue": "1",
      "fsip_activemmr_state": 1,
      "fsip_2ndyearescalation": null,
      "_fsip_wagecategory_value": null,
      "fsip_maintenancecontractid": "6bdcfa5f-cd3b-f011-b4cb-000d3a302e4a",
      "fsip_contractreviewdate": null,
      "fsip_lastinvoicerollup_state@OData.Community.Display.V1.FormattedValue": "1",
      "fsip_lastinvoicerollup_state": 1,
      "fsip_invoiced_state@OData.Community.Display.V1.FormattedValue": "1",
      "fsip_invoiced_state": 1,
      "fsip_2ndyearescalation_base": null,
      "fsip_5thyearescalation_base": null,
      "fsip_proratedequipment": null,
      "_fsip_originatingcontract_value": null,
      "lcd_runcancelflow@OData.Community.Display.V1.FormattedValue": "No",
      "lcd_runcancelflow": 802290001,
      "fsip_nextbillingdate": null,
      "lcd_createcontractbilling": null,
      "fsip_lastinvoicerollup@OData.Community.Display.V1.FormattedValue": "1/1/2026",
      "fsip_lastinvoicerollup": "2026-01-01",
      "fsip_billingnote": null,
      "_fsip_salesperson_value": null,
      "fsip_invoiceconsolidationtype@OData.Community.Display.V1.FormattedValue": "By Contract",
      "fsip_invoiceconsolidationtype": 683440002,
      "fsip_4thyearescalation_base": null,
      "_fsip_billtocustomer_value@OData.Community.Display.V1.FormattedValue": "KP Developers",
      "_fsip_billtocustomer_value": "1b119b18-45a9-ec11-9840-000d3a307669",
      "fsip_costs@OData.Community.Display.V1.FormattedValue": "$0.00",
      "fsip_costs": 0.0000000000,
      "_owningbusinessunit_value@OData.Community.Display.V1.FormattedValue": "LCD Elevator",
      "_owningbusinessunit_value": "c9e85d8b-8fa0-ec11-b400-000d3a58d68e",
      "fsip_legacycontract": null,
      "fsip_printbillingnote@OData.Community.Display.V1.FormattedValue": "Yes",
      "fsip_printbillingnote": true,
      "timezoneruleversionnumber@OData.Community.Display.V1.FormattedValue": "4",
      "timezoneruleversionnumber": 4,
      "fsip_grossmargin@OData.Community.Display.V1.FormattedValue": "$3,600.00",
      "fsip_grossmargin": 3600.0000000000,
      "fsip_payssafetyequipment": null,
      "_ownerid_value@OData.Community.Display.V1.FormattedValue": "Barbara Oliveira",
      "_ownerid_value": "554d6842-59b6-ef11-b8e9-000d3a5a6b66",
      "_fsip_primarybuildinglocation_value@OData.Community.Display.V1.FormattedValue": "207 West 115th Street",
      "_fsip_primarybuildinglocation_value": "f6bc60e1-cc3b-f011-b4cb-000d3a302e4a",
      "fsip_lastinvoiced_date@OData.Community.Display.V1.FormattedValue": "1/12/2026 8:46 PM",
      "fsip_lastinvoiced_date": "2026-01-12T20:46:52Z",
      "fsip_invoiced_base@OData.Community.Display.V1.FormattedValue": "$3,600.00",
      "fsip_invoiced_base": 3600.0000000000,
      "importsequencenumber": null,
      "fsip_escalationamount": null,
      "fsip_1styearescalation_base": null,
      "_owninguser_value": "554d6842-59b6-ef11-b8e9-000d3a5a6b66",
      "_transactioncurrencyid_value@OData.Community.Display.V1.FormattedValue": "US Dollar",
      "_transactioncurrencyid_value": "28c060c5-d1a0-ec11-b400-000d3a58d68e",
      "_fsip_productcb_value": null,
      "fsip_visitfrequency@OData.Community.Display.V1.FormattedValue": "30",
      "fsip_visitfrequency": 683440000,
      "fsip_3rdyearescalation_base": null,
      "_fsip_project_value": null,
      "_fsip_division_value@OData.Community.Display.V1.FormattedValue": "Maintenance",
      "_fsip_division_value": "9316e0ff-55a5-ec11-9840-000d3a5c16ba",
      "_fsip_contracttype_value@OData.Community.Display.V1.FormattedValue": "Limited Service",
      "_fsip_contracttype_value": "f13ce9c0-42a9-ec11-9840-000d3a307669",
      "fsip_sendescalationletter@OData.Community.Display.V1.FormattedValue": "No",
      "fsip_sendescalationletter": false,
      "lcd_braketestprice": "850",
      "utcconversiontimezonecode": null,
      "_createdonbehalfby_value": null,
      "fsip_numberofvisits": "1",
      "fsip_totalcontract_base": null,
      "fsip_grossmarginpercent@OData.Community.Display.V1.FormattedValue": "100.00",
      "fsip_grossmarginpercent": 100.00,
      "fsip_certificateofinsurance@OData.Community.Display.V1.FormattedValue": "No",
      "fsip_certificateofinsurance": false,
      "fsip_permitfeesbillable@OData.Community.Display.V1.FormattedValue": "No",
      "fsip_permitfeesbillable": false,
      "fsip_billingendon": null,
      "fsip_lastinvoiced@OData.Community.Display.V1.FormattedValue": "1/5/2026",
      "fsip_lastinvoiced": "2026-01-05T12:56:49Z",
      "fsip_internalnote": null,
      "fsip_escalationfrequency": null,
      "fsip_name": "207 West 115th Street",
      "fsip_workorderconsolidationtype@OData.Community.Display.V1.FormattedValue": "By Contract",
      "fsip_workorderconsolidationtype": 683440000,
      "fsip_addalldevicescontractbillings@OData.Community.Display.V1.FormattedValue": "No",
      "fsip_addalldevicescontractbillings": false,
      "fsip_lastescalationlettersent": null,
      "fsip_otminoradjustmentscbservice@OData.Community.Display.V1.FormattedValue": "No",
      "fsip_otminoradjustmentscbservice": false,
      "fsip_duration": null,
      "lcd_daystoexpire@OData.Community.Display.V1.FormattedValue": "-140.00",
      "lcd_daystoexpire": -140.0000000000,
      "fsip_3rdyearescalation": null,
      "fsip_invoicingmethod@OData.Community.Display.V1.FormattedValue": "Work Order Billing",
      "fsip_invoicingmethod": 683440001,
      "lcd_cat5fullloadbillable@OData.Community.Display.V1.FormattedValue": "Yes",
      "lcd_cat5fullloadbillable": 802290000,
      "fsip_cancelon": null,
      "fsip_originalcontractstartdate@OData.Community.Display.V1.FormattedValue": "6/1/2025",
      "fsip_originalcontractstartdate": "2025-06-01",
      "fsip_contractnumber": "MC-0002990",
      "fsip_exclusions": "Please note, the disconnect means and fuses, car enclosures, car doors and hoist-way entrances are excluded. All repairs performed by LCD will use only genuine standard parts produced and manufactured for customer's equipment. Maintenance does not include service calls, repair or replacement of electrical and mechanical parts of elevator equipment and apparatus which shall be performed only at additional cost billed at parts plus labor.",
      "_fsip_product_value": null,
      "fsip_quantity": null,
      "fsip_usediscountaspercentage@OData.Community.Display.V1.FormattedValue": "Amount",
      "fsip_usediscountaspercentage": false,
      "fsip_contractlanguage": null,
      "fsip_currentcontractyear": null,
      "lcd_originalcontractamount_base": null,
      "_modifiedonbehalfby_value": null,
      "fsip_fiveyearsafetytest@OData.Community.Display.V1.FormattedValue": "No",
      "fsip_fiveyearsafetytest": false,
      "fsip_closedate": null,
      "fsip_invoiceamount_base": null,
      "versionnumber@OData.Community.Display.V1.FormattedValue": "126,960,364",
      "versionnumber": 126960364,
      "fsip_description": null,
      "fsip_activeon": null,
      "fsip_billingenddate": null,
      "fsip_activemmr_base@OData.Community.Display.V1.FormattedValue": "$450.00",
      "fsip_activemmr_base": 450.0000000000,
      "statuscode@OData.Community.Display.V1.FormattedValue": "Active",
      "statuscode": 683440001,
      "fsip_testbillable@OData.Community.Display.V1.FormattedValue": "No",
      "fsip_testbillable": false,
      "createdon@OData.Community.Display.V1.FormattedValue": "5/28/2025 2:09 PM",
      "createdon": "2025-05-28T14:09:35Z",
      "fsip_holdnote": null,
      "fsip_grossmargin_base@OData.Community.Display.V1.FormattedValue": "$3,600.00",
      "fsip_grossmargin_base": 3600.0000000000,
      "_fsip_serviceaddress_value": null,
      "fsip_activemmr@OData.Community.Display.V1.FormattedValue": "$450.00",
      "fsip_activemmr": 450.0000000000,
      "lcd_braketestbillable@OData.Community.Display.V1.FormattedValue": "Yes",
      "lcd_braketestbillable": 802290000,
      "fsip_1styearescalation": null,
      "fsip_currentactualprofitpercent": null,
      "fsip_lastinvoicerollup_date@OData.Community.Display.V1.FormattedValue": "1/12/2026 8:46 PM",
      "fsip_lastinvoicerollup_date": "2026-01-12T20:46:52Z",
      "fsip_billinginprogress@OData.Community.Display.V1.FormattedValue": "No",
      "fsip_billinginprogress": false
    },
    {
      "@odata.etag": "W/\"126309656\"",
      "lcd_cancellationnotes": null,
      "fsip_po": null,
      "fsip_billingfrequency": null,
      "lcd_cat1annualprice": null,
      "fsip_expireson": null,
      "fsip_won@OData.Community.Display.V1.FormattedValue": "No",
      "fsip_won": false,
      "fsip_schedulinginprogress@OData.Community.Display.V1.FormattedValue": "No",
      "fsip_schedulinginprogress": false,
      "_fsip_sortbyaccount_value@OData.Community.Display.V1.FormattedValue": "Cubesmart L.P.",
      "_fsip_sortbyaccount_value": "f80f9b18-45a9-ec11-9840-000d3a307669",
      "fsip_invoiced@OData.Community.Display.V1.FormattedValue": "$0.00",
      "fsip_invoiced": 0.0000000000,
      "fsip_currentannualamount_base": null,
      "fsip_currentcontractstartdate@OData.Community.Display.V1.FormattedValue": "6/24/2025",
      "fsip_currentcontractstartdate": "2025-06-24",
      "fsip_nextescalationdate": null,
      "fsip_billingstarton": null,
      "fsip_costs_base@OData.Community.Display.V1.FormattedValue": "$0.00",
      "fsip_costs_base": 0.0000000000,
      "fsip_nextcontractbillingdate": null,
      "fsip_4thyearescalation": null,
      "fsip_invoiced_date@OData.Community.Display.V1.FormattedValue": "1/12/2026 8:46 PM",
      "fsip_invoiced_date": "2026-01-12T20:46:52Z",
      "fsip_billingfrequencycode": null,
      "lcd_cat5fullloadprice": null,
      "_fsip_copydevicesfromcontract_value": null,
      "statecode@OData.Community.Display.V1.FormattedValue": "Active",
      "statecode": 0,
      "fsip_regulartimecbservice@OData.Community.Display.V1.FormattedValue": "No",
      "fsip_regulartimecbservice": false,
      "fsip_costs_date@OData.Community.Display.V1.FormattedValue": "1/12/2026 8:46 PM",
      "fsip_costs_date": "2026-01-12T20:46:52Z",
      "_fsip_copydevicesfrombuildinglocation_value": null,
      "lcd_originalcontractamount": null,
      "fsip_closedstatus": null,
      "_fsip_customerid_value@OData.Community.Display.V1.FormattedValue": "Cubesmart L.P.",
      "_fsip_customerid_value": "f80f9b18-45a9-ec11-9840-000d3a307669",
      "fsip_contractservicelevelcode": null,
      "fsip_invoiceamount": null,
      "_modifiedby_value@OData.Community.Display.V1.FormattedValue": "# SCRIBE INTEGRATION",
      "_modifiedby_value": "910423db-6a8d-ef11-ac21-000d3a326f08",
      "modifiedon@OData.Community.Display.V1.FormattedValue": "12/31/2025 5:38 PM",
      "modifiedon": "2025-12-31T17:38:04Z",
      "lcd_cancelationnotifyoffice@OData.Community.Display.V1.FormattedValue": "No",
      "lcd_cancelationnotifyoffice": 802290001,
      "lcd_autorenewal@OData.Community.Display.V1.FormattedValue": "No",
      "lcd_autorenewal": 802290001,
      "fsip_billingnotecb": null,
      "fsip_lastinvoiced_state@OData.Community.Display.V1.FormattedValue": "1",
      "fsip_lastinvoiced_state": 1,
      "fsip_costs_state@OData.Community.Display.V1.FormattedValue": "1",
      "fsip_costs_state": 1,
      "fsip_percentageoramount": null,
      "fsip_escalationamount_base": null,
      "fsip_closecontract@OData.Community.Display.V1.FormattedValue": "No",
      "fsip_closecontract": false,
      "overriddencreatedon": null,
      "lcd_cat1annualbillable": null,
      "fsip_activemmr_date@OData.Community.Display.V1.FormattedValue": "1/12/2026 8:46 PM",
      "fsip_activemmr_date": "2026-01-12T20:46:52Z",
      "fsip_specialconditions": null,
      "fsip_currentcontractenddate@OData.Community.Display.V1.FormattedValue": "6/24/2026",
      "fsip_currentcontractenddate": "2026-06-24",
      "lcd_servicefrequencywords": "Monthly",
      "fsip_cleanpithoistwaycartops@OData.Community.Display.V1.FormattedValue": "No",
      "fsip_cleanpithoistwaycartops": false,
      "fsip_5thyearescalation": null,
      "fsip_totalcontract": null,
      "_owningteam_value": null,
      "fsip_autorenew@OData.Community.Display.V1.FormattedValue": "No",
      "fsip_autorenew": false,
      "fsip_escalationpercent": null,
      "exchangerate@OData.Community.Display.V1.FormattedValue": "1.0000000000",
      "exchangerate": 1.000000000000,
      "fsip_excludefromcontractescalations@OData.Community.Display.V1.FormattedValue": "No",
      "fsip_excludefromcontractescalations": false,
      "fsip_annualsafetytest@OData.Community.Display.V1.FormattedValue": "No",
      "fsip_annualsafetytest": false,
      "fsip_nextservicedate@OData.Community.Display.V1.FormattedValue": "2/24/2026",
      "fsip_nextservicedate": "2026-02-24T11:00:00Z",
      "fsip_onhold@OData.Community.Display.V1.FormattedValue": "No",
      "fsip_onhold": false,
      "fsip_currentannualamount": null,
      "_createdby_value@OData.Community.Display.V1.FormattedValue": "Barbara Oliveira",
      "_createdby_value": "554d6842-59b6-ef11-b8e9-000d3a5a6b66",
      "fsip_activemmr_state@OData.Community.Display.V1.FormattedValue": "1",
      "fsip_activemmr_state": 1,
      "fsip_2ndyearescalation": null,
      "_fsip_wagecategory_value": null,
      "fsip_maintenancecontractid": "0ee1f0cf-5e71-f011-b4cb-000d3a302e4a",
      "fsip_contractreviewdate": null,
      "fsip_lastinvoicerollup_state@OData.Community.Display.V1.FormattedValue": "0",
      "fsip_lastinvoicerollup_state": 0,
      "fsip_invoiced_state@OData.Community.Display.V1.FormattedValue": "1",
      "fsip_invoiced_state": 1,
      "fsip_2ndyearescalation_base": null,
      "fsip_5thyearescalation_base": null,
      "fsip_proratedequipment": null,
      "_fsip_originatingcontract_value": null,
      "lcd_runcancelflow@OData.Community.Display.V1.FormattedValue": "No",
      "lcd_runcancelflow": 802290001,
      "fsip_nextbillingdate": null,
      "lcd_createcontractbilling": null,
      "fsip_lastinvoicerollup": null,
      "fsip_billingnote": null,
      "_fsip_salesperson_value@OData.Community.Display.V1.FormattedValue": "Stu Tenzer",
      "_fsip_salesperson_value": "bcf5f82b-0baa-ec11-9840-000d3a302927",
      "fsip_invoiceconsolidationtype@OData.Community.Display.V1.FormattedValue": "No Consolidation",
      "fsip_invoiceconsolidationtype": 683440000,
      "fsip_4thyearescalation_base": null,
      "_fsip_billtocustomer_value@OData.Community.Display.V1.FormattedValue": "Cubesmart L.P.",
      "_fsip_billtocustomer_value": "f80f9b18-45a9-ec11-9840-000d3a307669",
      "fsip_costs@OData.Community.Display.V1.FormattedValue": "$0.00",
      "fsip_costs": 0.0000000000,
      "_owningbusinessunit_value@OData.Community.Display.V1.FormattedValue": "LCD Elevator",
      "_owningbusinessunit_value": "c9e85d8b-8fa0-ec11-b400-000d3a58d68e",
      "fsip_legacycontract": null,
      "fsip_printbillingnote@OData.Community.Display.V1.FormattedValue": "Yes",
      "fsip_printbillingnote": true,
      "timezoneruleversionnumber@OData.Community.Display.V1.FormattedValue": "4",
      "timezoneruleversionnumber": 4,
      "fsip_grossmargin@OData.Community.Display.V1.FormattedValue": "$0.00",
      "fsip_grossmargin": 0.0000000000,
      "fsip_payssafetyequipment": null,
      "_ownerid_value@OData.Community.Display.V1.FormattedValue": "Barbara Oliveira",
      "_ownerid_value": "554d6842-59b6-ef11-b8e9-000d3a5a6b66",
      "_fsip_primarybuildinglocation_value@OData.Community.Display.V1.FormattedValue": "354 North Main Street",
      "_fsip_primarybuildinglocation_value": "f07b458d-f171-ef11-a670-000d3a3abd71",
      "fsip_lastinvoiced_date@OData.Community.Display.V1.FormattedValue": "1/12/2026 8:46 PM",
      "fsip_lastinvoiced_date": "2026-01-12T20:46:52Z",
      "fsip_invoiced_base@OData.Community.Display.V1.FormattedValue": "$0.00",
      "fsip_invoiced_base": 0.0000000000,
      "importsequencenumber": null,
      "fsip_escalationamount": null,
      "fsip_1styearescalation_base": null,
      "_owninguser_value": "554d6842-59b6-ef11-b8e9-000d3a5a6b66",
      "_transactioncurrencyid_value@OData.Community.Display.V1.FormattedValue": "US Dollar",
      "_transactioncurrencyid_value": "28c060c5-d1a0-ec11-b400-000d3a58d68e",
      "_fsip_productcb_value": null,
      "fsip_visitfrequency@OData.Community.Display.V1.FormattedValue": "30",
      "fsip_visitfrequency": 683440000,
      "fsip_3rdyearescalation_base": null,
      "_fsip_project_value": null,
      "_fsip_division_value@OData.Community.Display.V1.FormattedValue": "Maintenance",
      "_fsip_division_value": "9316e0ff-55a5-ec11-9840-000d3a5c16ba",
      "_fsip_contracttype_value@OData.Community.Display.V1.FormattedValue": "Free Maintenance (Warranty)",
      "_fsip_contracttype_value": "fd3ce9c0-42a9-ec11-9840-000d3a307669",
      "fsip_sendescalationletter@OData.Community.Display.V1.FormattedValue": "No",
      "fsip_sendescalationletter": false,
      "lcd_braketestprice": null,
      "utcconversiontimezonecode": null,
      "_createdonbehalfby_value": null,
      "fsip_numberofvisits": "1",
      "fsip_totalcontract_base": null,
      "fsip_grossmarginpercent": null,
      "fsip_certificateofinsurance@OData.Community.Display.V1.FormattedValue": "No",
      "fsip_certificateofinsurance": false,
      "fsip_permitfeesbillable@OData.Community.Display.V1.FormattedValue": "No",
      "fsip_permitfeesbillable": false,
      "fsip_billingendon": null,
      "fsip_lastinvoiced": null,
      "fsip_internalnote": null,
      "fsip_escalationfrequency": null,
      "fsip_name": "354 North Main Street",
      "fsip_workorderconsolidationtype@OData.Community.Display.V1.FormattedValue": "By Contract",
      "fsip_workorderconsolidationtype": 683440000,
      "fsip_addalldevicescontractbillings@OData.Community.Display.V1.FormattedValue": "No",
      "fsip_addalldevicescontractbillings": false,
      "fsip_lastescalationlettersent": null,
      "fsip_otminoradjustmentscbservice@OData.Community.Display.V1.FormattedValue": "No",
      "fsip_otminoradjustmentscbservice": false,
      "fsip_duration": null,
      "lcd_daystoexpire@OData.Community.Display.V1.FormattedValue": "-163.00",
      "lcd_daystoexpire": -163.0000000000,
      "fsip_3rdyearescalation": null,
      "fsip_invoicingmethod@OData.Community.Display.V1.FormattedValue": "Work Order Billing",
      "fsip_invoicingmethod": 683440001,
      "lcd_cat5fullloadbillable": null,
      "fsip_cancelon": null,
      "fsip_originalcontractstartdate@OData.Community.Display.V1.FormattedValue": "6/24/2025",
      "fsip_originalcontractstartdate": "2025-06-24",
      "fsip_contractnumber": "MC-0003045",
      "fsip_exclusions": null,
      "_fsip_product_value": null,
      "fsip_quantity": null,
      "fsip_usediscountaspercentage@OData.Community.Display.V1.FormattedValue": "Amount",
      "fsip_usediscountaspercentage": false,
      "fsip_contractlanguage": null,
      "fsip_currentcontractyear": null,
      "lcd_originalcontractamount_base": null,
      "_modifiedonbehalfby_value": null,
      "fsip_fiveyearsafetytest@OData.Community.Display.V1.FormattedValue": "No",
      "fsip_fiveyearsafetytest": false,
      "fsip_closedate": null,
      "fsip_invoiceamount_base": null,
      "versionnumber@OData.Community.Display.V1.FormattedValue": "126,309,656",
      "versionnumber": 126309656,
      "fsip_description": null,
      "fsip_activeon": null,
      "fsip_billingenddate": null,
      "fsip_activemmr_base@OData.Community.Display.V1.FormattedValue": "$0.00",
      "fsip_activemmr_base": 0.0000000000,
      "statuscode@OData.Community.Display.V1.FormattedValue": "Active",
      "statuscode": 683440001,
      "fsip_testbillable@OData.Community.Display.V1.FormattedValue": "No",
      "fsip_testbillable": false,
      "createdon@OData.Community.Display.V1.FormattedValue": "8/4/2025 6:14 PM",
      "createdon": "2025-08-04T18:14:12Z",
      "fsip_holdnote": null,
      "fsip_grossmargin_base@OData.Community.Display.V1.FormattedValue": "$0.00",
      "fsip_grossmargin_base": 0.0000000000,
      "_fsip_serviceaddress_value": null,
      "fsip_activemmr@OData.Community.Display.V1.FormattedValue": "$0.00",
      "fsip_activemmr": 0.0000000000,
      "lcd_braketestbillable": null,
      "fsip_1styearescalation": null,
      "fsip_currentactualprofitpercent": null,
      "fsip_lastinvoicerollup_date@OData.Community.Display.V1.FormattedValue": "1/12/2026 8:46 PM",
      "fsip_lastinvoicerollup_date": "2026-01-12T20:46:52Z",
      "fsip_billinginprogress@OData.Community.Display.V1.FormattedValue": "No",
      "fsip_billinginprogress": false
    },
    {
      "@odata.etag": "W/\"126387508\"",
      "lcd_cancellationnotes": null,
      "fsip_po": null,
      "fsip_billingfrequency": null,
      "lcd_cat1annualprice": "775",
      "fsip_expireson": null,
      "fsip_won@OData.Community.Display.V1.FormattedValue": "No",
      "fsip_won": false,
      "fsip_schedulinginprogress@OData.Community.Display.V1.FormattedValue": "No",
      "fsip_schedulinginprogress": false,
      "_fsip_sortbyaccount_value@OData.Community.Display.V1.FormattedValue": "URO Realty Partners",
      "_fsip_sortbyaccount_value": "2ebba8ef-0c78-ee11-8179-6045bd0388ff",
      "fsip_invoiced@OData.Community.Display.V1.FormattedValue": "$1,078.00",
      "fsip_invoiced": 1078.0000000000,
      "fsip_currentannualamount_base": null,
      "fsip_currentcontractstartdate@OData.Community.Display.V1.FormattedValue": "10/1/2025",
      "fsip_currentcontractstartdate": "2025-10-01",
      "fsip_nextescalationdate": null,
      "fsip_billingstarton": null,
      "fsip_costs_base@OData.Community.Display.V1.FormattedValue": "$0.00",
      "fsip_costs_base": 0.0000000000,
      "fsip_nextcontractbillingdate@OData.Community.Display.V1.FormattedValue": "4/1/2026",
      "fsip_nextcontractbillingdate": "2026-04-01",
      "fsip_4thyearescalation": null,
      "fsip_invoiced_date@OData.Community.Display.V1.FormattedValue": "1/12/2026 8:46 PM",
      "fsip_invoiced_date": "2026-01-12T20:46:52Z",
      "fsip_billingfrequencycode": null,
      "lcd_cat5fullloadprice": null,
      "_fsip_copydevicesfromcontract_value": null,
      "statecode@OData.Community.Display.V1.FormattedValue": "Active",
      "statecode": 0,
      "fsip_regulartimecbservice@OData.Community.Display.V1.FormattedValue": "No",
      "fsip_regulartimecbservice": false,
      "fsip_costs_date@OData.Community.Display.V1.FormattedValue": "1/12/2026 8:46 PM",
      "fsip_costs_date": "2026-01-12T20:46:52Z",
      "_fsip_copydevicesfrombuildinglocation_value": null,
      "lcd_originalcontractamount": null,
      "fsip_closedstatus": null,
      "_fsip_customerid_value@OData.Community.Display.V1.FormattedValue": "URO Realty Partners",
      "_fsip_customerid_value": "2ebba8ef-0c78-ee11-8179-6045bd0388ff",
      "fsip_contractservicelevelcode": null,
      "fsip_invoiceamount": null,
      "_modifiedby_value@OData.Community.Display.V1.FormattedValue": "# SCRIBE INTEGRATION",
      "_modifiedby_value": "910423db-6a8d-ef11-ac21-000d3a326f08",
      "modifiedon@OData.Community.Display.V1.FormattedValue": "1/5/2026 12:59 PM",
      "modifiedon": "2026-01-05T12:59:37Z",
      "lcd_cancelationnotifyoffice@OData.Community.Display.V1.FormattedValue": "No",
      "lcd_cancelationnotifyoffice": 802290001,
      "lcd_autorenewal@OData.Community.Display.V1.FormattedValue": "No",
      "lcd_autorenewal": 802290001,
      "fsip_billingnotecb": null,
      "fsip_lastinvoiced_state@OData.Community.Display.V1.FormattedValue": "1",
      "fsip_lastinvoiced_state": 1,
      "fsip_costs_state@OData.Community.Display.V1.FormattedValue": "1",
      "fsip_costs_state": 1,
      "fsip_percentageoramount": null,
      "fsip_escalationamount_base": null,
      "fsip_closecontract@OData.Community.Display.V1.FormattedValue": "No",
      "fsip_closecontract": false,
      "overriddencreatedon": null,
      "lcd_cat1annualbillable@OData.Community.Display.V1.FormattedValue": "Yes",
      "lcd_cat1annualbillable": 802290000,
      "fsip_activemmr_date@OData.Community.Display.V1.FormattedValue": "1/12/2026 8:46 PM",
      "fsip_activemmr_date": "2026-01-12T20:46:52Z",
      "fsip_specialconditions": null,
      "fsip_currentcontractenddate@OData.Community.Display.V1.FormattedValue": "10/1/2026",
      "fsip_currentcontractenddate": "2026-10-01",
      "lcd_servicefrequencywords": "Quarterly",
      "fsip_cleanpithoistwaycartops@OData.Community.Display.V1.FormattedValue": "No",
      "fsip_cleanpithoistwaycartops": false,
      "fsip_5thyearescalation": null,
      "fsip_totalcontract": null,
      "_owningteam_value": null,
      "fsip_autorenew@OData.Community.Display.V1.FormattedValue": "No",
      "fsip_autorenew": false,
      "fsip_escalationpercent": null,
      "exchangerate@OData.Community.Display.V1.FormattedValue": "1.0000000000",
      "exchangerate": 1.000000000000,
      "fsip_excludefromcontractescalations@OData.Community.Display.V1.FormattedValue": "No",
      "fsip_excludefromcontractescalations": false,
      "fsip_annualsafetytest@OData.Community.Display.V1.FormattedValue": "No",
      "fsip_annualsafetytest": false,
      "fsip_nextservicedate@OData.Community.Display.V1.FormattedValue": "4/1/2026",
      "fsip_nextservicedate": "2026-04-01T11:00:00Z",
      "fsip_onhold@OData.Community.Display.V1.FormattedValue": "No",
      "fsip_onhold": false,
      "fsip_currentannualamount": null,
      "_createdby_value@OData.Community.Display.V1.FormattedValue": "Barbara Oliveira",
      "_createdby_value": "554d6842-59b6-ef11-b8e9-000d3a5a6b66",
      "fsip_activemmr_state@OData.Community.Display.V1.FormattedValue": "1",
      "fsip_activemmr_state": 1,
      "fsip_2ndyearescalation": null,
      "_fsip_wagecategory_value": null,
      "fsip_maintenancecontractid": "f3a92566-ad8c-f011-b4cb-000d3a302e4a",
      "fsip_contractreviewdate@OData.Community.Display.V1.FormattedValue": "9/1/2026",
      "fsip_contractreviewdate": "2026-09-01",
      "fsip_lastinvoicerollup_state@OData.Community.Display.V1.FormattedValue": "1",
      "fsip_lastinvoicerollup_state": 1,
      "fsip_invoiced_state@OData.Community.Display.V1.FormattedValue": "1",
      "fsip_invoiced_state": 1,
      "fsip_2ndyearescalation_base": null,
      "fsip_5thyearescalation_base": null,
      "fsip_proratedequipment": null,
      "_fsip_originatingcontract_value": null,
      "lcd_runcancelflow@OData.Community.Display.V1.FormattedValue": "No",
      "lcd_runcancelflow": 802290001,
      "fsip_nextbillingdate": null,
      "lcd_createcontractbilling": null,
      "fsip_lastinvoicerollup@OData.Community.Display.V1.FormattedValue": "1/1/2026",
      "fsip_lastinvoicerollup": "2026-01-01",
      "fsip_billingnote": null,
      "_fsip_salesperson_value": null,
      "fsip_invoiceconsolidationtype@OData.Community.Display.V1.FormattedValue": "By Contract",
      "fsip_invoiceconsolidationtype": 683440002,
      "fsip_4thyearescalation_base": null,
      "_fsip_billtocustomer_value@OData.Community.Display.V1.FormattedValue": "URO Realty Partners",
      "_fsip_billtocustomer_value": "2ebba8ef-0c78-ee11-8179-6045bd0388ff",
      "fsip_costs@OData.Community.Display.V1.FormattedValue": "$0.00",
      "fsip_costs": 0.0000000000,
      "_owningbusinessunit_value@OData.Community.Display.V1.FormattedValue": "LCD Elevator",
      "_owningbusinessunit_value": "c9e85d8b-8fa0-ec11-b400-000d3a58d68e",
      "fsip_legacycontract": null,
      "fsip_printbillingnote@OData.Community.Display.V1.FormattedValue": "Yes",
      "fsip_printbillingnote": true,
      "timezoneruleversionnumber@OData.Community.Display.V1.FormattedValue": "4",
      "timezoneruleversionnumber": 4,
      "fsip_grossmargin@OData.Community.Display.V1.FormattedValue": "$1,078.00",
      "fsip_grossmargin": 1078.0000000000,
      "fsip_payssafetyequipment": null,
      "_ownerid_value@OData.Community.Display.V1.FormattedValue": "Barbara Oliveira",
      "_ownerid_value": "554d6842-59b6-ef11-b8e9-000d3a5a6b66",
      "_fsip_primarybuildinglocation_value@OData.Community.Display.V1.FormattedValue": "7210 13th Avenue",
      "_fsip_primarybuildinglocation_value": "ecd36c25-1caa-ec11-9840-000d3a307669",
      "fsip_lastinvoiced_date@OData.Community.Display.V1.FormattedValue": "1/12/2026 8:46 PM",
      "fsip_lastinvoiced_date": "2026-01-12T20:46:52Z",
      "fsip_invoiced_base@OData.Community.Display.V1.FormattedValue": "$1,078.00",
      "fsip_invoiced_base": 1078.0000000000,
      "importsequencenumber": null,
      "fsip_escalationamount": null,
      "fsip_1styearescalation_base": null,
      "_owninguser_value": "554d6842-59b6-ef11-b8e9-000d3a5a6b66",
      "_transactioncurrencyid_value@OData.Community.Display.V1.FormattedValue": "US Dollar",
      "_transactioncurrencyid_value": "28c060c5-d1a0-ec11-b400-000d3a58d68e",
      "_fsip_productcb_value": null,
      "fsip_visitfrequency@OData.Community.Display.V1.FormattedValue": "90",
      "fsip_visitfrequency": 683440002,
      "fsip_3rdyearescalation_base": null,
      "_fsip_project_value": null,
      "_fsip_division_value@OData.Community.Display.V1.FormattedValue": "Maintenance",
      "_fsip_division_value": "9316e0ff-55a5-ec11-9840-000d3a5c16ba",
      "_fsip_contracttype_value@OData.Community.Display.V1.FormattedValue": "Limited Service",
      "_fsip_contracttype_value": "f13ce9c0-42a9-ec11-9840-000d3a307669",
      "fsip_sendescalationletter@OData.Community.Display.V1.FormattedValue": "No",
      "fsip_sendescalationletter": false,
      "lcd_braketestprice": null,
      "utcconversiontimezonecode": null,
      "_createdonbehalfby_value": null,
      "fsip_numberofvisits": "1",
      "fsip_totalcontract_base": null,
      "fsip_grossmarginpercent@OData.Community.Display.V1.FormattedValue": "100.00",
      "fsip_grossmarginpercent": 100.00,
      "fsip_certificateofinsurance@OData.Community.Display.V1.FormattedValue": "No",
      "fsip_certificateofinsurance": false,
      "fsip_permitfeesbillable@OData.Community.Display.V1.FormattedValue": "No",
      "fsip_permitfeesbillable": false,
      "fsip_billingendon": null,
      "fsip_lastinvoiced@OData.Community.Display.V1.FormattedValue": "1/5/2026",
      "fsip_lastinvoiced": "2026-01-05T12:56:49Z",
      "fsip_internalnote": null,
      "fsip_escalationfrequency": null,
      "fsip_name": "7210 13th Avenue",
      "fsip_workorderconsolidationtype@OData.Community.Display.V1.FormattedValue": "By Contract",
      "fsip_workorderconsolidationtype": 683440000,
      "fsip_addalldevicescontractbillings@OData.Community.Display.V1.FormattedValue": "No",
      "fsip_addalldevicescontractbillings": false,
      "fsip_lastescalationlettersent": null,
      "fsip_otminoradjustmentscbservice@OData.Community.Display.V1.FormattedValue": "No",
      "fsip_otminoradjustmentscbservice": false,
      "fsip_duration": null,
      "lcd_daystoexpire@OData.Community.Display.V1.FormattedValue": "-262.00",
      "lcd_daystoexpire": -262.0000000000,
      "fsip_3rdyearescalation": null,
      "fsip_invoicingmethod@OData.Community.Display.V1.FormattedValue": "Work Order Billing",
      "fsip_invoicingmethod": 683440001,
      "lcd_cat5fullloadbillable": null,
      "fsip_cancelon": null,
      "fsip_originalcontractstartdate@OData.Community.Display.V1.FormattedValue": "10/1/2025",
      "fsip_originalcontractstartdate": "2025-10-01",
      "fsip_contractnumber": "MC-0003070",
      "fsip_exclusions": null,
      "_fsip_product_value": null,
      "fsip_quantity": null,
      "fsip_usediscountaspercentage@OData.Community.Display.V1.FormattedValue": "Amount",
      "fsip_usediscountaspercentage": false,
      "fsip_contractlanguage": null,
      "fsip_currentcontractyear": null,
      "lcd_originalcontractamount_base": null,
      "_modifiedonbehalfby_value": null,
      "fsip_fiveyearsafetytest@OData.Community.Display.V1.FormattedValue": "No",
      "fsip_fiveyearsafetytest": false,
      "fsip_closedate": null,
      "fsip_invoiceamount_base": null,
      "versionnumber@OData.Community.Display.V1.FormattedValue": "126,387,508",
      "versionnumber": 126387508,
      "fsip_description": null,
      "fsip_activeon": null,
      "fsip_billingenddate": null,
      "fsip_activemmr_base@OData.Community.Display.V1.FormattedValue": "$179.67",
      "fsip_activemmr_base": 179.6666660000,
      "statuscode@OData.Community.Display.V1.FormattedValue": "Active",
      "statuscode": 683440001,
      "fsip_testbillable@OData.Community.Display.V1.FormattedValue": "No",
      "fsip_testbillable": false,
      "createdon@OData.Community.Display.V1.FormattedValue": "9/8/2025 12:14 PM",
      "createdon": "2025-09-08T12:14:43Z",
      "fsip_holdnote": null,
      "fsip_grossmargin_base@OData.Community.Display.V1.FormattedValue": "$1,078.00",
      "fsip_grossmargin_base": 1078.0000000000,
      "_fsip_serviceaddress_value": null,
      "fsip_activemmr@OData.Community.Display.V1.FormattedValue": "$179.67",
      "fsip_activemmr": 179.6666660000,
      "lcd_braketestbillable": null,
      "fsip_1styearescalation": null,
      "fsip_currentactualprofitpercent": null,
      "fsip_lastinvoicerollup_date@OData.Community.Display.V1.FormattedValue": "1/12/2026 8:46 PM",
      "fsip_lastinvoicerollup_date": "2026-01-12T20:46:52Z",
      "fsip_billinginprogress@OData.Community.Display.V1.FormattedValue": "No",
      "fsip_billinginprogress": false
    },
    {
      "@odata.etag": "W/\"126426792\"",
      "lcd_cancellationnotes": null,
      "fsip_po": null,
      "fsip_billingfrequency": null,
      "lcd_cat1annualprice": "775",
      "fsip_expireson": null,
      "fsip_won@OData.Community.Display.V1.FormattedValue": "No",
      "fsip_won": false,
      "fsip_schedulinginprogress@OData.Community.Display.V1.FormattedValue": "No",
      "fsip_schedulinginprogress": false,
      "_fsip_sortbyaccount_value@OData.Community.Display.V1.FormattedValue": "H20 Property Services",
      "_fsip_sortbyaccount_value": "44827374-d712-ef11-9f8a-6045bd0954f0",
      "fsip_invoiced@OData.Community.Display.V1.FormattedValue": "$1,104.00",
      "fsip_invoiced": 1104.0000000000,
      "fsip_currentannualamount_base": null,
      "fsip_currentcontractstartdate@OData.Community.Display.V1.FormattedValue": "11/1/2025",
      "fsip_currentcontractstartdate": "2025-11-01",
      "fsip_nextescalationdate": null,
      "fsip_billingstarton": null,
      "fsip_costs_base@OData.Community.Display.V1.FormattedValue": "$0.00",
      "fsip_costs_base": 0.0000000000,
      "fsip_nextcontractbillingdate@OData.Community.Display.V1.FormattedValue": "2/1/2026",
      "fsip_nextcontractbillingdate": "2026-02-01",
      "fsip_4thyearescalation": null,
      "fsip_invoiced_date@OData.Community.Display.V1.FormattedValue": "1/12/2026 8:46 PM",
      "fsip_invoiced_date": "2026-01-12T20:46:52Z",
      "fsip_billingfrequencycode": null,
      "lcd_cat5fullloadprice": "1550",
      "_fsip_copydevicesfromcontract_value": null,
      "statecode@OData.Community.Display.V1.FormattedValue": "Active",
      "statecode": 0,
      "fsip_regulartimecbservice@OData.Community.Display.V1.FormattedValue": "No",
      "fsip_regulartimecbservice": false,
      "fsip_costs_date@OData.Community.Display.V1.FormattedValue": "1/12/2026 8:46 PM",
      "fsip_costs_date": "2026-01-12T20:46:52Z",
      "_fsip_copydevicesfrombuildinglocation_value": null,
      "lcd_originalcontractamount": null,
      "fsip_closedstatus": null,
      "_fsip_customerid_value@OData.Community.Display.V1.FormattedValue": "H20 Property Services",
      "_fsip_customerid_value": "44827374-d712-ef11-9f8a-6045bd0954f0",
      "fsip_contractservicelevelcode": null,
      "fsip_invoiceamount": null,
      "_modifiedby_value@OData.Community.Display.V1.FormattedValue": "Alexander Buffolino",
      "_modifiedby_value": "721e05c5-9e60-ef11-bfe3-000d3a316b4e",
      "modifiedon@OData.Community.Display.V1.FormattedValue": "1/5/2026 7:41 PM",
      "modifiedon": "2026-01-05T19:41:25Z",
      "lcd_cancelationnotifyoffice@OData.Community.Display.V1.FormattedValue": "No",
      "lcd_cancelationnotifyoffice": 802290001,
      "lcd_autorenewal@OData.Community.Display.V1.FormattedValue": "Yes",
      "lcd_autorenewal": 802290000,
      "fsip_billingnotecb": null,
      "fsip_lastinvoiced_state@OData.Community.Display.V1.FormattedValue": "1",
      "fsip_lastinvoiced_state": 1,
      "fsip_costs_state@OData.Community.Display.V1.FormattedValue": "1",
      "fsip_costs_state": 1,
      "fsip_percentageoramount": null,
      "fsip_escalationamount_base": null,
      "fsip_closecontract@OData.Community.Display.V1.FormattedValue": "No",
      "fsip_closecontract": false,
      "overriddencreatedon": null,
      "lcd_cat1annualbillable@OData.Community.Display.V1.FormattedValue": "Yes",
      "lcd_cat1annualbillable": 802290000,
      "fsip_activemmr_date@OData.Community.Display.V1.FormattedValue": "1/12/2026 8:46 PM",
      "fsip_activemmr_date": "2026-01-12T20:46:52Z",
      "fsip_specialconditions": null,
      "fsip_currentcontractenddate@OData.Community.Display.V1.FormattedValue": "11/1/2026",
      "fsip_currentcontractenddate": "2026-11-01",
      "lcd_servicefrequencywords": "Monthly",
      "fsip_cleanpithoistwaycartops@OData.Community.Display.V1.FormattedValue": "No",
      "fsip_cleanpithoistwaycartops": false,
      "fsip_5thyearescalation": null,
      "fsip_totalcontract": null,
      "_owningteam_value": null,
      "fsip_autorenew@OData.Community.Display.V1.FormattedValue": "No",
      "fsip_autorenew": false,
      "fsip_escalationpercent": null,
      "exchangerate@OData.Community.Display.V1.FormattedValue": "1.0000000000",
      "exchangerate": 1.000000000000,
      "fsip_excludefromcontractescalations@OData.Community.Display.V1.FormattedValue": "No",
      "fsip_excludefromcontractescalations": false,
      "fsip_annualsafetytest@OData.Community.Display.V1.FormattedValue": "No",
      "fsip_annualsafetytest": false,
      "fsip_nextservicedate@OData.Community.Display.V1.FormattedValue": "2/1/2026",
      "fsip_nextservicedate": "2026-02-01T11:00:00Z",
      "fsip_onhold@OData.Community.Display.V1.FormattedValue": "No",
      "fsip_onhold": false,
      "fsip_currentannualamount": null,
      "_createdby_value@OData.Community.Display.V1.FormattedValue": "Barbara Oliveira",
      "_createdby_value": "554d6842-59b6-ef11-b8e9-000d3a5a6b66",
      "fsip_activemmr_state@OData.Community.Display.V1.FormattedValue": "1",
      "fsip_activemmr_state": 1,
      "fsip_2ndyearescalation": null,
      "_fsip_wagecategory_value": null,
      "fsip_maintenancecontractid": "96de5ba8-748d-f011-b4cb-000d3a302e4a",
      "fsip_contractreviewdate": null,
      "fsip_lastinvoicerollup_state@OData.Community.Display.V1.FormattedValue": "1",
      "fsip_lastinvoicerollup_state": 1,
      "fsip_invoiced_state@OData.Community.Display.V1.FormattedValue": "1",
      "fsip_invoiced_state": 1,
      "fsip_2ndyearescalation_base": null,
      "fsip_5thyearescalation_base": null,
      "fsip_proratedequipment": null,
      "_fsip_originatingcontract_value": null,
      "lcd_runcancelflow@OData.Community.Display.V1.FormattedValue": "No",
      "lcd_runcancelflow": 802290001,
      "fsip_nextbillingdate": null,
      "lcd_createcontractbilling": null,
      "fsip_lastinvoicerollup@OData.Community.Display.V1.FormattedValue": "1/1/2026",
      "fsip_lastinvoicerollup": "2026-01-01",
      "fsip_billingnote": null,
      "_fsip_salesperson_value@OData.Community.Display.V1.FormattedValue": "Stu Tenzer",
      "_fsip_salesperson_value": "bcf5f82b-0baa-ec11-9840-000d3a302927",
      "fsip_invoiceconsolidationtype@OData.Community.Display.V1.FormattedValue": "By Contract",
      "fsip_invoiceconsolidationtype": 683440002,
      "fsip_4thyearescalation_base": null,
      "_fsip_billtocustomer_value@OData.Community.Display.V1.FormattedValue": "H20 Property Services",
      "_fsip_billtocustomer_value": "44827374-d712-ef11-9f8a-6045bd0954f0",
      "fsip_costs@OData.Community.Display.V1.FormattedValue": "$0.00",
      "fsip_costs": 0.0000000000,
      "_owningbusinessunit_value@OData.Community.Display.V1.FormattedValue": "LCD Elevator",
      "_owningbusinessunit_value": "c9e85d8b-8fa0-ec11-b400-000d3a58d68e",
      "fsip_legacycontract": null,
      "fsip_printbillingnote@OData.Community.Display.V1.FormattedValue": "Yes",
      "fsip_printbillingnote": true,
      "timezoneruleversionnumber@OData.Community.Display.V1.FormattedValue": "4",
      "timezoneruleversionnumber": 4,
      "fsip_grossmargin@OData.Community.Display.V1.FormattedValue": "$1,104.00",
      "fsip_grossmargin": 1104.0000000000,
      "fsip_payssafetyequipment": null,
      "_ownerid_value@OData.Community.Display.V1.FormattedValue": "Barbara Oliveira",
      "_ownerid_value": "554d6842-59b6-ef11-b8e9-000d3a5a6b66",
      "_fsip_primarybuildinglocation_value@OData.Community.Display.V1.FormattedValue": "1119 Boston Road",
      "_fsip_primarybuildinglocation_value": "faed84ff-d712-ef11-9f8a-6045bd0954f0",
      "fsip_lastinvoiced_date@OData.Community.Display.V1.FormattedValue": "1/12/2026 8:46 PM",
      "fsip_lastinvoiced_date": "2026-01-12T20:46:52Z",
      "fsip_invoiced_base@OData.Community.Display.V1.FormattedValue": "$1,104.00",
      "fsip_invoiced_base": 1104.0000000000,
      "importsequencenumber": null,
      "fsip_escalationamount": null,
      "fsip_1styearescalation_base": null,
      "_owninguser_value": "554d6842-59b6-ef11-b8e9-000d3a5a6b66",
      "_transactioncurrencyid_value@OData.Community.Display.V1.FormattedValue": "US Dollar",
      "_transactioncurrencyid_value": "28c060c5-d1a0-ec11-b400-000d3a58d68e",
      "_fsip_productcb_value": null,
      "fsip_visitfrequency@OData.Community.Display.V1.FormattedValue": "30",
      "fsip_visitfrequency": 683440000,
      "fsip_3rdyearescalation_base": null,
      "_fsip_project_value": null,
      "_fsip_division_value@OData.Community.Display.V1.FormattedValue": "Maintenance",
      "_fsip_division_value": "9316e0ff-55a5-ec11-9840-000d3a5c16ba",
      "_fsip_contracttype_value@OData.Community.Display.V1.FormattedValue": "Limited Service",
      "_fsip_contracttype_value": "f13ce9c0-42a9-ec11-9840-000d3a307669",
      "fsip_sendescalationletter@OData.Community.Display.V1.FormattedValue": "No",
      "fsip_sendescalationletter": false,
      "lcd_braketestprice": "850",
      "utcconversiontimezonecode": null,
      "_createdonbehalfby_value": null,
      "fsip_numberofvisits": "1",
      "fsip_totalcontract_base": null,
      "fsip_grossmarginpercent@OData.Community.Display.V1.FormattedValue": "100.00",
      "fsip_grossmarginpercent": 100.00,
      "fsip_certificateofinsurance@OData.Community.Display.V1.FormattedValue": "No",
      "fsip_certificateofinsurance": false,
      "fsip_permitfeesbillable@OData.Community.Display.V1.FormattedValue": "No",
      "fsip_permitfeesbillable": false,
      "fsip_billingendon": null,
      "fsip_lastinvoiced@OData.Community.Display.V1.FormattedValue": "1/5/2026",
      "fsip_lastinvoiced": "2026-01-05T12:56:49Z",
      "fsip_internalnote": null,
      "fsip_escalationfrequency": null,
      "fsip_name": "1119 Boston Road",
      "fsip_workorderconsolidationtype@OData.Community.Display.V1.FormattedValue": "By Contract",
      "fsip_workorderconsolidationtype": 683440000,
      "fsip_addalldevicescontractbillings@OData.Community.Display.V1.FormattedValue": "No",
      "fsip_addalldevicescontractbillings": false,
      "fsip_lastescalationlettersent": null,
      "fsip_otminoradjustmentscbservice@OData.Community.Display.V1.FormattedValue": "No",
      "fsip_otminoradjustmentscbservice": false,
      "fsip_duration": null,
      "lcd_daystoexpire@OData.Community.Display.V1.FormattedValue": "-293.00",
      "lcd_daystoexpire": -293.0000000000,
      "fsip_3rdyearescalation": null,
      "fsip_invoicingmethod@OData.Community.Display.V1.FormattedValue": "Work Order Billing",
      "fsip_invoicingmethod": 683440001,
      "lcd_cat5fullloadbillable@OData.Community.Display.V1.FormattedValue": "Yes",
      "lcd_cat5fullloadbillable": 802290000,
      "fsip_cancelon": null,
      "fsip_originalcontractstartdate@OData.Community.Display.V1.FormattedValue": "11/1/2025",
      "fsip_originalcontractstartdate": "2025-11-01",
      "fsip_contractnumber": "MC-0003071",
      "fsip_exclusions": "Please note, the disconnect means and fuses, car enclosures, car doors and hoist-way entrances are excluded. All repairs performed by LCD will use only genuine standard parts produced and manufactured for customers equipment. Maintenance does not include service calls, repair or replacement of electrical and mechanical parts of elevator equipment and apparatus which shall be performed only at additional cost billed at parts plus labor.",
      "_fsip_product_value": null,
      "fsip_quantity": null,
      "fsip_usediscountaspercentage@OData.Community.Display.V1.FormattedValue": "Amount",
      "fsip_usediscountaspercentage": false,
      "fsip_contractlanguage": null,
      "fsip_currentcontractyear": null,
      "lcd_originalcontractamount_base": null,
      "_modifiedonbehalfby_value": null,
      "fsip_fiveyearsafetytest@OData.Community.Display.V1.FormattedValue": "No",
      "fsip_fiveyearsafetytest": false,
      "fsip_closedate": null,
      "fsip_invoiceamount_base": null,
      "versionnumber@OData.Community.Display.V1.FormattedValue": "126,426,792",
      "versionnumber": 126426792,
      "fsip_description": null,
      "fsip_activeon": null,
      "fsip_billingenddate": null,
      "fsip_activemmr_base@OData.Community.Display.V1.FormattedValue": "$368.00",
      "fsip_activemmr_base": 368.0000000000,
      "statuscode@OData.Community.Display.V1.FormattedValue": "Active",
      "statuscode": 683440001,
      "fsip_testbillable@OData.Community.Display.V1.FormattedValue": "No",
      "fsip_testbillable": false,
      "createdon@OData.Community.Display.V1.FormattedValue": "9/9/2025 12:01 PM",
      "createdon": "2025-09-09T12:01:07Z",
      "fsip_holdnote": null,
      "fsip_grossmargin_base@OData.Community.Display.V1.FormattedValue": "$1,104.00",
      "fsip_grossmargin_base": 1104.0000000000,
      "_fsip_serviceaddress_value": null,
      "fsip_activemmr@OData.Community.Display.V1.FormattedValue": "$368.00",
      "fsip_activemmr": 368.0000000000,
      "lcd_braketestbillable@OData.Community.Display.V1.FormattedValue": "Yes",
      "lcd_braketestbillable": 802290000,
      "fsip_1styearescalation": null,
      "fsip_currentactualprofitpercent": null,
      "fsip_lastinvoicerollup_date@OData.Community.Display.V1.FormattedValue": "1/12/2026 8:46 PM",
      "fsip_lastinvoicerollup_date": "2026-01-12T20:46:52Z",
      "fsip_billinginprogress@OData.Community.Display.V1.FormattedValue": "No",
      "fsip_billinginprogress": false
    },
    {
      "@odata.etag": "W/\"126387682\"",
      "lcd_cancellationnotes": null,
      "fsip_po": null,
      "fsip_billingfrequency": null,
      "lcd_cat1annualprice": "775",
      "fsip_expireson": null,
      "fsip_won@OData.Community.Display.V1.FormattedValue": "No",
      "fsip_won": false,
      "fsip_schedulinginprogress@OData.Community.Display.V1.FormattedValue": "No",
      "fsip_schedulinginprogress": false,
      "_fsip_sortbyaccount_value@OData.Community.Display.V1.FormattedValue": "2180 Walton Avenue LLC",
      "_fsip_sortbyaccount_value": "4e819f95-b9e9-ed11-a7c6-6045bd0388ff",
      "fsip_invoiced@OData.Community.Display.V1.FormattedValue": "$1,644.00",
      "fsip_invoiced": 1644.0000000000,
      "fsip_currentannualamount_base": null,
      "fsip_currentcontractstartdate@OData.Community.Display.V1.FormattedValue": "10/1/2025",
      "fsip_currentcontractstartdate": "2025-10-01",
      "fsip_nextescalationdate": null,
      "fsip_billingstarton": null,
      "fsip_costs_base@OData.Community.Display.V1.FormattedValue": "$0.00",
      "fsip_costs_base": 0.0000000000,
      "fsip_nextcontractbillingdate@OData.Community.Display.V1.FormattedValue": "2/1/2026",
      "fsip_nextcontractbillingdate": "2026-02-01",
      "fsip_4thyearescalation": null,
      "fsip_invoiced_date@OData.Community.Display.V1.FormattedValue": "1/12/2026 8:46 PM",
      "fsip_invoiced_date": "2026-01-12T20:46:52Z",
      "fsip_billingfrequencycode": null,
      "lcd_cat5fullloadprice": "1550",
      "_fsip_copydevicesfromcontract_value": null,
      "statecode@OData.Community.Display.V1.FormattedValue": "Active",
      "statecode": 0,
      "fsip_regulartimecbservice@OData.Community.Display.V1.FormattedValue": "No",
      "fsip_regulartimecbservice": false,
      "fsip_costs_date@OData.Community.Display.V1.FormattedValue": "1/12/2026 8:46 PM",
      "fsip_costs_date": "2026-01-12T20:46:52Z",
      "_fsip_copydevicesfrombuildinglocation_value": null,
      "lcd_originalcontractamount": null,
      "fsip_closedstatus": null,
      "_fsip_customerid_value@OData.Community.Display.V1.FormattedValue": "2180 Walton Avenue LLC",
      "_fsip_customerid_value": "4e819f95-b9e9-ed11-a7c6-6045bd0388ff",
      "fsip_contractservicelevelcode": null,
      "fsip_invoiceamount": null,
      "_modifiedby_value@OData.Community.Display.V1.FormattedValue": "# SCRIBE INTEGRATION",
      "_modifiedby_value": "910423db-6a8d-ef11-ac21-000d3a326f08",
      "modifiedon@OData.Community.Display.V1.FormattedValue": "1/5/2026 12:59 PM",
      "modifiedon": "2026-01-05T12:59:38Z",
      "lcd_cancelationnotifyoffice@OData.Community.Display.V1.FormattedValue": "No",
      "lcd_cancelationnotifyoffice": 802290001,
      "lcd_autorenewal@OData.Community.Display.V1.FormattedValue": "Yes",
      "lcd_autorenewal": 802290000,
      "fsip_billingnotecb": null,
      "fsip_lastinvoiced_state@OData.Community.Display.V1.FormattedValue": "1",
      "fsip_lastinvoiced_state": 1,
      "fsip_costs_state@OData.Community.Display.V1.FormattedValue": "1",
      "fsip_costs_state": 1,
      "fsip_percentageoramount": null,
      "fsip_escalationamount_base": null,
      "fsip_closecontract@OData.Community.Display.V1.FormattedValue": "No",
      "fsip_closecontract": false,
      "overriddencreatedon": null,
      "lcd_cat1annualbillable@OData.Community.Display.V1.FormattedValue": "Yes",
      "lcd_cat1annualbillable": 802290000,
      "fsip_activemmr_date@OData.Community.Display.V1.FormattedValue": "1/12/2026 8:46 PM",
      "fsip_activemmr_date": "2026-01-12T20:46:52Z",
      "fsip_specialconditions": null,
      "fsip_currentcontractenddate@OData.Community.Display.V1.FormattedValue": "10/1/2026",
      "fsip_currentcontractenddate": "2026-10-01",
      "lcd_servicefrequencywords": "Monthly",
      "fsip_cleanpithoistwaycartops@OData.Community.Display.V1.FormattedValue": "No",
      "fsip_cleanpithoistwaycartops": false,
      "fsip_5thyearescalation": null,
      "fsip_totalcontract": null,
      "_owningteam_value": null,
      "fsip_autorenew@OData.Community.Display.V1.FormattedValue": "No",
      "fsip_autorenew": false,
      "fsip_escalationpercent": null,
      "exchangerate@OData.Community.Display.V1.FormattedValue": "1.0000000000",
      "exchangerate": 1.000000000000,
      "fsip_excludefromcontractescalations@OData.Community.Display.V1.FormattedValue": "No",
      "fsip_excludefromcontractescalations": false,
      "fsip_annualsafetytest@OData.Community.Display.V1.FormattedValue": "No",
      "fsip_annualsafetytest": false,
      "fsip_nextservicedate@OData.Community.Display.V1.FormattedValue": "2/1/2026",
      "fsip_nextservicedate": "2026-02-01T11:00:00Z",
      "fsip_onhold@OData.Community.Display.V1.FormattedValue": "No",
      "fsip_onhold": false,
      "fsip_currentannualamount": null,
      "_createdby_value@OData.Community.Display.V1.FormattedValue": "Barbara Oliveira",
      "_createdby_value": "554d6842-59b6-ef11-b8e9-000d3a5a6b66",
      "fsip_activemmr_state@OData.Community.Display.V1.FormattedValue": "1",
      "fsip_activemmr_state": 1,
      "fsip_2ndyearescalation": null,
      "_fsip_wagecategory_value": null,
      "fsip_maintenancecontractid": "d68bb70f-788d-f011-b4cb-000d3a302e4a",
      "fsip_contractreviewdate": null,
      "fsip_lastinvoicerollup_state@OData.Community.Display.V1.FormattedValue": "1",
      "fsip_lastinvoicerollup_state": 1,
      "fsip_invoiced_state@OData.Community.Display.V1.FormattedValue": "1",
      "fsip_invoiced_state": 1,
      "fsip_2ndyearescalation_base": null,
      "fsip_5thyearescalation_base": null,
      "fsip_proratedequipment": null,
      "_fsip_originatingcontract_value": null,
      "lcd_runcancelflow@OData.Community.Display.V1.FormattedValue": "No",
      "lcd_runcancelflow": 802290001,
      "fsip_nextbillingdate": null,
      "lcd_createcontractbilling": null,
      "fsip_lastinvoicerollup@OData.Community.Display.V1.FormattedValue": "1/1/2026",
      "fsip_lastinvoicerollup": "2026-01-01",
      "fsip_billingnote": null,
      "_fsip_salesperson_value": null,
      "fsip_invoiceconsolidationtype@OData.Community.Display.V1.FormattedValue": "By Contract",
      "fsip_invoiceconsolidationtype": 683440002,
      "fsip_4thyearescalation_base": null,
      "_fsip_billtocustomer_value@OData.Community.Display.V1.FormattedValue": "2180 Walton Avenue LLC",
      "_fsip_billtocustomer_value": "4e819f95-b9e9-ed11-a7c6-6045bd0388ff",
      "fsip_costs@OData.Community.Display.V1.FormattedValue": "$0.00",
      "fsip_costs": 0.0000000000,
      "_owningbusinessunit_value@OData.Community.Display.V1.FormattedValue": "LCD Elevator",
      "_owningbusinessunit_value": "c9e85d8b-8fa0-ec11-b400-000d3a58d68e",
      "fsip_legacycontract": null,
      "fsip_printbillingnote@OData.Community.Display.V1.FormattedValue": "Yes",
      "fsip_printbillingnote": true,
      "timezoneruleversionnumber@OData.Community.Display.V1.FormattedValue": "4",
      "timezoneruleversionnumber": 4,
      "fsip_grossmargin@OData.Community.Display.V1.FormattedValue": "$1,644.00",
      "fsip_grossmargin": 1644.0000000000,
      "fsip_payssafetyequipment": null,
      "_ownerid_value@OData.Community.Display.V1.FormattedValue": "Barbara Oliveira",
      "_ownerid_value": "554d6842-59b6-ef11-b8e9-000d3a5a6b66",
      "_fsip_primarybuildinglocation_value@OData.Community.Display.V1.FormattedValue": "2180 Walton Avenue",
      "_fsip_primarybuildinglocation_value": "fbb87bf0-b8e9-ed11-a7c6-6045bd0388ff",
      "fsip_lastinvoiced_date@OData.Community.Display.V1.FormattedValue": "1/12/2026 8:46 PM",
      "fsip_lastinvoiced_date": "2026-01-12T20:46:52Z",
      "fsip_invoiced_base@OData.Community.Display.V1.FormattedValue": "$1,644.00",
      "fsip_invoiced_base": 1644.0000000000,
      "importsequencenumber": null,
      "fsip_escalationamount": null,
      "fsip_1styearescalation_base": null,
      "_owninguser_value": "554d6842-59b6-ef11-b8e9-000d3a5a6b66",
      "_transactioncurrencyid_value@OData.Community.Display.V1.FormattedValue": "US Dollar",
      "_transactioncurrencyid_value": "28c060c5-d1a0-ec11-b400-000d3a58d68e",
      "_fsip_productcb_value": null,
      "fsip_visitfrequency@OData.Community.Display.V1.FormattedValue": "30",
      "fsip_visitfrequency": 683440000,
      "fsip_3rdyearescalation_base": null,
      "_fsip_project_value": null,
      "_fsip_division_value@OData.Community.Display.V1.FormattedValue": "Maintenance",
      "_fsip_division_value": "9316e0ff-55a5-ec11-9840-000d3a5c16ba",
      "_fsip_contracttype_value@OData.Community.Display.V1.FormattedValue": "Limited Service",
      "_fsip_contracttype_value": "f13ce9c0-42a9-ec11-9840-000d3a307669",
      "fsip_sendescalationletter@OData.Community.Display.V1.FormattedValue": "No",
      "fsip_sendescalationletter": false,
      "lcd_braketestprice": "850",
      "utcconversiontimezonecode": null,
      "_createdonbehalfby_value": null,
      "fsip_numberofvisits": "1",
      "fsip_totalcontract_base": null,
      "fsip_grossmarginpercent@OData.Community.Display.V1.FormattedValue": "100.00",
      "fsip_grossmarginpercent": 100.00,
      "fsip_certificateofinsurance@OData.Community.Display.V1.FormattedValue": "No",
      "fsip_certificateofinsurance": false,
      "fsip_permitfeesbillable@OData.Community.Display.V1.FormattedValue": "No",
      "fsip_permitfeesbillable": false,
      "fsip_billingendon": null,
      "fsip_lastinvoiced@OData.Community.Display.V1.FormattedValue": "1/5/2026",
      "fsip_lastinvoiced": "2026-01-05T12:56:51Z",
      "fsip_internalnote": null,
      "fsip_escalationfrequency": null,
      "fsip_name": "2180 Walton Avenue",
      "fsip_workorderconsolidationtype@OData.Community.Display.V1.FormattedValue": "By Contract",
      "fsip_workorderconsolidationtype": 683440000,
      "fsip_addalldevicescontractbillings@OData.Community.Display.V1.FormattedValue": "No",
      "fsip_addalldevicescontractbillings": false,
      "fsip_lastescalationlettersent": null,
      "fsip_otminoradjustmentscbservice@OData.Community.Display.V1.FormattedValue": "No",
      "fsip_otminoradjustmentscbservice": false,
      "fsip_duration": null,
      "lcd_daystoexpire@OData.Community.Display.V1.FormattedValue": "-262.00",
      "lcd_daystoexpire": -262.0000000000,
      "fsip_3rdyearescalation": null,
      "fsip_invoicingmethod@OData.Community.Display.V1.FormattedValue": "Work Order Billing",
      "fsip_invoicingmethod": 683440001,
      "lcd_cat5fullloadbillable@OData.Community.Display.V1.FormattedValue": "Yes",
      "lcd_cat5fullloadbillable": 802290000,
      "fsip_cancelon": null,
      "fsip_originalcontractstartdate@OData.Community.Display.V1.FormattedValue": "10/1/2025",
      "fsip_originalcontractstartdate": "2025-10-01",
      "fsip_contractnumber": "MC-0003072",
      "fsip_exclusions": "Please note, the disconnect means and fuses, car enclosures, car doors and hoist-way entrances are excluded. All repairs performed by LCD will use only genuine standard parts produced and manufactured for customer's equipment. Maintenance does not include repair or replacement of electrical and mechanical parts of elevator equipment and apparatus which shall be performed only at additional cost billed at parts plus labor.",
      "_fsip_product_value": null,
      "fsip_quantity": null,
      "fsip_usediscountaspercentage@OData.Community.Display.V1.FormattedValue": "Amount",
      "fsip_usediscountaspercentage": false,
      "fsip_contractlanguage": null,
      "fsip_currentcontractyear": null,
      "lcd_originalcontractamount_base": null,
      "_modifiedonbehalfby_value": null,
      "fsip_fiveyearsafetytest@OData.Community.Display.V1.FormattedValue": "No",
      "fsip_fiveyearsafetytest": false,
      "fsip_closedate": null,
      "fsip_invoiceamount_base": null,
      "versionnumber@OData.Community.Display.V1.FormattedValue": "126,387,682",
      "versionnumber": 126387682,
      "fsip_description": null,
      "fsip_activeon": null,
      "fsip_billingenddate": null,
      "fsip_activemmr_base@OData.Community.Display.V1.FormattedValue": "$411.00",
      "fsip_activemmr_base": 411.0000000000,
      "statuscode@OData.Community.Display.V1.FormattedValue": "Active",
      "statuscode": 683440001,
      "fsip_testbillable@OData.Community.Display.V1.FormattedValue": "No",
      "fsip_testbillable": false,
      "createdon@OData.Community.Display.V1.FormattedValue": "9/9/2025 12:25 PM",
      "createdon": "2025-09-09T12:25:25Z",
      "fsip_holdnote": null,
      "fsip_grossmargin_base@OData.Community.Display.V1.FormattedValue": "$1,644.00",
      "fsip_grossmargin_base": 1644.0000000000,
      "_fsip_serviceaddress_value": null,
      "fsip_activemmr@OData.Community.Display.V1.FormattedValue": "$411.00",
      "fsip_activemmr": 411.0000000000,
      "lcd_braketestbillable@OData.Community.Display.V1.FormattedValue": "Yes",
      "lcd_braketestbillable": 802290000,
      "fsip_1styearescalation": null,
      "fsip_currentactualprofitpercent": null,
      "fsip_lastinvoicerollup_date@OData.Community.Display.V1.FormattedValue": "1/12/2026 8:46 PM",
      "fsip_lastinvoicerollup_date": "2026-01-12T20:46:52Z",
      "fsip_billinginprogress@OData.Community.Display.V1.FormattedValue": "No",
      "fsip_billinginprogress": false
    },
    {
      "@odata.etag": "W/\"126664103\"",
      "lcd_cancellationnotes": null,
      "fsip_po": null,
      "fsip_billingfrequency": null,
      "lcd_cat1annualprice": "775",
      "fsip_expireson": null,
      "fsip_won@OData.Community.Display.V1.FormattedValue": "No",
      "fsip_won": false,
      "fsip_schedulinginprogress@OData.Community.Display.V1.FormattedValue": "No",
      "fsip_schedulinginprogress": false,
      "_fsip_sortbyaccount_value@OData.Community.Display.V1.FormattedValue": "Benedict Realty Group - Andy",
      "_fsip_sortbyaccount_value": "01522376-1ba3-ed11-aad0-6045bd03814f",
      "fsip_invoiced@OData.Community.Display.V1.FormattedValue": "$3,000.00",
      "fsip_invoiced": 3000.0000000000,
      "fsip_currentannualamount_base": null,
      "fsip_currentcontractstartdate@OData.Community.Display.V1.FormattedValue": "10/1/2025",
      "fsip_currentcontractstartdate": "2025-10-01",
      "fsip_nextescalationdate": null,
      "fsip_billingstarton": null,
      "fsip_costs_base@OData.Community.Display.V1.FormattedValue": "$0.00",
      "fsip_costs_base": 0.0000000000,
      "fsip_nextcontractbillingdate@OData.Community.Display.V1.FormattedValue": "2/1/2026",
      "fsip_nextcontractbillingdate": "2026-02-01",
      "fsip_4thyearescalation": null,
      "fsip_invoiced_date@OData.Community.Display.V1.FormattedValue": "1/12/2026 8:46 PM",
      "fsip_invoiced_date": "2026-01-12T20:46:52Z",
      "fsip_billingfrequencycode": null,
      "lcd_cat5fullloadprice": "1550",
      "_fsip_copydevicesfromcontract_value": null,
      "statecode@OData.Community.Display.V1.FormattedValue": "Active",
      "statecode": 0,
      "fsip_regulartimecbservice@OData.Community.Display.V1.FormattedValue": "No",
      "fsip_regulartimecbservice": false,
      "fsip_costs_date@OData.Community.Display.V1.FormattedValue": "1/12/2026 8:46 PM",
      "fsip_costs_date": "2026-01-12T20:46:52Z",
      "_fsip_copydevicesfrombuildinglocation_value": null,
      "lcd_originalcontractamount": null,
      "fsip_closedstatus": null,
      "_fsip_customerid_value@OData.Community.Display.V1.FormattedValue": "Benedict Realty Group - Andy",
      "_fsip_customerid_value": "01522376-1ba3-ed11-aad0-6045bd03814f",
      "fsip_contractservicelevelcode": null,
      "fsip_invoiceamount": null,
      "_modifiedby_value@OData.Community.Display.V1.FormattedValue": "# SCRIBE INTEGRATION",
      "_modifiedby_value": "910423db-6a8d-ef11-ac21-000d3a326f08",
      "modifiedon@OData.Community.Display.V1.FormattedValue": "1/5/2026 12:59 PM",
      "modifiedon": "2026-01-05T12:59:38Z",
      "lcd_cancelationnotifyoffice@OData.Community.Display.V1.FormattedValue": "No",
      "lcd_cancelationnotifyoffice": 802290001,
      "lcd_autorenewal@OData.Community.Display.V1.FormattedValue": "Yes",
      "lcd_autorenewal": 802290000,
      "fsip_billingnotecb": null,
      "fsip_lastinvoiced_state@OData.Community.Display.V1.FormattedValue": "1",
      "fsip_lastinvoiced_state": 1,
      "fsip_costs_state@OData.Community.Display.V1.FormattedValue": "1",
      "fsip_costs_state": 1,
      "fsip_percentageoramount": null,
      "fsip_escalationamount_base": null,
      "fsip_closecontract@OData.Community.Display.V1.FormattedValue": "No",
      "fsip_closecontract": false,
      "overriddencreatedon": null,
      "lcd_cat1annualbillable@OData.Community.Display.V1.FormattedValue": "Yes",
      "lcd_cat1annualbillable": 802290000,
      "fsip_activemmr_date@OData.Community.Display.V1.FormattedValue": "1/12/2026 8:46 PM",
      "fsip_activemmr_date": "2026-01-12T20:46:52Z",
      "fsip_specialconditions": null,
      "fsip_currentcontractenddate@OData.Community.Display.V1.FormattedValue": "10/1/2026",
      "fsip_currentcontractenddate": "2026-10-01",
      "lcd_servicefrequencywords": "Monthly",
      "fsip_cleanpithoistwaycartops@OData.Community.Display.V1.FormattedValue": "No",
      "fsip_cleanpithoistwaycartops": false,
      "fsip_5thyearescalation": null,
      "fsip_totalcontract": null,
      "_owningteam_value": null,
      "fsip_autorenew@OData.Community.Display.V1.FormattedValue": "No",
      "fsip_autorenew": false,
      "fsip_escalationpercent": null,
      "exchangerate@OData.Community.Display.V1.FormattedValue": "1.0000000000",
      "exchangerate": 1.000000000000,
      "fsip_excludefromcontractescalations@OData.Community.Display.V1.FormattedValue": "No",
      "fsip_excludefromcontractescalations": false,
      "fsip_annualsafetytest@OData.Community.Display.V1.FormattedValue": "No",
      "fsip_annualsafetytest": false,
      "fsip_nextservicedate@OData.Community.Display.V1.FormattedValue": "2/1/2026",
      "fsip_nextservicedate": "2026-02-01T11:00:00Z",
      "fsip_onhold@OData.Community.Display.V1.FormattedValue": "No",
      "fsip_onhold": false,
      "fsip_currentannualamount": null,
      "_createdby_value@OData.Community.Display.V1.FormattedValue": "Barbara Oliveira",
      "_createdby_value": "554d6842-59b6-ef11-b8e9-000d3a5a6b66",
      "fsip_activemmr_state@OData.Community.Display.V1.FormattedValue": "1",
      "fsip_activemmr_state": 1,
      "fsip_2ndyearescalation": null,
      "_fsip_wagecategory_value": null,
      "fsip_maintenancecontractid": "8da5ab69-7a8d-f011-b4cb-000d3a302e4a",
      "fsip_contractreviewdate": null,
      "fsip_lastinvoicerollup_state@OData.Community.Display.V1.FormattedValue": "1",
      "fsip_lastinvoicerollup_state": 1,
      "fsip_invoiced_state@OData.Community.Display.V1.FormattedValue": "1",
      "fsip_invoiced_state": 1,
      "fsip_2ndyearescalation_base": null,
      "fsip_5thyearescalation_base": null,
      "fsip_proratedequipment": null,
      "_fsip_originatingcontract_value": null,
      "lcd_runcancelflow@OData.Community.Display.V1.FormattedValue": "No",
      "lcd_runcancelflow": 802290001,
      "fsip_nextbillingdate": null,
      "lcd_createcontractbilling": null,
      "fsip_lastinvoicerollup@OData.Community.Display.V1.FormattedValue": "1/1/2026",
      "fsip_lastinvoicerollup": "2026-01-01",
      "fsip_billingnote": null,
      "_fsip_salesperson_value": null,
      "fsip_invoiceconsolidationtype@OData.Community.Display.V1.FormattedValue": "By Contract",
      "fsip_invoiceconsolidationtype": 683440002,
      "fsip_4thyearescalation_base": null,
      "_fsip_billtocustomer_value@OData.Community.Display.V1.FormattedValue": "Benedict Realty Group - Andy",
      "_fsip_billtocustomer_value": "01522376-1ba3-ed11-aad0-6045bd03814f",
      "fsip_costs@OData.Community.Display.V1.FormattedValue": "$0.00",
      "fsip_costs": 0.0000000000,
      "_owningbusinessunit_value@OData.Community.Display.V1.FormattedValue": "LCD Elevator",
      "_owningbusinessunit_value": "c9e85d8b-8fa0-ec11-b400-000d3a58d68e",
      "fsip_legacycontract": null,
      "fsip_printbillingnote@OData.Community.Display.V1.FormattedValue": "Yes",
      "fsip_printbillingnote": true,
      "timezoneruleversionnumber@OData.Community.Display.V1.FormattedValue": "4",
      "timezoneruleversionnumber": 4,
      "fsip_grossmargin@OData.Community.Display.V1.FormattedValue": "$3,000.00",
      "fsip_grossmargin": 3000.0000000000,
      "fsip_payssafetyequipment": null,
      "_ownerid_value@OData.Community.Display.V1.FormattedValue": "Barbara Oliveira",
      "_ownerid_value": "554d6842-59b6-ef11-b8e9-000d3a5a6b66",
      "_fsip_primarybuildinglocation_value@OData.Community.Display.V1.FormattedValue": "30 Ocean Parkway",
      "_fsip_primarybuildinglocation_value": "99504900-7a8d-f011-b4cb-000d3a302e4a",
      "fsip_lastinvoiced_date@OData.Community.Display.V1.FormattedValue": "1/12/2026 8:46 PM",
      "fsip_lastinvoiced_date": "2026-01-12T20:46:52Z",
      "fsip_invoiced_base@OData.Community.Display.V1.FormattedValue": "$3,000.00",
      "fsip_invoiced_base": 3000.0000000000,
      "importsequencenumber": null,
      "fsip_escalationamount": null,
      "fsip_1styearescalation_base": null,
      "_owninguser_value": "554d6842-59b6-ef11-b8e9-000d3a5a6b66",
      "_transactioncurrencyid_value@OData.Community.Display.V1.FormattedValue": "US Dollar",
      "_transactioncurrencyid_value": "28c060c5-d1a0-ec11-b400-000d3a58d68e",
      "_fsip_productcb_value": null,
      "fsip_visitfrequency@OData.Community.Display.V1.FormattedValue": "30",
      "fsip_visitfrequency": 683440000,
      "fsip_3rdyearescalation_base": null,
      "_fsip_project_value": null,
      "_fsip_division_value@OData.Community.Display.V1.FormattedValue": "Maintenance",
      "_fsip_division_value": "9316e0ff-55a5-ec11-9840-000d3a5c16ba",
      "_fsip_contracttype_value@OData.Community.Display.V1.FormattedValue": "Limited Service",
      "_fsip_contracttype_value": "f13ce9c0-42a9-ec11-9840-000d3a307669",
      "fsip_sendescalationletter@OData.Community.Display.V1.FormattedValue": "No",
      "fsip_sendescalationletter": false,
      "lcd_braketestprice": "850",
      "utcconversiontimezonecode": null,
      "_createdonbehalfby_value": null,
      "fsip_numberofvisits": "1",
      "fsip_totalcontract_base": null,
      "fsip_grossmarginpercent@OData.Community.Display.V1.FormattedValue": "100.00",
      "fsip_grossmarginpercent": 100.00,
      "fsip_certificateofinsurance@OData.Community.Display.V1.FormattedValue": "No",
      "fsip_certificateofinsurance": false,
      "fsip_permitfeesbillable@OData.Community.Display.V1.FormattedValue": "No",
      "fsip_permitfeesbillable": false,
      "fsip_billingendon": null,
      "fsip_lastinvoiced@OData.Community.Display.V1.FormattedValue": "1/5/2026",
      "fsip_lastinvoiced": "2026-01-05T12:56:49Z",
      "fsip_internalnote": null,
      "fsip_escalationfrequency": null,
      "fsip_name": "30 Ocean Parkway",
      "fsip_workorderconsolidationtype@OData.Community.Display.V1.FormattedValue": "By Contract",
      "fsip_workorderconsolidationtype": 683440000,
      "fsip_addalldevicescontractbillings": null,
      "fsip_lastescalationlettersent": null,
      "fsip_otminoradjustmentscbservice@OData.Community.Display.V1.FormattedValue": "No",
      "fsip_otminoradjustmentscbservice": false,
      "fsip_duration": null,
      "lcd_daystoexpire@OData.Community.Display.V1.FormattedValue": "-262.00",
      "lcd_daystoexpire": -262.0000000000,
      "fsip_3rdyearescalation": null,
      "fsip_invoicingmethod@OData.Community.Display.V1.FormattedValue": "Work Order Billing",
      "fsip_invoicingmethod": 683440001,
      "lcd_cat5fullloadbillable@OData.Community.Display.V1.FormattedValue": "Yes",
      "lcd_cat5fullloadbillable": 802290000,
      "fsip_cancelon": null,
      "fsip_originalcontractstartdate@OData.Community.Display.V1.FormattedValue": "10/1/2025",
      "fsip_originalcontractstartdate": "2025-10-01",
      "fsip_contractnumber": "MC-0003073",
      "fsip_exclusions": "Please note, the disconnect means and fuses, car enclosures, car doors and hoist-way entrances are excluded. All repairs performed by LCD will use only genuine standard parts produced and manufactured for customer's equipment. Maintenance does not include service calls, repair or replacement of electrical and mechanical parts of elevator equipment and apparatus which shall be performed only at additional cost billed at parts plus labor.",
      "_fsip_product_value": null,
      "fsip_quantity": null,
      "fsip_usediscountaspercentage@OData.Community.Display.V1.FormattedValue": "Amount",
      "fsip_usediscountaspercentage": false,
      "fsip_contractlanguage": null,
      "fsip_currentcontractyear": null,
      "lcd_originalcontractamount_base": null,
      "_modifiedonbehalfby_value": null,
      "fsip_fiveyearsafetytest@OData.Community.Display.V1.FormattedValue": "No",
      "fsip_fiveyearsafetytest": false,
      "fsip_closedate": null,
      "fsip_invoiceamount_base": null,
      "versionnumber@OData.Community.Display.V1.FormattedValue": "126,664,103",
      "versionnumber": 126664103,
      "fsip_description": null,
      "fsip_activeon": null,
      "fsip_billingenddate": null,
      "fsip_activemmr_base@OData.Community.Display.V1.FormattedValue": "$750.00",
      "fsip_activemmr_base": 750.0000000000,
      "statuscode@OData.Community.Display.V1.FormattedValue": "Active",
      "statuscode": 683440001,
      "fsip_testbillable@OData.Community.Display.V1.FormattedValue": "No",
      "fsip_testbillable": false,
      "createdon@OData.Community.Display.V1.FormattedValue": "9/9/2025 12:42 PM",
      "createdon": "2025-09-09T12:42:22Z",
      "fsip_holdnote": null,
      "fsip_grossmargin_base@OData.Community.Display.V1.FormattedValue": "$3,000.00",
      "fsip_grossmargin_base": 3000.0000000000,
      "_fsip_serviceaddress_value": null,
      "fsip_activemmr@OData.Community.Display.V1.FormattedValue": "$750.00",
      "fsip_activemmr": 750.0000000000,
      "lcd_braketestbillable@OData.Community.Display.V1.FormattedValue": "Yes",
      "lcd_braketestbillable": 802290000,
      "fsip_1styearescalation": null,
      "fsip_currentactualprofitpercent": null,
      "fsip_lastinvoicerollup_date@OData.Community.Display.V1.FormattedValue": "1/12/2026 8:46 PM",
      "fsip_lastinvoicerollup_date": "2026-01-12T20:46:52Z",
      "fsip_billinginprogress@OData.Community.Display.V1.FormattedValue": "No",
      "fsip_billinginprogress": false
    },
    {
      "@odata.etag": "W/\"126387742\"",
      "lcd_cancellationnotes": null,
      "fsip_po": null,
      "fsip_billingfrequency": null,
      "lcd_cat1annualprice": null,
      "fsip_expireson": null,
      "fsip_won@OData.Community.Display.V1.FormattedValue": "No",
      "fsip_won": false,
      "fsip_schedulinginprogress@OData.Community.Display.V1.FormattedValue": "No",
      "fsip_schedulinginprogress": false,
      "_fsip_sortbyaccount_value@OData.Community.Display.V1.FormattedValue": "230 East 88th Street Corporation",
      "_fsip_sortbyaccount_value": "d6025792-86a2-ef11-8a69-000d3a34f349",
      "fsip_invoiced@OData.Community.Display.V1.FormattedValue": "$9,678.00",
      "fsip_invoiced": 9678.0000000000,
      "fsip_currentannualamount_base": null,
      "fsip_currentcontractstartdate@OData.Community.Display.V1.FormattedValue": "8/15/2025",
      "fsip_currentcontractstartdate": "2025-08-15",
      "fsip_nextescalationdate": null,
      "fsip_billingstarton": null,
      "fsip_costs_base@OData.Community.Display.V1.FormattedValue": "$0.00",
      "fsip_costs_base": 0.0000000000,
      "fsip_nextcontractbillingdate@OData.Community.Display.V1.FormattedValue": "2/15/2026",
      "fsip_nextcontractbillingdate": "2026-02-15",
      "fsip_4thyearescalation": null,
      "fsip_invoiced_date@OData.Community.Display.V1.FormattedValue": "1/12/2026 8:46 PM",
      "fsip_invoiced_date": "2026-01-12T20:46:52Z",
      "fsip_billingfrequencycode": null,
      "lcd_cat5fullloadprice": null,
      "_fsip_copydevicesfromcontract_value": null,
      "statecode@OData.Community.Display.V1.FormattedValue": "Active",
      "statecode": 0,
      "fsip_regulartimecbservice@OData.Community.Display.V1.FormattedValue": "No",
      "fsip_regulartimecbservice": false,
      "fsip_costs_date@OData.Community.Display.V1.FormattedValue": "1/12/2026 8:46 PM",
      "fsip_costs_date": "2026-01-12T20:46:52Z",
      "_fsip_copydevicesfrombuildinglocation_value": null,
      "lcd_originalcontractamount": null,
      "fsip_closedstatus": null,
      "_fsip_customerid_value@OData.Community.Display.V1.FormattedValue": "230 East 88th Street Corporation",
      "_fsip_customerid_value": "d6025792-86a2-ef11-8a69-000d3a34f349",
      "fsip_contractservicelevelcode": null,
      "fsip_invoiceamount": null,
      "_modifiedby_value@OData.Community.Display.V1.FormattedValue": "# SCRIBE INTEGRATION",
      "_modifiedby_value": "910423db-6a8d-ef11-ac21-000d3a326f08",
      "modifiedon@OData.Community.Display.V1.FormattedValue": "1/5/2026 12:59 PM",
      "modifiedon": "2026-01-05T12:59:39Z",
      "lcd_cancelationnotifyoffice@OData.Community.Display.V1.FormattedValue": "No",
      "lcd_cancelationnotifyoffice": 802290001,
      "lcd_autorenewal@OData.Community.Display.V1.FormattedValue": "Yes",
      "lcd_autorenewal": 802290000,
      "fsip_billingnotecb": null,
      "fsip_lastinvoiced_state@OData.Community.Display.V1.FormattedValue": "1",
      "fsip_lastinvoiced_state": 1,
      "fsip_costs_state@OData.Community.Display.V1.FormattedValue": "1",
      "fsip_costs_state": 1,
      "fsip_percentageoramount": null,
      "fsip_escalationamount_base": null,
      "fsip_closecontract@OData.Community.Display.V1.FormattedValue": "No",
      "fsip_closecontract": false,
      "overriddencreatedon": null,
      "lcd_cat1annualbillable@OData.Community.Display.V1.FormattedValue": "No",
      "lcd_cat1annualbillable": 802290001,
      "fsip_activemmr_date@OData.Community.Display.V1.FormattedValue": "1/12/2026 8:46 PM",
      "fsip_activemmr_date": "2026-01-12T20:46:52Z",
      "fsip_specialconditions": null,
      "fsip_currentcontractenddate@OData.Community.Display.V1.FormattedValue": "8/15/2026",
      "fsip_currentcontractenddate": "2026-08-15",
      "lcd_servicefrequencywords": "Monthly",
      "fsip_cleanpithoistwaycartops@OData.Community.Display.V1.FormattedValue": "No",
      "fsip_cleanpithoistwaycartops": false,
      "fsip_5thyearescalation": null,
      "fsip_totalcontract": null,
      "_owningteam_value": null,
      "fsip_autorenew@OData.Community.Display.V1.FormattedValue": "No",
      "fsip_autorenew": false,
      "fsip_escalationpercent": null,
      "exchangerate@OData.Community.Display.V1.FormattedValue": "1.0000000000",
      "exchangerate": 1.000000000000,
      "fsip_excludefromcontractescalations@OData.Community.Display.V1.FormattedValue": "No",
      "fsip_excludefromcontractescalations": false,
      "fsip_annualsafetytest@OData.Community.Display.V1.FormattedValue": "No",
      "fsip_annualsafetytest": false,
      "fsip_nextservicedate@OData.Community.Display.V1.FormattedValue": "2/15/2026",
      "fsip_nextservicedate": "2026-02-15T11:00:00Z",
      "fsip_onhold@OData.Community.Display.V1.FormattedValue": "No",
      "fsip_onhold": false,
      "fsip_currentannualamount": null,
      "_createdby_value@OData.Community.Display.V1.FormattedValue": "Barbara Oliveira",
      "_createdby_value": "554d6842-59b6-ef11-b8e9-000d3a5a6b66",
      "fsip_activemmr_state@OData.Community.Display.V1.FormattedValue": "1",
      "fsip_activemmr_state": 1,
      "fsip_2ndyearescalation": null,
      "_fsip_wagecategory_value": null,
      "fsip_maintenancecontractid": "09e7e496-cc79-f011-b4cc-000d3a302e4a",
      "fsip_contractreviewdate@OData.Community.Display.V1.FormattedValue": "7/15/2026",
      "fsip_contractreviewdate": "2026-07-15",
      "fsip_lastinvoicerollup_state@OData.Community.Display.V1.FormattedValue": "1",
      "fsip_lastinvoicerollup_state": 1,
      "fsip_invoiced_state@OData.Community.Display.V1.FormattedValue": "1",
      "fsip_invoiced_state": 1,
      "fsip_2ndyearescalation_base": null,
      "fsip_5thyearescalation_base": null,
      "fsip_proratedequipment": null,
      "_fsip_originatingcontract_value": null,
      "lcd_runcancelflow@OData.Community.Display.V1.FormattedValue": "No",
      "lcd_runcancelflow": 802290001,
      "fsip_nextbillingdate": null,
      "lcd_createcontractbilling": null,
      "fsip_lastinvoicerollup@OData.Community.Display.V1.FormattedValue": "1/15/2026",
      "fsip_lastinvoicerollup": "2026-01-15",
      "fsip_billingnote": null,
      "_fsip_salesperson_value@OData.Community.Display.V1.FormattedValue": "Bill Appelbaum",
      "_fsip_salesperson_value": "caf5f82b-0baa-ec11-9840-000d3a302927",
      "fsip_invoiceconsolidationtype@OData.Community.Display.V1.FormattedValue": "By Contract",
      "fsip_invoiceconsolidationtype": 683440002,
      "fsip_4thyearescalation_base": null,
      "_fsip_billtocustomer_value@OData.Community.Display.V1.FormattedValue": "230 East 88th Street Corporation",
      "_fsip_billtocustomer_value": "d6025792-86a2-ef11-8a69-000d3a34f349",
      "fsip_costs@OData.Community.Display.V1.FormattedValue": "$0.00",
      "fsip_costs": 0.0000000000,
      "_owningbusinessunit_value@OData.Community.Display.V1.FormattedValue": "LCD Elevator",
      "_owningbusinessunit_value": "c9e85d8b-8fa0-ec11-b400-000d3a58d68e",
      "fsip_legacycontract": null,
      "fsip_printbillingnote@OData.Community.Display.V1.FormattedValue": "Yes",
      "fsip_printbillingnote": true,
      "timezoneruleversionnumber@OData.Community.Display.V1.FormattedValue": "4",
      "timezoneruleversionnumber": 4,
      "fsip_grossmargin@OData.Community.Display.V1.FormattedValue": "$9,678.00",
      "fsip_grossmargin": 9678.0000000000,
      "fsip_payssafetyequipment": null,
      "_ownerid_value@OData.Community.Display.V1.FormattedValue": "Barbara Oliveira",
      "_ownerid_value": "554d6842-59b6-ef11-b8e9-000d3a5a6b66",
      "_fsip_primarybuildinglocation_value@OData.Community.Display.V1.FormattedValue": "230 East 88th Street",
      "_fsip_primarybuildinglocation_value": "83a9ccca-7717-ee11-8f6e-6045bd07e840",
      "fsip_lastinvoiced_date@OData.Community.Display.V1.FormattedValue": "1/12/2026 8:46 PM",
      "fsip_lastinvoiced_date": "2026-01-12T20:46:52Z",
      "fsip_invoiced_base@OData.Community.Display.V1.FormattedValue": "$9,678.00",
      "fsip_invoiced_base": 9678.0000000000,
      "importsequencenumber": null,
      "fsip_escalationamount": null,
      "fsip_1styearescalation_base": null,
      "_owninguser_value": "554d6842-59b6-ef11-b8e9-000d3a5a6b66",
      "_transactioncurrencyid_value@OData.Community.Display.V1.FormattedValue": "US Dollar",
      "_transactioncurrencyid_value": "28c060c5-d1a0-ec11-b400-000d3a58d68e",
      "_fsip_productcb_value": null,
      "fsip_visitfrequency@OData.Community.Display.V1.FormattedValue": "30",
      "fsip_visitfrequency": 683440000,
      "fsip_3rdyearescalation_base": null,
      "_fsip_project_value": null,
      "_fsip_division_value@OData.Community.Display.V1.FormattedValue": "Maintenance",
      "_fsip_division_value": "9316e0ff-55a5-ec11-9840-000d3a5c16ba",
      "_fsip_contracttype_value@OData.Community.Display.V1.FormattedValue": "Full Service",
      "_fsip_contracttype_value": "f53ce9c0-42a9-ec11-9840-000d3a307669",
      "fsip_sendescalationletter@OData.Community.Display.V1.FormattedValue": "No",
      "fsip_sendescalationletter": false,
      "lcd_braketestprice": null,
      "utcconversiontimezonecode": null,
      "_createdonbehalfby_value": null,
      "fsip_numberofvisits": "1",
      "fsip_totalcontract_base": null,
      "fsip_grossmarginpercent@OData.Community.Display.V1.FormattedValue": "100.00",
      "fsip_grossmarginpercent": 100.00,
      "fsip_certificateofinsurance@OData.Community.Display.V1.FormattedValue": "No",
      "fsip_certificateofinsurance": false,
      "fsip_permitfeesbillable@OData.Community.Display.V1.FormattedValue": "No",
      "fsip_permitfeesbillable": false,
      "fsip_billingendon": null,
      "fsip_lastinvoiced@OData.Community.Display.V1.FormattedValue": "1/5/2026",
      "fsip_lastinvoiced": "2026-01-05T12:56:52Z",
      "fsip_internalnote": null,
      "fsip_escalationfrequency": null,
      "fsip_name": "230 East 88th Street",
      "fsip_workorderconsolidationtype@OData.Community.Display.V1.FormattedValue": "By Contract",
      "fsip_workorderconsolidationtype": 683440000,
      "fsip_addalldevicescontractbillings": null,
      "fsip_lastescalationlettersent": null,
      "fsip_otminoradjustmentscbservice@OData.Community.Display.V1.FormattedValue": "No",
      "fsip_otminoradjustmentscbservice": false,
      "fsip_duration": null,
      "lcd_daystoexpire@OData.Community.Display.V1.FormattedValue": "-215.00",
      "lcd_daystoexpire": -215.0000000000,
      "fsip_3rdyearescalation": null,
      "fsip_invoicingmethod@OData.Community.Display.V1.FormattedValue": "Work Order Billing",
      "fsip_invoicingmethod": 683440001,
      "lcd_cat5fullloadbillable@OData.Community.Display.V1.FormattedValue": "No",
      "lcd_cat5fullloadbillable": 802290001,
      "fsip_cancelon": null,
      "fsip_originalcontractstartdate@OData.Community.Display.V1.FormattedValue": "8/15/2025",
      "fsip_originalcontractstartdate": "2025-08-15",
      "fsip_contractnumber": "MC-0003052",
      "fsip_exclusions": "Please note, the disconnect means and fuses, car enclosures, car doors and hoist-way entrances are excluded. All repairs performed by LCD will use only genuine standard parts produced and manufactured for customers equipment. Maintenance does not include repair or replacement of electrical and mechanical parts of elevator equipment and apparatus which shall be performed only at additional cost billed at parts plus labor.\n\nVandalism, customer negligence, water damage, weather-related damage, theft, and the addition of new parts not originally installed during the initial construction of the elevators are excluded from coverage. Any work required as a result of these conditions will be billed separately in accordance with the necessary repairs or a written proposal.\n\nOvertime and double-time rates are not included in the monthly pricing contract. Any work performed during overtime or double-time hours will be billed separately at the applicable rates. These rates are subject to change, and a current rate schedule will be provided to the customer upon request.",
      "_fsip_product_value": null,
      "fsip_quantity": null,
      "fsip_usediscountaspercentage@OData.Community.Display.V1.FormattedValue": "Amount",
      "fsip_usediscountaspercentage": false,
      "fsip_contractlanguage": null,
      "fsip_currentcontractyear": null,
      "lcd_originalcontractamount_base": null,
      "_modifiedonbehalfby_value": null,
      "fsip_fiveyearsafetytest@OData.Community.Display.V1.FormattedValue": "No",
      "fsip_fiveyearsafetytest": false,
      "fsip_closedate": null,
      "fsip_invoiceamount_base": null,
      "versionnumber@OData.Community.Display.V1.FormattedValue": "126,387,742",
      "versionnumber": 126387742,
      "fsip_description": null,
      "fsip_activeon": null,
      "fsip_billingenddate": null,
      "fsip_activemmr_base@OData.Community.Display.V1.FormattedValue": "$1,613.00",
      "fsip_activemmr_base": 1613.0000000000,
      "statuscode@OData.Community.Display.V1.FormattedValue": "Active",
      "statuscode": 683440001,
      "fsip_testbillable@OData.Community.Display.V1.FormattedValue": "No",
      "fsip_testbillable": false,
      "createdon@OData.Community.Display.V1.FormattedValue": "8/15/2025 11:40 AM",
      "createdon": "2025-08-15T11:40:07Z",
      "fsip_holdnote": null,
      "fsip_grossmargin_base@OData.Community.Display.V1.FormattedValue": "$9,678.00",
      "fsip_grossmargin_base": 9678.0000000000,
      "_fsip_serviceaddress_value": null,
      "fsip_activemmr@OData.Community.Display.V1.FormattedValue": "$1,613.00",
      "fsip_activemmr": 1613.0000000000,
      "lcd_braketestbillable@OData.Community.Display.V1.FormattedValue": "No",
      "lcd_braketestbillable": 802290001,
      "fsip_1styearescalation": null,
      "fsip_currentactualprofitpercent": null,
      "fsip_lastinvoicerollup_date@OData.Community.Display.V1.FormattedValue": "1/12/2026 8:46 PM",
      "fsip_lastinvoicerollup_date": "2026-01-12T20:46:52Z",
      "fsip_billinginprogress@OData.Community.Display.V1.FormattedValue": "No",
      "fsip_billinginprogress": false
    },
    {
      "@odata.etag": "W/\"126387634\"",
      "lcd_cancellationnotes": null,
      "fsip_po": null,
      "fsip_billingfrequency": null,
      "lcd_cat1annualprice": "775",
      "fsip_expireson": null,
      "fsip_won@OData.Community.Display.V1.FormattedValue": "No",
      "fsip_won": false,
      "fsip_schedulinginprogress@OData.Community.Display.V1.FormattedValue": "No",
      "fsip_schedulinginprogress": false,
      "_fsip_sortbyaccount_value@OData.Community.Display.V1.FormattedValue": "Services For The Underserved",
      "_fsip_sortbyaccount_value": "45129b18-45a9-ec11-9840-000d3a307669",
      "fsip_invoiced@OData.Community.Display.V1.FormattedValue": "$4,000.00",
      "fsip_invoiced": 4000.0000000000,
      "fsip_currentannualamount_base": null,
      "fsip_currentcontractstartdate@OData.Community.Display.V1.FormattedValue": "9/1/2025",
      "fsip_currentcontractstartdate": "2025-09-01",
      "fsip_nextescalationdate": null,
      "fsip_billingstarton": null,
      "fsip_costs_base@OData.Community.Display.V1.FormattedValue": "$0.00",
      "fsip_costs_base": 0.0000000000,
      "fsip_nextcontractbillingdate@OData.Community.Display.V1.FormattedValue": "2/1/2026",
      "fsip_nextcontractbillingdate": "2026-02-01",
      "fsip_4thyearescalation": null,
      "fsip_invoiced_date@OData.Community.Display.V1.FormattedValue": "1/12/2026 8:46 PM",
      "fsip_invoiced_date": "2026-01-12T20:46:52Z",
      "fsip_billingfrequencycode": null,
      "lcd_cat5fullloadprice": "1550",
      "_fsip_copydevicesfromcontract_value": null,
      "statecode@OData.Community.Display.V1.FormattedValue": "Active",
      "statecode": 0,
      "fsip_regulartimecbservice@OData.Community.Display.V1.FormattedValue": "No",
      "fsip_regulartimecbservice": false,
      "fsip_costs_date@OData.Community.Display.V1.FormattedValue": "1/12/2026 8:46 PM",
      "fsip_costs_date": "2026-01-12T20:46:52Z",
      "_fsip_copydevicesfrombuildinglocation_value": null,
      "lcd_originalcontractamount": null,
      "fsip_closedstatus": null,
      "_fsip_customerid_value@OData.Community.Display.V1.FormattedValue": "Services For The Underserved",
      "_fsip_customerid_value": "45129b18-45a9-ec11-9840-000d3a307669",
      "fsip_contractservicelevelcode": null,
      "fsip_invoiceamount": null,
      "_modifiedby_value@OData.Community.Display.V1.FormattedValue": "# SCRIBE INTEGRATION",
      "_modifiedby_value": "910423db-6a8d-ef11-ac21-000d3a326f08",
      "modifiedon@OData.Community.Display.V1.FormattedValue": "1/5/2026 12:59 PM",
      "modifiedon": "2026-01-05T12:59:39Z",
      "lcd_cancelationnotifyoffice@OData.Community.Display.V1.FormattedValue": "No",
      "lcd_cancelationnotifyoffice": 802290001,
      "lcd_autorenewal@OData.Community.Display.V1.FormattedValue": "Yes",
      "lcd_autorenewal": 802290000,
      "fsip_billingnotecb": null,
      "fsip_lastinvoiced_state@OData.Community.Display.V1.FormattedValue": "1",
      "fsip_lastinvoiced_state": 1,
      "fsip_costs_state@OData.Community.Display.V1.FormattedValue": "1",
      "fsip_costs_state": 1,
      "fsip_percentageoramount": null,
      "fsip_escalationamount_base": null,
      "fsip_closecontract@OData.Community.Display.V1.FormattedValue": "No",
      "fsip_closecontract": false,
      "overriddencreatedon": null,
      "lcd_cat1annualbillable@OData.Community.Display.V1.FormattedValue": "Yes",
      "lcd_cat1annualbillable": 802290000,
      "fsip_activemmr_date@OData.Community.Display.V1.FormattedValue": "1/12/2026 8:46 PM",
      "fsip_activemmr_date": "2026-01-12T20:46:52Z",
      "fsip_specialconditions": null,
      "fsip_currentcontractenddate@OData.Community.Display.V1.FormattedValue": "9/1/2026",
      "fsip_currentcontractenddate": "2026-09-01",
      "lcd_servicefrequencywords": "Monthly",
      "fsip_cleanpithoistwaycartops@OData.Community.Display.V1.FormattedValue": "No",
      "fsip_cleanpithoistwaycartops": false,
      "fsip_5thyearescalation": null,
      "fsip_totalcontract": null,
      "_owningteam_value": null,
      "fsip_autorenew@OData.Community.Display.V1.FormattedValue": "No",
      "fsip_autorenew": false,
      "fsip_escalationpercent": null,
      "exchangerate@OData.Community.Display.V1.FormattedValue": "1.0000000000",
      "exchangerate": 1.000000000000,
      "fsip_excludefromcontractescalations@OData.Community.Display.V1.FormattedValue": "No",
      "fsip_excludefromcontractescalations": false,
      "fsip_annualsafetytest@OData.Community.Display.V1.FormattedValue": "No",
      "fsip_annualsafetytest": false,
      "fsip_nextservicedate@OData.Community.Display.V1.FormattedValue": "2/1/2026",
      "fsip_nextservicedate": "2026-02-01T11:00:00Z",
      "fsip_onhold@OData.Community.Display.V1.FormattedValue": "No",
      "fsip_onhold": false,
      "fsip_currentannualamount": null,
      "_createdby_value@OData.Community.Display.V1.FormattedValue": "Barbara Oliveira",
      "_createdby_value": "554d6842-59b6-ef11-b8e9-000d3a5a6b66",
      "fsip_activemmr_state@OData.Community.Display.V1.FormattedValue": "1",
      "fsip_activemmr_state": 1,
      "fsip_2ndyearescalation": null,
      "_fsip_wagecategory_value": null,
      "fsip_maintenancecontractid": "3cc0dc34-e279-f011-b4cc-000d3a302e4a",
      "fsip_contractreviewdate": null,
      "fsip_lastinvoicerollup_state@OData.Community.Display.V1.FormattedValue": "1",
      "fsip_lastinvoicerollup_state": 1,
      "fsip_invoiced_state@OData.Community.Display.V1.FormattedValue": "1",
      "fsip_invoiced_state": 1,
      "fsip_2ndyearescalation_base": null,
      "fsip_5thyearescalation_base": null,
      "fsip_proratedequipment": null,
      "_fsip_originatingcontract_value": null,
      "lcd_runcancelflow@OData.Community.Display.V1.FormattedValue": "No",
      "lcd_runcancelflow": 802290001,
      "fsip_nextbillingdate": null,
      "lcd_createcontractbilling": null,
      "fsip_lastinvoicerollup@OData.Community.Display.V1.FormattedValue": "1/1/2026",
      "fsip_lastinvoicerollup": "2026-01-01",
      "fsip_billingnote": null,
      "_fsip_salesperson_value": null,
      "fsip_invoiceconsolidationtype@OData.Community.Display.V1.FormattedValue": "By Contract",
      "fsip_invoiceconsolidationtype": 683440002,
      "fsip_4thyearescalation_base": null,
      "_fsip_billtocustomer_value@OData.Community.Display.V1.FormattedValue": "Services For The Underserved",
      "_fsip_billtocustomer_value": "45129b18-45a9-ec11-9840-000d3a307669",
      "fsip_costs@OData.Community.Display.V1.FormattedValue": "$0.00",
      "fsip_costs": 0.0000000000,
      "_owningbusinessunit_value@OData.Community.Display.V1.FormattedValue": "LCD Elevator",
      "_owningbusinessunit_value": "c9e85d8b-8fa0-ec11-b400-000d3a58d68e",
      "fsip_legacycontract": null,
      "fsip_printbillingnote@OData.Community.Display.V1.FormattedValue": "Yes",
      "fsip_printbillingnote": true,
      "timezoneruleversionnumber@OData.Community.Display.V1.FormattedValue": "4",
      "timezoneruleversionnumber": 4,
      "fsip_grossmargin@OData.Community.Display.V1.FormattedValue": "$4,000.00",
      "fsip_grossmargin": 4000.0000000000,
      "fsip_payssafetyequipment": null,
      "_ownerid_value@OData.Community.Display.V1.FormattedValue": "Barbara Oliveira",
      "_ownerid_value": "554d6842-59b6-ef11-b8e9-000d3a5a6b66",
      "_fsip_primarybuildinglocation_value@OData.Community.Display.V1.FormattedValue": "12 East 31st Street",
      "_fsip_primarybuildinglocation_value": "58d66c25-1caa-ec11-9840-000d3a307669",
      "fsip_lastinvoiced_date@OData.Community.Display.V1.FormattedValue": "1/12/2026 8:46 PM",
      "fsip_lastinvoiced_date": "2026-01-12T20:46:52Z",
      "fsip_invoiced_base@OData.Community.Display.V1.FormattedValue": "$4,000.00",
      "fsip_invoiced_base": 4000.0000000000,
      "importsequencenumber": null,
      "fsip_escalationamount": null,
      "fsip_1styearescalation_base": null,
      "_owninguser_value": "554d6842-59b6-ef11-b8e9-000d3a5a6b66",
      "_transactioncurrencyid_value@OData.Community.Display.V1.FormattedValue": "US Dollar",
      "_transactioncurrencyid_value": "28c060c5-d1a0-ec11-b400-000d3a58d68e",
      "_fsip_productcb_value": null,
      "fsip_visitfrequency@OData.Community.Display.V1.FormattedValue": "30",
      "fsip_visitfrequency": 683440000,
      "fsip_3rdyearescalation_base": null,
      "_fsip_project_value": null,
      "_fsip_division_value@OData.Community.Display.V1.FormattedValue": "Maintenance",
      "_fsip_division_value": "9316e0ff-55a5-ec11-9840-000d3a5c16ba",
      "_fsip_contracttype_value@OData.Community.Display.V1.FormattedValue": "Limited Service",
      "_fsip_contracttype_value": "f13ce9c0-42a9-ec11-9840-000d3a307669",
      "fsip_sendescalationletter@OData.Community.Display.V1.FormattedValue": "No",
      "fsip_sendescalationletter": false,
      "lcd_braketestprice": "850",
      "utcconversiontimezonecode": null,
      "_createdonbehalfby_value": null,
      "fsip_numberofvisits": "1",
      "fsip_totalcontract_base": null,
      "fsip_grossmarginpercent@OData.Community.Display.V1.FormattedValue": "100.00",
      "fsip_grossmarginpercent": 100.00,
      "fsip_certificateofinsurance@OData.Community.Display.V1.FormattedValue": "No",
      "fsip_certificateofinsurance": false,
      "fsip_permitfeesbillable@OData.Community.Display.V1.FormattedValue": "No",
      "fsip_permitfeesbillable": false,
      "fsip_billingendon": null,
      "fsip_lastinvoiced@OData.Community.Display.V1.FormattedValue": "1/5/2026",
      "fsip_lastinvoiced": "2026-01-05T12:56:50Z",
      "fsip_internalnote": null,
      "fsip_escalationfrequency": null,
      "fsip_name": "12 East 31st Street",
      "fsip_workorderconsolidationtype@OData.Community.Display.V1.FormattedValue": "By Contract",
      "fsip_workorderconsolidationtype": 683440000,
      "fsip_addalldevicescontractbillings": null,
      "fsip_lastescalationlettersent": null,
      "fsip_otminoradjustmentscbservice@OData.Community.Display.V1.FormattedValue": "No",
      "fsip_otminoradjustmentscbservice": false,
      "fsip_duration": null,
      "lcd_daystoexpire@OData.Community.Display.V1.FormattedValue": "-232.00",
      "lcd_daystoexpire": -232.0000000000,
      "fsip_3rdyearescalation": null,
      "fsip_invoicingmethod@OData.Community.Display.V1.FormattedValue": "Work Order Billing",
      "fsip_invoicingmethod": 683440001,
      "lcd_cat5fullloadbillable@OData.Community.Display.V1.FormattedValue": "Yes",
      "lcd_cat5fullloadbillable": 802290000,
      "fsip_cancelon": null,
      "fsip_originalcontractstartdate@OData.Community.Display.V1.FormattedValue": "9/1/2025",
      "fsip_originalcontractstartdate": "2025-09-01",
      "fsip_contractnumber": "MC-0003053",
      "fsip_exclusions": null,
      "_fsip_product_value": null,
      "fsip_quantity": null,
      "fsip_usediscountaspercentage@OData.Community.Display.V1.FormattedValue": "Amount",
      "fsip_usediscountaspercentage": false,
      "fsip_contractlanguage": null,
      "fsip_currentcontractyear": null,
      "lcd_originalcontractamount_base": null,
      "_modifiedonbehalfby_value": null,
      "fsip_fiveyearsafetytest@OData.Community.Display.V1.FormattedValue": "No",
      "fsip_fiveyearsafetytest": false,
      "fsip_closedate": null,
      "fsip_invoiceamount_base": null,
      "versionnumber@OData.Community.Display.V1.FormattedValue": "126,387,634",
      "versionnumber": 126387634,
      "fsip_description": null,
      "fsip_activeon": null,
      "fsip_billingenddate": null,
      "fsip_activemmr_base@OData.Community.Display.V1.FormattedValue": "$800.00",
      "fsip_activemmr_base": 800.0000000000,
      "statuscode@OData.Community.Display.V1.FormattedValue": "Active",
      "statuscode": 683440001,
      "fsip_testbillable@OData.Community.Display.V1.FormattedValue": "No",
      "fsip_testbillable": false,
      "createdon@OData.Community.Display.V1.FormattedValue": "8/15/2025 2:14 PM",
      "createdon": "2025-08-15T14:14:58Z",
      "fsip_holdnote": null,
      "fsip_grossmargin_base@OData.Community.Display.V1.FormattedValue": "$4,000.00",
      "fsip_grossmargin_base": 4000.0000000000,
      "_fsip_serviceaddress_value": null,
      "fsip_activemmr@OData.Community.Display.V1.FormattedValue": "$800.00",
      "fsip_activemmr": 800.0000000000,
      "lcd_braketestbillable@OData.Community.Display.V1.FormattedValue": "Yes",
      "lcd_braketestbillable": 802290000,
      "fsip_1styearescalation": null,
      "fsip_currentactualprofitpercent": null,
      "fsip_lastinvoicerollup_date@OData.Community.Display.V1.FormattedValue": "1/12/2026 8:46 PM",
      "fsip_lastinvoicerollup_date": "2026-01-12T20:46:52Z",
      "fsip_billinginprogress@OData.Community.Display.V1.FormattedValue": "No",
      "fsip_billinginprogress": false
    },
    {
      "@odata.etag": "W/\"126387669\"",
      "lcd_cancellationnotes": null,
      "fsip_po": null,
      "fsip_billingfrequency": null,
      "lcd_cat1annualprice": "775",
      "fsip_expireson": null,
      "fsip_won@OData.Community.Display.V1.FormattedValue": "No",
      "fsip_won": false,
      "fsip_schedulinginprogress@OData.Community.Display.V1.FormattedValue": "No",
      "fsip_schedulinginprogress": false,
      "_fsip_sortbyaccount_value@OData.Community.Display.V1.FormattedValue": "Services For The Underserved",
      "_fsip_sortbyaccount_value": "45129b18-45a9-ec11-9840-000d3a307669",
      "fsip_invoiced@OData.Community.Display.V1.FormattedValue": "$2,255.00",
      "fsip_invoiced": 2255.0000000000,
      "fsip_currentannualamount_base": null,
      "fsip_currentcontractstartdate@OData.Community.Display.V1.FormattedValue": "9/1/2025",
      "fsip_currentcontractstartdate": "2025-09-01",
      "fsip_nextescalationdate": null,
      "fsip_billingstarton": null,
      "fsip_costs_base@OData.Community.Display.V1.FormattedValue": "$0.00",
      "fsip_costs_base": 0.0000000000,
      "fsip_nextcontractbillingdate@OData.Community.Display.V1.FormattedValue": "2/1/2026",
      "fsip_nextcontractbillingdate": "2026-02-01",
      "fsip_4thyearescalation": null,
      "fsip_invoiced_date@OData.Community.Display.V1.FormattedValue": "1/12/2026 8:46 PM",
      "fsip_invoiced_date": "2026-01-12T20:46:52Z",
      "fsip_billingfrequencycode": null,
      "lcd_cat5fullloadprice": "1550",
      "_fsip_copydevicesfromcontract_value": null,
      "statecode@OData.Community.Display.V1.FormattedValue": "Active",
      "statecode": 0,
      "fsip_regulartimecbservice@OData.Community.Display.V1.FormattedValue": "No",
      "fsip_regulartimecbservice": false,
      "fsip_costs_date@OData.Community.Display.V1.FormattedValue": "1/12/2026 8:46 PM",
      "fsip_costs_date": "2026-01-12T20:46:52Z",
      "_fsip_copydevicesfrombuildinglocation_value": null,
      "lcd_originalcontractamount": null,
      "fsip_closedstatus": null,
      "_fsip_customerid_value@OData.Community.Display.V1.FormattedValue": "Services For The Underserved",
      "_fsip_customerid_value": "45129b18-45a9-ec11-9840-000d3a307669",
      "fsip_contractservicelevelcode": null,
      "fsip_invoiceamount": null,
      "_modifiedby_value@OData.Community.Display.V1.FormattedValue": "# SCRIBE INTEGRATION",
      "_modifiedby_value": "910423db-6a8d-ef11-ac21-000d3a326f08",
      "modifiedon@OData.Community.Display.V1.FormattedValue": "1/5/2026 12:59 PM",
      "modifiedon": "2026-01-05T12:59:39Z",
      "lcd_cancelationnotifyoffice@OData.Community.Display.V1.FormattedValue": "No",
      "lcd_cancelationnotifyoffice": 802290001,
      "lcd_autorenewal@OData.Community.Display.V1.FormattedValue": "Yes",
      "lcd_autorenewal": 802290000,
      "fsip_billingnotecb": null,
      "fsip_lastinvoiced_state@OData.Community.Display.V1.FormattedValue": "1",
      "fsip_lastinvoiced_state": 1,
      "fsip_costs_state@OData.Community.Display.V1.FormattedValue": "1",
      "fsip_costs_state": 1,
      "fsip_percentageoramount": null,
      "fsip_escalationamount_base": null,
      "fsip_closecontract@OData.Community.Display.V1.FormattedValue": "No",
      "fsip_closecontract": false,
      "overriddencreatedon": null,
      "lcd_cat1annualbillable@OData.Community.Display.V1.FormattedValue": "Yes",
      "lcd_cat1annualbillable": 802290000,
      "fsip_activemmr_date@OData.Community.Display.V1.FormattedValue": "1/12/2026 8:46 PM",
      "fsip_activemmr_date": "2026-01-12T20:46:52Z",
      "fsip_specialconditions": null,
      "fsip_currentcontractenddate@OData.Community.Display.V1.FormattedValue": "9/1/2026",
      "fsip_currentcontractenddate": "2026-09-01",
      "lcd_servicefrequencywords": "Monthly",
      "fsip_cleanpithoistwaycartops@OData.Community.Display.V1.FormattedValue": "No",
      "fsip_cleanpithoistwaycartops": false,
      "fsip_5thyearescalation": null,
      "fsip_totalcontract": null,
      "_owningteam_value": null,
      "fsip_autorenew@OData.Community.Display.V1.FormattedValue": "No",
      "fsip_autorenew": false,
      "fsip_escalationpercent": null,
      "exchangerate@OData.Community.Display.V1.FormattedValue": "1.0000000000",
      "exchangerate": 1.000000000000,
      "fsip_excludefromcontractescalations@OData.Community.Display.V1.FormattedValue": "No",
      "fsip_excludefromcontractescalations": false,
      "fsip_annualsafetytest@OData.Community.Display.V1.FormattedValue": "No",
      "fsip_annualsafetytest": false,
      "fsip_nextservicedate@OData.Community.Display.V1.FormattedValue": "2/1/2026",
      "fsip_nextservicedate": "2026-02-01T11:00:00Z",
      "fsip_onhold@OData.Community.Display.V1.FormattedValue": "No",
      "fsip_onhold": false,
      "fsip_currentannualamount": null,
      "_createdby_value@OData.Community.Display.V1.FormattedValue": "Barbara Oliveira",
      "_createdby_value": "554d6842-59b6-ef11-b8e9-000d3a5a6b66",
      "fsip_activemmr_state@OData.Community.Display.V1.FormattedValue": "1",
      "fsip_activemmr_state": 1,
      "fsip_2ndyearescalation": null,
      "_fsip_wagecategory_value": null,
      "fsip_maintenancecontractid": "70f0174b-e379-f011-b4cc-000d3a302e4a",
      "fsip_contractreviewdate": null,
      "fsip_lastinvoicerollup_state@OData.Community.Display.V1.FormattedValue": "1",
      "fsip_lastinvoicerollup_state": 1,
      "fsip_invoiced_state@OData.Community.Display.V1.FormattedValue": "1",
      "fsip_invoiced_state": 1,
      "fsip_2ndyearescalation_base": null,
      "fsip_5thyearescalation_base": null,
      "fsip_proratedequipment": null,
      "_fsip_originatingcontract_value": null,
      "lcd_runcancelflow@OData.Community.Display.V1.FormattedValue": "No",
      "lcd_runcancelflow": 802290001,
      "fsip_nextbillingdate": null,
      "lcd_createcontractbilling": null,
      "fsip_lastinvoicerollup@OData.Community.Display.V1.FormattedValue": "1/1/2026",
      "fsip_lastinvoicerollup": "2026-01-01",
      "fsip_billingnote": null,
      "_fsip_salesperson_value": null,
      "fsip_invoiceconsolidationtype@OData.Community.Display.V1.FormattedValue": "By Contract",
      "fsip_invoiceconsolidationtype": 683440002,
      "fsip_4thyearescalation_base": null,
      "_fsip_billtocustomer_value@OData.Community.Display.V1.FormattedValue": "Services For The Underserved",
      "_fsip_billtocustomer_value": "45129b18-45a9-ec11-9840-000d3a307669",
      "fsip_costs@OData.Community.Display.V1.FormattedValue": "$0.00",
      "fsip_costs": 0.0000000000,
      "_owningbusinessunit_value@OData.Community.Display.V1.FormattedValue": "LCD Elevator",
      "_owningbusinessunit_value": "c9e85d8b-8fa0-ec11-b400-000d3a58d68e",
      "fsip_legacycontract": null,
      "fsip_printbillingnote@OData.Community.Display.V1.FormattedValue": "Yes",
      "fsip_printbillingnote": true,
      "timezoneruleversionnumber@OData.Community.Display.V1.FormattedValue": "4",
      "timezoneruleversionnumber": 4,
      "fsip_grossmargin@OData.Community.Display.V1.FormattedValue": "$2,255.00",
      "fsip_grossmargin": 2255.0000000000,
      "fsip_payssafetyequipment": null,
      "_ownerid_value@OData.Community.Display.V1.FormattedValue": "Barbara Oliveira",
      "_ownerid_value": "554d6842-59b6-ef11-b8e9-000d3a5a6b66",
      "_fsip_primarybuildinglocation_value@OData.Community.Display.V1.FormattedValue": "1808 3rd Avenue",
      "_fsip_primarybuildinglocation_value": "a4d76c25-1caa-ec11-9840-000d3a307669",
      "fsip_lastinvoiced_date@OData.Community.Display.V1.FormattedValue": "1/12/2026 8:46 PM",
      "fsip_lastinvoiced_date": "2026-01-12T20:46:52Z",
      "fsip_invoiced_base@OData.Community.Display.V1.FormattedValue": "$2,255.00",
      "fsip_invoiced_base": 2255.0000000000,
      "importsequencenumber": null,
      "fsip_escalationamount": null,
      "fsip_1styearescalation_base": null,
      "_owninguser_value": "554d6842-59b6-ef11-b8e9-000d3a5a6b66",
      "_transactioncurrencyid_value@OData.Community.Display.V1.FormattedValue": "US Dollar",
      "_transactioncurrencyid_value": "28c060c5-d1a0-ec11-b400-000d3a58d68e",
      "_fsip_productcb_value": null,
      "fsip_visitfrequency@OData.Community.Display.V1.FormattedValue": "30",
      "fsip_visitfrequency": 683440000,
      "fsip_3rdyearescalation_base": null,
      "_fsip_project_value": null,
      "_fsip_division_value@OData.Community.Display.V1.FormattedValue": "Maintenance",
      "_fsip_division_value": "9316e0ff-55a5-ec11-9840-000d3a5c16ba",
      "_fsip_contracttype_value@OData.Community.Display.V1.FormattedValue": "Limited Service",
      "_fsip_contracttype_value": "f13ce9c0-42a9-ec11-9840-000d3a307669",
      "fsip_sendescalationletter@OData.Community.Display.V1.FormattedValue": "No",
      "fsip_sendescalationletter": false,
      "lcd_braketestprice": "850",
      "utcconversiontimezonecode": null,
      "_createdonbehalfby_value": null,
      "fsip_numberofvisits": "1",
      "fsip_totalcontract_base": null,
      "fsip_grossmarginpercent@OData.Community.Display.V1.FormattedValue": "100.00",
      "fsip_grossmarginpercent": 100.00,
      "fsip_certificateofinsurance@OData.Community.Display.V1.FormattedValue": "No",
      "fsip_certificateofinsurance": false,
      "fsip_permitfeesbillable@OData.Community.Display.V1.FormattedValue": "No",
      "fsip_permitfeesbillable": false,
      "fsip_billingendon": null,
      "fsip_lastinvoiced@OData.Community.Display.V1.FormattedValue": "1/5/2026",
      "fsip_lastinvoiced": "2026-01-05T12:56:51Z",
      "fsip_internalnote": null,
      "fsip_escalationfrequency": null,
      "fsip_name": "1808 3rd Avenue",
      "fsip_workorderconsolidationtype@OData.Community.Display.V1.FormattedValue": "By Contract",
      "fsip_workorderconsolidationtype": 683440000,
      "fsip_addalldevicescontractbillings@OData.Community.Display.V1.FormattedValue": "No",
      "fsip_addalldevicescontractbillings": false,
      "fsip_lastescalationlettersent": null,
      "fsip_otminoradjustmentscbservice@OData.Community.Display.V1.FormattedValue": "No",
      "fsip_otminoradjustmentscbservice": false,
      "fsip_duration": null,
      "lcd_daystoexpire@OData.Community.Display.V1.FormattedValue": "-232.00",
      "lcd_daystoexpire": -232.0000000000,
      "fsip_3rdyearescalation": null,
      "fsip_invoicingmethod@OData.Community.Display.V1.FormattedValue": "Work Order Billing",
      "fsip_invoicingmethod": 683440001,
      "lcd_cat5fullloadbillable@OData.Community.Display.V1.FormattedValue": "Yes",
      "lcd_cat5fullloadbillable": 802290000,
      "fsip_cancelon": null,
      "fsip_originalcontractstartdate@OData.Community.Display.V1.FormattedValue": "9/1/2025",
      "fsip_originalcontractstartdate": "2025-09-01",
      "fsip_contractnumber": "MC-0003054",
      "fsip_exclusions": null,
      "_fsip_product_value": null,
      "fsip_quantity": null,
      "fsip_usediscountaspercentage@OData.Community.Display.V1.FormattedValue": "Amount",
      "fsip_usediscountaspercentage": false,
      "fsip_contractlanguage": null,
      "fsip_currentcontractyear": null,
      "lcd_originalcontractamount_base": null,
      "_modifiedonbehalfby_value": null,
      "fsip_fiveyearsafetytest@OData.Community.Display.V1.FormattedValue": "No",
      "fsip_fiveyearsafetytest": false,
      "fsip_closedate": null,
      "fsip_invoiceamount_base": null,
      "versionnumber@OData.Community.Display.V1.FormattedValue": "126,387,669",
      "versionnumber": 126387669,
      "fsip_description": null,
      "fsip_activeon": null,
      "fsip_billingenddate": null,
      "fsip_activemmr_base@OData.Community.Display.V1.FormattedValue": "$386.00",
      "fsip_activemmr_base": 386.0000000000,
      "statuscode@OData.Community.Display.V1.FormattedValue": "Active",
      "statuscode": 683440001,
      "fsip_testbillable@OData.Community.Display.V1.FormattedValue": "No",
      "fsip_testbillable": false,
      "createdon@OData.Community.Display.V1.FormattedValue": "8/15/2025 2:22 PM",
      "createdon": "2025-08-15T14:22:43Z",
      "fsip_holdnote": null,
      "fsip_grossmargin_base@OData.Community.Display.V1.FormattedValue": "$2,255.00",
      "fsip_grossmargin_base": 2255.0000000000,
      "_fsip_serviceaddress_value": null,
      "fsip_activemmr@OData.Community.Display.V1.FormattedValue": "$386.00",
      "fsip_activemmr": 386.0000000000,
      "lcd_braketestbillable@OData.Community.Display.V1.FormattedValue": "Yes",
      "lcd_braketestbillable": 802290000,
      "fsip_1styearescalation": null,
      "fsip_currentactualprofitpercent": null,
      "fsip_lastinvoicerollup_date@OData.Community.Display.V1.FormattedValue": "1/12/2026 8:46 PM",
      "fsip_lastinvoicerollup_date": "2026-01-12T20:46:52Z",
      "fsip_billinginprogress@OData.Community.Display.V1.FormattedValue": "No",
      "fsip_billinginprogress": false
    },
    {
      "@odata.etag": "W/\"126387637\"",
      "lcd_cancellationnotes": null,
      "fsip_po": null,
      "fsip_billingfrequency": null,
      "lcd_cat1annualprice": "775",
      "fsip_expireson": null,
      "fsip_won@OData.Community.Display.V1.FormattedValue": "No",
      "fsip_won": false,
      "fsip_schedulinginprogress@OData.Community.Display.V1.FormattedValue": "No",
      "fsip_schedulinginprogress": false,
      "_fsip_sortbyaccount_value@OData.Community.Display.V1.FormattedValue": "Services For The Underserved",
      "_fsip_sortbyaccount_value": "45129b18-45a9-ec11-9840-000d3a307669",
      "fsip_invoiced@OData.Community.Display.V1.FormattedValue": "$1,825.00",
      "fsip_invoiced": 1825.0000000000,
      "fsip_currentannualamount_base": null,
      "fsip_currentcontractstartdate@OData.Community.Display.V1.FormattedValue": "9/1/2025",
      "fsip_currentcontractstartdate": "2025-09-01",
      "fsip_nextescalationdate": null,
      "fsip_billingstarton": null,
      "fsip_costs_base@OData.Community.Display.V1.FormattedValue": "$0.00",
      "fsip_costs_base": 0.0000000000,
      "fsip_nextcontractbillingdate@OData.Community.Display.V1.FormattedValue": "2/1/2026",
      "fsip_nextcontractbillingdate": "2026-02-01",
      "fsip_4thyearescalation": null,
      "fsip_invoiced_date@OData.Community.Display.V1.FormattedValue": "1/12/2026 8:46 PM",
      "fsip_invoiced_date": "2026-01-12T20:46:52Z",
      "fsip_billingfrequencycode": null,
      "lcd_cat5fullloadprice": "1550",
      "_fsip_copydevicesfromcontract_value": null,
      "statecode@OData.Community.Display.V1.FormattedValue": "Active",
      "statecode": 0,
      "fsip_regulartimecbservice@OData.Community.Display.V1.FormattedValue": "No",
      "fsip_regulartimecbservice": false,
      "fsip_costs_date@OData.Community.Display.V1.FormattedValue": "1/12/2026 8:46 PM",
      "fsip_costs_date": "2026-01-12T20:46:52Z",
      "_fsip_copydevicesfrombuildinglocation_value": null,
      "lcd_originalcontractamount": null,
      "fsip_closedstatus": null,
      "_fsip_customerid_value@OData.Community.Display.V1.FormattedValue": "Services For The Underserved",
      "_fsip_customerid_value": "45129b18-45a9-ec11-9840-000d3a307669",
      "fsip_contractservicelevelcode": null,
      "fsip_invoiceamount": null,
      "_modifiedby_value@OData.Community.Display.V1.FormattedValue": "# SCRIBE INTEGRATION",
      "_modifiedby_value": "910423db-6a8d-ef11-ac21-000d3a326f08",
      "modifiedon@OData.Community.Display.V1.FormattedValue": "1/5/2026 12:59 PM",
      "modifiedon": "2026-01-05T12:59:40Z",
      "lcd_cancelationnotifyoffice@OData.Community.Display.V1.FormattedValue": "No",
      "lcd_cancelationnotifyoffice": 802290001,
      "lcd_autorenewal@OData.Community.Display.V1.FormattedValue": "Yes",
      "lcd_autorenewal": 802290000,
      "fsip_billingnotecb": null,
      "fsip_lastinvoiced_state@OData.Community.Display.V1.FormattedValue": "1",
      "fsip_lastinvoiced_state": 1,
      "fsip_costs_state@OData.Community.Display.V1.FormattedValue": "1",
      "fsip_costs_state": 1,
      "fsip_percentageoramount": null,
      "fsip_escalationamount_base": null,
      "fsip_closecontract@OData.Community.Display.V1.FormattedValue": "No",
      "fsip_closecontract": false,
      "overriddencreatedon": null,
      "lcd_cat1annualbillable@OData.Community.Display.V1.FormattedValue": "Yes",
      "lcd_cat1annualbillable": 802290000,
      "fsip_activemmr_date@OData.Community.Display.V1.FormattedValue": "1/12/2026 8:46 PM",
      "fsip_activemmr_date": "2026-01-12T20:46:52Z",
      "fsip_specialconditions": null,
      "fsip_currentcontractenddate@OData.Community.Display.V1.FormattedValue": "9/1/2026",
      "fsip_currentcontractenddate": "2026-09-01",
      "lcd_servicefrequencywords": "Monthly",
      "fsip_cleanpithoistwaycartops@OData.Community.Display.V1.FormattedValue": "No",
      "fsip_cleanpithoistwaycartops": false,
      "fsip_5thyearescalation": null,
      "fsip_totalcontract": null,
      "_owningteam_value": null,
      "fsip_autorenew@OData.Community.Display.V1.FormattedValue": "No",
      "fsip_autorenew": false,
      "fsip_escalationpercent": null,
      "exchangerate@OData.Community.Display.V1.FormattedValue": "1.0000000000",
      "exchangerate": 1.000000000000,
      "fsip_excludefromcontractescalations@OData.Community.Display.V1.FormattedValue": "No",
      "fsip_excludefromcontractescalations": false,
      "fsip_annualsafetytest@OData.Community.Display.V1.FormattedValue": "No",
      "fsip_annualsafetytest": false,
      "fsip_nextservicedate@OData.Community.Display.V1.FormattedValue": "2/1/2026",
      "fsip_nextservicedate": "2026-02-01T11:00:00Z",
      "fsip_onhold@OData.Community.Display.V1.FormattedValue": "No",
      "fsip_onhold": false,
      "fsip_currentannualamount": null,
      "_createdby_value@OData.Community.Display.V1.FormattedValue": "Barbara Oliveira",
      "_createdby_value": "554d6842-59b6-ef11-b8e9-000d3a5a6b66",
      "fsip_activemmr_state@OData.Community.Display.V1.FormattedValue": "1",
      "fsip_activemmr_state": 1,
      "fsip_2ndyearescalation": null,
      "_fsip_wagecategory_value": null,
      "fsip_maintenancecontractid": "50b24a1a-e579-f011-b4cc-000d3a302e4a",
      "fsip_contractreviewdate": null,
      "fsip_lastinvoicerollup_state@OData.Community.Display.V1.FormattedValue": "1",
      "fsip_lastinvoicerollup_state": 1,
      "fsip_invoiced_state@OData.Community.Display.V1.FormattedValue": "1",
      "fsip_invoiced_state": 1,
      "fsip_2ndyearescalation_base": null,
      "fsip_5thyearescalation_base": null,
      "fsip_proratedequipment": null,
      "_fsip_originatingcontract_value": null,
      "lcd_runcancelflow@OData.Community.Display.V1.FormattedValue": "No",
      "lcd_runcancelflow": 802290001,
      "fsip_nextbillingdate": null,
      "lcd_createcontractbilling": null,
      "fsip_lastinvoicerollup@OData.Community.Display.V1.FormattedValue": "1/1/2026",
      "fsip_lastinvoicerollup": "2026-01-01",
      "fsip_billingnote": null,
      "_fsip_salesperson_value": null,
      "fsip_invoiceconsolidationtype@OData.Community.Display.V1.FormattedValue": "By Contract",
      "fsip_invoiceconsolidationtype": 683440002,
      "fsip_4thyearescalation_base": null,
      "_fsip_billtocustomer_value@OData.Community.Display.V1.FormattedValue": "Services For The Underserved",
      "_fsip_billtocustomer_value": "45129b18-45a9-ec11-9840-000d3a307669",
      "fsip_costs@OData.Community.Display.V1.FormattedValue": "$0.00",
      "fsip_costs": 0.0000000000,
      "_owningbusinessunit_value@OData.Community.Display.V1.FormattedValue": "LCD Elevator",
      "_owningbusinessunit_value": "c9e85d8b-8fa0-ec11-b400-000d3a58d68e",
      "fsip_legacycontract": null,
      "fsip_printbillingnote@OData.Community.Display.V1.FormattedValue": "Yes",
      "fsip_printbillingnote": true,
      "timezoneruleversionnumber@OData.Community.Display.V1.FormattedValue": "4",
      "timezoneruleversionnumber": 4,
      "fsip_grossmargin@OData.Community.Display.V1.FormattedValue": "$1,825.00",
      "fsip_grossmargin": 1825.0000000000,
      "fsip_payssafetyequipment": null,
      "_ownerid_value@OData.Community.Display.V1.FormattedValue": "Barbara Oliveira",
      "_ownerid_value": "554d6842-59b6-ef11-b8e9-000d3a5a6b66",
      "_fsip_primarybuildinglocation_value@OData.Community.Display.V1.FormattedValue": "1000 Blake Avenue",
      "_fsip_primarybuildinglocation_value": "36d46c25-1caa-ec11-9840-000d3a307669",
      "fsip_lastinvoiced_date@OData.Community.Display.V1.FormattedValue": "1/12/2026 8:46 PM",
      "fsip_lastinvoiced_date": "2026-01-12T20:46:52Z",
      "fsip_invoiced_base@OData.Community.Display.V1.FormattedValue": "$1,825.00",
      "fsip_invoiced_base": 1825.0000000000,
      "importsequencenumber": null,
      "fsip_escalationamount": null,
      "fsip_1styearescalation_base": null,
      "_owninguser_value": "554d6842-59b6-ef11-b8e9-000d3a5a6b66",
      "_transactioncurrencyid_value@OData.Community.Display.V1.FormattedValue": "US Dollar",
      "_transactioncurrencyid_value": "28c060c5-d1a0-ec11-b400-000d3a58d68e",
      "_fsip_productcb_value": null,
      "fsip_visitfrequency@OData.Community.Display.V1.FormattedValue": "30",
      "fsip_visitfrequency": 683440000,
      "fsip_3rdyearescalation_base": null,
      "_fsip_project_value": null,
      "_fsip_division_value@OData.Community.Display.V1.FormattedValue": "Maintenance",
      "_fsip_division_value": "9316e0ff-55a5-ec11-9840-000d3a5c16ba",
      "_fsip_contracttype_value@OData.Community.Display.V1.FormattedValue": "Limited Service",
      "_fsip_contracttype_value": "f13ce9c0-42a9-ec11-9840-000d3a307669",
      "fsip_sendescalationletter@OData.Community.Display.V1.FormattedValue": "No",
      "fsip_sendescalationletter": false,
      "lcd_braketestprice": "850",
      "utcconversiontimezonecode": null,
      "_createdonbehalfby_value": null,
      "fsip_numberofvisits": "1",
      "fsip_totalcontract_base": null,
      "fsip_grossmarginpercent@OData.Community.Display.V1.FormattedValue": "100.00",
      "fsip_grossmarginpercent": 100.00,
      "fsip_certificateofinsurance@OData.Community.Display.V1.FormattedValue": "No",
      "fsip_certificateofinsurance": false,
      "fsip_permitfeesbillable@OData.Community.Display.V1.FormattedValue": "No",
      "fsip_permitfeesbillable": false,
      "fsip_billingendon": null,
      "fsip_lastinvoiced@OData.Community.Display.V1.FormattedValue": "1/5/2026",
      "fsip_lastinvoiced": "2026-01-05T12:56:50Z",
      "fsip_internalnote": null,
      "fsip_escalationfrequency": null,
      "fsip_name": "1000 Blake Avenue",
      "fsip_workorderconsolidationtype@OData.Community.Display.V1.FormattedValue": "By Contract",
      "fsip_workorderconsolidationtype": 683440000,
      "fsip_addalldevicescontractbillings@OData.Community.Display.V1.FormattedValue": "No",
      "fsip_addalldevicescontractbillings": false,
      "fsip_lastescalationlettersent": null,
      "fsip_otminoradjustmentscbservice@OData.Community.Display.V1.FormattedValue": "No",
      "fsip_otminoradjustmentscbservice": false,
      "fsip_duration": null,
      "lcd_daystoexpire@OData.Community.Display.V1.FormattedValue": "-232.00",
      "lcd_daystoexpire": -232.0000000000,
      "fsip_3rdyearescalation": null,
      "fsip_invoicingmethod@OData.Community.Display.V1.FormattedValue": "Work Order Billing",
      "fsip_invoicingmethod": 683440001,
      "lcd_cat5fullloadbillable@OData.Community.Display.V1.FormattedValue": "Yes",
      "lcd_cat5fullloadbillable": 802290000,
      "fsip_cancelon": null,
      "fsip_originalcontractstartdate@OData.Community.Display.V1.FormattedValue": "9/1/2025",
      "fsip_originalcontractstartdate": "2025-09-01",
      "fsip_contractnumber": "MC-0003055",
      "fsip_exclusions": null,
      "_fsip_product_value": null,
      "fsip_quantity": null,
      "fsip_usediscountaspercentage@OData.Community.Display.V1.FormattedValue": "Amount",
      "fsip_usediscountaspercentage": false,
      "fsip_contractlanguage": null,
      "fsip_currentcontractyear": null,
      "lcd_originalcontractamount_base": null,
      "_modifiedonbehalfby_value": null,
      "fsip_fiveyearsafetytest@OData.Community.Display.V1.FormattedValue": "No",
      "fsip_fiveyearsafetytest": false,
      "fsip_closedate": null,
      "fsip_invoiceamount_base": null,
      "versionnumber@OData.Community.Display.V1.FormattedValue": "126,387,637",
      "versionnumber": 126387637,
      "fsip_description": null,
      "fsip_activeon": null,
      "fsip_billingenddate": null,
      "fsip_activemmr_base@OData.Community.Display.V1.FormattedValue": "$365.00",
      "fsip_activemmr_base": 365.0000000000,
      "statuscode@OData.Community.Display.V1.FormattedValue": "Active",
      "statuscode": 683440001,
      "fsip_testbillable@OData.Community.Display.V1.FormattedValue": "No",
      "fsip_testbillable": false,
      "createdon@OData.Community.Display.V1.FormattedValue": "8/15/2025 2:35 PM",
      "createdon": "2025-08-15T14:35:41Z",
      "fsip_holdnote": null,
      "fsip_grossmargin_base@OData.Community.Display.V1.FormattedValue": "$1,825.00",
      "fsip_grossmargin_base": 1825.0000000000,
      "_fsip_serviceaddress_value": null,
      "fsip_activemmr@OData.Community.Display.V1.FormattedValue": "$365.00",
      "fsip_activemmr": 365.0000000000,
      "lcd_braketestbillable@OData.Community.Display.V1.FormattedValue": "Yes",
      "lcd_braketestbillable": 802290000,
      "fsip_1styearescalation": null,
      "fsip_currentactualprofitpercent": null,
      "fsip_lastinvoicerollup_date@OData.Community.Display.V1.FormattedValue": "1/12/2026 8:46 PM",
      "fsip_lastinvoicerollup_date": "2026-01-12T20:46:52Z",
      "fsip_billinginprogress@OData.Community.Display.V1.FormattedValue": "No",
      "fsip_billinginprogress": false
    },
    {
      "@odata.etag": "W/\"126387675\"",
      "lcd_cancellationnotes": null,
      "fsip_po": null,
      "fsip_billingfrequency": null,
      "lcd_cat1annualprice": "775",
      "fsip_expireson": null,
      "fsip_won@OData.Community.Display.V1.FormattedValue": "No",
      "fsip_won": false,
      "fsip_schedulinginprogress@OData.Community.Display.V1.FormattedValue": "No",
      "fsip_schedulinginprogress": false,
      "_fsip_sortbyaccount_value@OData.Community.Display.V1.FormattedValue": "Services For The Underserved",
      "_fsip_sortbyaccount_value": "45129b18-45a9-ec11-9840-000d3a307669",
      "fsip_invoiced@OData.Community.Display.V1.FormattedValue": "$1,430.00",
      "fsip_invoiced": 1430.0000000000,
      "fsip_currentannualamount_base": null,
      "fsip_currentcontractstartdate@OData.Community.Display.V1.FormattedValue": "9/1/2025",
      "fsip_currentcontractstartdate": "2025-09-01",
      "fsip_nextescalationdate": null,
      "fsip_billingstarton": null,
      "fsip_costs_base@OData.Community.Display.V1.FormattedValue": "$0.00",
      "fsip_costs_base": 0.0000000000,
      "fsip_nextcontractbillingdate@OData.Community.Display.V1.FormattedValue": "2/1/2026",
      "fsip_nextcontractbillingdate": "2026-02-01",
      "fsip_4thyearescalation": null,
      "fsip_invoiced_date@OData.Community.Display.V1.FormattedValue": "1/12/2026 8:46 PM",
      "fsip_invoiced_date": "2026-01-12T20:46:52Z",
      "fsip_billingfrequencycode": null,
      "lcd_cat5fullloadprice": "1550",
      "_fsip_copydevicesfromcontract_value": null,
      "statecode@OData.Community.Display.V1.FormattedValue": "Active",
      "statecode": 0,
      "fsip_regulartimecbservice@OData.Community.Display.V1.FormattedValue": "No",
      "fsip_regulartimecbservice": false,
      "fsip_costs_date@OData.Community.Display.V1.FormattedValue": "1/12/2026 8:46 PM",
      "fsip_costs_date": "2026-01-12T20:46:52Z",
      "_fsip_copydevicesfrombuildinglocation_value": null,
      "lcd_originalcontractamount": null,
      "fsip_closedstatus": null,
      "_fsip_customerid_value@OData.Community.Display.V1.FormattedValue": "Services For The Underserved",
      "_fsip_customerid_value": "45129b18-45a9-ec11-9840-000d3a307669",
      "fsip_contractservicelevelcode": null,
      "fsip_invoiceamount": null,
      "_modifiedby_value@OData.Community.Display.V1.FormattedValue": "# SCRIBE INTEGRATION",
      "_modifiedby_value": "910423db-6a8d-ef11-ac21-000d3a326f08",
      "modifiedon@OData.Community.Display.V1.FormattedValue": "1/5/2026 12:59 PM",
      "modifiedon": "2026-01-05T12:59:40Z",
      "lcd_cancelationnotifyoffice@OData.Community.Display.V1.FormattedValue": "No",
      "lcd_cancelationnotifyoffice": 802290001,
      "lcd_autorenewal@OData.Community.Display.V1.FormattedValue": "Yes",
      "lcd_autorenewal": 802290000,
      "fsip_billingnotecb": null,
      "fsip_lastinvoiced_state@OData.Community.Display.V1.FormattedValue": "1",
      "fsip_lastinvoiced_state": 1,
      "fsip_costs_state@OData.Community.Display.V1.FormattedValue": "1",
      "fsip_costs_state": 1,
      "fsip_percentageoramount": null,
      "fsip_escalationamount_base": null,
      "fsip_closecontract@OData.Community.Display.V1.FormattedValue": "No",
      "fsip_closecontract": false,
      "overriddencreatedon": null,
      "lcd_cat1annualbillable@OData.Community.Display.V1.FormattedValue": "Yes",
      "lcd_cat1annualbillable": 802290000,
      "fsip_activemmr_date@OData.Community.Display.V1.FormattedValue": "1/12/2026 8:46 PM",
      "fsip_activemmr_date": "2026-01-12T20:46:52Z",
      "fsip_specialconditions": null,
      "fsip_currentcontractenddate@OData.Community.Display.V1.FormattedValue": "9/1/2026",
      "fsip_currentcontractenddate": "2026-09-01",
      "lcd_servicefrequencywords": "Monthly",
      "fsip_cleanpithoistwaycartops@OData.Community.Display.V1.FormattedValue": "No",
      "fsip_cleanpithoistwaycartops": false,
      "fsip_5thyearescalation": null,
      "fsip_totalcontract": null,
      "_owningteam_value": null,
      "fsip_autorenew@OData.Community.Display.V1.FormattedValue": "No",
      "fsip_autorenew": false,
      "fsip_escalationpercent": null,
      "exchangerate@OData.Community.Display.V1.FormattedValue": "1.0000000000",
      "exchangerate": 1.000000000000,
      "fsip_excludefromcontractescalations@OData.Community.Display.V1.FormattedValue": "No",
      "fsip_excludefromcontractescalations": false,
      "fsip_annualsafetytest@OData.Community.Display.V1.FormattedValue": "No",
      "fsip_annualsafetytest": false,
      "fsip_nextservicedate@OData.Community.Display.V1.FormattedValue": "2/1/2026",
      "fsip_nextservicedate": "2026-02-01T11:00:00Z",
      "fsip_onhold@OData.Community.Display.V1.FormattedValue": "No",
      "fsip_onhold": false,
      "fsip_currentannualamount": null,
      "_createdby_value@OData.Community.Display.V1.FormattedValue": "Barbara Oliveira",
      "_createdby_value": "554d6842-59b6-ef11-b8e9-000d3a5a6b66",
      "fsip_activemmr_state@OData.Community.Display.V1.FormattedValue": "1",
      "fsip_activemmr_state": 1,
      "fsip_2ndyearescalation": null,
      "_fsip_wagecategory_value": null,
      "fsip_maintenancecontractid": "4f02b44a-ea79-f011-b4cc-000d3a302e4a",
      "fsip_contractreviewdate": null,
      "fsip_lastinvoicerollup_state@OData.Community.Display.V1.FormattedValue": "1",
      "fsip_lastinvoicerollup_state": 1,
      "fsip_invoiced_state@OData.Community.Display.V1.FormattedValue": "1",
      "fsip_invoiced_state": 1,
      "fsip_2ndyearescalation_base": null,
      "fsip_5thyearescalation_base": null,
      "fsip_proratedequipment": null,
      "_fsip_originatingcontract_value": null,
      "lcd_runcancelflow@OData.Community.Display.V1.FormattedValue": "No",
      "lcd_runcancelflow": 802290001,
      "fsip_nextbillingdate": null,
      "lcd_createcontractbilling": null,
      "fsip_lastinvoicerollup@OData.Community.Display.V1.FormattedValue": "1/1/2026",
      "fsip_lastinvoicerollup": "2026-01-01",
      "fsip_billingnote": null,
      "_fsip_salesperson_value": null,
      "fsip_invoiceconsolidationtype@OData.Community.Display.V1.FormattedValue": "By Contract",
      "fsip_invoiceconsolidationtype": 683440002,
      "fsip_4thyearescalation_base": null,
      "_fsip_billtocustomer_value@OData.Community.Display.V1.FormattedValue": "Services For The Underserved",
      "_fsip_billtocustomer_value": "45129b18-45a9-ec11-9840-000d3a307669",
      "fsip_costs@OData.Community.Display.V1.FormattedValue": "$0.00",
      "fsip_costs": 0.0000000000,
      "_owningbusinessunit_value@OData.Community.Display.V1.FormattedValue": "LCD Elevator",
      "_owningbusinessunit_value": "c9e85d8b-8fa0-ec11-b400-000d3a58d68e",
      "fsip_legacycontract": null,
      "fsip_printbillingnote@OData.Community.Display.V1.FormattedValue": "Yes",
      "fsip_printbillingnote": true,
      "timezoneruleversionnumber@OData.Community.Display.V1.FormattedValue": "4",
      "timezoneruleversionnumber": 4,
      "fsip_grossmargin@OData.Community.Display.V1.FormattedValue": "$1,430.00",
      "fsip_grossmargin": 1430.0000000000,
      "fsip_payssafetyequipment": null,
      "_ownerid_value@OData.Community.Display.V1.FormattedValue": "Barbara Oliveira",
      "_ownerid_value": "554d6842-59b6-ef11-b8e9-000d3a5a6b66",
      "_fsip_primarybuildinglocation_value@OData.Community.Display.V1.FormattedValue": "599 Ralph Avenue",
      "_fsip_primarybuildinglocation_value": "40d46c25-1caa-ec11-9840-000d3a307669",
      "fsip_lastinvoiced_date@OData.Community.Display.V1.FormattedValue": "1/12/2026 8:46 PM",
      "fsip_lastinvoiced_date": "2026-01-12T20:46:52Z",
      "fsip_invoiced_base@OData.Community.Display.V1.FormattedValue": "$1,430.00",
      "fsip_invoiced_base": 1430.0000000000,
      "importsequencenumber": null,
      "fsip_escalationamount": null,
      "fsip_1styearescalation_base": null,
      "_owninguser_value": "554d6842-59b6-ef11-b8e9-000d3a5a6b66",
      "_transactioncurrencyid_value@OData.Community.Display.V1.FormattedValue": "US Dollar",
      "_transactioncurrencyid_value": "28c060c5-d1a0-ec11-b400-000d3a58d68e",
      "_fsip_productcb_value": null,
      "fsip_visitfrequency@OData.Community.Display.V1.FormattedValue": "30",
      "fsip_visitfrequency": 683440000,
      "fsip_3rdyearescalation_base": null,
      "_fsip_project_value": null,
      "_fsip_division_value@OData.Community.Display.V1.FormattedValue": "Maintenance",
      "_fsip_division_value": "9316e0ff-55a5-ec11-9840-000d3a5c16ba",
      "_fsip_contracttype_value@OData.Community.Display.V1.FormattedValue": "Limited Service",
      "_fsip_contracttype_value": "f13ce9c0-42a9-ec11-9840-000d3a307669",
      "fsip_sendescalationletter@OData.Community.Display.V1.FormattedValue": "No",
      "fsip_sendescalationletter": false,
      "lcd_braketestprice": "850",
      "utcconversiontimezonecode": null,
      "_createdonbehalfby_value": null,
      "fsip_numberofvisits": "1",
      "fsip_totalcontract_base": null,
      "fsip_grossmarginpercent@OData.Community.Display.V1.FormattedValue": "100.00",
      "fsip_grossmarginpercent": 100.00,
      "fsip_certificateofinsurance@OData.Community.Display.V1.FormattedValue": "No",
      "fsip_certificateofinsurance": false,
      "fsip_permitfeesbillable@OData.Community.Display.V1.FormattedValue": "No",
      "fsip_permitfeesbillable": false,
      "fsip_billingendon": null,
      "fsip_lastinvoiced@OData.Community.Display.V1.FormattedValue": "1/5/2026",
      "fsip_lastinvoiced": "2026-01-05T12:56:51Z",
      "fsip_internalnote": null,
      "fsip_escalationfrequency": null,
      "fsip_name": "599 Ralph Avenue",
      "fsip_workorderconsolidationtype@OData.Community.Display.V1.FormattedValue": "By Contract",
      "fsip_workorderconsolidationtype": 683440000,
      "fsip_addalldevicescontractbillings@OData.Community.Display.V1.FormattedValue": "No",
      "fsip_addalldevicescontractbillings": false,
      "fsip_lastescalationlettersent": null,
      "fsip_otminoradjustmentscbservice@OData.Community.Display.V1.FormattedValue": "No",
      "fsip_otminoradjustmentscbservice": false,
      "fsip_duration": null,
      "lcd_daystoexpire@OData.Community.Display.V1.FormattedValue": "-232.00",
      "lcd_daystoexpire": -232.0000000000,
      "fsip_3rdyearescalation": null,
      "fsip_invoicingmethod@OData.Community.Display.V1.FormattedValue": "Work Order Billing",
      "fsip_invoicingmethod": 683440001,
      "lcd_cat5fullloadbillable@OData.Community.Display.V1.FormattedValue": "Yes",
      "lcd_cat5fullloadbillable": 802290000,
      "fsip_cancelon": null,
      "fsip_originalcontractstartdate@OData.Community.Display.V1.FormattedValue": "9/1/2025",
      "fsip_originalcontractstartdate": "2025-09-01",
      "fsip_contractnumber": "MC-0003056",
      "fsip_exclusions": null,
      "_fsip_product_value": null,
      "fsip_quantity": null,
      "fsip_usediscountaspercentage@OData.Community.Display.V1.FormattedValue": "Amount",
      "fsip_usediscountaspercentage": false,
      "fsip_contractlanguage": null,
      "fsip_currentcontractyear": null,
      "lcd_originalcontractamount_base": null,
      "_modifiedonbehalfby_value": null,
      "fsip_fiveyearsafetytest@OData.Community.Display.V1.FormattedValue": "No",
      "fsip_fiveyearsafetytest": false,
      "fsip_closedate": null,
      "fsip_invoiceamount_base": null,
      "versionnumber@OData.Community.Display.V1.FormattedValue": "126,387,675",
      "versionnumber": 126387675,
      "fsip_description": null,
      "fsip_activeon": null,
      "fsip_billingenddate": null,
      "fsip_activemmr_base@OData.Community.Display.V1.FormattedValue": "$286.00",
      "fsip_activemmr_base": 286.0000000000,
      "statuscode@OData.Community.Display.V1.FormattedValue": "Active",
      "statuscode": 683440001,
      "fsip_testbillable@OData.Community.Display.V1.FormattedValue": "No",
      "fsip_testbillable": false,
      "createdon@OData.Community.Display.V1.FormattedValue": "8/15/2025 3:12 PM",
      "createdon": "2025-08-15T15:12:50Z",
      "fsip_holdnote": null,
      "fsip_grossmargin_base@OData.Community.Display.V1.FormattedValue": "$1,430.00",
      "fsip_grossmargin_base": 1430.0000000000,
      "_fsip_serviceaddress_value": null,
      "fsip_activemmr@OData.Community.Display.V1.FormattedValue": "$286.00",
      "fsip_activemmr": 286.0000000000,
      "lcd_braketestbillable@OData.Community.Display.V1.FormattedValue": "Yes",
      "lcd_braketestbillable": 802290000,
      "fsip_1styearescalation": null,
      "fsip_currentactualprofitpercent": null,
      "fsip_lastinvoicerollup_date@OData.Community.Display.V1.FormattedValue": "1/12/2026 8:46 PM",
      "fsip_lastinvoicerollup_date": "2026-01-12T20:46:52Z",
      "fsip_billinginprogress@OData.Community.Display.V1.FormattedValue": "No",
      "fsip_billinginprogress": false
    },
    {
      "@odata.etag": "W/\"126387288\"",
      "lcd_cancellationnotes": null,
      "fsip_po": null,
      "fsip_billingfrequency": null,
      "lcd_cat1annualprice": "775",
      "fsip_expireson": null,
      "fsip_won@OData.Community.Display.V1.FormattedValue": "No",
      "fsip_won": false,
      "fsip_schedulinginprogress@OData.Community.Display.V1.FormattedValue": "No",
      "fsip_schedulinginprogress": false,
      "_fsip_sortbyaccount_value@OData.Community.Display.V1.FormattedValue": "Stagg Group",
      "_fsip_sortbyaccount_value": "7d129b18-45a9-ec11-9840-000d3a307669",
      "fsip_invoiced@OData.Community.Display.V1.FormattedValue": "$6,118.00",
      "fsip_invoiced": 6118.0000000000,
      "fsip_currentannualamount_base": null,
      "fsip_currentcontractstartdate@OData.Community.Display.V1.FormattedValue": "10/1/2025",
      "fsip_currentcontractstartdate": "2025-10-01",
      "fsip_nextescalationdate": null,
      "fsip_billingstarton": null,
      "fsip_costs_base@OData.Community.Display.V1.FormattedValue": "$0.00",
      "fsip_costs_base": 0.0000000000,
      "fsip_nextcontractbillingdate@OData.Community.Display.V1.FormattedValue": "2/1/2026",
      "fsip_nextcontractbillingdate": "2026-02-01",
      "fsip_4thyearescalation": null,
      "fsip_invoiced_date@OData.Community.Display.V1.FormattedValue": "1/12/2026 8:46 PM",
      "fsip_invoiced_date": "2026-01-12T20:46:52Z",
      "fsip_billingfrequencycode": null,
      "lcd_cat5fullloadprice": "1550",
      "_fsip_copydevicesfromcontract_value": null,
      "statecode@OData.Community.Display.V1.FormattedValue": "Active",
      "statecode": 0,
      "fsip_regulartimecbservice@OData.Community.Display.V1.FormattedValue": "No",
      "fsip_regulartimecbservice": false,
      "fsip_costs_date@OData.Community.Display.V1.FormattedValue": "1/12/2026 8:46 PM",
      "fsip_costs_date": "2026-01-12T20:46:52Z",
      "_fsip_copydevicesfrombuildinglocation_value": null,
      "lcd_originalcontractamount": null,
      "fsip_closedstatus": null,
      "_fsip_customerid_value@OData.Community.Display.V1.FormattedValue": "Stagg Group",
      "_fsip_customerid_value": "7d129b18-45a9-ec11-9840-000d3a307669",
      "fsip_contractservicelevelcode": null,
      "fsip_invoiceamount": null,
      "_modifiedby_value@OData.Community.Display.V1.FormattedValue": "# SCRIBE INTEGRATION",
      "_modifiedby_value": "910423db-6a8d-ef11-ac21-000d3a326f08",
      "modifiedon@OData.Community.Display.V1.FormattedValue": "1/5/2026 12:59 PM",
      "modifiedon": "2026-01-05T12:59:40Z",
      "lcd_cancelationnotifyoffice@OData.Community.Display.V1.FormattedValue": "No",
      "lcd_cancelationnotifyoffice": 802290001,
      "lcd_autorenewal@OData.Community.Display.V1.FormattedValue": "Yes",
      "lcd_autorenewal": 802290000,
      "fsip_billingnotecb": null,
      "fsip_lastinvoiced_state@OData.Community.Display.V1.FormattedValue": "1",
      "fsip_lastinvoiced_state": 1,
      "fsip_costs_state@OData.Community.Display.V1.FormattedValue": "1",
      "fsip_costs_state": 1,
      "fsip_percentageoramount": null,
      "fsip_escalationamount_base": null,
      "fsip_closecontract@OData.Community.Display.V1.FormattedValue": "No",
      "fsip_closecontract": false,
      "overriddencreatedon": null,
      "lcd_cat1annualbillable@OData.Community.Display.V1.FormattedValue": "Yes",
      "lcd_cat1annualbillable": 802290000,
      "fsip_activemmr_date@OData.Community.Display.V1.FormattedValue": "1/12/2026 8:46 PM",
      "fsip_activemmr_date": "2026-01-12T20:46:52Z",
      "fsip_specialconditions": null,
      "fsip_currentcontractenddate@OData.Community.Display.V1.FormattedValue": "10/1/2026",
      "fsip_currentcontractenddate": "2026-10-01",
      "lcd_servicefrequencywords": "Monthly",
      "fsip_cleanpithoistwaycartops@OData.Community.Display.V1.FormattedValue": "No",
      "fsip_cleanpithoistwaycartops": false,
      "fsip_5thyearescalation": null,
      "fsip_totalcontract": null,
      "_owningteam_value": null,
      "fsip_autorenew@OData.Community.Display.V1.FormattedValue": "No",
      "fsip_autorenew": false,
      "fsip_escalationpercent": null,
      "exchangerate@OData.Community.Display.V1.FormattedValue": "1.0000000000",
      "exchangerate": 1.000000000000,
      "fsip_excludefromcontractescalations@OData.Community.Display.V1.FormattedValue": "No",
      "fsip_excludefromcontractescalations": false,
      "fsip_annualsafetytest@OData.Community.Display.V1.FormattedValue": "No",
      "fsip_annualsafetytest": false,
      "fsip_nextservicedate@OData.Community.Display.V1.FormattedValue": "2/1/2026",
      "fsip_nextservicedate": "2026-02-01T11:00:00Z",
      "fsip_onhold@OData.Community.Display.V1.FormattedValue": "No",
      "fsip_onhold": false,
      "fsip_currentannualamount": null,
      "_createdby_value@OData.Community.Display.V1.FormattedValue": "Barbara Oliveira",
      "_createdby_value": "554d6842-59b6-ef11-b8e9-000d3a5a6b66",
      "fsip_activemmr_state@OData.Community.Display.V1.FormattedValue": "1",
      "fsip_activemmr_state": 1,
      "fsip_2ndyearescalation": null,
      "_fsip_wagecategory_value": null,
      "fsip_maintenancecontractid": "96c82cfc-507f-f011-b4cc-000d3a302e4a",
      "fsip_contractreviewdate": null,
      "fsip_lastinvoicerollup_state@OData.Community.Display.V1.FormattedValue": "1",
      "fsip_lastinvoicerollup_state": 1,
      "fsip_invoiced_state@OData.Community.Display.V1.FormattedValue": "1",
      "fsip_invoiced_state": 1,
      "fsip_2ndyearescalation_base": null,
      "fsip_5thyearescalation_base": null,
      "fsip_proratedequipment": null,
      "_fsip_originatingcontract_value": null,
      "lcd_runcancelflow@OData.Community.Display.V1.FormattedValue": "No",
      "lcd_runcancelflow": 802290001,
      "fsip_nextbillingdate": null,
      "lcd_createcontractbilling": null,
      "fsip_lastinvoicerollup@OData.Community.Display.V1.FormattedValue": "1/1/2026",
      "fsip_lastinvoicerollup": "2026-01-01",
      "fsip_billingnote": null,
      "_fsip_salesperson_value": null,
      "fsip_invoiceconsolidationtype@OData.Community.Display.V1.FormattedValue": "By Contract",
      "fsip_invoiceconsolidationtype": 683440002,
      "fsip_4thyearescalation_base": null,
      "_fsip_billtocustomer_value@OData.Community.Display.V1.FormattedValue": "Stagg Group",
      "_fsip_billtocustomer_value": "7d129b18-45a9-ec11-9840-000d3a307669",
      "fsip_costs@OData.Community.Display.V1.FormattedValue": "$0.00",
      "fsip_costs": 0.0000000000,
      "_owningbusinessunit_value@OData.Community.Display.V1.FormattedValue": "LCD Elevator",
      "_owningbusinessunit_value": "c9e85d8b-8fa0-ec11-b400-000d3a58d68e",
      "fsip_legacycontract": null,
      "fsip_printbillingnote@OData.Community.Display.V1.FormattedValue": "Yes",
      "fsip_printbillingnote": true,
      "timezoneruleversionnumber@OData.Community.Display.V1.FormattedValue": "4",
      "timezoneruleversionnumber": 4,
      "fsip_grossmargin@OData.Community.Display.V1.FormattedValue": "$6,118.00",
      "fsip_grossmargin": 6118.0000000000,
      "fsip_payssafetyequipment": null,
      "_ownerid_value@OData.Community.Display.V1.FormattedValue": "Barbara Oliveira",
      "_ownerid_value": "554d6842-59b6-ef11-b8e9-000d3a5a6b66",
      "_fsip_primarybuildinglocation_value@OData.Community.Display.V1.FormattedValue": "1001 Whitlock Avenue",
      "_fsip_primarybuildinglocation_value": "aa6dff44-09e5-ed11-a7c7-6045bd03814f",
      "fsip_lastinvoiced_date@OData.Community.Display.V1.FormattedValue": "1/12/2026 8:46 PM",
      "fsip_lastinvoiced_date": "2026-01-12T20:46:52Z",
      "fsip_invoiced_base@OData.Community.Display.V1.FormattedValue": "$6,118.00",
      "fsip_invoiced_base": 6118.0000000000,
      "importsequencenumber": null,
      "fsip_escalationamount": null,
      "fsip_1styearescalation_base": null,
      "_owninguser_value": "554d6842-59b6-ef11-b8e9-000d3a5a6b66",
      "_transactioncurrencyid_value@OData.Community.Display.V1.FormattedValue": "US Dollar",
      "_transactioncurrencyid_value": "28c060c5-d1a0-ec11-b400-000d3a58d68e",
      "_fsip_productcb_value": null,
      "fsip_visitfrequency@OData.Community.Display.V1.FormattedValue": "30",
      "fsip_visitfrequency": 683440000,
      "fsip_3rdyearescalation_base": null,
      "_fsip_project_value": null,
      "_fsip_division_value@OData.Community.Display.V1.FormattedValue": "Maintenance",
      "_fsip_division_value": "9316e0ff-55a5-ec11-9840-000d3a5c16ba",
      "_fsip_contracttype_value@OData.Community.Display.V1.FormattedValue": "Limited Service",
      "_fsip_contracttype_value": "f13ce9c0-42a9-ec11-9840-000d3a307669",
      "fsip_sendescalationletter@OData.Community.Display.V1.FormattedValue": "No",
      "fsip_sendescalationletter": false,
      "lcd_braketestprice": "850",
      "utcconversiontimezonecode": null,
      "_createdonbehalfby_value": null,
      "fsip_numberofvisits": "1",
      "fsip_totalcontract_base": null,
      "fsip_grossmarginpercent@OData.Community.Display.V1.FormattedValue": "100.00",
      "fsip_grossmarginpercent": 100.00,
      "fsip_certificateofinsurance@OData.Community.Display.V1.FormattedValue": "No",
      "fsip_certificateofinsurance": false,
      "fsip_permitfeesbillable@OData.Community.Display.V1.FormattedValue": "No",
      "fsip_permitfeesbillable": false,
      "fsip_billingendon": null,
      "fsip_lastinvoiced@OData.Community.Display.V1.FormattedValue": "1/5/2026",
      "fsip_lastinvoiced": "2026-01-05T12:56:43Z",
      "fsip_internalnote": null,
      "fsip_escalationfrequency": null,
      "fsip_name": "1001 Whitlock Avenue",
      "fsip_workorderconsolidationtype@OData.Community.Display.V1.FormattedValue": "By Contract",
      "fsip_workorderconsolidationtype": 683440000,
      "fsip_addalldevicescontractbillings": null,
      "fsip_lastescalationlettersent": null,
      "fsip_otminoradjustmentscbservice@OData.Community.Display.V1.FormattedValue": "No",
      "fsip_otminoradjustmentscbservice": false,
      "fsip_duration": null,
      "lcd_daystoexpire@OData.Community.Display.V1.FormattedValue": "-262.00",
      "lcd_daystoexpire": -262.0000000000,
      "fsip_3rdyearescalation": null,
      "fsip_invoicingmethod@OData.Community.Display.V1.FormattedValue": "Work Order Billing",
      "fsip_invoicingmethod": 683440001,
      "lcd_cat5fullloadbillable@OData.Community.Display.V1.FormattedValue": "Yes",
      "lcd_cat5fullloadbillable": 802290000,
      "fsip_cancelon": null,
      "fsip_originalcontractstartdate@OData.Community.Display.V1.FormattedValue": "10/1/2025",
      "fsip_originalcontractstartdate": "2025-10-01",
      "fsip_contractnumber": "MC-0003058",
      "fsip_exclusions": null,
      "_fsip_product_value": null,
      "fsip_quantity": null,
      "fsip_usediscountaspercentage@OData.Community.Display.V1.FormattedValue": "Amount",
      "fsip_usediscountaspercentage": false,
      "fsip_contractlanguage": null,
      "fsip_currentcontractyear": null,
      "lcd_originalcontractamount_base": null,
      "_modifiedonbehalfby_value": null,
      "fsip_fiveyearsafetytest@OData.Community.Display.V1.FormattedValue": "No",
      "fsip_fiveyearsafetytest": false,
      "fsip_closedate": null,
      "fsip_invoiceamount_base": null,
      "versionnumber@OData.Community.Display.V1.FormattedValue": "126,387,288",
      "versionnumber": 126387288,
      "fsip_description": null,
      "fsip_activeon": null,
      "fsip_billingenddate": null,
      "fsip_activemmr_base@OData.Community.Display.V1.FormattedValue": "$1,529.50",
      "fsip_activemmr_base": 1529.5000000000,
      "statuscode@OData.Community.Display.V1.FormattedValue": "Active",
      "statuscode": 683440001,
      "fsip_testbillable@OData.Community.Display.V1.FormattedValue": "No",
      "fsip_testbillable": false,
      "createdon@OData.Community.Display.V1.FormattedValue": "8/22/2025 12:10 PM",
      "createdon": "2025-08-22T12:10:29Z",
      "fsip_holdnote": null,
      "fsip_grossmargin_base@OData.Community.Display.V1.FormattedValue": "$6,118.00",
      "fsip_grossmargin_base": 6118.0000000000,
      "_fsip_serviceaddress_value": null,
      "fsip_activemmr@OData.Community.Display.V1.FormattedValue": "$1,529.50",
      "fsip_activemmr": 1529.5000000000,
      "lcd_braketestbillable@OData.Community.Display.V1.FormattedValue": "Yes",
      "lcd_braketestbillable": 802290000,
      "fsip_1styearescalation": null,
      "fsip_currentactualprofitpercent": null,
      "fsip_lastinvoicerollup_date@OData.Community.Display.V1.FormattedValue": "1/12/2026 8:46 PM",
      "fsip_lastinvoicerollup_date": "2026-01-12T20:46:52Z",
      "fsip_billinginprogress@OData.Community.Display.V1.FormattedValue": "No",
      "fsip_billinginprogress": false
    },
    {
      "@odata.etag": "W/\"126406949\"",
      "lcd_cancellationnotes": null,
      "fsip_po": null,
      "fsip_billingfrequency": null,
      "lcd_cat1annualprice": "775",
      "fsip_expireson": null,
      "fsip_won@OData.Community.Display.V1.FormattedValue": "No",
      "fsip_won": false,
      "fsip_schedulinginprogress@OData.Community.Display.V1.FormattedValue": "No",
      "fsip_schedulinginprogress": false,
      "_fsip_sortbyaccount_value@OData.Community.Display.V1.FormattedValue": "Kulanu Academy",
      "_fsip_sortbyaccount_value": "de5d4be4-b108-f011-bae2-000d3a307f92",
      "fsip_invoiced@OData.Community.Display.V1.FormattedValue": "$1,625.00",
      "fsip_invoiced": 1625.0000000000,
      "fsip_currentannualamount_base": null,
      "fsip_currentcontractstartdate@OData.Community.Display.V1.FormattedValue": "8/28/2025",
      "fsip_currentcontractstartdate": "2025-08-28",
      "fsip_nextescalationdate": null,
      "fsip_billingstarton": null,
      "fsip_costs_base@OData.Community.Display.V1.FormattedValue": "$0.00",
      "fsip_costs_base": 0.0000000000,
      "fsip_nextcontractbillingdate@OData.Community.Display.V1.FormattedValue": "2/1/2026",
      "fsip_nextcontractbillingdate": "2026-02-01",
      "fsip_4thyearescalation": null,
      "fsip_invoiced_date@OData.Community.Display.V1.FormattedValue": "1/12/2026 8:46 PM",
      "fsip_invoiced_date": "2026-01-12T20:46:52Z",
      "fsip_billingfrequencycode": null,
      "lcd_cat5fullloadprice": "1150",
      "_fsip_copydevicesfromcontract_value": null,
      "statecode@OData.Community.Display.V1.FormattedValue": "Active",
      "statecode": 0,
      "fsip_regulartimecbservice@OData.Community.Display.V1.FormattedValue": "No",
      "fsip_regulartimecbservice": false,
      "fsip_costs_date@OData.Community.Display.V1.FormattedValue": "1/12/2026 8:46 PM",
      "fsip_costs_date": "2026-01-12T20:46:52Z",
      "_fsip_copydevicesfrombuildinglocation_value": null,
      "lcd_originalcontractamount": null,
      "fsip_closedstatus": null,
      "_fsip_customerid_value@OData.Community.Display.V1.FormattedValue": "Kulanu Academy",
      "_fsip_customerid_value": "de5d4be4-b108-f011-bae2-000d3a307f92",
      "fsip_contractservicelevelcode": null,
      "fsip_invoiceamount": null,
      "_modifiedby_value@OData.Community.Display.V1.FormattedValue": "# SCRIBE INTEGRATION",
      "_modifiedby_value": "910423db-6a8d-ef11-ac21-000d3a326f08",
      "modifiedon@OData.Community.Display.V1.FormattedValue": "1/5/2026 12:59 PM",
      "modifiedon": "2026-01-05T12:59:41Z",
      "lcd_cancelationnotifyoffice@OData.Community.Display.V1.FormattedValue": "No",
      "lcd_cancelationnotifyoffice": 802290001,
      "lcd_autorenewal@OData.Community.Display.V1.FormattedValue": "Yes",
      "lcd_autorenewal": 802290000,
      "fsip_billingnotecb": null,
      "fsip_lastinvoiced_state@OData.Community.Display.V1.FormattedValue": "1",
      "fsip_lastinvoiced_state": 1,
      "fsip_costs_state@OData.Community.Display.V1.FormattedValue": "1",
      "fsip_costs_state": 1,
      "fsip_percentageoramount": null,
      "fsip_escalationamount_base": null,
      "fsip_closecontract@OData.Community.Display.V1.FormattedValue": "No",
      "fsip_closecontract": false,
      "overriddencreatedon": null,
      "lcd_cat1annualbillable@OData.Community.Display.V1.FormattedValue": "Yes",
      "lcd_cat1annualbillable": 802290000,
      "fsip_activemmr_date@OData.Community.Display.V1.FormattedValue": "1/12/2026 8:46 PM",
      "fsip_activemmr_date": "2026-01-12T20:46:52Z",
      "fsip_specialconditions": null,
      "fsip_currentcontractenddate@OData.Community.Display.V1.FormattedValue": "8/28/2026",
      "fsip_currentcontractenddate": "2026-08-28",
      "lcd_servicefrequencywords": "Monthly",
      "fsip_cleanpithoistwaycartops@OData.Community.Display.V1.FormattedValue": "No",
      "fsip_cleanpithoistwaycartops": false,
      "fsip_5thyearescalation": null,
      "fsip_totalcontract": null,
      "_owningteam_value": null,
      "fsip_autorenew@OData.Community.Display.V1.FormattedValue": "No",
      "fsip_autorenew": false,
      "fsip_escalationpercent": null,
      "exchangerate@OData.Community.Display.V1.FormattedValue": "1.0000000000",
      "exchangerate": 1.000000000000,
      "fsip_excludefromcontractescalations@OData.Community.Display.V1.FormattedValue": "No",
      "fsip_excludefromcontractescalations": false,
      "fsip_annualsafetytest@OData.Community.Display.V1.FormattedValue": "No",
      "fsip_annualsafetytest": false,
      "fsip_nextservicedate@OData.Community.Display.V1.FormattedValue": "2/28/2026",
      "fsip_nextservicedate": "2026-02-28T11:00:00Z",
      "fsip_onhold@OData.Community.Display.V1.FormattedValue": "No",
      "fsip_onhold": false,
      "fsip_currentannualamount": null,
      "_createdby_value@OData.Community.Display.V1.FormattedValue": "Barbara Oliveira",
      "_createdby_value": "554d6842-59b6-ef11-b8e9-000d3a5a6b66",
      "fsip_activemmr_state@OData.Community.Display.V1.FormattedValue": "1",
      "fsip_activemmr_state": 1,
      "fsip_2ndyearescalation": null,
      "_fsip_wagecategory_value": null,
      "fsip_maintenancecontractid": "c3b36e1e-1a84-f011-b4cc-000d3a302e4a",
      "fsip_contractreviewdate": null,
      "fsip_lastinvoicerollup_state@OData.Community.Display.V1.FormattedValue": "1",
      "fsip_lastinvoicerollup_state": 1,
      "fsip_invoiced_state@OData.Community.Display.V1.FormattedValue": "1",
      "fsip_invoiced_state": 1,
      "fsip_2ndyearescalation_base": null,
      "fsip_5thyearescalation_base": null,
      "fsip_proratedequipment": null,
      "_fsip_originatingcontract_value": null,
      "lcd_runcancelflow@OData.Community.Display.V1.FormattedValue": "No",
      "lcd_runcancelflow": 802290001,
      "fsip_nextbillingdate": null,
      "lcd_createcontractbilling": null,
      "fsip_lastinvoicerollup@OData.Community.Display.V1.FormattedValue": "1/1/2026",
      "fsip_lastinvoicerollup": "2026-01-01",
      "fsip_billingnote": null,
      "_fsip_salesperson_value": null,
      "fsip_invoiceconsolidationtype@OData.Community.Display.V1.FormattedValue": "By Contract",
      "fsip_invoiceconsolidationtype": 683440002,
      "fsip_4thyearescalation_base": null,
      "_fsip_billtocustomer_value@OData.Community.Display.V1.FormattedValue": "Kulanu Academy",
      "_fsip_billtocustomer_value": "de5d4be4-b108-f011-bae2-000d3a307f92",
      "fsip_costs@OData.Community.Display.V1.FormattedValue": "$0.00",
      "fsip_costs": 0.0000000000,
      "_owningbusinessunit_value@OData.Community.Display.V1.FormattedValue": "LCD Elevator",
      "_owningbusinessunit_value": "c9e85d8b-8fa0-ec11-b400-000d3a58d68e",
      "fsip_legacycontract": null,
      "fsip_printbillingnote@OData.Community.Display.V1.FormattedValue": "Yes",
      "fsip_printbillingnote": true,
      "timezoneruleversionnumber@OData.Community.Display.V1.FormattedValue": "4",
      "timezoneruleversionnumber": 4,
      "fsip_grossmargin@OData.Community.Display.V1.FormattedValue": "$1,625.00",
      "fsip_grossmargin": 1625.0000000000,
      "fsip_payssafetyequipment": null,
      "_ownerid_value@OData.Community.Display.V1.FormattedValue": "Barbara Oliveira",
      "_ownerid_value": "554d6842-59b6-ef11-b8e9-000d3a5a6b66",
      "_fsip_primarybuildinglocation_value@OData.Community.Display.V1.FormattedValue": "620 Central Avenue",
      "_fsip_primarybuildinglocation_value": "9f591b98-102c-f011-8c4d-000d3a33a53f",
      "fsip_lastinvoiced_date@OData.Community.Display.V1.FormattedValue": "1/12/2026 8:46 PM",
      "fsip_lastinvoiced_date": "2026-01-12T20:46:52Z",
      "fsip_invoiced_base@OData.Community.Display.V1.FormattedValue": "$1,625.00",
      "fsip_invoiced_base": 1625.0000000000,
      "importsequencenumber": null,
      "fsip_escalationamount": null,
      "fsip_1styearescalation_base": null,
      "_owninguser_value": "554d6842-59b6-ef11-b8e9-000d3a5a6b66",
      "_transactioncurrencyid_value@OData.Community.Display.V1.FormattedValue": "US Dollar",
      "_transactioncurrencyid_value": "28c060c5-d1a0-ec11-b400-000d3a58d68e",
      "_fsip_productcb_value": null,
      "fsip_visitfrequency@OData.Community.Display.V1.FormattedValue": "30",
      "fsip_visitfrequency": 683440000,
      "fsip_3rdyearescalation_base": null,
      "_fsip_project_value": null,
      "_fsip_division_value@OData.Community.Display.V1.FormattedValue": "Maintenance",
      "_fsip_division_value": "9316e0ff-55a5-ec11-9840-000d3a5c16ba",
      "_fsip_contracttype_value@OData.Community.Display.V1.FormattedValue": "Limited Service",
      "_fsip_contracttype_value": "f13ce9c0-42a9-ec11-9840-000d3a307669",
      "fsip_sendescalationletter@OData.Community.Display.V1.FormattedValue": "No",
      "fsip_sendescalationletter": false,
      "lcd_braketestprice": null,
      "utcconversiontimezonecode": null,
      "_createdonbehalfby_value": null,
      "fsip_numberofvisits": "1",
      "fsip_totalcontract_base": null,
      "fsip_grossmarginpercent@OData.Community.Display.V1.FormattedValue": "100.00",
      "fsip_grossmarginpercent": 100.00,
      "fsip_certificateofinsurance@OData.Community.Display.V1.FormattedValue": "No",
      "fsip_certificateofinsurance": false,
      "fsip_permitfeesbillable@OData.Community.Display.V1.FormattedValue": "No",
      "fsip_permitfeesbillable": false,
      "fsip_billingendon": null,
      "fsip_lastinvoiced@OData.Community.Display.V1.FormattedValue": "1/5/2026",
      "fsip_lastinvoiced": "2026-01-05T12:56:43Z",
      "fsip_internalnote": null,
      "fsip_escalationfrequency": null,
      "fsip_name": "620 Central Avenue",
      "fsip_workorderconsolidationtype@OData.Community.Display.V1.FormattedValue": "By Contract",
      "fsip_workorderconsolidationtype": 683440000,
      "fsip_addalldevicescontractbillings@OData.Community.Display.V1.FormattedValue": "No",
      "fsip_addalldevicescontractbillings": false,
      "fsip_lastescalationlettersent": null,
      "fsip_otminoradjustmentscbservice@OData.Community.Display.V1.FormattedValue": "No",
      "fsip_otminoradjustmentscbservice": false,
      "fsip_duration": null,
      "lcd_daystoexpire@OData.Community.Display.V1.FormattedValue": "-228.00",
      "lcd_daystoexpire": -228.0000000000,
      "fsip_3rdyearescalation": null,
      "fsip_invoicingmethod@OData.Community.Display.V1.FormattedValue": "Work Order Billing",
      "fsip_invoicingmethod": 683440001,
      "lcd_cat5fullloadbillable@OData.Community.Display.V1.FormattedValue": "Yes",
      "lcd_cat5fullloadbillable": 802290000,
      "fsip_cancelon": null,
      "fsip_originalcontractstartdate@OData.Community.Display.V1.FormattedValue": "8/28/2025",
      "fsip_originalcontractstartdate": "2025-08-28",
      "fsip_contractnumber": "MC-0003064",
      "fsip_exclusions": null,
      "_fsip_product_value": null,
      "fsip_quantity": null,
      "fsip_usediscountaspercentage@OData.Community.Display.V1.FormattedValue": "Amount",
      "fsip_usediscountaspercentage": false,
      "fsip_contractlanguage": null,
      "fsip_currentcontractyear": null,
      "lcd_originalcontractamount_base": null,
      "_modifiedonbehalfby_value": null,
      "fsip_fiveyearsafetytest@OData.Community.Display.V1.FormattedValue": "No",
      "fsip_fiveyearsafetytest": false,
      "fsip_closedate": null,
      "fsip_invoiceamount_base": null,
      "versionnumber@OData.Community.Display.V1.FormattedValue": "126,406,949",
      "versionnumber": 126406949,
      "fsip_description": null,
      "fsip_activeon": null,
      "fsip_billingenddate": null,
      "fsip_activemmr_base@OData.Community.Display.V1.FormattedValue": "$325.00",
      "fsip_activemmr_base": 325.0000000000,
      "statuscode@OData.Community.Display.V1.FormattedValue": "Active",
      "statuscode": 683440001,
      "fsip_testbillable@OData.Community.Display.V1.FormattedValue": "No",
      "fsip_testbillable": false,
      "createdon@OData.Community.Display.V1.FormattedValue": "8/28/2025 2:20 PM",
      "createdon": "2025-08-28T14:20:25Z",
      "fsip_holdnote": null,
      "fsip_grossmargin_base@OData.Community.Display.V1.FormattedValue": "$1,625.00",
      "fsip_grossmargin_base": 1625.0000000000,
      "_fsip_serviceaddress_value": null,
      "fsip_activemmr@OData.Community.Display.V1.FormattedValue": "$325.00",
      "fsip_activemmr": 325.0000000000,
      "lcd_braketestbillable": null,
      "fsip_1styearescalation": null,
      "fsip_currentactualprofitpercent": null,
      "fsip_lastinvoicerollup_date@OData.Community.Display.V1.FormattedValue": "1/12/2026 8:46 PM",
      "fsip_lastinvoicerollup_date": "2026-01-12T20:46:52Z",
      "fsip_billinginprogress@OData.Community.Display.V1.FormattedValue": "No",
      "fsip_billinginprogress": false
    },
    {
      "@odata.etag": "W/\"126623440\"",
      "lcd_cancellationnotes": null,
      "fsip_po": null,
      "fsip_billingfrequency": null,
      "lcd_cat1annualprice": null,
      "fsip_expireson": null,
      "fsip_won@OData.Community.Display.V1.FormattedValue": "No",
      "fsip_won": false,
      "fsip_schedulinginprogress@OData.Community.Display.V1.FormattedValue": "No",
      "fsip_schedulinginprogress": false,
      "_fsip_sortbyaccount_value@OData.Community.Display.V1.FormattedValue": "Neko Health",
      "_fsip_sortbyaccount_value": "c65d4cdc-d5d9-f011-8544-000d3a308b24",
      "fsip_invoiced@OData.Community.Display.V1.FormattedValue": "$0.00",
      "fsip_invoiced": 0.0000000000,
      "fsip_currentannualamount_base": null,
      "fsip_currentcontractstartdate@OData.Community.Display.V1.FormattedValue": "10/6/2025",
      "fsip_currentcontractstartdate": "2025-10-06",
      "fsip_nextescalationdate": null,
      "fsip_billingstarton": null,
      "fsip_costs_base@OData.Community.Display.V1.FormattedValue": "$0.00",
      "fsip_costs_base": 0.0000000000,
      "fsip_nextcontractbillingdate": null,
      "fsip_4thyearescalation": null,
      "fsip_invoiced_date@OData.Community.Display.V1.FormattedValue": "1/12/2026 8:46 PM",
      "fsip_invoiced_date": "2026-01-12T20:46:52Z",
      "fsip_billingfrequencycode": null,
      "lcd_cat5fullloadprice": null,
      "_fsip_copydevicesfromcontract_value": null,
      "statecode@OData.Community.Display.V1.FormattedValue": "Inactive",
      "statecode": 1,
      "fsip_regulartimecbservice@OData.Community.Display.V1.FormattedValue": "No",
      "fsip_regulartimecbservice": false,
      "fsip_costs_date@OData.Community.Display.V1.FormattedValue": "1/12/2026 8:46 PM",
      "fsip_costs_date": "2026-01-12T20:46:52Z",
      "_fsip_copydevicesfrombuildinglocation_value": null,
      "lcd_originalcontractamount": null,
      "fsip_closedstatus@OData.Community.Display.V1.FormattedValue": "Expired",
      "fsip_closedstatus": 683440004,
      "_fsip_customerid_value@OData.Community.Display.V1.FormattedValue": "Neko Health",
      "_fsip_customerid_value": "c65d4cdc-d5d9-f011-8544-000d3a308b24",
      "fsip_contractservicelevelcode": null,
      "fsip_invoiceamount": null,
      "_modifiedby_value@OData.Community.Display.V1.FormattedValue": "# SCRIBE INTEGRATION",
      "_modifiedby_value": "910423db-6a8d-ef11-ac21-000d3a326f08",
      "modifiedon@OData.Community.Display.V1.FormattedValue": "1/8/2026 2:06 PM",
      "modifiedon": "2026-01-08T14:06:13Z",
      "lcd_cancelationnotifyoffice@OData.Community.Display.V1.FormattedValue": "No",
      "lcd_cancelationnotifyoffice": 802290001,
      "lcd_autorenewal@OData.Community.Display.V1.FormattedValue": "No",
      "lcd_autorenewal": 802290001,
      "fsip_billingnotecb": null,
      "fsip_lastinvoiced_state@OData.Community.Display.V1.FormattedValue": "1",
      "fsip_lastinvoiced_state": 1,
      "fsip_costs_state@OData.Community.Display.V1.FormattedValue": "1",
      "fsip_costs_state": 1,
      "fsip_percentageoramount": null,
      "fsip_escalationamount_base": null,
      "fsip_closecontract@OData.Community.Display.V1.FormattedValue": "No",
      "fsip_closecontract": false,
      "overriddencreatedon": null,
      "lcd_cat1annualbillable": null,
      "fsip_activemmr_date@OData.Community.Display.V1.FormattedValue": "1/12/2026 8:46 PM",
      "fsip_activemmr_date": "2026-01-12T20:46:52Z",
      "fsip_specialconditions": null,
      "fsip_currentcontractenddate@OData.Community.Display.V1.FormattedValue": "10/6/2026",
      "fsip_currentcontractenddate": "2026-10-06",
      "lcd_servicefrequencywords": "Monthly",
      "fsip_cleanpithoistwaycartops@OData.Community.Display.V1.FormattedValue": "No",
      "fsip_cleanpithoistwaycartops": false,
      "fsip_5thyearescalation": null,
      "fsip_totalcontract": null,
      "_owningteam_value": null,
      "fsip_autorenew@OData.Community.Display.V1.FormattedValue": "No",
      "fsip_autorenew": false,
      "fsip_escalationpercent": null,
      "exchangerate@OData.Community.Display.V1.FormattedValue": "1.0000000000",
      "exchangerate": 1.000000000000,
      "fsip_excludefromcontractescalations@OData.Community.Display.V1.FormattedValue": "No",
      "fsip_excludefromcontractescalations": false,
      "fsip_annualsafetytest@OData.Community.Display.V1.FormattedValue": "No",
      "fsip_annualsafetytest": false,
      "fsip_nextservicedate@OData.Community.Display.V1.FormattedValue": "2/6/2026",
      "fsip_nextservicedate": "2026-02-06T11:00:00Z",
      "fsip_onhold@OData.Community.Display.V1.FormattedValue": "No",
      "fsip_onhold": false,
      "fsip_currentannualamount": null,
      "_createdby_value@OData.Community.Display.V1.FormattedValue": "Barbara Oliveira",
      "_createdby_value": "554d6842-59b6-ef11-b8e9-000d3a5a6b66",
      "fsip_activemmr_state@OData.Community.Display.V1.FormattedValue": "1",
      "fsip_activemmr_state": 1,
      "fsip_2ndyearescalation": null,
      "_fsip_wagecategory_value": null,
      "fsip_maintenancecontractid": "807c14f6-e2a5-f011-bbd3-000d3a302e4a",
      "fsip_contractreviewdate": null,
      "fsip_lastinvoicerollup_state@OData.Community.Display.V1.FormattedValue": "0",
      "fsip_lastinvoicerollup_state": 0,
      "fsip_invoiced_state@OData.Community.Display.V1.FormattedValue": "1",
      "fsip_invoiced_state": 1,
      "fsip_2ndyearescalation_base": null,
      "fsip_5thyearescalation_base": null,
      "fsip_proratedequipment": null,
      "_fsip_originatingcontract_value": null,
      "lcd_runcancelflow@OData.Community.Display.V1.FormattedValue": "No",
      "lcd_runcancelflow": 802290001,
      "fsip_nextbillingdate": null,
      "lcd_createcontractbilling": null,
      "fsip_lastinvoicerollup": null,
      "fsip_billingnote": null,
      "_fsip_salesperson_value@OData.Community.Display.V1.FormattedValue": "Bill Appelbaum",
      "_fsip_salesperson_value": "caf5f82b-0baa-ec11-9840-000d3a302927",
      "fsip_invoiceconsolidationtype@OData.Community.Display.V1.FormattedValue": "No Consolidation",
      "fsip_invoiceconsolidationtype": 683440000,
      "fsip_4thyearescalation_base": null,
      "_fsip_billtocustomer_value@OData.Community.Display.V1.FormattedValue": "Plaza Construction",
      "_fsip_billtocustomer_value": "26c58941-f296-ef11-8a6a-000d3a5a6b66",
      "fsip_costs@OData.Community.Display.V1.FormattedValue": "$0.00",
      "fsip_costs": 0.0000000000,
      "_owningbusinessunit_value@OData.Community.Display.V1.FormattedValue": "LCD Elevator",
      "_owningbusinessunit_value": "c9e85d8b-8fa0-ec11-b400-000d3a58d68e",
      "fsip_legacycontract": null,
      "fsip_printbillingnote@OData.Community.Display.V1.FormattedValue": "Yes",
      "fsip_printbillingnote": true,
      "timezoneruleversionnumber@OData.Community.Display.V1.FormattedValue": "0",
      "timezoneruleversionnumber": 0,
      "fsip_grossmargin@OData.Community.Display.V1.FormattedValue": "$0.00",
      "fsip_grossmargin": 0.0000000000,
      "fsip_payssafetyequipment": null,
      "_ownerid_value@OData.Community.Display.V1.FormattedValue": "Barbara Oliveira",
      "_ownerid_value": "554d6842-59b6-ef11-b8e9-000d3a5a6b66",
      "_fsip_primarybuildinglocation_value@OData.Community.Display.V1.FormattedValue": "300 Lafayette Street",
      "_fsip_primarybuildinglocation_value": "d294ebb8-f296-ef11-8a6a-000d3a5a6b66",
      "fsip_lastinvoiced_date@OData.Community.Display.V1.FormattedValue": "1/12/2026 8:46 PM",
      "fsip_lastinvoiced_date": "2026-01-12T20:46:52Z",
      "fsip_invoiced_base@OData.Community.Display.V1.FormattedValue": "$0.00",
      "fsip_invoiced_base": 0.0000000000,
      "importsequencenumber": null,
      "fsip_escalationamount": null,
      "fsip_1styearescalation_base": null,
      "_owninguser_value": "554d6842-59b6-ef11-b8e9-000d3a5a6b66",
      "_transactioncurrencyid_value@OData.Community.Display.V1.FormattedValue": "US Dollar",
      "_transactioncurrencyid_value": "28c060c5-d1a0-ec11-b400-000d3a58d68e",
      "_fsip_productcb_value": null,
      "fsip_visitfrequency@OData.Community.Display.V1.FormattedValue": "30",
      "fsip_visitfrequency": 683440000,
      "fsip_3rdyearescalation_base": null,
      "_fsip_project_value": null,
      "_fsip_division_value@OData.Community.Display.V1.FormattedValue": "Maintenance",
      "_fsip_division_value": "9316e0ff-55a5-ec11-9840-000d3a5c16ba",
      "_fsip_contracttype_value@OData.Community.Display.V1.FormattedValue": "Free Maintenance (Warranty)",
      "_fsip_contracttype_value": "fd3ce9c0-42a9-ec11-9840-000d3a307669",
      "fsip_sendescalationletter@OData.Community.Display.V1.FormattedValue": "No",
      "fsip_sendescalationletter": false,
      "lcd_braketestprice": null,
      "utcconversiontimezonecode": null,
      "_createdonbehalfby_value": null,
      "fsip_numberofvisits": "1",
      "fsip_totalcontract_base": null,
      "fsip_grossmarginpercent": null,
      "fsip_certificateofinsurance@OData.Community.Display.V1.FormattedValue": "No",
      "fsip_certificateofinsurance": false,
      "fsip_permitfeesbillable@OData.Community.Display.V1.FormattedValue": "No",
      "fsip_permitfeesbillable": false,
      "fsip_billingendon": null,
      "fsip_lastinvoiced": null,
      "fsip_internalnote": null,
      "fsip_escalationfrequency": null,
      "fsip_name": "300 Lafayette Street",
      "fsip_workorderconsolidationtype@OData.Community.Display.V1.FormattedValue": "By Contract",
      "fsip_workorderconsolidationtype": 683440000,
      "fsip_addalldevicescontractbillings@OData.Community.Display.V1.FormattedValue": "No",
      "fsip_addalldevicescontractbillings": false,
      "fsip_lastescalationlettersent": null,
      "fsip_otminoradjustmentscbservice@OData.Community.Display.V1.FormattedValue": "No",
      "fsip_otminoradjustmentscbservice": false,
      "fsip_duration": null,
      "lcd_daystoexpire@OData.Community.Display.V1.FormattedValue": "-267.00",
      "lcd_daystoexpire": -267.0000000000,
      "fsip_3rdyearescalation": null,
      "fsip_invoicingmethod@OData.Community.Display.V1.FormattedValue": "Work Order Billing",
      "fsip_invoicingmethod": 683440001,
      "lcd_cat5fullloadbillable": null,
      "fsip_cancelon@OData.Community.Display.V1.FormattedValue": "1/7/2026",
      "fsip_cancelon": "2026-01-07",
      "fsip_originalcontractstartdate@OData.Community.Display.V1.FormattedValue": "10/6/2025",
      "fsip_originalcontractstartdate": "2025-10-06",
      "fsip_contractnumber": "MC-0003106",
      "fsip_exclusions": null,
      "_fsip_product_value": null,
      "fsip_quantity": null,
      "fsip_usediscountaspercentage@OData.Community.Display.V1.FormattedValue": "Amount",
      "fsip_usediscountaspercentage": false,
      "fsip_contractlanguage": null,
      "fsip_currentcontractyear": null,
      "lcd_originalcontractamount_base": null,
      "_modifiedonbehalfby_value": null,
      "fsip_fiveyearsafetytest@OData.Community.Display.V1.FormattedValue": "No",
      "fsip_fiveyearsafetytest": false,
      "fsip_closedate@OData.Community.Display.V1.FormattedValue": "1/7/2026",
      "fsip_closedate": "2026-01-07",
      "fsip_invoiceamount_base": null,
      "versionnumber@OData.Community.Display.V1.FormattedValue": "126,623,440",
      "versionnumber": 126623440,
      "fsip_description": null,
      "fsip_activeon": null,
      "fsip_billingenddate": null,
      "fsip_activemmr_base@OData.Community.Display.V1.FormattedValue": "$0.00",
      "fsip_activemmr_base": 0.0000000000,
      "statuscode@OData.Community.Display.V1.FormattedValue": "Expired",
      "statuscode": 683440004,
      "fsip_testbillable@OData.Community.Display.V1.FormattedValue": "No",
      "fsip_testbillable": false,
      "createdon@OData.Community.Display.V1.FormattedValue": "10/10/2025 2:11 PM",
      "createdon": "2025-10-10T14:11:15Z",
      "fsip_holdnote": null,
      "fsip_grossmargin_base@OData.Community.Display.V1.FormattedValue": "$0.00",
      "fsip_grossmargin_base": 0.0000000000,
      "_fsip_serviceaddress_value": null,
      "fsip_activemmr@OData.Community.Display.V1.FormattedValue": "$0.00",
      "fsip_activemmr": 0.0000000000,
      "lcd_braketestbillable": null,
      "fsip_1styearescalation": null,
      "fsip_currentactualprofitpercent": null,
      "fsip_lastinvoicerollup_date@OData.Community.Display.V1.FormattedValue": "1/12/2026 8:46 PM",
      "fsip_lastinvoicerollup_date": "2026-01-12T20:46:52Z",
      "fsip_billinginprogress@OData.Community.Display.V1.FormattedValue": "No",
      "fsip_billinginprogress": false
    },
    {
      "@odata.etag": "W/\"126045951\"",
      "lcd_cancellationnotes": null,
      "fsip_po": null,
      "fsip_billingfrequency": null,
      "lcd_cat1annualprice": null,
      "fsip_expireson": null,
      "fsip_won@OData.Community.Display.V1.FormattedValue": "No",
      "fsip_won": false,
      "fsip_schedulinginprogress@OData.Community.Display.V1.FormattedValue": "No",
      "fsip_schedulinginprogress": false,
      "_fsip_sortbyaccount_value@OData.Community.Display.V1.FormattedValue": "Extell Development Company",
      "_fsip_sortbyaccount_value": "59109b18-45a9-ec11-9840-000d3a307669",
      "fsip_invoiced@OData.Community.Display.V1.FormattedValue": "$0.00",
      "fsip_invoiced": 0.0000000000,
      "fsip_currentannualamount_base": null,
      "fsip_currentcontractstartdate@OData.Community.Display.V1.FormattedValue": "9/18/2025",
      "fsip_currentcontractstartdate": "2025-09-18",
      "fsip_nextescalationdate": null,
      "fsip_billingstarton": null,
      "fsip_costs_base@OData.Community.Display.V1.FormattedValue": "$0.00",
      "fsip_costs_base": 0.0000000000,
      "fsip_nextcontractbillingdate": null,
      "fsip_4thyearescalation": null,
      "fsip_invoiced_date@OData.Community.Display.V1.FormattedValue": "1/12/2026 8:46 PM",
      "fsip_invoiced_date": "2026-01-12T20:46:52Z",
      "fsip_billingfrequencycode": null,
      "lcd_cat5fullloadprice": null,
      "_fsip_copydevicesfromcontract_value": null,
      "statecode@OData.Community.Display.V1.FormattedValue": "Active",
      "statecode": 0,
      "fsip_regulartimecbservice@OData.Community.Display.V1.FormattedValue": "No",
      "fsip_regulartimecbservice": false,
      "fsip_costs_date@OData.Community.Display.V1.FormattedValue": "1/12/2026 8:46 PM",
      "fsip_costs_date": "2026-01-12T20:46:52Z",
      "_fsip_copydevicesfrombuildinglocation_value": null,
      "lcd_originalcontractamount": null,
      "fsip_closedstatus": null,
      "_fsip_customerid_value@OData.Community.Display.V1.FormattedValue": "Extell Development Company",
      "_fsip_customerid_value": "59109b18-45a9-ec11-9840-000d3a307669",
      "fsip_contractservicelevelcode": null,
      "fsip_invoiceamount": null,
      "_modifiedby_value@OData.Community.Display.V1.FormattedValue": "# SCRIBE INTEGRATION",
      "_modifiedby_value": "910423db-6a8d-ef11-ac21-000d3a326f08",
      "modifiedon@OData.Community.Display.V1.FormattedValue": "12/31/2025 5:37 PM",
      "modifiedon": "2025-12-31T17:37:58Z",
      "lcd_cancelationnotifyoffice@OData.Community.Display.V1.FormattedValue": "No",
      "lcd_cancelationnotifyoffice": 802290001,
      "lcd_autorenewal@OData.Community.Display.V1.FormattedValue": "No",
      "lcd_autorenewal": 802290001,
      "fsip_billingnotecb": null,
      "fsip_lastinvoiced_state@OData.Community.Display.V1.FormattedValue": "1",
      "fsip_lastinvoiced_state": 1,
      "fsip_costs_state@OData.Community.Display.V1.FormattedValue": "1",
      "fsip_costs_state": 1,
      "fsip_percentageoramount": null,
      "fsip_escalationamount_base": null,
      "fsip_closecontract@OData.Community.Display.V1.FormattedValue": "No",
      "fsip_closecontract": false,
      "overriddencreatedon": null,
      "lcd_cat1annualbillable": null,
      "fsip_activemmr_date@OData.Community.Display.V1.FormattedValue": "1/12/2026 8:46 PM",
      "fsip_activemmr_date": "2026-01-12T20:46:52Z",
      "fsip_specialconditions": null,
      "fsip_currentcontractenddate@OData.Community.Display.V1.FormattedValue": "9/18/2026",
      "fsip_currentcontractenddate": "2026-09-18",
      "lcd_servicefrequencywords": "Monthly",
      "fsip_cleanpithoistwaycartops@OData.Community.Display.V1.FormattedValue": "No",
      "fsip_cleanpithoistwaycartops": false,
      "fsip_5thyearescalation": null,
      "fsip_totalcontract": null,
      "_owningteam_value": null,
      "fsip_autorenew@OData.Community.Display.V1.FormattedValue": "No",
      "fsip_autorenew": false,
      "fsip_escalationpercent": null,
      "exchangerate@OData.Community.Display.V1.FormattedValue": "1.0000000000",
      "exchangerate": 1.000000000000,
      "fsip_excludefromcontractescalations@OData.Community.Display.V1.FormattedValue": "No",
      "fsip_excludefromcontractescalations": false,
      "fsip_annualsafetytest@OData.Community.Display.V1.FormattedValue": "No",
      "fsip_annualsafetytest": false,
      "fsip_nextservicedate@OData.Community.Display.V1.FormattedValue": "2/18/2026",
      "fsip_nextservicedate": "2026-02-18T11:00:00Z",
      "fsip_onhold@OData.Community.Display.V1.FormattedValue": "No",
      "fsip_onhold": false,
      "fsip_currentannualamount": null,
      "_createdby_value@OData.Community.Display.V1.FormattedValue": "Barbara Oliveira",
      "_createdby_value": "554d6842-59b6-ef11-b8e9-000d3a5a6b66",
      "fsip_activemmr_state@OData.Community.Display.V1.FormattedValue": "1",
      "fsip_activemmr_state": 1,
      "fsip_2ndyearescalation": null,
      "_fsip_wagecategory_value": null,
      "fsip_maintenancecontractid": "4fe49622-53a8-f011-bbd3-000d3a302e4a",
      "fsip_contractreviewdate": null,
      "fsip_lastinvoicerollup_state@OData.Community.Display.V1.FormattedValue": "0",
      "fsip_lastinvoicerollup_state": 0,
      "fsip_invoiced_state@OData.Community.Display.V1.FormattedValue": "1",
      "fsip_invoiced_state": 1,
      "fsip_2ndyearescalation_base": null,
      "fsip_5thyearescalation_base": null,
      "fsip_proratedequipment": null,
      "_fsip_originatingcontract_value": null,
      "lcd_runcancelflow@OData.Community.Display.V1.FormattedValue": "No",
      "lcd_runcancelflow": 802290001,
      "fsip_nextbillingdate": null,
      "lcd_createcontractbilling": null,
      "fsip_lastinvoicerollup": null,
      "fsip_billingnote": null,
      "_fsip_salesperson_value": null,
      "fsip_invoiceconsolidationtype@OData.Community.Display.V1.FormattedValue": "No Consolidation",
      "fsip_invoiceconsolidationtype": 683440000,
      "fsip_4thyearescalation_base": null,
      "_fsip_billtocustomer_value@OData.Community.Display.V1.FormattedValue": "Extell Development Company",
      "_fsip_billtocustomer_value": "59109b18-45a9-ec11-9840-000d3a307669",
      "fsip_costs@OData.Community.Display.V1.FormattedValue": "$0.00",
      "fsip_costs": 0.0000000000,
      "_owningbusinessunit_value@OData.Community.Display.V1.FormattedValue": "LCD Elevator",
      "_owningbusinessunit_value": "c9e85d8b-8fa0-ec11-b400-000d3a58d68e",
      "fsip_legacycontract": null,
      "fsip_printbillingnote@OData.Community.Display.V1.FormattedValue": "Yes",
      "fsip_printbillingnote": true,
      "timezoneruleversionnumber@OData.Community.Display.V1.FormattedValue": "4",
      "timezoneruleversionnumber": 4,
      "fsip_grossmargin@OData.Community.Display.V1.FormattedValue": "$0.00",
      "fsip_grossmargin": 0.0000000000,
      "fsip_payssafetyequipment": null,
      "_ownerid_value@OData.Community.Display.V1.FormattedValue": "Barbara Oliveira",
      "_ownerid_value": "554d6842-59b6-ef11-b8e9-000d3a5a6b66",
      "_fsip_primarybuildinglocation_value@OData.Community.Display.V1.FormattedValue": "32 West 48th Street",
      "_fsip_primarybuildinglocation_value": "797100df-1035-ed11-9db1-000d3a3108fd",
      "fsip_lastinvoiced_date@OData.Community.Display.V1.FormattedValue": "1/12/2026 8:46 PM",
      "fsip_lastinvoiced_date": "2026-01-12T20:46:52Z",
      "fsip_invoiced_base@OData.Community.Display.V1.FormattedValue": "$0.00",
      "fsip_invoiced_base": 0.0000000000,
      "importsequencenumber": null,
      "fsip_escalationamount": null,
      "fsip_1styearescalation_base": null,
      "_owninguser_value": "554d6842-59b6-ef11-b8e9-000d3a5a6b66",
      "_transactioncurrencyid_value@OData.Community.Display.V1.FormattedValue": "US Dollar",
      "_transactioncurrencyid_value": "28c060c5-d1a0-ec11-b400-000d3a58d68e",
      "_fsip_productcb_value": null,
      "fsip_visitfrequency@OData.Community.Display.V1.FormattedValue": "30",
      "fsip_visitfrequency": 683440000,
      "fsip_3rdyearescalation_base": null,
      "_fsip_project_value": null,
      "_fsip_division_value@OData.Community.Display.V1.FormattedValue": "Maintenance",
      "_fsip_division_value": "9316e0ff-55a5-ec11-9840-000d3a5c16ba",
      "_fsip_contracttype_value@OData.Community.Display.V1.FormattedValue": "Free Maintenance (Warranty)",
      "_fsip_contracttype_value": "fd3ce9c0-42a9-ec11-9840-000d3a307669",
      "fsip_sendescalationletter@OData.Community.Display.V1.FormattedValue": "No",
      "fsip_sendescalationletter": false,
      "lcd_braketestprice": null,
      "utcconversiontimezonecode": null,
      "_createdonbehalfby_value": null,
      "fsip_numberofvisits": "1",
      "fsip_totalcontract_base": null,
      "fsip_grossmarginpercent": null,
      "fsip_certificateofinsurance@OData.Community.Display.V1.FormattedValue": "No",
      "fsip_certificateofinsurance": false,
      "fsip_permitfeesbillable@OData.Community.Display.V1.FormattedValue": "No",
      "fsip_permitfeesbillable": false,
      "fsip_billingendon": null,
      "fsip_lastinvoiced": null,
      "fsip_internalnote": null,
      "fsip_escalationfrequency": null,
      "fsip_name": "32 West 48th Street",
      "fsip_workorderconsolidationtype@OData.Community.Display.V1.FormattedValue": "By Contract",
      "fsip_workorderconsolidationtype": 683440000,
      "fsip_addalldevicescontractbillings@OData.Community.Display.V1.FormattedValue": "No",
      "fsip_addalldevicescontractbillings": false,
      "fsip_lastescalationlettersent": null,
      "fsip_otminoradjustmentscbservice@OData.Community.Display.V1.FormattedValue": "No",
      "fsip_otminoradjustmentscbservice": false,
      "fsip_duration": null,
      "lcd_daystoexpire@OData.Community.Display.V1.FormattedValue": "-249.00",
      "lcd_daystoexpire": -249.0000000000,
      "fsip_3rdyearescalation": null,
      "fsip_invoicingmethod@OData.Community.Display.V1.FormattedValue": "Work Order Billing",
      "fsip_invoicingmethod": 683440001,
      "lcd_cat5fullloadbillable": null,
      "fsip_cancelon": null,
      "fsip_originalcontractstartdate@OData.Community.Display.V1.FormattedValue": "9/18/2025",
      "fsip_originalcontractstartdate": "2025-09-18",
      "fsip_contractnumber": "MC-0003107",
      "fsip_exclusions": null,
      "_fsip_product_value": null,
      "fsip_quantity": null,
      "fsip_usediscountaspercentage@OData.Community.Display.V1.FormattedValue": "Amount",
      "fsip_usediscountaspercentage": false,
      "fsip_contractlanguage": null,
      "fsip_currentcontractyear": null,
      "lcd_originalcontractamount_base": null,
      "_modifiedonbehalfby_value": null,
      "fsip_fiveyearsafetytest@OData.Community.Display.V1.FormattedValue": "No",
      "fsip_fiveyearsafetytest": false,
      "fsip_closedate": null,
      "fsip_invoiceamount_base": null,
      "versionnumber@OData.Community.Display.V1.FormattedValue": "126,045,951",
      "versionnumber": 126045951,
      "fsip_description": null,
      "fsip_activeon": null,
      "fsip_billingenddate": null,
      "fsip_activemmr_base@OData.Community.Display.V1.FormattedValue": "$0.00",
      "fsip_activemmr_base": 0.0000000000,
      "statuscode@OData.Community.Display.V1.FormattedValue": "Active",
      "statuscode": 683440001,
      "fsip_testbillable@OData.Community.Display.V1.FormattedValue": "No",
      "fsip_testbillable": false,
      "createdon@OData.Community.Display.V1.FormattedValue": "10/13/2025 4:39 PM",
      "createdon": "2025-10-13T16:39:17Z",
      "fsip_holdnote": null,
      "fsip_grossmargin_base@OData.Community.Display.V1.FormattedValue": "$0.00",
      "fsip_grossmargin_base": 0.0000000000,
      "_fsip_serviceaddress_value": null,
      "fsip_activemmr@OData.Community.Display.V1.FormattedValue": "$0.00",
      "fsip_activemmr": 0.0000000000,
      "lcd_braketestbillable": null,
      "fsip_1styearescalation": null,
      "fsip_currentactualprofitpercent": null,
      "fsip_lastinvoicerollup_date@OData.Community.Display.V1.FormattedValue": "1/12/2026 8:46 PM",
      "fsip_lastinvoicerollup_date": "2026-01-12T20:46:52Z",
      "fsip_billinginprogress@OData.Community.Display.V1.FormattedValue": "No",
      "fsip_billinginprogress": false
    },
    {
      "@odata.etag": "W/\"126386071\"",
      "lcd_cancellationnotes": null,
      "fsip_po": null,
      "fsip_billingfrequency": null,
      "lcd_cat1annualprice": null,
      "fsip_expireson": null,
      "fsip_won@OData.Community.Display.V1.FormattedValue": "No",
      "fsip_won": false,
      "fsip_schedulinginprogress@OData.Community.Display.V1.FormattedValue": "No",
      "fsip_schedulinginprogress": false,
      "_fsip_sortbyaccount_value@OData.Community.Display.V1.FormattedValue": "Manhattanville Community Partners",
      "_fsip_sortbyaccount_value": "72e310d8-f06a-ef11-bfe3-00224803b9a8",
      "fsip_invoiced@OData.Community.Display.V1.FormattedValue": "$0.00",
      "fsip_invoiced": 0.0000000000,
      "fsip_currentannualamount_base": null,
      "fsip_currentcontractstartdate@OData.Community.Display.V1.FormattedValue": "8/14/2025",
      "fsip_currentcontractstartdate": "2025-08-14",
      "fsip_nextescalationdate": null,
      "fsip_billingstarton": null,
      "fsip_costs_base@OData.Community.Display.V1.FormattedValue": "$0.00",
      "fsip_costs_base": 0.0000000000,
      "fsip_nextcontractbillingdate@OData.Community.Display.V1.FormattedValue": "2/1/2026",
      "fsip_nextcontractbillingdate": "2026-02-01",
      "fsip_4thyearescalation": null,
      "fsip_invoiced_date@OData.Community.Display.V1.FormattedValue": "1/12/2026 8:46 PM",
      "fsip_invoiced_date": "2026-01-12T20:46:52Z",
      "fsip_billingfrequencycode": null,
      "lcd_cat5fullloadprice": null,
      "_fsip_copydevicesfromcontract_value": null,
      "statecode@OData.Community.Display.V1.FormattedValue": "Active",
      "statecode": 0,
      "fsip_regulartimecbservice@OData.Community.Display.V1.FormattedValue": "No",
      "fsip_regulartimecbservice": false,
      "fsip_costs_date@OData.Community.Display.V1.FormattedValue": "1/12/2026 8:46 PM",
      "fsip_costs_date": "2026-01-12T20:46:52Z",
      "_fsip_copydevicesfrombuildinglocation_value": null,
      "lcd_originalcontractamount": null,
      "fsip_closedstatus": null,
      "_fsip_customerid_value@OData.Community.Display.V1.FormattedValue": "Manhattanville Community Partners",
      "_fsip_customerid_value": "72e310d8-f06a-ef11-bfe3-00224803b9a8",
      "fsip_contractservicelevelcode": null,
      "fsip_invoiceamount": null,
      "_modifiedby_value@OData.Community.Display.V1.FormattedValue": "# SCRIBE INTEGRATION",
      "_modifiedby_value": "910423db-6a8d-ef11-ac21-000d3a326f08",
      "modifiedon@OData.Community.Display.V1.FormattedValue": "1/5/2026 3:29 PM",
      "modifiedon": "2026-01-05T15:29:38Z",
      "lcd_cancelationnotifyoffice@OData.Community.Display.V1.FormattedValue": "No",
      "lcd_cancelationnotifyoffice": 802290001,
      "lcd_autorenewal@OData.Community.Display.V1.FormattedValue": "No",
      "lcd_autorenewal": 802290001,
      "fsip_billingnotecb": null,
      "fsip_lastinvoiced_state@OData.Community.Display.V1.FormattedValue": "1",
      "fsip_lastinvoiced_state": 1,
      "fsip_costs_state@OData.Community.Display.V1.FormattedValue": "1",
      "fsip_costs_state": 1,
      "fsip_percentageoramount": null,
      "fsip_escalationamount_base": null,
      "fsip_closecontract@OData.Community.Display.V1.FormattedValue": "No",
      "fsip_closecontract": false,
      "overriddencreatedon": null,
      "lcd_cat1annualbillable": null,
      "fsip_activemmr_date@OData.Community.Display.V1.FormattedValue": "1/12/2026 8:46 PM",
      "fsip_activemmr_date": "2026-01-12T20:46:52Z",
      "fsip_specialconditions": null,
      "fsip_currentcontractenddate@OData.Community.Display.V1.FormattedValue": "8/14/2026",
      "fsip_currentcontractenddate": "2026-08-14",
      "lcd_servicefrequencywords": "Monthly",
      "fsip_cleanpithoistwaycartops@OData.Community.Display.V1.FormattedValue": "No",
      "fsip_cleanpithoistwaycartops": false,
      "fsip_5thyearescalation": null,
      "fsip_totalcontract": null,
      "_owningteam_value": null,
      "fsip_autorenew@OData.Community.Display.V1.FormattedValue": "No",
      "fsip_autorenew": false,
      "fsip_escalationpercent": null,
      "exchangerate@OData.Community.Display.V1.FormattedValue": "1.0000000000",
      "exchangerate": 1.000000000000,
      "fsip_excludefromcontractescalations@OData.Community.Display.V1.FormattedValue": "No",
      "fsip_excludefromcontractescalations": false,
      "fsip_annualsafetytest@OData.Community.Display.V1.FormattedValue": "No",
      "fsip_annualsafetytest": false,
      "fsip_nextservicedate@OData.Community.Display.V1.FormattedValue": "2/1/2026",
      "fsip_nextservicedate": "2026-02-01T11:00:00Z",
      "fsip_onhold@OData.Community.Display.V1.FormattedValue": "No",
      "fsip_onhold": false,
      "fsip_currentannualamount": null,
      "_createdby_value@OData.Community.Display.V1.FormattedValue": "Barbara Oliveira",
      "_createdby_value": "554d6842-59b6-ef11-b8e9-000d3a5a6b66",
      "fsip_activemmr_state@OData.Community.Display.V1.FormattedValue": "1",
      "fsip_activemmr_state": 1,
      "fsip_2ndyearescalation": null,
      "_fsip_wagecategory_value": null,
      "fsip_maintenancecontractid": "98500b7b-64a8-f011-bbd3-000d3a302e4a",
      "fsip_contractreviewdate": null,
      "fsip_lastinvoicerollup_state@OData.Community.Display.V1.FormattedValue": "0",
      "fsip_lastinvoicerollup_state": 0,
      "fsip_invoiced_state@OData.Community.Display.V1.FormattedValue": "1",
      "fsip_invoiced_state": 1,
      "fsip_2ndyearescalation_base": null,
      "fsip_5thyearescalation_base": null,
      "fsip_proratedequipment": null,
      "_fsip_originatingcontract_value": null,
      "lcd_runcancelflow@OData.Community.Display.V1.FormattedValue": "No",
      "lcd_runcancelflow": 802290001,
      "fsip_nextbillingdate": null,
      "lcd_createcontractbilling": null,
      "fsip_lastinvoicerollup": null,
      "fsip_billingnote": null,
      "_fsip_salesperson_value": null,
      "fsip_invoiceconsolidationtype@OData.Community.Display.V1.FormattedValue": "By Customer",
      "fsip_invoiceconsolidationtype": 683440003,
      "fsip_4thyearescalation_base": null,
      "_fsip_billtocustomer_value@OData.Community.Display.V1.FormattedValue": "Manhattanville Community Partners",
      "_fsip_billtocustomer_value": "72e310d8-f06a-ef11-bfe3-00224803b9a8",
      "fsip_costs@OData.Community.Display.V1.FormattedValue": "$0.00",
      "fsip_costs": 0.0000000000,
      "_owningbusinessunit_value@OData.Community.Display.V1.FormattedValue": "LCD Elevator",
      "_owningbusinessunit_value": "c9e85d8b-8fa0-ec11-b400-000d3a58d68e",
      "fsip_legacycontract": null,
      "fsip_printbillingnote@OData.Community.Display.V1.FormattedValue": "Yes",
      "fsip_printbillingnote": true,
      "timezoneruleversionnumber@OData.Community.Display.V1.FormattedValue": "4",
      "timezoneruleversionnumber": 4,
      "fsip_grossmargin@OData.Community.Display.V1.FormattedValue": "$0.00",
      "fsip_grossmargin": 0.0000000000,
      "fsip_payssafetyequipment": null,
      "_ownerid_value@OData.Community.Display.V1.FormattedValue": "Barbara Oliveira",
      "_ownerid_value": "554d6842-59b6-ef11-b8e9-000d3a5a6b66",
      "_fsip_primarybuildinglocation_value@OData.Community.Display.V1.FormattedValue": "1430 Amsterdam Avenue",
      "_fsip_primarybuildinglocation_value": "960fc487-f16a-ef11-bfe3-00224803b9a8",
      "fsip_lastinvoiced_date@OData.Community.Display.V1.FormattedValue": "1/12/2026 8:46 PM",
      "fsip_lastinvoiced_date": "2026-01-12T20:46:52Z",
      "fsip_invoiced_base@OData.Community.Display.V1.FormattedValue": "$0.00",
      "fsip_invoiced_base": 0.0000000000,
      "importsequencenumber": null,
      "fsip_escalationamount": null,
      "fsip_1styearescalation_base": null,
      "_owninguser_value": "554d6842-59b6-ef11-b8e9-000d3a5a6b66",
      "_transactioncurrencyid_value@OData.Community.Display.V1.FormattedValue": "US Dollar",
      "_transactioncurrencyid_value": "28c060c5-d1a0-ec11-b400-000d3a58d68e",
      "_fsip_productcb_value": null,
      "fsip_visitfrequency@OData.Community.Display.V1.FormattedValue": "30",
      "fsip_visitfrequency": 683440000,
      "fsip_3rdyearescalation_base": null,
      "_fsip_project_value": null,
      "_fsip_division_value@OData.Community.Display.V1.FormattedValue": "Maintenance",
      "_fsip_division_value": "9316e0ff-55a5-ec11-9840-000d3a5c16ba",
      "_fsip_contracttype_value@OData.Community.Display.V1.FormattedValue": "Free Maintenance (Warranty)",
      "_fsip_contracttype_value": "fd3ce9c0-42a9-ec11-9840-000d3a307669",
      "fsip_sendescalationletter@OData.Community.Display.V1.FormattedValue": "No",
      "fsip_sendescalationletter": false,
      "lcd_braketestprice": null,
      "utcconversiontimezonecode": null,
      "_createdonbehalfby_value": null,
      "fsip_numberofvisits": "1",
      "fsip_totalcontract_base": null,
      "fsip_grossmarginpercent": null,
      "fsip_certificateofinsurance@OData.Community.Display.V1.FormattedValue": "No",
      "fsip_certificateofinsurance": false,
      "fsip_permitfeesbillable@OData.Community.Display.V1.FormattedValue": "No",
      "fsip_permitfeesbillable": false,
      "fsip_billingendon": null,
      "fsip_lastinvoiced": null,
      "fsip_internalnote": null,
      "fsip_escalationfrequency": null,
      "fsip_name": "1430 Amsterdam Avenue",
      "fsip_workorderconsolidationtype@OData.Community.Display.V1.FormattedValue": "By Contract",
      "fsip_workorderconsolidationtype": 683440000,
      "fsip_addalldevicescontractbillings@OData.Community.Display.V1.FormattedValue": "No",
      "fsip_addalldevicescontractbillings": false,
      "fsip_lastescalationlettersent": null,
      "fsip_otminoradjustmentscbservice@OData.Community.Display.V1.FormattedValue": "No",
      "fsip_otminoradjustmentscbservice": false,
      "fsip_duration": null,
      "lcd_daystoexpire@OData.Community.Display.V1.FormattedValue": "-214.00",
      "lcd_daystoexpire": -214.0000000000,
      "fsip_3rdyearescalation": null,
      "fsip_invoicingmethod@OData.Community.Display.V1.FormattedValue": "Work Order Billing",
      "fsip_invoicingmethod": 683440001,
      "lcd_cat5fullloadbillable": null,
      "fsip_cancelon": null,
      "fsip_originalcontractstartdate@OData.Community.Display.V1.FormattedValue": "8/14/2025",
      "fsip_originalcontractstartdate": "2025-08-14",
      "fsip_contractnumber": "MC-0003108",
      "fsip_exclusions": null,
      "_fsip_product_value": null,
      "fsip_quantity": null,
      "fsip_usediscountaspercentage@OData.Community.Display.V1.FormattedValue": "Amount",
      "fsip_usediscountaspercentage": false,
      "fsip_contractlanguage": null,
      "fsip_currentcontractyear": null,
      "lcd_originalcontractamount_base": null,
      "_modifiedonbehalfby_value": null,
      "fsip_fiveyearsafetytest@OData.Community.Display.V1.FormattedValue": "No",
      "fsip_fiveyearsafetytest": false,
      "fsip_closedate": null,
      "fsip_invoiceamount_base": null,
      "versionnumber@OData.Community.Display.V1.FormattedValue": "126,386,071",
      "versionnumber": 126386071,
      "fsip_description": null,
      "fsip_activeon": null,
      "fsip_billingenddate": null,
      "fsip_activemmr_base@OData.Community.Display.V1.FormattedValue": "$641.54",
      "fsip_activemmr_base": 641.5400000000,
      "statuscode@OData.Community.Display.V1.FormattedValue": "Active",
      "statuscode": 683440001,
      "fsip_testbillable@OData.Community.Display.V1.FormattedValue": "No",
      "fsip_testbillable": false,
      "createdon@OData.Community.Display.V1.FormattedValue": "10/13/2025 6:43 PM",
      "createdon": "2025-10-13T18:43:22Z",
      "fsip_holdnote": null,
      "fsip_grossmargin_base@OData.Community.Display.V1.FormattedValue": "$0.00",
      "fsip_grossmargin_base": 0.0000000000,
      "_fsip_serviceaddress_value": null,
      "fsip_activemmr@OData.Community.Display.V1.FormattedValue": "$641.54",
      "fsip_activemmr": 641.5400000000,
      "lcd_braketestbillable": null,
      "fsip_1styearescalation": null,
      "fsip_currentactualprofitpercent": null,
      "fsip_lastinvoicerollup_date@OData.Community.Display.V1.FormattedValue": "1/12/2026 8:46 PM",
      "fsip_lastinvoicerollup_date": "2026-01-12T20:46:52Z",
      "fsip_billinginprogress@OData.Community.Display.V1.FormattedValue": "No",
      "fsip_billinginprogress": false
    },
    {
      "@odata.etag": "W/\"126386565\"",
      "lcd_cancellationnotes": null,
      "fsip_po": null,
      "fsip_billingfrequency": null,
      "lcd_cat1annualprice": null,
      "fsip_expireson": null,
      "fsip_won@OData.Community.Display.V1.FormattedValue": "No",
      "fsip_won": false,
      "fsip_schedulinginprogress@OData.Community.Display.V1.FormattedValue": "No",
      "fsip_schedulinginprogress": false,
      "_fsip_sortbyaccount_value@OData.Community.Display.V1.FormattedValue": "Manhattanville Community Partners",
      "_fsip_sortbyaccount_value": "72e310d8-f06a-ef11-bfe3-00224803b9a8",
      "fsip_invoiced@OData.Community.Display.V1.FormattedValue": "$0.00",
      "fsip_invoiced": 0.0000000000,
      "fsip_currentannualamount_base": null,
      "fsip_currentcontractstartdate@OData.Community.Display.V1.FormattedValue": "8/14/2025",
      "fsip_currentcontractstartdate": "2025-08-14",
      "fsip_nextescalationdate": null,
      "fsip_billingstarton": null,
      "fsip_costs_base@OData.Community.Display.V1.FormattedValue": "$0.00",
      "fsip_costs_base": 0.0000000000,
      "fsip_nextcontractbillingdate@OData.Community.Display.V1.FormattedValue": "2/1/2026",
      "fsip_nextcontractbillingdate": "2026-02-01",
      "fsip_4thyearescalation": null,
      "fsip_invoiced_date@OData.Community.Display.V1.FormattedValue": "1/12/2026 8:46 PM",
      "fsip_invoiced_date": "2026-01-12T20:46:52Z",
      "fsip_billingfrequencycode": null,
      "lcd_cat5fullloadprice": null,
      "_fsip_copydevicesfromcontract_value": null,
      "statecode@OData.Community.Display.V1.FormattedValue": "Active",
      "statecode": 0,
      "fsip_regulartimecbservice@OData.Community.Display.V1.FormattedValue": "No",
      "fsip_regulartimecbservice": false,
      "fsip_costs_date@OData.Community.Display.V1.FormattedValue": "1/12/2026 8:46 PM",
      "fsip_costs_date": "2026-01-12T20:46:52Z",
      "_fsip_copydevicesfrombuildinglocation_value": null,
      "lcd_originalcontractamount": null,
      "fsip_closedstatus": null,
      "_fsip_customerid_value@OData.Community.Display.V1.FormattedValue": "Manhattanville Community Partners",
      "_fsip_customerid_value": "72e310d8-f06a-ef11-bfe3-00224803b9a8",
      "fsip_contractservicelevelcode": null,
      "fsip_invoiceamount": null,
      "_modifiedby_value@OData.Community.Display.V1.FormattedValue": "# SCRIBE INTEGRATION",
      "_modifiedby_value": "910423db-6a8d-ef11-ac21-000d3a326f08",
      "modifiedon@OData.Community.Display.V1.FormattedValue": "1/5/2026 3:29 PM",
      "modifiedon": "2026-01-05T15:29:38Z",
      "lcd_cancelationnotifyoffice@OData.Community.Display.V1.FormattedValue": "No",
      "lcd_cancelationnotifyoffice": 802290001,
      "lcd_autorenewal@OData.Community.Display.V1.FormattedValue": "No",
      "lcd_autorenewal": 802290001,
      "fsip_billingnotecb": null,
      "fsip_lastinvoiced_state@OData.Community.Display.V1.FormattedValue": "1",
      "fsip_lastinvoiced_state": 1,
      "fsip_costs_state@OData.Community.Display.V1.FormattedValue": "1",
      "fsip_costs_state": 1,
      "fsip_percentageoramount": null,
      "fsip_escalationamount_base": null,
      "fsip_closecontract@OData.Community.Display.V1.FormattedValue": "No",
      "fsip_closecontract": false,
      "overriddencreatedon": null,
      "lcd_cat1annualbillable": null,
      "fsip_activemmr_date@OData.Community.Display.V1.FormattedValue": "1/12/2026 8:46 PM",
      "fsip_activemmr_date": "2026-01-12T20:46:52Z",
      "fsip_specialconditions": null,
      "fsip_currentcontractenddate@OData.Community.Display.V1.FormattedValue": "8/14/2026",
      "fsip_currentcontractenddate": "2026-08-14",
      "lcd_servicefrequencywords": "Monthly",
      "fsip_cleanpithoistwaycartops@OData.Community.Display.V1.FormattedValue": "No",
      "fsip_cleanpithoistwaycartops": false,
      "fsip_5thyearescalation": null,
      "fsip_totalcontract": null,
      "_owningteam_value": null,
      "fsip_autorenew@OData.Community.Display.V1.FormattedValue": "No",
      "fsip_autorenew": false,
      "fsip_escalationpercent": null,
      "exchangerate@OData.Community.Display.V1.FormattedValue": "1.0000000000",
      "exchangerate": 1.000000000000,
      "fsip_excludefromcontractescalations@OData.Community.Display.V1.FormattedValue": "No",
      "fsip_excludefromcontractescalations": false,
      "fsip_annualsafetytest@OData.Community.Display.V1.FormattedValue": "No",
      "fsip_annualsafetytest": false,
      "fsip_nextservicedate@OData.Community.Display.V1.FormattedValue": "2/1/2026",
      "fsip_nextservicedate": "2026-02-01T11:00:00Z",
      "fsip_onhold@OData.Community.Display.V1.FormattedValue": "No",
      "fsip_onhold": false,
      "fsip_currentannualamount": null,
      "_createdby_value@OData.Community.Display.V1.FormattedValue": "Barbara Oliveira",
      "_createdby_value": "554d6842-59b6-ef11-b8e9-000d3a5a6b66",
      "fsip_activemmr_state@OData.Community.Display.V1.FormattedValue": "1",
      "fsip_activemmr_state": 1,
      "fsip_2ndyearescalation": null,
      "_fsip_wagecategory_value": null,
      "fsip_maintenancecontractid": "fe69bb9d-65a8-f011-bbd3-000d3a302e4a",
      "fsip_contractreviewdate": null,
      "fsip_lastinvoicerollup_state@OData.Community.Display.V1.FormattedValue": "0",
      "fsip_lastinvoicerollup_state": 0,
      "fsip_invoiced_state@OData.Community.Display.V1.FormattedValue": "1",
      "fsip_invoiced_state": 1,
      "fsip_2ndyearescalation_base": null,
      "fsip_5thyearescalation_base": null,
      "fsip_proratedequipment": null,
      "_fsip_originatingcontract_value": null,
      "lcd_runcancelflow@OData.Community.Display.V1.FormattedValue": "No",
      "lcd_runcancelflow": 802290001,
      "fsip_nextbillingdate": null,
      "lcd_createcontractbilling": null,
      "fsip_lastinvoicerollup": null,
      "fsip_billingnote": null,
      "_fsip_salesperson_value": null,
      "fsip_invoiceconsolidationtype@OData.Community.Display.V1.FormattedValue": "By Customer",
      "fsip_invoiceconsolidationtype": 683440003,
      "fsip_4thyearescalation_base": null,
      "_fsip_billtocustomer_value@OData.Community.Display.V1.FormattedValue": "Manhattanville Community Partners",
      "_fsip_billtocustomer_value": "72e310d8-f06a-ef11-bfe3-00224803b9a8",
      "fsip_costs@OData.Community.Display.V1.FormattedValue": "$0.00",
      "fsip_costs": 0.0000000000,
      "_owningbusinessunit_value@OData.Community.Display.V1.FormattedValue": "LCD Elevator",
      "_owningbusinessunit_value": "c9e85d8b-8fa0-ec11-b400-000d3a58d68e",
      "fsip_legacycontract": null,
      "fsip_printbillingnote@OData.Community.Display.V1.FormattedValue": "Yes",
      "fsip_printbillingnote": true,
      "timezoneruleversionnumber@OData.Community.Display.V1.FormattedValue": "4",
      "timezoneruleversionnumber": 4,
      "fsip_grossmargin@OData.Community.Display.V1.FormattedValue": "$0.00",
      "fsip_grossmargin": 0.0000000000,
      "fsip_payssafetyequipment": null,
      "_ownerid_value@OData.Community.Display.V1.FormattedValue": "Barbara Oliveira",
      "_ownerid_value": "554d6842-59b6-ef11-b8e9-000d3a5a6b66",
      "_fsip_primarybuildinglocation_value@OData.Community.Display.V1.FormattedValue": "3250 Broadway",
      "_fsip_primarybuildinglocation_value": "dd84e447-50a3-ef11-8a69-000d3a34f349",
      "fsip_lastinvoiced_date@OData.Community.Display.V1.FormattedValue": "1/12/2026 8:46 PM",
      "fsip_lastinvoiced_date": "2026-01-12T20:46:52Z",
      "fsip_invoiced_base@OData.Community.Display.V1.FormattedValue": "$0.00",
      "fsip_invoiced_base": 0.0000000000,
      "importsequencenumber": null,
      "fsip_escalationamount": null,
      "fsip_1styearescalation_base": null,
      "_owninguser_value": "554d6842-59b6-ef11-b8e9-000d3a5a6b66",
      "_transactioncurrencyid_value@OData.Community.Display.V1.FormattedValue": "US Dollar",
      "_transactioncurrencyid_value": "28c060c5-d1a0-ec11-b400-000d3a58d68e",
      "_fsip_productcb_value": null,
      "fsip_visitfrequency@OData.Community.Display.V1.FormattedValue": "30",
      "fsip_visitfrequency": 683440000,
      "fsip_3rdyearescalation_base": null,
      "_fsip_project_value": null,
      "_fsip_division_value@OData.Community.Display.V1.FormattedValue": "Maintenance",
      "_fsip_division_value": "9316e0ff-55a5-ec11-9840-000d3a5c16ba",
      "_fsip_contracttype_value@OData.Community.Display.V1.FormattedValue": "Free Maintenance (Warranty)",
      "_fsip_contracttype_value": "fd3ce9c0-42a9-ec11-9840-000d3a307669",
      "fsip_sendescalationletter@OData.Community.Display.V1.FormattedValue": "No",
      "fsip_sendescalationletter": false,
      "lcd_braketestprice": null,
      "utcconversiontimezonecode": null,
      "_createdonbehalfby_value": null,
      "fsip_numberofvisits": "1",
      "fsip_totalcontract_base": null,
      "fsip_grossmarginpercent": null,
      "fsip_certificateofinsurance@OData.Community.Display.V1.FormattedValue": "No",
      "fsip_certificateofinsurance": false,
      "fsip_permitfeesbillable@OData.Community.Display.V1.FormattedValue": "No",
      "fsip_permitfeesbillable": false,
      "fsip_billingendon": null,
      "fsip_lastinvoiced": null,
      "fsip_internalnote": null,
      "fsip_escalationfrequency": null,
      "fsip_name": "3250 Broadway",
      "fsip_workorderconsolidationtype@OData.Community.Display.V1.FormattedValue": "By Contract",
      "fsip_workorderconsolidationtype": 683440000,
      "fsip_addalldevicescontractbillings@OData.Community.Display.V1.FormattedValue": "No",
      "fsip_addalldevicescontractbillings": false,
      "fsip_lastescalationlettersent": null,
      "fsip_otminoradjustmentscbservice@OData.Community.Display.V1.FormattedValue": "No",
      "fsip_otminoradjustmentscbservice": false,
      "fsip_duration": null,
      "lcd_daystoexpire@OData.Community.Display.V1.FormattedValue": "-214.00",
      "lcd_daystoexpire": -214.0000000000,
      "fsip_3rdyearescalation": null,
      "fsip_invoicingmethod@OData.Community.Display.V1.FormattedValue": "Work Order Billing",
      "fsip_invoicingmethod": 683440001,
      "lcd_cat5fullloadbillable": null,
      "fsip_cancelon": null,
      "fsip_originalcontractstartdate@OData.Community.Display.V1.FormattedValue": "8/14/2025",
      "fsip_originalcontractstartdate": "2025-08-14",
      "fsip_contractnumber": "MC-0003109",
      "fsip_exclusions": null,
      "_fsip_product_value": null,
      "fsip_quantity": null,
      "fsip_usediscountaspercentage@OData.Community.Display.V1.FormattedValue": "Amount",
      "fsip_usediscountaspercentage": false,
      "fsip_contractlanguage": null,
      "fsip_currentcontractyear": null,
      "lcd_originalcontractamount_base": null,
      "_modifiedonbehalfby_value": null,
      "fsip_fiveyearsafetytest@OData.Community.Display.V1.FormattedValue": "No",
      "fsip_fiveyearsafetytest": false,
      "fsip_closedate": null,
      "fsip_invoiceamount_base": null,
      "versionnumber@OData.Community.Display.V1.FormattedValue": "126,386,565",
      "versionnumber": 126386565,
      "fsip_description": null,
      "fsip_activeon": null,
      "fsip_billingenddate": null,
      "fsip_activemmr_base@OData.Community.Display.V1.FormattedValue": "$641.53",
      "fsip_activemmr_base": 641.5300000000,
      "statuscode@OData.Community.Display.V1.FormattedValue": "Active",
      "statuscode": 683440001,
      "fsip_testbillable@OData.Community.Display.V1.FormattedValue": "No",
      "fsip_testbillable": false,
      "createdon@OData.Community.Display.V1.FormattedValue": "10/13/2025 6:51 PM",
      "createdon": "2025-10-13T18:51:28Z",
      "fsip_holdnote": null,
      "fsip_grossmargin_base@OData.Community.Display.V1.FormattedValue": "$0.00",
      "fsip_grossmargin_base": 0.0000000000,
      "_fsip_serviceaddress_value": null,
      "fsip_activemmr@OData.Community.Display.V1.FormattedValue": "$641.53",
      "fsip_activemmr": 641.5300000000,
      "lcd_braketestbillable": null,
      "fsip_1styearescalation": null,
      "fsip_currentactualprofitpercent": null,
      "fsip_lastinvoicerollup_date@OData.Community.Display.V1.FormattedValue": "1/12/2026 8:46 PM",
      "fsip_lastinvoicerollup_date": "2026-01-12T20:46:52Z",
      "fsip_billinginprogress@OData.Community.Display.V1.FormattedValue": "No",
      "fsip_billinginprogress": false
    },
    {
      "@odata.etag": "W/\"126389646\"",
      "lcd_cancellationnotes": null,
      "fsip_po": null,
      "fsip_billingfrequency": null,
      "lcd_cat1annualprice": null,
      "fsip_expireson": null,
      "fsip_won@OData.Community.Display.V1.FormattedValue": "No",
      "fsip_won": false,
      "fsip_schedulinginprogress@OData.Community.Display.V1.FormattedValue": "No",
      "fsip_schedulinginprogress": false,
      "_fsip_sortbyaccount_value@OData.Community.Display.V1.FormattedValue": "Manhattanville Community Partners",
      "_fsip_sortbyaccount_value": "72e310d8-f06a-ef11-bfe3-00224803b9a8",
      "fsip_invoiced@OData.Community.Display.V1.FormattedValue": "$0.00",
      "fsip_invoiced": 0.0000000000,
      "fsip_currentannualamount_base": null,
      "fsip_currentcontractstartdate@OData.Community.Display.V1.FormattedValue": "8/15/2025",
      "fsip_currentcontractstartdate": "2025-08-15",
      "fsip_nextescalationdate": null,
      "fsip_billingstarton": null,
      "fsip_costs_base@OData.Community.Display.V1.FormattedValue": "$0.00",
      "fsip_costs_base": 0.0000000000,
      "fsip_nextcontractbillingdate@OData.Community.Display.V1.FormattedValue": "2/1/2026",
      "fsip_nextcontractbillingdate": "2026-02-01",
      "fsip_4thyearescalation": null,
      "fsip_invoiced_date@OData.Community.Display.V1.FormattedValue": "1/12/2026 8:46 PM",
      "fsip_invoiced_date": "2026-01-12T20:46:52Z",
      "fsip_billingfrequencycode": null,
      "lcd_cat5fullloadprice": null,
      "_fsip_copydevicesfromcontract_value": null,
      "statecode@OData.Community.Display.V1.FormattedValue": "Active",
      "statecode": 0,
      "fsip_regulartimecbservice@OData.Community.Display.V1.FormattedValue": "No",
      "fsip_regulartimecbservice": false,
      "fsip_costs_date@OData.Community.Display.V1.FormattedValue": "1/12/2026 8:46 PM",
      "fsip_costs_date": "2026-01-12T20:46:52Z",
      "_fsip_copydevicesfrombuildinglocation_value": null,
      "lcd_originalcontractamount": null,
      "fsip_closedstatus": null,
      "_fsip_customerid_value@OData.Community.Display.V1.FormattedValue": "Manhattanville Community Partners",
      "_fsip_customerid_value": "72e310d8-f06a-ef11-bfe3-00224803b9a8",
      "fsip_contractservicelevelcode": null,
      "fsip_invoiceamount": null,
      "_modifiedby_value@OData.Community.Display.V1.FormattedValue": "# SCRIBE INTEGRATION",
      "_modifiedby_value": "910423db-6a8d-ef11-ac21-000d3a326f08",
      "modifiedon@OData.Community.Display.V1.FormattedValue": "1/5/2026 3:29 PM",
      "modifiedon": "2026-01-05T15:29:39Z",
      "lcd_cancelationnotifyoffice@OData.Community.Display.V1.FormattedValue": "No",
      "lcd_cancelationnotifyoffice": 802290001,
      "lcd_autorenewal@OData.Community.Display.V1.FormattedValue": "No",
      "lcd_autorenewal": 802290001,
      "fsip_billingnotecb": null,
      "fsip_lastinvoiced_state@OData.Community.Display.V1.FormattedValue": "1",
      "fsip_lastinvoiced_state": 1,
      "fsip_costs_state@OData.Community.Display.V1.FormattedValue": "1",
      "fsip_costs_state": 1,
      "fsip_percentageoramount": null,
      "fsip_escalationamount_base": null,
      "fsip_closecontract@OData.Community.Display.V1.FormattedValue": "No",
      "fsip_closecontract": false,
      "overriddencreatedon": null,
      "lcd_cat1annualbillable": null,
      "fsip_activemmr_date@OData.Community.Display.V1.FormattedValue": "1/12/2026 8:46 PM",
      "fsip_activemmr_date": "2026-01-12T20:46:52Z",
      "fsip_specialconditions": null,
      "fsip_currentcontractenddate@OData.Community.Display.V1.FormattedValue": "8/15/2026",
      "fsip_currentcontractenddate": "2026-08-15",
      "lcd_servicefrequencywords": "Monthly",
      "fsip_cleanpithoistwaycartops@OData.Community.Display.V1.FormattedValue": "No",
      "fsip_cleanpithoistwaycartops": false,
      "fsip_5thyearescalation": null,
      "fsip_totalcontract": null,
      "_owningteam_value": null,
      "fsip_autorenew@OData.Community.Display.V1.FormattedValue": "No",
      "fsip_autorenew": false,
      "fsip_escalationpercent": null,
      "exchangerate@OData.Community.Display.V1.FormattedValue": "1.0000000000",
      "exchangerate": 1.000000000000,
      "fsip_excludefromcontractescalations@OData.Community.Display.V1.FormattedValue": "No",
      "fsip_excludefromcontractescalations": false,
      "fsip_annualsafetytest@OData.Community.Display.V1.FormattedValue": "No",
      "fsip_annualsafetytest": false,
      "fsip_nextservicedate@OData.Community.Display.V1.FormattedValue": "2/1/2026",
      "fsip_nextservicedate": "2026-02-01T11:00:00Z",
      "fsip_onhold@OData.Community.Display.V1.FormattedValue": "No",
      "fsip_onhold": false,
      "fsip_currentannualamount": null,
      "_createdby_value@OData.Community.Display.V1.FormattedValue": "Barbara Oliveira",
      "_createdby_value": "554d6842-59b6-ef11-b8e9-000d3a5a6b66",
      "fsip_activemmr_state@OData.Community.Display.V1.FormattedValue": "1",
      "fsip_activemmr_state": 1,
      "fsip_2ndyearescalation": null,
      "_fsip_wagecategory_value": null,
      "fsip_maintenancecontractid": "747dea2e-66a8-f011-bbd3-000d3a302e4a",
      "fsip_contractreviewdate": null,
      "fsip_lastinvoicerollup_state@OData.Community.Display.V1.FormattedValue": "0",
      "fsip_lastinvoicerollup_state": 0,
      "fsip_invoiced_state@OData.Community.Display.V1.FormattedValue": "1",
      "fsip_invoiced_state": 1,
      "fsip_2ndyearescalation_base": null,
      "fsip_5thyearescalation_base": null,
      "fsip_proratedequipment": null,
      "_fsip_originatingcontract_value": null,
      "lcd_runcancelflow@OData.Community.Display.V1.FormattedValue": "No",
      "lcd_runcancelflow": 802290001,
      "fsip_nextbillingdate": null,
      "lcd_createcontractbilling": null,
      "fsip_lastinvoicerollup": null,
      "fsip_billingnote": null,
      "_fsip_salesperson_value@OData.Community.Display.V1.FormattedValue": "Bill Appelbaum",
      "_fsip_salesperson_value": "caf5f82b-0baa-ec11-9840-000d3a302927",
      "fsip_invoiceconsolidationtype@OData.Community.Display.V1.FormattedValue": "By Customer",
      "fsip_invoiceconsolidationtype": 683440003,
      "fsip_4thyearescalation_base": null,
      "_fsip_billtocustomer_value@OData.Community.Display.V1.FormattedValue": "Manhattanville Community Partners",
      "_fsip_billtocustomer_value": "72e310d8-f06a-ef11-bfe3-00224803b9a8",
      "fsip_costs@OData.Community.Display.V1.FormattedValue": "$0.00",
      "fsip_costs": 0.0000000000,
      "_owningbusinessunit_value@OData.Community.Display.V1.FormattedValue": "LCD Elevator",
      "_owningbusinessunit_value": "c9e85d8b-8fa0-ec11-b400-000d3a58d68e",
      "fsip_legacycontract": null,
      "fsip_printbillingnote@OData.Community.Display.V1.FormattedValue": "Yes",
      "fsip_printbillingnote": true,
      "timezoneruleversionnumber@OData.Community.Display.V1.FormattedValue": "4",
      "timezoneruleversionnumber": 4,
      "fsip_grossmargin@OData.Community.Display.V1.FormattedValue": "$0.00",
      "fsip_grossmargin": 0.0000000000,
      "fsip_payssafetyequipment": null,
      "_ownerid_value@OData.Community.Display.V1.FormattedValue": "Barbara Oliveira",
      "_ownerid_value": "554d6842-59b6-ef11-b8e9-000d3a5a6b66",
      "_fsip_primarybuildinglocation_value@OData.Community.Display.V1.FormattedValue": "1420 Amsterdam Avenue",
      "_fsip_primarybuildinglocation_value": "5997ca72-f16a-ef11-bfe3-00224803b9a8",
      "fsip_lastinvoiced_date@OData.Community.Display.V1.FormattedValue": "1/12/2026 8:46 PM",
      "fsip_lastinvoiced_date": "2026-01-12T20:46:52Z",
      "fsip_invoiced_base@OData.Community.Display.V1.FormattedValue": "$0.00",
      "fsip_invoiced_base": 0.0000000000,
      "importsequencenumber": null,
      "fsip_escalationamount": null,
      "fsip_1styearescalation_base": null,
      "_owninguser_value": "554d6842-59b6-ef11-b8e9-000d3a5a6b66",
      "_transactioncurrencyid_value@OData.Community.Display.V1.FormattedValue": "US Dollar",
      "_transactioncurrencyid_value": "28c060c5-d1a0-ec11-b400-000d3a58d68e",
      "_fsip_productcb_value": null,
      "fsip_visitfrequency@OData.Community.Display.V1.FormattedValue": "30",
      "fsip_visitfrequency": 683440000,
      "fsip_3rdyearescalation_base": null,
      "_fsip_project_value": null,
      "_fsip_division_value@OData.Community.Display.V1.FormattedValue": "Maintenance",
      "_fsip_division_value": "9316e0ff-55a5-ec11-9840-000d3a5c16ba",
      "_fsip_contracttype_value@OData.Community.Display.V1.FormattedValue": "Free Maintenance (Warranty)",
      "_fsip_contracttype_value": "fd3ce9c0-42a9-ec11-9840-000d3a307669",
      "fsip_sendescalationletter@OData.Community.Display.V1.FormattedValue": "No",
      "fsip_sendescalationletter": false,
      "lcd_braketestprice": null,
      "utcconversiontimezonecode": null,
      "_createdonbehalfby_value": null,
      "fsip_numberofvisits": "1",
      "fsip_totalcontract_base": null,
      "fsip_grossmarginpercent": null,
      "fsip_certificateofinsurance@OData.Community.Display.V1.FormattedValue": "No",
      "fsip_certificateofinsurance": false,
      "fsip_permitfeesbillable@OData.Community.Display.V1.FormattedValue": "No",
      "fsip_permitfeesbillable": false,
      "fsip_billingendon": null,
      "fsip_lastinvoiced": null,
      "fsip_internalnote": null,
      "fsip_escalationfrequency": null,
      "fsip_name": "1420 Amsterdam Avenue",
      "fsip_workorderconsolidationtype@OData.Community.Display.V1.FormattedValue": "By Contract",
      "fsip_workorderconsolidationtype": 683440000,
      "fsip_addalldevicescontractbillings@OData.Community.Display.V1.FormattedValue": "No",
      "fsip_addalldevicescontractbillings": false,
      "fsip_lastescalationlettersent": null,
      "fsip_otminoradjustmentscbservice@OData.Community.Display.V1.FormattedValue": "No",
      "fsip_otminoradjustmentscbservice": false,
      "fsip_duration": null,
      "lcd_daystoexpire@OData.Community.Display.V1.FormattedValue": "-215.00",
      "lcd_daystoexpire": -215.0000000000,
      "fsip_3rdyearescalation": null,
      "fsip_invoicingmethod@OData.Community.Display.V1.FormattedValue": "Work Order Billing",
      "fsip_invoicingmethod": 683440001,
      "lcd_cat5fullloadbillable": null,
      "fsip_cancelon": null,
      "fsip_originalcontractstartdate@OData.Community.Display.V1.FormattedValue": "8/15/2025",
      "fsip_originalcontractstartdate": "2025-08-15",
      "fsip_contractnumber": "MC-0003110",
      "fsip_exclusions": null,
      "_fsip_product_value": null,
      "fsip_quantity": null,
      "fsip_usediscountaspercentage@OData.Community.Display.V1.FormattedValue": "Amount",
      "fsip_usediscountaspercentage": false,
      "fsip_contractlanguage": null,
      "fsip_currentcontractyear": null,
      "lcd_originalcontractamount_base": null,
      "_modifiedonbehalfby_value": null,
      "fsip_fiveyearsafetytest@OData.Community.Display.V1.FormattedValue": "No",
      "fsip_fiveyearsafetytest": false,
      "fsip_closedate": null,
      "fsip_invoiceamount_base": null,
      "versionnumber@OData.Community.Display.V1.FormattedValue": "126,389,646",
      "versionnumber": 126389646,
      "fsip_description": null,
      "fsip_activeon": null,
      "fsip_billingenddate": null,
      "fsip_activemmr_base@OData.Community.Display.V1.FormattedValue": "$641.54",
      "fsip_activemmr_base": 641.5400000000,
      "statuscode@OData.Community.Display.V1.FormattedValue": "Active",
      "statuscode": 683440001,
      "fsip_testbillable@OData.Community.Display.V1.FormattedValue": "No",
      "fsip_testbillable": false,
      "createdon@OData.Community.Display.V1.FormattedValue": "10/13/2025 6:55 PM",
      "createdon": "2025-10-13T18:55:31Z",
      "fsip_holdnote": null,
      "fsip_grossmargin_base@OData.Community.Display.V1.FormattedValue": "$0.00",
      "fsip_grossmargin_base": 0.0000000000,
      "_fsip_serviceaddress_value": null,
      "fsip_activemmr@OData.Community.Display.V1.FormattedValue": "$641.54",
      "fsip_activemmr": 641.5400000000,
      "lcd_braketestbillable": null,
      "fsip_1styearescalation": null,
      "fsip_currentactualprofitpercent": null,
      "fsip_lastinvoicerollup_date@OData.Community.Display.V1.FormattedValue": "1/12/2026 8:46 PM",
      "fsip_lastinvoicerollup_date": "2026-01-12T20:46:52Z",
      "fsip_billinginprogress@OData.Community.Display.V1.FormattedValue": "No",
      "fsip_billinginprogress": false
    },
    {
      "@odata.etag": "W/\"126387122\"",
      "lcd_cancellationnotes": null,
      "fsip_po": null,
      "fsip_billingfrequency": null,
      "lcd_cat1annualprice": null,
      "fsip_expireson": null,
      "fsip_won@OData.Community.Display.V1.FormattedValue": "No",
      "fsip_won": false,
      "fsip_schedulinginprogress@OData.Community.Display.V1.FormattedValue": "No",
      "fsip_schedulinginprogress": false,
      "_fsip_sortbyaccount_value@OData.Community.Display.V1.FormattedValue": "Manhattanville Community Partners",
      "_fsip_sortbyaccount_value": "72e310d8-f06a-ef11-bfe3-00224803b9a8",
      "fsip_invoiced@OData.Community.Display.V1.FormattedValue": "$0.00",
      "fsip_invoiced": 0.0000000000,
      "fsip_currentannualamount_base": null,
      "fsip_currentcontractstartdate@OData.Community.Display.V1.FormattedValue": "8/15/2025",
      "fsip_currentcontractstartdate": "2025-08-15",
      "fsip_nextescalationdate": null,
      "fsip_billingstarton": null,
      "fsip_costs_base@OData.Community.Display.V1.FormattedValue": "$0.00",
      "fsip_costs_base": 0.0000000000,
      "fsip_nextcontractbillingdate@OData.Community.Display.V1.FormattedValue": "2/1/2026",
      "fsip_nextcontractbillingdate": "2026-02-01",
      "fsip_4thyearescalation": null,
      "fsip_invoiced_date@OData.Community.Display.V1.FormattedValue": "1/12/2026 8:46 PM",
      "fsip_invoiced_date": "2026-01-12T20:46:52Z",
      "fsip_billingfrequencycode": null,
      "lcd_cat5fullloadprice": null,
      "_fsip_copydevicesfromcontract_value": null,
      "statecode@OData.Community.Display.V1.FormattedValue": "Active",
      "statecode": 0,
      "fsip_regulartimecbservice@OData.Community.Display.V1.FormattedValue": "No",
      "fsip_regulartimecbservice": false,
      "fsip_costs_date@OData.Community.Display.V1.FormattedValue": "1/12/2026 8:46 PM",
      "fsip_costs_date": "2026-01-12T20:46:52Z",
      "_fsip_copydevicesfrombuildinglocation_value": null,
      "lcd_originalcontractamount": null,
      "fsip_closedstatus": null,
      "_fsip_customerid_value@OData.Community.Display.V1.FormattedValue": "Manhattanville Community Partners",
      "_fsip_customerid_value": "72e310d8-f06a-ef11-bfe3-00224803b9a8",
      "fsip_contractservicelevelcode": null,
      "fsip_invoiceamount": null,
      "_modifiedby_value@OData.Community.Display.V1.FormattedValue": "# SCRIBE INTEGRATION",
      "_modifiedby_value": "910423db-6a8d-ef11-ac21-000d3a326f08",
      "modifiedon@OData.Community.Display.V1.FormattedValue": "1/5/2026 3:29 PM",
      "modifiedon": "2026-01-05T15:29:40Z",
      "lcd_cancelationnotifyoffice@OData.Community.Display.V1.FormattedValue": "No",
      "lcd_cancelationnotifyoffice": 802290001,
      "lcd_autorenewal@OData.Community.Display.V1.FormattedValue": "No",
      "lcd_autorenewal": 802290001,
      "fsip_billingnotecb": null,
      "fsip_lastinvoiced_state@OData.Community.Display.V1.FormattedValue": "1",
      "fsip_lastinvoiced_state": 1,
      "fsip_costs_state@OData.Community.Display.V1.FormattedValue": "1",
      "fsip_costs_state": 1,
      "fsip_percentageoramount": null,
      "fsip_escalationamount_base": null,
      "fsip_closecontract@OData.Community.Display.V1.FormattedValue": "No",
      "fsip_closecontract": false,
      "overriddencreatedon": null,
      "lcd_cat1annualbillable": null,
      "fsip_activemmr_date@OData.Community.Display.V1.FormattedValue": "1/12/2026 8:46 PM",
      "fsip_activemmr_date": "2026-01-12T20:46:52Z",
      "fsip_specialconditions": null,
      "fsip_currentcontractenddate@OData.Community.Display.V1.FormattedValue": "8/15/2026",
      "fsip_currentcontractenddate": "2026-08-15",
      "lcd_servicefrequencywords": "Monthly",
      "fsip_cleanpithoistwaycartops@OData.Community.Display.V1.FormattedValue": "No",
      "fsip_cleanpithoistwaycartops": false,
      "fsip_5thyearescalation": null,
      "fsip_totalcontract": null,
      "_owningteam_value": null,
      "fsip_autorenew@OData.Community.Display.V1.FormattedValue": "No",
      "fsip_autorenew": false,
      "fsip_escalationpercent": null,
      "exchangerate@OData.Community.Display.V1.FormattedValue": "1.0000000000",
      "exchangerate": 1.000000000000,
      "fsip_excludefromcontractescalations@OData.Community.Display.V1.FormattedValue": "No",
      "fsip_excludefromcontractescalations": false,
      "fsip_annualsafetytest@OData.Community.Display.V1.FormattedValue": "No",
      "fsip_annualsafetytest": false,
      "fsip_nextservicedate@OData.Community.Display.V1.FormattedValue": "2/1/2026",
      "fsip_nextservicedate": "2026-02-01T11:00:00Z",
      "fsip_onhold@OData.Community.Display.V1.FormattedValue": "No",
      "fsip_onhold": false,
      "fsip_currentannualamount": null,
      "_createdby_value@OData.Community.Display.V1.FormattedValue": "Barbara Oliveira",
      "_createdby_value": "554d6842-59b6-ef11-b8e9-000d3a5a6b66",
      "fsip_activemmr_state@OData.Community.Display.V1.FormattedValue": "1",
      "fsip_activemmr_state": 1,
      "fsip_2ndyearescalation": null,
      "_fsip_wagecategory_value": null,
      "fsip_maintenancecontractid": "05ec167a-66a8-f011-bbd3-000d3a302e4a",
      "fsip_contractreviewdate": null,
      "fsip_lastinvoicerollup_state@OData.Community.Display.V1.FormattedValue": "0",
      "fsip_lastinvoicerollup_state": 0,
      "fsip_invoiced_state@OData.Community.Display.V1.FormattedValue": "1",
      "fsip_invoiced_state": 1,
      "fsip_2ndyearescalation_base": null,
      "fsip_5thyearescalation_base": null,
      "fsip_proratedequipment": null,
      "_fsip_originatingcontract_value": null,
      "lcd_runcancelflow@OData.Community.Display.V1.FormattedValue": "No",
      "lcd_runcancelflow": 802290001,
      "fsip_nextbillingdate": null,
      "lcd_createcontractbilling": null,
      "fsip_lastinvoicerollup": null,
      "fsip_billingnote": null,
      "_fsip_salesperson_value@OData.Community.Display.V1.FormattedValue": "Bill Appelbaum",
      "_fsip_salesperson_value": "caf5f82b-0baa-ec11-9840-000d3a302927",
      "fsip_invoiceconsolidationtype@OData.Community.Display.V1.FormattedValue": "By Customer",
      "fsip_invoiceconsolidationtype": 683440003,
      "fsip_4thyearescalation_base": null,
      "_fsip_billtocustomer_value@OData.Community.Display.V1.FormattedValue": "Manhattanville Community Partners",
      "_fsip_billtocustomer_value": "72e310d8-f06a-ef11-bfe3-00224803b9a8",
      "fsip_costs@OData.Community.Display.V1.FormattedValue": "$0.00",
      "fsip_costs": 0.0000000000,
      "_owningbusinessunit_value@OData.Community.Display.V1.FormattedValue": "LCD Elevator",
      "_owningbusinessunit_value": "c9e85d8b-8fa0-ec11-b400-000d3a58d68e",
      "fsip_legacycontract": null,
      "fsip_printbillingnote@OData.Community.Display.V1.FormattedValue": "Yes",
      "fsip_printbillingnote": true,
      "timezoneruleversionnumber@OData.Community.Display.V1.FormattedValue": "4",
      "timezoneruleversionnumber": 4,
      "fsip_grossmargin@OData.Community.Display.V1.FormattedValue": "$0.00",
      "fsip_grossmargin": 0.0000000000,
      "fsip_payssafetyequipment": null,
      "_ownerid_value@OData.Community.Display.V1.FormattedValue": "Barbara Oliveira",
      "_ownerid_value": "554d6842-59b6-ef11-b8e9-000d3a5a6b66",
      "_fsip_primarybuildinglocation_value@OData.Community.Display.V1.FormattedValue": "545 West 126th Street",
      "_fsip_primarybuildinglocation_value": "849e412e-f16a-ef11-bfe3-00224803b9a8",
      "fsip_lastinvoiced_date@OData.Community.Display.V1.FormattedValue": "1/12/2026 8:46 PM",
      "fsip_lastinvoiced_date": "2026-01-12T20:46:52Z",
      "fsip_invoiced_base@OData.Community.Display.V1.FormattedValue": "$0.00",
      "fsip_invoiced_base": 0.0000000000,
      "importsequencenumber": null,
      "fsip_escalationamount": null,
      "fsip_1styearescalation_base": null,
      "_owninguser_value": "554d6842-59b6-ef11-b8e9-000d3a5a6b66",
      "_transactioncurrencyid_value@OData.Community.Display.V1.FormattedValue": "US Dollar",
      "_transactioncurrencyid_value": "28c060c5-d1a0-ec11-b400-000d3a58d68e",
      "_fsip_productcb_value": null,
      "fsip_visitfrequency@OData.Community.Display.V1.FormattedValue": "30",
      "fsip_visitfrequency": 683440000,
      "fsip_3rdyearescalation_base": null,
      "_fsip_project_value": null,
      "_fsip_division_value@OData.Community.Display.V1.FormattedValue": "Maintenance",
      "_fsip_division_value": "9316e0ff-55a5-ec11-9840-000d3a5c16ba",
      "_fsip_contracttype_value@OData.Community.Display.V1.FormattedValue": "Free Maintenance (Warranty)",
      "_fsip_contracttype_value": "fd3ce9c0-42a9-ec11-9840-000d3a307669",
      "fsip_sendescalationletter@OData.Community.Display.V1.FormattedValue": "No",
      "fsip_sendescalationletter": false,
      "lcd_braketestprice": null,
      "utcconversiontimezonecode": null,
      "_createdonbehalfby_value": null,
      "fsip_numberofvisits": "1",
      "fsip_totalcontract_base": null,
      "fsip_grossmarginpercent": null,
      "fsip_certificateofinsurance@OData.Community.Display.V1.FormattedValue": "No",
      "fsip_certificateofinsurance": false,
      "fsip_permitfeesbillable@OData.Community.Display.V1.FormattedValue": "No",
      "fsip_permitfeesbillable": false,
      "fsip_billingendon": null,
      "fsip_lastinvoiced": null,
      "fsip_internalnote": null,
      "fsip_escalationfrequency": null,
      "fsip_name": "545 West 126th Street",
      "fsip_workorderconsolidationtype@OData.Community.Display.V1.FormattedValue": "By Contract",
      "fsip_workorderconsolidationtype": 683440000,
      "fsip_addalldevicescontractbillings@OData.Community.Display.V1.FormattedValue": "No",
      "fsip_addalldevicescontractbillings": false,
      "fsip_lastescalationlettersent": null,
      "fsip_otminoradjustmentscbservice@OData.Community.Display.V1.FormattedValue": "No",
      "fsip_otminoradjustmentscbservice": false,
      "fsip_duration": null,
      "lcd_daystoexpire@OData.Community.Display.V1.FormattedValue": "-215.00",
      "lcd_daystoexpire": -215.0000000000,
      "fsip_3rdyearescalation": null,
      "fsip_invoicingmethod@OData.Community.Display.V1.FormattedValue": "Work Order Billing",
      "fsip_invoicingmethod": 683440001,
      "lcd_cat5fullloadbillable": null,
      "fsip_cancelon": null,
      "fsip_originalcontractstartdate@OData.Community.Display.V1.FormattedValue": "8/15/2025",
      "fsip_originalcontractstartdate": "2025-08-15",
      "fsip_contractnumber": "MC-0003111",
      "fsip_exclusions": null,
      "_fsip_product_value": null,
      "fsip_quantity": null,
      "fsip_usediscountaspercentage@OData.Community.Display.V1.FormattedValue": "Amount",
      "fsip_usediscountaspercentage": false,
      "fsip_contractlanguage": null,
      "fsip_currentcontractyear": null,
      "lcd_originalcontractamount_base": null,
      "_modifiedonbehalfby_value": null,
      "fsip_fiveyearsafetytest@OData.Community.Display.V1.FormattedValue": "No",
      "fsip_fiveyearsafetytest": false,
      "fsip_closedate": null,
      "fsip_invoiceamount_base": null,
      "versionnumber@OData.Community.Display.V1.FormattedValue": "126,387,122",
      "versionnumber": 126387122,
      "fsip_description": null,
      "fsip_activeon": null,
      "fsip_billingenddate": null,
      "fsip_activemmr_base@OData.Community.Display.V1.FormattedValue": "$641.54",
      "fsip_activemmr_base": 641.5400000000,
      "statuscode@OData.Community.Display.V1.FormattedValue": "Active",
      "statuscode": 683440001,
      "fsip_testbillable@OData.Community.Display.V1.FormattedValue": "No",
      "fsip_testbillable": false,
      "createdon@OData.Community.Display.V1.FormattedValue": "10/13/2025 6:57 PM",
      "createdon": "2025-10-13T18:57:43Z",
      "fsip_holdnote": null,
      "fsip_grossmargin_base@OData.Community.Display.V1.FormattedValue": "$0.00",
      "fsip_grossmargin_base": 0.0000000000,
      "_fsip_serviceaddress_value": null,
      "fsip_activemmr@OData.Community.Display.V1.FormattedValue": "$641.54",
      "fsip_activemmr": 641.5400000000,
      "lcd_braketestbillable": null,
      "fsip_1styearescalation": null,
      "fsip_currentactualprofitpercent": null,
      "fsip_lastinvoicerollup_date@OData.Community.Display.V1.FormattedValue": "1/12/2026 8:46 PM",
      "fsip_lastinvoicerollup_date": "2026-01-12T20:46:52Z",
      "fsip_billinginprogress@OData.Community.Display.V1.FormattedValue": "No",
      "fsip_billinginprogress": false
    },
    {
      "@odata.etag": "W/\"126384484\"",
      "lcd_cancellationnotes": null,
      "fsip_po": null,
      "fsip_billingfrequency": null,
      "lcd_cat1annualprice": null,
      "fsip_expireson": null,
      "fsip_won@OData.Community.Display.V1.FormattedValue": "No",
      "fsip_won": false,
      "fsip_schedulinginprogress@OData.Community.Display.V1.FormattedValue": "No",
      "fsip_schedulinginprogress": false,
      "_fsip_sortbyaccount_value@OData.Community.Display.V1.FormattedValue": "SKF Management",
      "_fsip_sortbyaccount_value": "5d129b18-45a9-ec11-9840-000d3a307669",
      "fsip_invoiced@OData.Community.Display.V1.FormattedValue": "$0.00",
      "fsip_invoiced": 0.0000000000,
      "fsip_currentannualamount_base": null,
      "fsip_currentcontractstartdate@OData.Community.Display.V1.FormattedValue": "10/20/2025",
      "fsip_currentcontractstartdate": "2025-10-20",
      "fsip_nextescalationdate": null,
      "fsip_billingstarton": null,
      "fsip_costs_base@OData.Community.Display.V1.FormattedValue": "$0.00",
      "fsip_costs_base": 0.0000000000,
      "fsip_nextcontractbillingdate": null,
      "fsip_4thyearescalation": null,
      "fsip_invoiced_date@OData.Community.Display.V1.FormattedValue": "1/12/2026 8:46 PM",
      "fsip_invoiced_date": "2026-01-12T20:46:52Z",
      "fsip_billingfrequencycode": null,
      "lcd_cat5fullloadprice": null,
      "_fsip_copydevicesfromcontract_value": null,
      "statecode@OData.Community.Display.V1.FormattedValue": "Active",
      "statecode": 0,
      "fsip_regulartimecbservice@OData.Community.Display.V1.FormattedValue": "No",
      "fsip_regulartimecbservice": false,
      "fsip_costs_date@OData.Community.Display.V1.FormattedValue": "1/12/2026 8:46 PM",
      "fsip_costs_date": "2026-01-12T20:46:52Z",
      "_fsip_copydevicesfrombuildinglocation_value": null,
      "lcd_originalcontractamount": null,
      "fsip_closedstatus": null,
      "_fsip_customerid_value@OData.Community.Display.V1.FormattedValue": "SKF Management",
      "_fsip_customerid_value": "5d129b18-45a9-ec11-9840-000d3a307669",
      "fsip_contractservicelevelcode": null,
      "fsip_invoiceamount": null,
      "_modifiedby_value@OData.Community.Display.V1.FormattedValue": "# SCRIBE INTEGRATION",
      "_modifiedby_value": "910423db-6a8d-ef11-ac21-000d3a326f08",
      "modifiedon@OData.Community.Display.V1.FormattedValue": "1/5/2026 2:54 PM",
      "modifiedon": "2026-01-05T14:54:14Z",
      "lcd_cancelationnotifyoffice@OData.Community.Display.V1.FormattedValue": "No",
      "lcd_cancelationnotifyoffice": 802290001,
      "lcd_autorenewal@OData.Community.Display.V1.FormattedValue": "Yes",
      "lcd_autorenewal": 802290000,
      "fsip_billingnotecb": null,
      "fsip_lastinvoiced_state@OData.Community.Display.V1.FormattedValue": "1",
      "fsip_lastinvoiced_state": 1,
      "fsip_costs_state@OData.Community.Display.V1.FormattedValue": "1",
      "fsip_costs_state": 1,
      "fsip_percentageoramount": null,
      "fsip_escalationamount_base": null,
      "fsip_closecontract@OData.Community.Display.V1.FormattedValue": "No",
      "fsip_closecontract": false,
      "overriddencreatedon": null,
      "lcd_cat1annualbillable@OData.Community.Display.V1.FormattedValue": "N/A",
      "lcd_cat1annualbillable": 802290003,
      "fsip_activemmr_date@OData.Community.Display.V1.FormattedValue": "1/12/2026 8:46 PM",
      "fsip_activemmr_date": "2026-01-12T20:46:52Z",
      "fsip_specialconditions": null,
      "fsip_currentcontractenddate@OData.Community.Display.V1.FormattedValue": "10/20/2026",
      "fsip_currentcontractenddate": "2026-10-20",
      "lcd_servicefrequencywords": "Monthly",
      "fsip_cleanpithoistwaycartops@OData.Community.Display.V1.FormattedValue": "No",
      "fsip_cleanpithoistwaycartops": false,
      "fsip_5thyearescalation": null,
      "fsip_totalcontract": null,
      "_owningteam_value": null,
      "fsip_autorenew@OData.Community.Display.V1.FormattedValue": "No",
      "fsip_autorenew": false,
      "fsip_escalationpercent": null,
      "exchangerate@OData.Community.Display.V1.FormattedValue": "1.0000000000",
      "exchangerate": 1.000000000000,
      "fsip_excludefromcontractescalations@OData.Community.Display.V1.FormattedValue": "No",
      "fsip_excludefromcontractescalations": false,
      "fsip_annualsafetytest@OData.Community.Display.V1.FormattedValue": "No",
      "fsip_annualsafetytest": false,
      "fsip_nextservicedate@OData.Community.Display.V1.FormattedValue": "2/20/2026",
      "fsip_nextservicedate": "2026-02-20T11:00:00Z",
      "fsip_onhold@OData.Community.Display.V1.FormattedValue": "No",
      "fsip_onhold": false,
      "fsip_currentannualamount": null,
      "_createdby_value@OData.Community.Display.V1.FormattedValue": "Barbara Oliveira",
      "_createdby_value": "554d6842-59b6-ef11-b8e9-000d3a5a6b66",
      "fsip_activemmr_state@OData.Community.Display.V1.FormattedValue": "1",
      "fsip_activemmr_state": 1,
      "fsip_2ndyearescalation": null,
      "_fsip_wagecategory_value": null,
      "fsip_maintenancecontractid": "f9d2513b-c5ad-f011-bbd3-000d3a302e4a",
      "fsip_contractreviewdate": null,
      "fsip_lastinvoicerollup_state@OData.Community.Display.V1.FormattedValue": "0",
      "fsip_lastinvoicerollup_state": 0,
      "fsip_invoiced_state@OData.Community.Display.V1.FormattedValue": "1",
      "fsip_invoiced_state": 1,
      "fsip_2ndyearescalation_base": null,
      "fsip_5thyearescalation_base": null,
      "fsip_proratedequipment": null,
      "_fsip_originatingcontract_value": null,
      "lcd_runcancelflow@OData.Community.Display.V1.FormattedValue": "No",
      "lcd_runcancelflow": 802290001,
      "fsip_nextbillingdate": null,
      "lcd_createcontractbilling": null,
      "fsip_lastinvoicerollup": null,
      "fsip_billingnote": null,
      "_fsip_salesperson_value": null,
      "fsip_invoiceconsolidationtype@OData.Community.Display.V1.FormattedValue": "No Consolidation",
      "fsip_invoiceconsolidationtype": 683440000,
      "fsip_4thyearescalation_base": null,
      "_fsip_billtocustomer_value@OData.Community.Display.V1.FormattedValue": "SKF Management",
      "_fsip_billtocustomer_value": "5d129b18-45a9-ec11-9840-000d3a307669",
      "fsip_costs@OData.Community.Display.V1.FormattedValue": "$0.00",
      "fsip_costs": 0.0000000000,
      "_owningbusinessunit_value@OData.Community.Display.V1.FormattedValue": "LCD Elevator",
      "_owningbusinessunit_value": "c9e85d8b-8fa0-ec11-b400-000d3a58d68e",
      "fsip_legacycontract": null,
      "fsip_printbillingnote@OData.Community.Display.V1.FormattedValue": "Yes",
      "fsip_printbillingnote": true,
      "timezoneruleversionnumber@OData.Community.Display.V1.FormattedValue": "4",
      "timezoneruleversionnumber": 4,
      "fsip_grossmargin@OData.Community.Display.V1.FormattedValue": "$0.00",
      "fsip_grossmargin": 0.0000000000,
      "fsip_payssafetyequipment": null,
      "_ownerid_value@OData.Community.Display.V1.FormattedValue": "Barbara Oliveira",
      "_ownerid_value": "554d6842-59b6-ef11-b8e9-000d3a5a6b66",
      "_fsip_primarybuildinglocation_value@OData.Community.Display.V1.FormattedValue": "2324 Webster Avenue",
      "_fsip_primarybuildinglocation_value": "4f6fd0a2-f7f0-ee11-904b-6045bd05c1c9",
      "fsip_lastinvoiced_date@OData.Community.Display.V1.FormattedValue": "1/12/2026 8:46 PM",
      "fsip_lastinvoiced_date": "2026-01-12T20:46:52Z",
      "fsip_invoiced_base@OData.Community.Display.V1.FormattedValue": "$0.00",
      "fsip_invoiced_base": 0.0000000000,
      "importsequencenumber": null,
      "fsip_escalationamount": null,
      "fsip_1styearescalation_base": null,
      "_owninguser_value": "554d6842-59b6-ef11-b8e9-000d3a5a6b66",
      "_transactioncurrencyid_value@OData.Community.Display.V1.FormattedValue": "US Dollar",
      "_transactioncurrencyid_value": "28c060c5-d1a0-ec11-b400-000d3a58d68e",
      "_fsip_productcb_value": null,
      "fsip_visitfrequency@OData.Community.Display.V1.FormattedValue": "30",
      "fsip_visitfrequency": 683440000,
      "fsip_3rdyearescalation_base": null,
      "_fsip_project_value": null,
      "_fsip_division_value@OData.Community.Display.V1.FormattedValue": "Maintenance",
      "_fsip_division_value": "9316e0ff-55a5-ec11-9840-000d3a5c16ba",
      "_fsip_contracttype_value@OData.Community.Display.V1.FormattedValue": "Free Maintenance (Warranty)",
      "_fsip_contracttype_value": "fd3ce9c0-42a9-ec11-9840-000d3a307669",
      "fsip_sendescalationletter@OData.Community.Display.V1.FormattedValue": "No",
      "fsip_sendescalationletter": false,
      "lcd_braketestprice": null,
      "utcconversiontimezonecode": null,
      "_createdonbehalfby_value": null,
      "fsip_numberofvisits": "1",
      "fsip_totalcontract_base": null,
      "fsip_grossmarginpercent": null,
      "fsip_certificateofinsurance@OData.Community.Display.V1.FormattedValue": "No",
      "fsip_certificateofinsurance": false,
      "fsip_permitfeesbillable@OData.Community.Display.V1.FormattedValue": "No",
      "fsip_permitfeesbillable": false,
      "fsip_billingendon": null,
      "fsip_lastinvoiced": null,
      "fsip_internalnote": null,
      "fsip_escalationfrequency": null,
      "fsip_name": "2324 Webster Ave",
      "fsip_workorderconsolidationtype@OData.Community.Display.V1.FormattedValue": "By Contract",
      "fsip_workorderconsolidationtype": 683440000,
      "fsip_addalldevicescontractbillings@OData.Community.Display.V1.FormattedValue": "No",
      "fsip_addalldevicescontractbillings": false,
      "fsip_lastescalationlettersent": null,
      "fsip_otminoradjustmentscbservice@OData.Community.Display.V1.FormattedValue": "No",
      "fsip_otminoradjustmentscbservice": false,
      "fsip_duration": null,
      "lcd_daystoexpire@OData.Community.Display.V1.FormattedValue": "-281.00",
      "lcd_daystoexpire": -281.0000000000,
      "fsip_3rdyearescalation": null,
      "fsip_invoicingmethod@OData.Community.Display.V1.FormattedValue": "Work Order Billing",
      "fsip_invoicingmethod": 683440001,
      "lcd_cat5fullloadbillable@OData.Community.Display.V1.FormattedValue": "N/A",
      "lcd_cat5fullloadbillable": 802290003,
      "fsip_cancelon": null,
      "fsip_originalcontractstartdate@OData.Community.Display.V1.FormattedValue": "10/20/2025",
      "fsip_originalcontractstartdate": "2025-10-20",
      "fsip_contractnumber": "MC-0003121",
      "fsip_exclusions": null,
      "_fsip_product_value": null,
      "fsip_quantity": null,
      "fsip_usediscountaspercentage@OData.Community.Display.V1.FormattedValue": "Amount",
      "fsip_usediscountaspercentage": false,
      "fsip_contractlanguage": null,
      "fsip_currentcontractyear": null,
      "lcd_originalcontractamount_base": null,
      "_modifiedonbehalfby_value": null,
      "fsip_fiveyearsafetytest@OData.Community.Display.V1.FormattedValue": "No",
      "fsip_fiveyearsafetytest": false,
      "fsip_closedate": null,
      "fsip_invoiceamount_base": null,
      "versionnumber@OData.Community.Display.V1.FormattedValue": "126,384,484",
      "versionnumber": 126384484,
      "fsip_description": null,
      "fsip_activeon": null,
      "fsip_billingenddate": null,
      "fsip_activemmr_base@OData.Community.Display.V1.FormattedValue": "$0.00",
      "fsip_activemmr_base": 0.0000000000,
      "statuscode@OData.Community.Display.V1.FormattedValue": "Active",
      "statuscode": 683440001,
      "fsip_testbillable@OData.Community.Display.V1.FormattedValue": "No",
      "fsip_testbillable": false,
      "createdon@OData.Community.Display.V1.FormattedValue": "10/20/2025 2:58 PM",
      "createdon": "2025-10-20T14:58:27Z",
      "fsip_holdnote": null,
      "fsip_grossmargin_base@OData.Community.Display.V1.FormattedValue": "$0.00",
      "fsip_grossmargin_base": 0.0000000000,
      "_fsip_serviceaddress_value": null,
      "fsip_activemmr@OData.Community.Display.V1.FormattedValue": "$0.00",
      "fsip_activemmr": 0.0000000000,
      "lcd_braketestbillable@OData.Community.Display.V1.FormattedValue": "N/A",
      "lcd_braketestbillable": 802290003,
      "fsip_1styearescalation": null,
      "fsip_currentactualprofitpercent": null,
      "fsip_lastinvoicerollup_date@OData.Community.Display.V1.FormattedValue": "1/12/2026 8:46 PM",
      "fsip_lastinvoicerollup_date": "2026-01-12T20:46:52Z",
      "fsip_billinginprogress@OData.Community.Display.V1.FormattedValue": "No",
      "fsip_billinginprogress": false
    },
    {
      "@odata.etag": "W/\"123796136\"",
      "lcd_cancellationnotes": null,
      "fsip_po": null,
      "fsip_billingfrequency": null,
      "lcd_cat1annualprice": "875",
      "fsip_expireson": null,
      "fsip_won@OData.Community.Display.V1.FormattedValue": "No",
      "fsip_won": false,
      "fsip_schedulinginprogress@OData.Community.Display.V1.FormattedValue": "No",
      "fsip_schedulinginprogress": false,
      "_fsip_sortbyaccount_value@OData.Community.Display.V1.FormattedValue": "SKF Management",
      "_fsip_sortbyaccount_value": "5d129b18-45a9-ec11-9840-000d3a307669",
      "fsip_invoiced@OData.Community.Display.V1.FormattedValue": "$0.00",
      "fsip_invoiced": 0.0000000000,
      "fsip_currentannualamount_base": null,
      "fsip_currentcontractstartdate@OData.Community.Display.V1.FormattedValue": "10/21/2026",
      "fsip_currentcontractstartdate": "2026-10-21",
      "fsip_nextescalationdate": null,
      "fsip_billingstarton": null,
      "fsip_costs_base@OData.Community.Display.V1.FormattedValue": "$0.00",
      "fsip_costs_base": 0.0000000000,
      "fsip_nextcontractbillingdate@OData.Community.Display.V1.FormattedValue": "10/20/2026",
      "fsip_nextcontractbillingdate": "2026-10-20",
      "fsip_4thyearescalation": null,
      "fsip_invoiced_date@OData.Community.Display.V1.FormattedValue": "1/12/2026 8:46 PM",
      "fsip_invoiced_date": "2026-01-12T20:46:52Z",
      "fsip_billingfrequencycode": null,
      "lcd_cat5fullloadprice": "1550",
      "_fsip_copydevicesfromcontract_value": null,
      "statecode@OData.Community.Display.V1.FormattedValue": "Active",
      "statecode": 0,
      "fsip_regulartimecbservice@OData.Community.Display.V1.FormattedValue": "No",
      "fsip_regulartimecbservice": false,
      "fsip_costs_date@OData.Community.Display.V1.FormattedValue": "1/12/2026 8:46 PM",
      "fsip_costs_date": "2026-01-12T20:46:52Z",
      "_fsip_copydevicesfrombuildinglocation_value": null,
      "lcd_originalcontractamount": null,
      "fsip_closedstatus": null,
      "_fsip_customerid_value@OData.Community.Display.V1.FormattedValue": "SKF Management",
      "_fsip_customerid_value": "5d129b18-45a9-ec11-9840-000d3a307669",
      "fsip_contractservicelevelcode": null,
      "fsip_invoiceamount": null,
      "_modifiedby_value@OData.Community.Display.V1.FormattedValue": "Alondra Lope",
      "_modifiedby_value": "026d1bc6-a8c6-ee11-9079-6045bd07e840",
      "modifiedon@OData.Community.Display.V1.FormattedValue": "12/5/2025 5:35 PM",
      "modifiedon": "2025-12-05T17:35:30Z",
      "lcd_cancelationnotifyoffice@OData.Community.Display.V1.FormattedValue": "No",
      "lcd_cancelationnotifyoffice": 802290001,
      "lcd_autorenewal@OData.Community.Display.V1.FormattedValue": "Yes",
      "lcd_autorenewal": 802290000,
      "fsip_billingnotecb": null,
      "fsip_lastinvoiced_state@OData.Community.Display.V1.FormattedValue": "1",
      "fsip_lastinvoiced_state": 1,
      "fsip_costs_state@OData.Community.Display.V1.FormattedValue": "1",
      "fsip_costs_state": 1,
      "fsip_percentageoramount": null,
      "fsip_escalationamount_base": null,
      "fsip_closecontract@OData.Community.Display.V1.FormattedValue": "No",
      "fsip_closecontract": false,
      "overriddencreatedon": null,
      "lcd_cat1annualbillable@OData.Community.Display.V1.FormattedValue": "Yes",
      "lcd_cat1annualbillable": 802290000,
      "fsip_activemmr_date@OData.Community.Display.V1.FormattedValue": "1/12/2026 8:46 PM",
      "fsip_activemmr_date": "2026-01-12T20:46:52Z",
      "fsip_specialconditions": null,
      "fsip_currentcontractenddate@OData.Community.Display.V1.FormattedValue": "10/21/2027",
      "fsip_currentcontractenddate": "2027-10-21",
      "lcd_servicefrequencywords": "Monthly",
      "fsip_cleanpithoistwaycartops@OData.Community.Display.V1.FormattedValue": "No",
      "fsip_cleanpithoistwaycartops": false,
      "fsip_5thyearescalation": null,
      "fsip_totalcontract": null,
      "_owningteam_value": null,
      "fsip_autorenew@OData.Community.Display.V1.FormattedValue": "No",
      "fsip_autorenew": false,
      "fsip_escalationpercent": null,
      "exchangerate@OData.Community.Display.V1.FormattedValue": "1.0000000000",
      "exchangerate": 1.000000000000,
      "fsip_excludefromcontractescalations@OData.Community.Display.V1.FormattedValue": "No",
      "fsip_excludefromcontractescalations": false,
      "fsip_annualsafetytest@OData.Community.Display.V1.FormattedValue": "No",
      "fsip_annualsafetytest": false,
      "fsip_nextservicedate@OData.Community.Display.V1.FormattedValue": "10/21/2026",
      "fsip_nextservicedate": "2026-10-21T11:00:00Z",
      "fsip_onhold@OData.Community.Display.V1.FormattedValue": "No",
      "fsip_onhold": false,
      "fsip_currentannualamount": null,
      "_createdby_value@OData.Community.Display.V1.FormattedValue": "Barbara Oliveira",
      "_createdby_value": "554d6842-59b6-ef11-b8e9-000d3a5a6b66",
      "fsip_activemmr_state@OData.Community.Display.V1.FormattedValue": "1",
      "fsip_activemmr_state": 1,
      "fsip_2ndyearescalation": null,
      "_fsip_wagecategory_value": null,
      "fsip_maintenancecontractid": "d52bd27f-c9ad-f011-bbd3-000d3a302e4a",
      "fsip_contractreviewdate": null,
      "fsip_lastinvoicerollup_state@OData.Community.Display.V1.FormattedValue": "0",
      "fsip_lastinvoicerollup_state": 0,
      "fsip_invoiced_state@OData.Community.Display.V1.FormattedValue": "1",
      "fsip_invoiced_state": 1,
      "fsip_2ndyearescalation_base": null,
      "fsip_5thyearescalation_base": null,
      "fsip_proratedequipment": null,
      "_fsip_originatingcontract_value": null,
      "lcd_runcancelflow@OData.Community.Display.V1.FormattedValue": "No",
      "lcd_runcancelflow": 802290001,
      "fsip_nextbillingdate": null,
      "lcd_createcontractbilling": null,
      "fsip_lastinvoicerollup": null,
      "fsip_billingnote": null,
      "_fsip_salesperson_value": null,
      "fsip_invoiceconsolidationtype@OData.Community.Display.V1.FormattedValue": "By Contract",
      "fsip_invoiceconsolidationtype": 683440002,
      "fsip_4thyearescalation_base": null,
      "_fsip_billtocustomer_value@OData.Community.Display.V1.FormattedValue": "SKF Management",
      "_fsip_billtocustomer_value": "5d129b18-45a9-ec11-9840-000d3a307669",
      "fsip_costs@OData.Community.Display.V1.FormattedValue": "$0.00",
      "fsip_costs": 0.0000000000,
      "_owningbusinessunit_value@OData.Community.Display.V1.FormattedValue": "LCD Elevator",
      "_owningbusinessunit_value": "c9e85d8b-8fa0-ec11-b400-000d3a58d68e",
      "fsip_legacycontract": null,
      "fsip_printbillingnote@OData.Community.Display.V1.FormattedValue": "Yes",
      "fsip_printbillingnote": true,
      "timezoneruleversionnumber@OData.Community.Display.V1.FormattedValue": "0",
      "timezoneruleversionnumber": 0,
      "fsip_grossmargin@OData.Community.Display.V1.FormattedValue": "$0.00",
      "fsip_grossmargin": 0.0000000000,
      "fsip_payssafetyequipment": null,
      "_ownerid_value@OData.Community.Display.V1.FormattedValue": "Barbara Oliveira",
      "_ownerid_value": "554d6842-59b6-ef11-b8e9-000d3a5a6b66",
      "_fsip_primarybuildinglocation_value@OData.Community.Display.V1.FormattedValue": "2324 Webster Avenue",
      "_fsip_primarybuildinglocation_value": "4f6fd0a2-f7f0-ee11-904b-6045bd05c1c9",
      "fsip_lastinvoiced_date@OData.Community.Display.V1.FormattedValue": "1/12/2026 8:46 PM",
      "fsip_lastinvoiced_date": "2026-01-12T20:46:52Z",
      "fsip_invoiced_base@OData.Community.Display.V1.FormattedValue": "$0.00",
      "fsip_invoiced_base": 0.0000000000,
      "importsequencenumber": null,
      "fsip_escalationamount": null,
      "fsip_1styearescalation_base": null,
      "_owninguser_value": "554d6842-59b6-ef11-b8e9-000d3a5a6b66",
      "_transactioncurrencyid_value@OData.Community.Display.V1.FormattedValue": "US Dollar",
      "_transactioncurrencyid_value": "28c060c5-d1a0-ec11-b400-000d3a58d68e",
      "_fsip_productcb_value": null,
      "fsip_visitfrequency@OData.Community.Display.V1.FormattedValue": "30",
      "fsip_visitfrequency": 683440000,
      "fsip_3rdyearescalation_base": null,
      "_fsip_project_value": null,
      "_fsip_division_value@OData.Community.Display.V1.FormattedValue": "Maintenance",
      "_fsip_division_value": "9316e0ff-55a5-ec11-9840-000d3a5c16ba",
      "_fsip_contracttype_value@OData.Community.Display.V1.FormattedValue": "Limited Service",
      "_fsip_contracttype_value": "f13ce9c0-42a9-ec11-9840-000d3a307669",
      "fsip_sendescalationletter@OData.Community.Display.V1.FormattedValue": "No",
      "fsip_sendescalationletter": false,
      "lcd_braketestprice": "850",
      "utcconversiontimezonecode": null,
      "_createdonbehalfby_value": null,
      "fsip_numberofvisits": "1",
      "fsip_totalcontract_base": null,
      "fsip_grossmarginpercent": null,
      "fsip_certificateofinsurance@OData.Community.Display.V1.FormattedValue": "No",
      "fsip_certificateofinsurance": false,
      "fsip_permitfeesbillable@OData.Community.Display.V1.FormattedValue": "No",
      "fsip_permitfeesbillable": false,
      "fsip_billingendon": null,
      "fsip_lastinvoiced": null,
      "fsip_internalnote": null,
      "fsip_escalationfrequency": null,
      "fsip_name": "2324 Webster Ave",
      "fsip_workorderconsolidationtype@OData.Community.Display.V1.FormattedValue": "By Contract",
      "fsip_workorderconsolidationtype": 683440000,
      "fsip_addalldevicescontractbillings@OData.Community.Display.V1.FormattedValue": "No",
      "fsip_addalldevicescontractbillings": false,
      "fsip_lastescalationlettersent": null,
      "fsip_otminoradjustmentscbservice@OData.Community.Display.V1.FormattedValue": "No",
      "fsip_otminoradjustmentscbservice": false,
      "fsip_duration": null,
      "lcd_daystoexpire@OData.Community.Display.V1.FormattedValue": "-647.00",
      "lcd_daystoexpire": -647.0000000000,
      "fsip_3rdyearescalation": null,
      "fsip_invoicingmethod@OData.Community.Display.V1.FormattedValue": "Work Order Billing",
      "fsip_invoicingmethod": 683440001,
      "lcd_cat5fullloadbillable@OData.Community.Display.V1.FormattedValue": "Yes",
      "lcd_cat5fullloadbillable": 802290000,
      "fsip_cancelon": null,
      "fsip_originalcontractstartdate@OData.Community.Display.V1.FormattedValue": "10/21/2026",
      "fsip_originalcontractstartdate": "2026-10-21",
      "fsip_contractnumber": "MC-0003122",
      "fsip_exclusions": null,
      "_fsip_product_value": null,
      "fsip_quantity": null,
      "fsip_usediscountaspercentage@OData.Community.Display.V1.FormattedValue": "Amount",
      "fsip_usediscountaspercentage": false,
      "fsip_contractlanguage": null,
      "fsip_currentcontractyear": null,
      "lcd_originalcontractamount_base": null,
      "_modifiedonbehalfby_value": null,
      "fsip_fiveyearsafetytest@OData.Community.Display.V1.FormattedValue": "No",
      "fsip_fiveyearsafetytest": false,
      "fsip_closedate": null,
      "fsip_invoiceamount_base": null,
      "versionnumber@OData.Community.Display.V1.FormattedValue": "123,796,136",
      "versionnumber": 123796136,
      "fsip_description": null,
      "fsip_activeon": null,
      "fsip_billingenddate": null,
      "fsip_activemmr_base@OData.Community.Display.V1.FormattedValue": "$426.00",
      "fsip_activemmr_base": 426.0000000000,
      "statuscode@OData.Community.Display.V1.FormattedValue": "Active",
      "statuscode": 683440001,
      "fsip_testbillable@OData.Community.Display.V1.FormattedValue": "No",
      "fsip_testbillable": false,
      "createdon@OData.Community.Display.V1.FormattedValue": "10/20/2025 3:29 PM",
      "createdon": "2025-10-20T15:29:07Z",
      "fsip_holdnote": null,
      "fsip_grossmargin_base@OData.Community.Display.V1.FormattedValue": "$0.00",
      "fsip_grossmargin_base": 0.0000000000,
      "_fsip_serviceaddress_value": null,
      "fsip_activemmr@OData.Community.Display.V1.FormattedValue": "$426.00",
      "fsip_activemmr": 426.0000000000,
      "lcd_braketestbillable@OData.Community.Display.V1.FormattedValue": "Yes",
      "lcd_braketestbillable": 802290000,
      "fsip_1styearescalation": null,
      "fsip_currentactualprofitpercent": null,
      "fsip_lastinvoicerollup_date@OData.Community.Display.V1.FormattedValue": "1/12/2026 8:46 PM",
      "fsip_lastinvoicerollup_date": "2026-01-12T20:46:52Z",
      "fsip_billinginprogress@OData.Community.Display.V1.FormattedValue": "No",
      "fsip_billinginprogress": false
    },
    {
      "@odata.etag": "W/\"126664122\"",
      "lcd_cancellationnotes": null,
      "fsip_po": null,
      "fsip_billingfrequency": null,
      "lcd_cat1annualprice": null,
      "fsip_expireson": null,
      "fsip_won@OData.Community.Display.V1.FormattedValue": "No",
      "fsip_won": false,
      "fsip_schedulinginprogress@OData.Community.Display.V1.FormattedValue": "No",
      "fsip_schedulinginprogress": false,
      "_fsip_sortbyaccount_value@OData.Community.Display.V1.FormattedValue": "Argo Real Estate",
      "_fsip_sortbyaccount_value": "03d136c2-01ee-ef11-9342-00224802d271",
      "fsip_invoiced@OData.Community.Display.V1.FormattedValue": "$1,800.00",
      "fsip_invoiced": 1800.0000000000,
      "fsip_currentannualamount_base": null,
      "fsip_currentcontractstartdate@OData.Community.Display.V1.FormattedValue": "10/20/2025",
      "fsip_currentcontractstartdate": "2025-10-20",
      "fsip_nextescalationdate": null,
      "fsip_billingstarton": null,
      "fsip_costs_base@OData.Community.Display.V1.FormattedValue": "$0.00",
      "fsip_costs_base": 0.0000000000,
      "fsip_nextcontractbillingdate@OData.Community.Display.V1.FormattedValue": "2/20/2026",
      "fsip_nextcontractbillingdate": "2026-02-20",
      "fsip_4thyearescalation": null,
      "fsip_invoiced_date@OData.Community.Display.V1.FormattedValue": "1/12/2026 8:46 PM",
      "fsip_invoiced_date": "2026-01-12T20:46:52Z",
      "fsip_billingfrequencycode": null,
      "lcd_cat5fullloadprice": null,
      "_fsip_copydevicesfromcontract_value": null,
      "statecode@OData.Community.Display.V1.FormattedValue": "Active",
      "statecode": 0,
      "fsip_regulartimecbservice@OData.Community.Display.V1.FormattedValue": "No",
      "fsip_regulartimecbservice": false,
      "fsip_costs_date@OData.Community.Display.V1.FormattedValue": "1/12/2026 8:46 PM",
      "fsip_costs_date": "2026-01-12T20:46:52Z",
      "_fsip_copydevicesfrombuildinglocation_value": null,
      "lcd_originalcontractamount": null,
      "fsip_closedstatus": null,
      "_fsip_customerid_value@OData.Community.Display.V1.FormattedValue": "Argo Real Estate",
      "_fsip_customerid_value": "03d136c2-01ee-ef11-9342-00224802d271",
      "fsip_contractservicelevelcode": null,
      "fsip_invoiceamount": null,
      "_modifiedby_value@OData.Community.Display.V1.FormattedValue": "# SCRIBE INTEGRATION",
      "_modifiedby_value": "910423db-6a8d-ef11-ac21-000d3a326f08",
      "modifiedon@OData.Community.Display.V1.FormattedValue": "1/5/2026 2:54 PM",
      "modifiedon": "2026-01-05T14:54:11Z",
      "lcd_cancelationnotifyoffice@OData.Community.Display.V1.FormattedValue": "No",
      "lcd_cancelationnotifyoffice": 802290001,
      "lcd_autorenewal@OData.Community.Display.V1.FormattedValue": "No",
      "lcd_autorenewal": 802290001,
      "fsip_billingnotecb": null,
      "fsip_lastinvoiced_state@OData.Community.Display.V1.FormattedValue": "1",
      "fsip_lastinvoiced_state": 1,
      "fsip_costs_state@OData.Community.Display.V1.FormattedValue": "1",
      "fsip_costs_state": 1,
      "fsip_percentageoramount": null,
      "fsip_escalationamount_base": null,
      "fsip_closecontract@OData.Community.Display.V1.FormattedValue": "No",
      "fsip_closecontract": false,
      "overriddencreatedon": null,
      "lcd_cat1annualbillable@OData.Community.Display.V1.FormattedValue": "No",
      "lcd_cat1annualbillable": 802290001,
      "fsip_activemmr_date@OData.Community.Display.V1.FormattedValue": "1/12/2026 8:46 PM",
      "fsip_activemmr_date": "2026-01-12T20:46:52Z",
      "fsip_specialconditions": null,
      "fsip_currentcontractenddate@OData.Community.Display.V1.FormattedValue": "10/20/2030",
      "fsip_currentcontractenddate": "2030-10-20",
      "lcd_servicefrequencywords": "Monthly",
      "fsip_cleanpithoistwaycartops@OData.Community.Display.V1.FormattedValue": "No",
      "fsip_cleanpithoistwaycartops": false,
      "fsip_5thyearescalation": null,
      "fsip_totalcontract": null,
      "_owningteam_value": null,
      "fsip_autorenew@OData.Community.Display.V1.FormattedValue": "No",
      "fsip_autorenew": false,
      "fsip_escalationpercent": null,
      "exchangerate@OData.Community.Display.V1.FormattedValue": "1.0000000000",
      "exchangerate": 1.000000000000,
      "fsip_excludefromcontractescalations@OData.Community.Display.V1.FormattedValue": "No",
      "fsip_excludefromcontractescalations": false,
      "fsip_annualsafetytest@OData.Community.Display.V1.FormattedValue": "No",
      "fsip_annualsafetytest": false,
      "fsip_nextservicedate@OData.Community.Display.V1.FormattedValue": "2/20/2026",
      "fsip_nextservicedate": "2026-02-20T11:00:00Z",
      "fsip_onhold@OData.Community.Display.V1.FormattedValue": "No",
      "fsip_onhold": false,
      "fsip_currentannualamount": null,
      "_createdby_value@OData.Community.Display.V1.FormattedValue": "Barbara Oliveira",
      "_createdby_value": "554d6842-59b6-ef11-b8e9-000d3a5a6b66",
      "fsip_activemmr_state@OData.Community.Display.V1.FormattedValue": "1",
      "fsip_activemmr_state": 1,
      "fsip_2ndyearescalation": null,
      "_fsip_wagecategory_value": null,
      "fsip_maintenancecontractid": "a9112154-efad-f011-bbd3-000d3a302e4a",
      "fsip_contractreviewdate@OData.Community.Display.V1.FormattedValue": "7/1/2030",
      "fsip_contractreviewdate": "2030-07-01",
      "fsip_lastinvoicerollup_state@OData.Community.Display.V1.FormattedValue": "1",
      "fsip_lastinvoicerollup_state": 1,
      "fsip_invoiced_state@OData.Community.Display.V1.FormattedValue": "1",
      "fsip_invoiced_state": 1,
      "fsip_2ndyearescalation_base": null,
      "fsip_5thyearescalation_base": null,
      "fsip_proratedequipment": null,
      "_fsip_originatingcontract_value": null,
      "lcd_runcancelflow@OData.Community.Display.V1.FormattedValue": "No",
      "lcd_runcancelflow": 802290001,
      "fsip_nextbillingdate": null,
      "lcd_createcontractbilling": null,
      "fsip_lastinvoicerollup@OData.Community.Display.V1.FormattedValue": "1/20/2026",
      "fsip_lastinvoicerollup": "2026-01-20",
      "fsip_billingnote": null,
      "_fsip_salesperson_value": null,
      "fsip_invoiceconsolidationtype@OData.Community.Display.V1.FormattedValue": "By Contract",
      "fsip_invoiceconsolidationtype": 683440002,
      "fsip_4thyearescalation_base": null,
      "_fsip_billtocustomer_value@OData.Community.Display.V1.FormattedValue": "Argo Real Estate",
      "_fsip_billtocustomer_value": "03d136c2-01ee-ef11-9342-00224802d271",
      "fsip_costs@OData.Community.Display.V1.FormattedValue": "$0.00",
      "fsip_costs": 0.0000000000,
      "_owningbusinessunit_value@OData.Community.Display.V1.FormattedValue": "LCD Elevator",
      "_owningbusinessunit_value": "c9e85d8b-8fa0-ec11-b400-000d3a58d68e",
      "fsip_legacycontract": null,
      "fsip_printbillingnote@OData.Community.Display.V1.FormattedValue": "Yes",
      "fsip_printbillingnote": true,
      "timezoneruleversionnumber@OData.Community.Display.V1.FormattedValue": "4",
      "timezoneruleversionnumber": 4,
      "fsip_grossmargin@OData.Community.Display.V1.FormattedValue": "$1,800.00",
      "fsip_grossmargin": 1800.0000000000,
      "fsip_payssafetyequipment": null,
      "_ownerid_value@OData.Community.Display.V1.FormattedValue": "Barbara Oliveira",
      "_ownerid_value": "554d6842-59b6-ef11-b8e9-000d3a5a6b66",
      "_fsip_primarybuildinglocation_value@OData.Community.Display.V1.FormattedValue": "376 President Street",
      "_fsip_primarybuildinglocation_value": "3f624968-35cd-ef11-b8e9-002248048cf3",
      "fsip_lastinvoiced_date@OData.Community.Display.V1.FormattedValue": "1/12/2026 8:46 PM",
      "fsip_lastinvoiced_date": "2026-01-12T20:46:52Z",
      "fsip_invoiced_base@OData.Community.Display.V1.FormattedValue": "$1,800.00",
      "fsip_invoiced_base": 1800.0000000000,
      "importsequencenumber": null,
      "fsip_escalationamount": null,
      "fsip_1styearescalation_base": null,
      "_owninguser_value": "554d6842-59b6-ef11-b8e9-000d3a5a6b66",
      "_transactioncurrencyid_value@OData.Community.Display.V1.FormattedValue": "US Dollar",
      "_transactioncurrencyid_value": "28c060c5-d1a0-ec11-b400-000d3a58d68e",
      "_fsip_productcb_value": null,
      "fsip_visitfrequency@OData.Community.Display.V1.FormattedValue": "30",
      "fsip_visitfrequency": 683440000,
      "fsip_3rdyearescalation_base": null,
      "_fsip_project_value": null,
      "_fsip_division_value@OData.Community.Display.V1.FormattedValue": "Maintenance",
      "_fsip_division_value": "9316e0ff-55a5-ec11-9840-000d3a5c16ba",
      "_fsip_contracttype_value@OData.Community.Display.V1.FormattedValue": "Bid/Spec",
      "_fsip_contracttype_value": "e97d952f-1e63-ee11-be6e-6045bd0388ff",
      "fsip_sendescalationletter@OData.Community.Display.V1.FormattedValue": "No",
      "fsip_sendescalationletter": false,
      "lcd_braketestprice": null,
      "utcconversiontimezonecode": null,
      "_createdonbehalfby_value": null,
      "fsip_numberofvisits": "1",
      "fsip_totalcontract_base": null,
      "fsip_grossmarginpercent@OData.Community.Display.V1.FormattedValue": "100.00",
      "fsip_grossmarginpercent": 100.00,
      "fsip_certificateofinsurance@OData.Community.Display.V1.FormattedValue": "No",
      "fsip_certificateofinsurance": false,
      "fsip_permitfeesbillable@OData.Community.Display.V1.FormattedValue": "No",
      "fsip_permitfeesbillable": false,
      "fsip_billingendon": null,
      "fsip_lastinvoiced@OData.Community.Display.V1.FormattedValue": "1/5/2026",
      "fsip_lastinvoiced": "2026-01-05T12:56:43Z",
      "fsip_internalnote": null,
      "fsip_escalationfrequency": null,
      "fsip_name": "376 President Street",
      "fsip_workorderconsolidationtype@OData.Community.Display.V1.FormattedValue": "By Contract",
      "fsip_workorderconsolidationtype": 683440000,
      "fsip_addalldevicescontractbillings@OData.Community.Display.V1.FormattedValue": "No",
      "fsip_addalldevicescontractbillings": false,
      "fsip_lastescalationlettersent": null,
      "fsip_otminoradjustmentscbservice@OData.Community.Display.V1.FormattedValue": "No",
      "fsip_otminoradjustmentscbservice": false,
      "fsip_duration": null,
      "lcd_daystoexpire@OData.Community.Display.V1.FormattedValue": "-1,742.00",
      "lcd_daystoexpire": -1742.0000000000,
      "fsip_3rdyearescalation": null,
      "fsip_invoicingmethod@OData.Community.Display.V1.FormattedValue": "Work Order Billing",
      "fsip_invoicingmethod": 683440001,
      "lcd_cat5fullloadbillable@OData.Community.Display.V1.FormattedValue": "No",
      "lcd_cat5fullloadbillable": 802290001,
      "fsip_cancelon": null,
      "fsip_originalcontractstartdate@OData.Community.Display.V1.FormattedValue": "10/20/2025",
      "fsip_originalcontractstartdate": "2025-10-20",
      "fsip_contractnumber": "MC-0003123",
      "fsip_exclusions": null,
      "_fsip_product_value": null,
      "fsip_quantity": null,
      "fsip_usediscountaspercentage@OData.Community.Display.V1.FormattedValue": "Amount",
      "fsip_usediscountaspercentage": false,
      "fsip_contractlanguage": null,
      "fsip_currentcontractyear": null,
      "lcd_originalcontractamount_base": null,
      "_modifiedonbehalfby_value": null,
      "fsip_fiveyearsafetytest@OData.Community.Display.V1.FormattedValue": "No",
      "fsip_fiveyearsafetytest": false,
      "fsip_closedate": null,
      "fsip_invoiceamount_base": null,
      "versionnumber@OData.Community.Display.V1.FormattedValue": "126,664,122",
      "versionnumber": 126664122,
      "fsip_description": null,
      "fsip_activeon": null,
      "fsip_billingenddate": null,
      "fsip_activemmr_base@OData.Community.Display.V1.FormattedValue": "$450.00",
      "fsip_activemmr_base": 450.0000000000,
      "statuscode@OData.Community.Display.V1.FormattedValue": "Active",
      "statuscode": 683440001,
      "fsip_testbillable@OData.Community.Display.V1.FormattedValue": "No",
      "fsip_testbillable": false,
      "createdon@OData.Community.Display.V1.FormattedValue": "10/20/2025 7:59 PM",
      "createdon": "2025-10-20T19:59:48Z",
      "fsip_holdnote": null,
      "fsip_grossmargin_base@OData.Community.Display.V1.FormattedValue": "$1,800.00",
      "fsip_grossmargin_base": 1800.0000000000,
      "_fsip_serviceaddress_value": null,
      "fsip_activemmr@OData.Community.Display.V1.FormattedValue": "$450.00",
      "fsip_activemmr": 450.0000000000,
      "lcd_braketestbillable@OData.Community.Display.V1.FormattedValue": "No",
      "lcd_braketestbillable": 802290001,
      "fsip_1styearescalation": null,
      "fsip_currentactualprofitpercent": null,
      "fsip_lastinvoicerollup_date@OData.Community.Display.V1.FormattedValue": "1/12/2026 8:46 PM",
      "fsip_lastinvoicerollup_date": "2026-01-12T20:46:52Z",
      "fsip_billinginprogress@OData.Community.Display.V1.FormattedValue": "No",
      "fsip_billinginprogress": false
    },
    {
      "@odata.etag": "W/\"124813709\"",
      "lcd_cancellationnotes": "building moved from concord to sobro to pillar management. Pillar management brought a new vendor in",
      "fsip_po": null,
      "fsip_billingfrequency": null,
      "lcd_cat1annualprice": "775",
      "fsip_expireson": null,
      "fsip_won@OData.Community.Display.V1.FormattedValue": "No",
      "fsip_won": false,
      "fsip_schedulinginprogress@OData.Community.Display.V1.FormattedValue": "No",
      "fsip_schedulinginprogress": false,
      "_fsip_sortbyaccount_value@OData.Community.Display.V1.FormattedValue": "SOBRO",
      "_fsip_sortbyaccount_value": "3abeb8be-f88f-f011-b4cb-00224805bbe5",
      "fsip_invoiced@OData.Community.Display.V1.FormattedValue": "$1,596.00",
      "fsip_invoiced": 1596.0000000000,
      "fsip_currentannualamount_base": null,
      "fsip_currentcontractstartdate@OData.Community.Display.V1.FormattedValue": "9/1/2025",
      "fsip_currentcontractstartdate": "2025-09-01",
      "fsip_nextescalationdate": null,
      "fsip_billingstarton": null,
      "fsip_costs_base@OData.Community.Display.V1.FormattedValue": "$0.00",
      "fsip_costs_base": 0.0000000000,
      "fsip_nextcontractbillingdate": null,
      "fsip_4thyearescalation": null,
      "fsip_invoiced_date@OData.Community.Display.V1.FormattedValue": "1/12/2026 8:46 PM",
      "fsip_invoiced_date": "2026-01-12T20:46:52Z",
      "fsip_billingfrequencycode": null,
      "lcd_cat5fullloadprice": "1550",
      "_fsip_copydevicesfromcontract_value": null,
      "statecode@OData.Community.Display.V1.FormattedValue": "Inactive",
      "statecode": 1,
      "fsip_regulartimecbservice@OData.Community.Display.V1.FormattedValue": "No",
      "fsip_regulartimecbservice": false,
      "fsip_costs_date@OData.Community.Display.V1.FormattedValue": "1/12/2026 8:46 PM",
      "fsip_costs_date": "2026-01-12T20:46:52Z",
      "_fsip_copydevicesfrombuildinglocation_value": null,
      "lcd_originalcontractamount": null,
      "fsip_closedstatus@OData.Community.Display.V1.FormattedValue": "Cancelled",
      "fsip_closedstatus": 2,
      "_fsip_customerid_value@OData.Community.Display.V1.FormattedValue": "SOBRO",
      "_fsip_customerid_value": "3abeb8be-f88f-f011-b4cb-00224805bbe5",
      "fsip_contractservicelevelcode": null,
      "fsip_invoiceamount": null,
      "_modifiedby_value@OData.Community.Display.V1.FormattedValue": "Paul Licht",
      "_modifiedby_value": "74807f22-98a1-ec11-b400-0022480b8d8e",
      "modifiedon@OData.Community.Display.V1.FormattedValue": "12/16/2025 2:07 PM",
      "modifiedon": "2025-12-16T14:07:09Z",
      "lcd_cancelationnotifyoffice@OData.Community.Display.V1.FormattedValue": "No",
      "lcd_cancelationnotifyoffice": 802290001,
      "lcd_autorenewal@OData.Community.Display.V1.FormattedValue": "No",
      "lcd_autorenewal": 802290001,
      "fsip_billingnotecb": null,
      "fsip_lastinvoiced_state@OData.Community.Display.V1.FormattedValue": "1",
      "fsip_lastinvoiced_state": 1,
      "fsip_costs_state@OData.Community.Display.V1.FormattedValue": "1",
      "fsip_costs_state": 1,
      "fsip_percentageoramount": null,
      "fsip_escalationamount_base": null,
      "fsip_closecontract@OData.Community.Display.V1.FormattedValue": "Yes",
      "fsip_closecontract": true,
      "overriddencreatedon": null,
      "lcd_cat1annualbillable@OData.Community.Display.V1.FormattedValue": "Yes",
      "lcd_cat1annualbillable": 802290000,
      "fsip_activemmr_date@OData.Community.Display.V1.FormattedValue": "1/12/2026 8:46 PM",
      "fsip_activemmr_date": "2026-01-12T20:46:52Z",
      "fsip_specialconditions": null,
      "fsip_currentcontractenddate@OData.Community.Display.V1.FormattedValue": "12/31/2025",
      "fsip_currentcontractenddate": "2025-12-31",
      "lcd_servicefrequencywords": "Monthly",
      "fsip_cleanpithoistwaycartops@OData.Community.Display.V1.FormattedValue": "No",
      "fsip_cleanpithoistwaycartops": false,
      "fsip_5thyearescalation": null,
      "fsip_totalcontract": null,
      "_owningteam_value": null,
      "fsip_autorenew@OData.Community.Display.V1.FormattedValue": "No",
      "fsip_autorenew": false,
      "fsip_escalationpercent": null,
      "exchangerate@OData.Community.Display.V1.FormattedValue": "1.0000000000",
      "exchangerate": 1.000000000000,
      "fsip_excludefromcontractescalations@OData.Community.Display.V1.FormattedValue": "No",
      "fsip_excludefromcontractescalations": false,
      "fsip_annualsafetytest@OData.Community.Display.V1.FormattedValue": "No",
      "fsip_annualsafetytest": false,
      "fsip_nextservicedate@OData.Community.Display.V1.FormattedValue": "1/1/2026",
      "fsip_nextservicedate": "2026-01-01T11:00:00Z",
      "fsip_onhold@OData.Community.Display.V1.FormattedValue": "No",
      "fsip_onhold": false,
      "fsip_currentannualamount": null,
      "_createdby_value@OData.Community.Display.V1.FormattedValue": "Barbara Oliveira",
      "_createdby_value": "554d6842-59b6-ef11-b8e9-000d3a5a6b66",
      "fsip_activemmr_state@OData.Community.Display.V1.FormattedValue": "1",
      "fsip_activemmr_state": 1,
      "fsip_2ndyearescalation": null,
      "_fsip_wagecategory_value": null,
      "fsip_maintenancecontractid": "8a19ef12-65af-f011-bbd3-000d3a302e4a",
      "fsip_contractreviewdate": null,
      "fsip_lastinvoicerollup_state@OData.Community.Display.V1.FormattedValue": "1",
      "fsip_lastinvoicerollup_state": 1,
      "fsip_invoiced_state@OData.Community.Display.V1.FormattedValue": "1",
      "fsip_invoiced_state": 1,
      "fsip_2ndyearescalation_base": null,
      "fsip_5thyearescalation_base": null,
      "fsip_proratedequipment": null,
      "_fsip_originatingcontract_value": null,
      "lcd_runcancelflow@OData.Community.Display.V1.FormattedValue": "No",
      "lcd_runcancelflow": 802290001,
      "fsip_nextbillingdate": null,
      "lcd_createcontractbilling": null,
      "fsip_lastinvoicerollup@OData.Community.Display.V1.FormattedValue": "12/1/2025",
      "fsip_lastinvoicerollup": "2025-12-01",
      "fsip_billingnote": null,
      "_fsip_salesperson_value": null,
      "fsip_invoiceconsolidationtype@OData.Community.Display.V1.FormattedValue": "By Contract",
      "fsip_invoiceconsolidationtype": 683440002,
      "fsip_4thyearescalation_base": null,
      "_fsip_billtocustomer_value@OData.Community.Display.V1.FormattedValue": "SOBRO",
      "_fsip_billtocustomer_value": "3abeb8be-f88f-f011-b4cb-00224805bbe5",
      "fsip_costs@OData.Community.Display.V1.FormattedValue": "$0.00",
      "fsip_costs": 0.0000000000,
      "_owningbusinessunit_value@OData.Community.Display.V1.FormattedValue": "LCD Elevator",
      "_owningbusinessunit_value": "c9e85d8b-8fa0-ec11-b400-000d3a58d68e",
      "fsip_legacycontract": null,
      "fsip_printbillingnote@OData.Community.Display.V1.FormattedValue": "Yes",
      "fsip_printbillingnote": true,
      "timezoneruleversionnumber@OData.Community.Display.V1.FormattedValue": "0",
      "timezoneruleversionnumber": 0,
      "fsip_grossmargin@OData.Community.Display.V1.FormattedValue": "$1,596.00",
      "fsip_grossmargin": 1596.0000000000,
      "fsip_payssafetyequipment": null,
      "_ownerid_value@OData.Community.Display.V1.FormattedValue": "Barbara Oliveira",
      "_ownerid_value": "554d6842-59b6-ef11-b8e9-000d3a5a6b66",
      "_fsip_primarybuildinglocation_value@OData.Community.Display.V1.FormattedValue": "130 Willis Avenue",
      "_fsip_primarybuildinglocation_value": "7ed26c25-1caa-ec11-9840-000d3a307669",
      "fsip_lastinvoiced_date@OData.Community.Display.V1.FormattedValue": "1/12/2026 8:46 PM",
      "fsip_lastinvoiced_date": "2026-01-12T20:46:52Z",
      "fsip_invoiced_base@OData.Community.Display.V1.FormattedValue": "$1,596.00",
      "fsip_invoiced_base": 1596.0000000000,
      "importsequencenumber": null,
      "fsip_escalationamount": null,
      "fsip_1styearescalation_base": null,
      "_owninguser_value": "554d6842-59b6-ef11-b8e9-000d3a5a6b66",
      "_transactioncurrencyid_value@OData.Community.Display.V1.FormattedValue": "US Dollar",
      "_transactioncurrencyid_value": "28c060c5-d1a0-ec11-b400-000d3a58d68e",
      "_fsip_productcb_value": null,
      "fsip_visitfrequency@OData.Community.Display.V1.FormattedValue": "30",
      "fsip_visitfrequency": 683440000,
      "fsip_3rdyearescalation_base": null,
      "_fsip_project_value": null,
      "_fsip_division_value@OData.Community.Display.V1.FormattedValue": "Maintenance",
      "_fsip_division_value": "9316e0ff-55a5-ec11-9840-000d3a5c16ba",
      "_fsip_contracttype_value@OData.Community.Display.V1.FormattedValue": "Oil & Grease",
      "_fsip_contracttype_value": "ef3ce9c0-42a9-ec11-9840-000d3a307669",
      "fsip_sendescalationletter@OData.Community.Display.V1.FormattedValue": "No",
      "fsip_sendescalationletter": false,
      "lcd_braketestprice": "850",
      "utcconversiontimezonecode": null,
      "_createdonbehalfby_value": null,
      "fsip_numberofvisits": "1",
      "fsip_totalcontract_base": null,
      "fsip_grossmarginpercent@OData.Community.Display.V1.FormattedValue": "100.00",
      "fsip_grossmarginpercent": 100.00,
      "fsip_certificateofinsurance@OData.Community.Display.V1.FormattedValue": "No",
      "fsip_certificateofinsurance": false,
      "fsip_permitfeesbillable@OData.Community.Display.V1.FormattedValue": "No",
      "fsip_permitfeesbillable": false,
      "fsip_billingendon": null,
      "fsip_lastinvoiced@OData.Community.Display.V1.FormattedValue": "12/1/2025",
      "fsip_lastinvoiced": "2025-12-01T13:02:42Z",
      "fsip_internalnote": null,
      "fsip_escalationfrequency": null,
      "fsip_name": "130 Willis Avenue",
      "fsip_workorderconsolidationtype@OData.Community.Display.V1.FormattedValue": "By Contract",
      "fsip_workorderconsolidationtype": 683440000,
      "fsip_addalldevicescontractbillings@OData.Community.Display.V1.FormattedValue": "No",
      "fsip_addalldevicescontractbillings": false,
      "fsip_lastescalationlettersent": null,
      "fsip_otminoradjustmentscbservice@OData.Community.Display.V1.FormattedValue": "No",
      "fsip_otminoradjustmentscbservice": false,
      "fsip_duration": null,
      "lcd_daystoexpire@OData.Community.Display.V1.FormattedValue": "12.00",
      "lcd_daystoexpire": 12.0000000000,
      "fsip_3rdyearescalation": null,
      "fsip_invoicingmethod@OData.Community.Display.V1.FormattedValue": "Work Order Billing",
      "fsip_invoicingmethod": 683440001,
      "lcd_cat5fullloadbillable@OData.Community.Display.V1.FormattedValue": "Yes",
      "lcd_cat5fullloadbillable": 802290000,
      "fsip_cancelon@OData.Community.Display.V1.FormattedValue": "12/16/2025",
      "fsip_cancelon": "2025-12-16",
      "fsip_originalcontractstartdate@OData.Community.Display.V1.FormattedValue": "9/1/2025",
      "fsip_originalcontractstartdate": "2025-09-01",
      "fsip_contractnumber": "MC-0003124",
      "fsip_exclusions": null,
      "_fsip_product_value": null,
      "fsip_quantity": null,
      "fsip_usediscountaspercentage@OData.Community.Display.V1.FormattedValue": "Amount",
      "fsip_usediscountaspercentage": false,
      "fsip_contractlanguage": null,
      "fsip_currentcontractyear": null,
      "lcd_originalcontractamount_base": null,
      "_modifiedonbehalfby_value": null,
      "fsip_fiveyearsafetytest@OData.Community.Display.V1.FormattedValue": "No",
      "fsip_fiveyearsafetytest": false,
      "fsip_closedate@OData.Community.Display.V1.FormattedValue": "12/16/2025",
      "fsip_closedate": "2025-12-16",
      "fsip_invoiceamount_base": null,
      "versionnumber@OData.Community.Display.V1.FormattedValue": "124,813,709",
      "versionnumber": 124813709,
      "fsip_description": null,
      "fsip_activeon": null,
      "fsip_billingenddate": null,
      "fsip_activemmr_base@OData.Community.Display.V1.FormattedValue": "$0.00",
      "fsip_activemmr_base": 0.0000000000,
      "statuscode@OData.Community.Display.V1.FormattedValue": "Expired",
      "statuscode": 683440004,
      "fsip_testbillable@OData.Community.Display.V1.FormattedValue": "No",
      "fsip_testbillable": false,
      "createdon@OData.Community.Display.V1.FormattedValue": "10/22/2025 4:35 PM",
      "createdon": "2025-10-22T16:35:17Z",
      "fsip_holdnote": null,
      "fsip_grossmargin_base@OData.Community.Display.V1.FormattedValue": "$1,596.00",
      "fsip_grossmargin_base": 1596.0000000000,
      "_fsip_serviceaddress_value": null,
      "fsip_activemmr@OData.Community.Display.V1.FormattedValue": "$0.00",
      "fsip_activemmr": 0.0000000000,
      "lcd_braketestbillable@OData.Community.Display.V1.FormattedValue": "Yes",
      "lcd_braketestbillable": 802290000,
      "fsip_1styearescalation": null,
      "fsip_currentactualprofitpercent": null,
      "fsip_lastinvoicerollup_date@OData.Community.Display.V1.FormattedValue": "1/12/2026 8:46 PM",
      "fsip_lastinvoicerollup_date": "2026-01-12T20:46:52Z",
      "fsip_billinginprogress@OData.Community.Display.V1.FormattedValue": "No",
      "fsip_billinginprogress": false
    },
    {
      "@odata.etag": "W/\"124813710\"",
      "lcd_cancellationnotes": "management change",
      "fsip_po": null,
      "fsip_billingfrequency": null,
      "lcd_cat1annualprice": "775",
      "fsip_expireson": null,
      "fsip_won@OData.Community.Display.V1.FormattedValue": "No",
      "fsip_won": false,
      "fsip_schedulinginprogress@OData.Community.Display.V1.FormattedValue": "No",
      "fsip_schedulinginprogress": false,
      "_fsip_sortbyaccount_value@OData.Community.Display.V1.FormattedValue": "SOBRO",
      "_fsip_sortbyaccount_value": "3abeb8be-f88f-f011-b4cb-00224805bbe5",
      "fsip_invoiced@OData.Community.Display.V1.FormattedValue": "$3,576.00",
      "fsip_invoiced": 3576.0000000000,
      "fsip_currentannualamount_base": null,
      "fsip_currentcontractstartdate@OData.Community.Display.V1.FormattedValue": "9/1/2025",
      "fsip_currentcontractstartdate": "2025-09-01",
      "fsip_nextescalationdate": null,
      "fsip_billingstarton": null,
      "fsip_costs_base@OData.Community.Display.V1.FormattedValue": "$0.00",
      "fsip_costs_base": 0.0000000000,
      "fsip_nextcontractbillingdate": null,
      "fsip_4thyearescalation": null,
      "fsip_invoiced_date@OData.Community.Display.V1.FormattedValue": "1/12/2026 8:46 PM",
      "fsip_invoiced_date": "2026-01-12T20:46:52Z",
      "fsip_billingfrequencycode": null,
      "lcd_cat5fullloadprice": "1550",
      "_fsip_copydevicesfromcontract_value": null,
      "statecode@OData.Community.Display.V1.FormattedValue": "Inactive",
      "statecode": 1,
      "fsip_regulartimecbservice@OData.Community.Display.V1.FormattedValue": "No",
      "fsip_regulartimecbservice": false,
      "fsip_costs_date@OData.Community.Display.V1.FormattedValue": "1/12/2026 8:46 PM",
      "fsip_costs_date": "2026-01-12T20:46:52Z",
      "_fsip_copydevicesfrombuildinglocation_value": null,
      "lcd_originalcontractamount": null,
      "fsip_closedstatus@OData.Community.Display.V1.FormattedValue": "Cancelled",
      "fsip_closedstatus": 2,
      "_fsip_customerid_value@OData.Community.Display.V1.FormattedValue": "SOBRO",
      "_fsip_customerid_value": "3abeb8be-f88f-f011-b4cb-00224805bbe5",
      "fsip_contractservicelevelcode": null,
      "fsip_invoiceamount": null,
      "_modifiedby_value@OData.Community.Display.V1.FormattedValue": "# SCRIBE INTEGRATION",
      "_modifiedby_value": "910423db-6a8d-ef11-ac21-000d3a326f08",
      "modifiedon@OData.Community.Display.V1.FormattedValue": "12/16/2025 2:08 PM",
      "modifiedon": "2025-12-16T14:08:01Z",
      "lcd_cancelationnotifyoffice@OData.Community.Display.V1.FormattedValue": "No",
      "lcd_cancelationnotifyoffice": 802290001,
      "lcd_autorenewal@OData.Community.Display.V1.FormattedValue": "No",
      "lcd_autorenewal": 802290001,
      "fsip_billingnotecb": null,
      "fsip_lastinvoiced_state@OData.Community.Display.V1.FormattedValue": "1",
      "fsip_lastinvoiced_state": 1,
      "fsip_costs_state@OData.Community.Display.V1.FormattedValue": "1",
      "fsip_costs_state": 1,
      "fsip_percentageoramount": null,
      "fsip_escalationamount_base": null,
      "fsip_closecontract@OData.Community.Display.V1.FormattedValue": "No",
      "fsip_closecontract": false,
      "overriddencreatedon": null,
      "lcd_cat1annualbillable@OData.Community.Display.V1.FormattedValue": "Yes",
      "lcd_cat1annualbillable": 802290000,
      "fsip_activemmr_date@OData.Community.Display.V1.FormattedValue": "1/12/2026 8:46 PM",
      "fsip_activemmr_date": "2026-01-12T20:46:52Z",
      "fsip_specialconditions": null,
      "fsip_currentcontractenddate@OData.Community.Display.V1.FormattedValue": "12/31/2025",
      "fsip_currentcontractenddate": "2025-12-31",
      "lcd_servicefrequencywords": "Monthly",
      "fsip_cleanpithoistwaycartops@OData.Community.Display.V1.FormattedValue": "No",
      "fsip_cleanpithoistwaycartops": false,
      "fsip_5thyearescalation": null,
      "fsip_totalcontract": null,
      "_owningteam_value": null,
      "fsip_autorenew@OData.Community.Display.V1.FormattedValue": "No",
      "fsip_autorenew": false,
      "fsip_escalationpercent": null,
      "exchangerate@OData.Community.Display.V1.FormattedValue": "1.0000000000",
      "exchangerate": 1.000000000000,
      "fsip_excludefromcontractescalations@OData.Community.Display.V1.FormattedValue": "No",
      "fsip_excludefromcontractescalations": false,
      "fsip_annualsafetytest@OData.Community.Display.V1.FormattedValue": "No",
      "fsip_annualsafetytest": false,
      "fsip_nextservicedate@OData.Community.Display.V1.FormattedValue": "1/1/2026",
      "fsip_nextservicedate": "2026-01-01T11:00:00Z",
      "fsip_onhold@OData.Community.Display.V1.FormattedValue": "No",
      "fsip_onhold": false,
      "fsip_currentannualamount": null,
      "_createdby_value@OData.Community.Display.V1.FormattedValue": "Barbara Oliveira",
      "_createdby_value": "554d6842-59b6-ef11-b8e9-000d3a5a6b66",
      "fsip_activemmr_state@OData.Community.Display.V1.FormattedValue": "1",
      "fsip_activemmr_state": 1,
      "fsip_2ndyearescalation": null,
      "_fsip_wagecategory_value": null,
      "fsip_maintenancecontractid": "07437257-bcb4-f011-bbd3-000d3a302e4a",
      "fsip_contractreviewdate": null,
      "fsip_lastinvoicerollup_state@OData.Community.Display.V1.FormattedValue": "1",
      "fsip_lastinvoicerollup_state": 1,
      "fsip_invoiced_state@OData.Community.Display.V1.FormattedValue": "1",
      "fsip_invoiced_state": 1,
      "fsip_2ndyearescalation_base": null,
      "fsip_5thyearescalation_base": null,
      "fsip_proratedequipment": null,
      "_fsip_originatingcontract_value": null,
      "lcd_runcancelflow@OData.Community.Display.V1.FormattedValue": "No",
      "lcd_runcancelflow": 802290001,
      "fsip_nextbillingdate": null,
      "lcd_createcontractbilling": null,
      "fsip_lastinvoicerollup@OData.Community.Display.V1.FormattedValue": "12/1/2025",
      "fsip_lastinvoicerollup": "2025-12-01",
      "fsip_billingnote": null,
      "_fsip_salesperson_value": null,
      "fsip_invoiceconsolidationtype@OData.Community.Display.V1.FormattedValue": "By Contract",
      "fsip_invoiceconsolidationtype": 683440002,
      "fsip_4thyearescalation_base": null,
      "_fsip_billtocustomer_value@OData.Community.Display.V1.FormattedValue": "SOBRO",
      "_fsip_billtocustomer_value": "3abeb8be-f88f-f011-b4cb-00224805bbe5",
      "fsip_costs@OData.Community.Display.V1.FormattedValue": "$0.00",
      "fsip_costs": 0.0000000000,
      "_owningbusinessunit_value@OData.Community.Display.V1.FormattedValue": "LCD Elevator",
      "_owningbusinessunit_value": "c9e85d8b-8fa0-ec11-b400-000d3a58d68e",
      "fsip_legacycontract": null,
      "fsip_printbillingnote@OData.Community.Display.V1.FormattedValue": "Yes",
      "fsip_printbillingnote": true,
      "timezoneruleversionnumber@OData.Community.Display.V1.FormattedValue": "4",
      "timezoneruleversionnumber": 4,
      "fsip_grossmargin@OData.Community.Display.V1.FormattedValue": "$3,576.00",
      "fsip_grossmargin": 3576.0000000000,
      "fsip_payssafetyequipment": null,
      "_ownerid_value@OData.Community.Display.V1.FormattedValue": "Barbara Oliveira",
      "_ownerid_value": "554d6842-59b6-ef11-b8e9-000d3a5a6b66",
      "_fsip_primarybuildinglocation_value@OData.Community.Display.V1.FormattedValue": "499 East 188th Street",
      "_fsip_primarybuildinglocation_value": "82d26c25-1caa-ec11-9840-000d3a307669",
      "fsip_lastinvoiced_date@OData.Community.Display.V1.FormattedValue": "1/12/2026 8:46 PM",
      "fsip_lastinvoiced_date": "2026-01-12T20:46:52Z",
      "fsip_invoiced_base@OData.Community.Display.V1.FormattedValue": "$3,576.00",
      "fsip_invoiced_base": 3576.0000000000,
      "importsequencenumber": null,
      "fsip_escalationamount": null,
      "fsip_1styearescalation_base": null,
      "_owninguser_value": "554d6842-59b6-ef11-b8e9-000d3a5a6b66",
      "_transactioncurrencyid_value@OData.Community.Display.V1.FormattedValue": "US Dollar",
      "_transactioncurrencyid_value": "28c060c5-d1a0-ec11-b400-000d3a58d68e",
      "_fsip_productcb_value": null,
      "fsip_visitfrequency@OData.Community.Display.V1.FormattedValue": "30",
      "fsip_visitfrequency": 683440000,
      "fsip_3rdyearescalation_base": null,
      "_fsip_project_value": null,
      "_fsip_division_value@OData.Community.Display.V1.FormattedValue": "Maintenance",
      "_fsip_division_value": "9316e0ff-55a5-ec11-9840-000d3a5c16ba",
      "_fsip_contracttype_value@OData.Community.Display.V1.FormattedValue": "Limited Service",
      "_fsip_contracttype_value": "f13ce9c0-42a9-ec11-9840-000d3a307669",
      "fsip_sendescalationletter@OData.Community.Display.V1.FormattedValue": "No",
      "fsip_sendescalationletter": false,
      "lcd_braketestprice": "850",
      "utcconversiontimezonecode": null,
      "_createdonbehalfby_value": null,
      "fsip_numberofvisits": "1",
      "fsip_totalcontract_base": null,
      "fsip_grossmarginpercent@OData.Community.Display.V1.FormattedValue": "100.00",
      "fsip_grossmarginpercent": 100.00,
      "fsip_certificateofinsurance@OData.Community.Display.V1.FormattedValue": "No",
      "fsip_certificateofinsurance": false,
      "fsip_permitfeesbillable@OData.Community.Display.V1.FormattedValue": "No",
      "fsip_permitfeesbillable": false,
      "fsip_billingendon": null,
      "fsip_lastinvoiced@OData.Community.Display.V1.FormattedValue": "12/1/2025",
      "fsip_lastinvoiced": "2025-12-01T13:02:42Z",
      "fsip_internalnote": null,
      "fsip_escalationfrequency": null,
      "fsip_name": "499 East 188th Street",
      "fsip_workorderconsolidationtype@OData.Community.Display.V1.FormattedValue": "By Contract",
      "fsip_workorderconsolidationtype": 683440000,
      "fsip_addalldevicescontractbillings": null,
      "fsip_lastescalationlettersent": null,
      "fsip_otminoradjustmentscbservice@OData.Community.Display.V1.FormattedValue": "No",
      "fsip_otminoradjustmentscbservice": false,
      "fsip_duration": null,
      "lcd_daystoexpire@OData.Community.Display.V1.FormattedValue": "12.00",
      "lcd_daystoexpire": 12.0000000000,
      "fsip_3rdyearescalation": null,
      "fsip_invoicingmethod@OData.Community.Display.V1.FormattedValue": "Work Order Billing",
      "fsip_invoicingmethod": 683440001,
      "lcd_cat5fullloadbillable@OData.Community.Display.V1.FormattedValue": "Yes",
      "lcd_cat5fullloadbillable": 802290000,
      "fsip_cancelon@OData.Community.Display.V1.FormattedValue": "12/31/2025",
      "fsip_cancelon": "2025-12-31",
      "fsip_originalcontractstartdate@OData.Community.Display.V1.FormattedValue": "9/1/2025",
      "fsip_originalcontractstartdate": "2025-09-01",
      "fsip_contractnumber": "MC-0003129",
      "fsip_exclusions": null,
      "_fsip_product_value": null,
      "fsip_quantity": null,
      "fsip_usediscountaspercentage@OData.Community.Display.V1.FormattedValue": "Amount",
      "fsip_usediscountaspercentage": false,
      "fsip_contractlanguage": null,
      "fsip_currentcontractyear": null,
      "lcd_originalcontractamount_base": null,
      "_modifiedonbehalfby_value": null,
      "fsip_fiveyearsafetytest@OData.Community.Display.V1.FormattedValue": "No",
      "fsip_fiveyearsafetytest": false,
      "fsip_closedate@OData.Community.Display.V1.FormattedValue": "12/31/2025",
      "fsip_closedate": "2025-12-31",
      "fsip_invoiceamount_base": null,
      "versionnumber@OData.Community.Display.V1.FormattedValue": "124,813,710",
      "versionnumber": 124813710,
      "fsip_description": null,
      "fsip_activeon": null,
      "fsip_billingenddate": null,
      "fsip_activemmr_base@OData.Community.Display.V1.FormattedValue": "$0.00",
      "fsip_activemmr_base": 0.0000000000,
      "statuscode@OData.Community.Display.V1.FormattedValue": "Cancelled",
      "statuscode": 2,
      "fsip_testbillable@OData.Community.Display.V1.FormattedValue": "No",
      "fsip_testbillable": false,
      "createdon@OData.Community.Display.V1.FormattedValue": "10/29/2025 11:42 AM",
      "createdon": "2025-10-29T11:42:30Z",
      "fsip_holdnote": null,
      "fsip_grossmargin_base@OData.Community.Display.V1.FormattedValue": "$3,576.00",
      "fsip_grossmargin_base": 3576.0000000000,
      "_fsip_serviceaddress_value": null,
      "fsip_activemmr@OData.Community.Display.V1.FormattedValue": "$0.00",
      "fsip_activemmr": 0.0000000000,
      "lcd_braketestbillable@OData.Community.Display.V1.FormattedValue": "Yes",
      "lcd_braketestbillable": 802290000,
      "fsip_1styearescalation": null,
      "fsip_currentactualprofitpercent": null,
      "fsip_lastinvoicerollup_date@OData.Community.Display.V1.FormattedValue": "1/12/2026 8:46 PM",
      "fsip_lastinvoicerollup_date": "2026-01-12T20:46:52Z",
      "fsip_billinginprogress@OData.Community.Display.V1.FormattedValue": "No",
      "fsip_billinginprogress": false
    },
    {
      "@odata.etag": "W/\"124813711\"",
      "lcd_cancellationnotes": null,
      "fsip_po": null,
      "fsip_billingfrequency": null,
      "lcd_cat1annualprice": "775",
      "fsip_expireson": null,
      "fsip_won@OData.Community.Display.V1.FormattedValue": "No",
      "fsip_won": false,
      "fsip_schedulinginprogress@OData.Community.Display.V1.FormattedValue": "No",
      "fsip_schedulinginprogress": false,
      "_fsip_sortbyaccount_value@OData.Community.Display.V1.FormattedValue": "SOBRO",
      "_fsip_sortbyaccount_value": "3abeb8be-f88f-f011-b4cb-00224805bbe5",
      "fsip_invoiced@OData.Community.Display.V1.FormattedValue": "$1,708.00",
      "fsip_invoiced": 1708.0000000000,
      "fsip_currentannualamount_base": null,
      "fsip_currentcontractstartdate@OData.Community.Display.V1.FormattedValue": "9/1/2025",
      "fsip_currentcontractstartdate": "2025-09-01",
      "fsip_nextescalationdate": null,
      "fsip_billingstarton": null,
      "fsip_costs_base@OData.Community.Display.V1.FormattedValue": "$0.00",
      "fsip_costs_base": 0.0000000000,
      "fsip_nextcontractbillingdate": null,
      "fsip_4thyearescalation": null,
      "fsip_invoiced_date@OData.Community.Display.V1.FormattedValue": "1/12/2026 8:46 PM",
      "fsip_invoiced_date": "2026-01-12T20:46:52Z",
      "fsip_billingfrequencycode": null,
      "lcd_cat5fullloadprice": "1550",
      "_fsip_copydevicesfromcontract_value": null,
      "statecode@OData.Community.Display.V1.FormattedValue": "Inactive",
      "statecode": 1,
      "fsip_regulartimecbservice@OData.Community.Display.V1.FormattedValue": "No",
      "fsip_regulartimecbservice": false,
      "fsip_costs_date@OData.Community.Display.V1.FormattedValue": "1/12/2026 8:46 PM",
      "fsip_costs_date": "2026-01-12T20:46:52Z",
      "_fsip_copydevicesfrombuildinglocation_value": null,
      "lcd_originalcontractamount": null,
      "fsip_closedstatus@OData.Community.Display.V1.FormattedValue": "Cancelled",
      "fsip_closedstatus": 2,
      "_fsip_customerid_value@OData.Community.Display.V1.FormattedValue": "SOBRO",
      "_fsip_customerid_value": "3abeb8be-f88f-f011-b4cb-00224805bbe5",
      "fsip_contractservicelevelcode": null,
      "fsip_invoiceamount": null,
      "_modifiedby_value@OData.Community.Display.V1.FormattedValue": "# SCRIBE INTEGRATION",
      "_modifiedby_value": "910423db-6a8d-ef11-ac21-000d3a326f08",
      "modifiedon@OData.Community.Display.V1.FormattedValue": "12/16/2025 2:10 PM",
      "modifiedon": "2025-12-16T14:10:48Z",
      "lcd_cancelationnotifyoffice@OData.Community.Display.V1.FormattedValue": "No",
      "lcd_cancelationnotifyoffice": 802290001,
      "lcd_autorenewal@OData.Community.Display.V1.FormattedValue": "No",
      "lcd_autorenewal": 802290001,
      "fsip_billingnotecb": null,
      "fsip_lastinvoiced_state@OData.Community.Display.V1.FormattedValue": "1",
      "fsip_lastinvoiced_state": 1,
      "fsip_costs_state@OData.Community.Display.V1.FormattedValue": "1",
      "fsip_costs_state": 1,
      "fsip_percentageoramount": null,
      "fsip_escalationamount_base": null,
      "fsip_closecontract@OData.Community.Display.V1.FormattedValue": "No",
      "fsip_closecontract": false,
      "overriddencreatedon": null,
      "lcd_cat1annualbillable@OData.Community.Display.V1.FormattedValue": "Yes",
      "lcd_cat1annualbillable": 802290000,
      "fsip_activemmr_date@OData.Community.Display.V1.FormattedValue": "1/12/2026 8:46 PM",
      "fsip_activemmr_date": "2026-01-12T20:46:52Z",
      "fsip_specialconditions": null,
      "fsip_currentcontractenddate@OData.Community.Display.V1.FormattedValue": "12/31/2025",
      "fsip_currentcontractenddate": "2025-12-31",
      "lcd_servicefrequencywords": "Monthly",
      "fsip_cleanpithoistwaycartops@OData.Community.Display.V1.FormattedValue": "No",
      "fsip_cleanpithoistwaycartops": false,
      "fsip_5thyearescalation": null,
      "fsip_totalcontract": null,
      "_owningteam_value": null,
      "fsip_autorenew@OData.Community.Display.V1.FormattedValue": "No",
      "fsip_autorenew": false,
      "fsip_escalationpercent": null,
      "exchangerate@OData.Community.Display.V1.FormattedValue": "1.0000000000",
      "exchangerate": 1.000000000000,
      "fsip_excludefromcontractescalations@OData.Community.Display.V1.FormattedValue": "No",
      "fsip_excludefromcontractescalations": false,
      "fsip_annualsafetytest@OData.Community.Display.V1.FormattedValue": "No",
      "fsip_annualsafetytest": false,
      "fsip_nextservicedate@OData.Community.Display.V1.FormattedValue": "1/1/2026",
      "fsip_nextservicedate": "2026-01-01T11:00:00Z",
      "fsip_onhold@OData.Community.Display.V1.FormattedValue": "No",
      "fsip_onhold": false,
      "fsip_currentannualamount": null,
      "_createdby_value@OData.Community.Display.V1.FormattedValue": "Barbara Oliveira",
      "_createdby_value": "554d6842-59b6-ef11-b8e9-000d3a5a6b66",
      "fsip_activemmr_state@OData.Community.Display.V1.FormattedValue": "1",
      "fsip_activemmr_state": 1,
      "fsip_2ndyearescalation": null,
      "_fsip_wagecategory_value": null,
      "fsip_maintenancecontractid": "799755b8-bdb4-f011-bbd3-000d3a302e4a",
      "fsip_contractreviewdate": null,
      "fsip_lastinvoicerollup_state@OData.Community.Display.V1.FormattedValue": "1",
      "fsip_lastinvoicerollup_state": 1,
      "fsip_invoiced_state@OData.Community.Display.V1.FormattedValue": "1",
      "fsip_invoiced_state": 1,
      "fsip_2ndyearescalation_base": null,
      "fsip_5thyearescalation_base": null,
      "fsip_proratedequipment": null,
      "_fsip_originatingcontract_value": null,
      "lcd_runcancelflow@OData.Community.Display.V1.FormattedValue": "No",
      "lcd_runcancelflow": 802290001,
      "fsip_nextbillingdate": null,
      "lcd_createcontractbilling": null,
      "fsip_lastinvoicerollup@OData.Community.Display.V1.FormattedValue": "12/1/2025",
      "fsip_lastinvoicerollup": "2025-12-01",
      "fsip_billingnote": null,
      "_fsip_salesperson_value": null,
      "fsip_invoiceconsolidationtype@OData.Community.Display.V1.FormattedValue": "By Contract",
      "fsip_invoiceconsolidationtype": 683440002,
      "fsip_4thyearescalation_base": null,
      "_fsip_billtocustomer_value@OData.Community.Display.V1.FormattedValue": "SOBRO",
      "_fsip_billtocustomer_value": "3abeb8be-f88f-f011-b4cb-00224805bbe5",
      "fsip_costs@OData.Community.Display.V1.FormattedValue": "$0.00",
      "fsip_costs": 0.0000000000,
      "_owningbusinessunit_value@OData.Community.Display.V1.FormattedValue": "LCD Elevator",
      "_owningbusinessunit_value": "c9e85d8b-8fa0-ec11-b400-000d3a58d68e",
      "fsip_legacycontract": null,
      "fsip_printbillingnote@OData.Community.Display.V1.FormattedValue": "Yes",
      "fsip_printbillingnote": true,
      "timezoneruleversionnumber@OData.Community.Display.V1.FormattedValue": "0",
      "timezoneruleversionnumber": 0,
      "fsip_grossmargin@OData.Community.Display.V1.FormattedValue": "$1,708.00",
      "fsip_grossmargin": 1708.0000000000,
      "fsip_payssafetyequipment": null,
      "_ownerid_value@OData.Community.Display.V1.FormattedValue": "Barbara Oliveira",
      "_ownerid_value": "554d6842-59b6-ef11-b8e9-000d3a5a6b66",
      "_fsip_primarybuildinglocation_value@OData.Community.Display.V1.FormattedValue": "35 West 131 Street",
      "_fsip_primarybuildinglocation_value": "74d66c25-1caa-ec11-9840-000d3a307669",
      "fsip_lastinvoiced_date@OData.Community.Display.V1.FormattedValue": "1/12/2026 8:46 PM",
      "fsip_lastinvoiced_date": "2026-01-12T20:46:52Z",
      "fsip_invoiced_base@OData.Community.Display.V1.FormattedValue": "$1,708.00",
      "fsip_invoiced_base": 1708.0000000000,
      "importsequencenumber": null,
      "fsip_escalationamount": null,
      "fsip_1styearescalation_base": null,
      "_owninguser_value": "554d6842-59b6-ef11-b8e9-000d3a5a6b66",
      "_transactioncurrencyid_value@OData.Community.Display.V1.FormattedValue": "US Dollar",
      "_transactioncurrencyid_value": "28c060c5-d1a0-ec11-b400-000d3a58d68e",
      "_fsip_productcb_value": null,
      "fsip_visitfrequency@OData.Community.Display.V1.FormattedValue": "30",
      "fsip_visitfrequency": 683440000,
      "fsip_3rdyearescalation_base": null,
      "_fsip_project_value": null,
      "_fsip_division_value@OData.Community.Display.V1.FormattedValue": "Maintenance",
      "_fsip_division_value": "9316e0ff-55a5-ec11-9840-000d3a5c16ba",
      "_fsip_contracttype_value@OData.Community.Display.V1.FormattedValue": "Limited Service",
      "_fsip_contracttype_value": "f13ce9c0-42a9-ec11-9840-000d3a307669",
      "fsip_sendescalationletter@OData.Community.Display.V1.FormattedValue": "No",
      "fsip_sendescalationletter": false,
      "lcd_braketestprice": "850",
      "utcconversiontimezonecode": null,
      "_createdonbehalfby_value": null,
      "fsip_numberofvisits": "1",
      "fsip_totalcontract_base": null,
      "fsip_grossmarginpercent@OData.Community.Display.V1.FormattedValue": "100.00",
      "fsip_grossmarginpercent": 100.00,
      "fsip_certificateofinsurance@OData.Community.Display.V1.FormattedValue": "No",
      "fsip_certificateofinsurance": false,
      "fsip_permitfeesbillable@OData.Community.Display.V1.FormattedValue": "No",
      "fsip_permitfeesbillable": false,
      "fsip_billingendon": null,
      "fsip_lastinvoiced@OData.Community.Display.V1.FormattedValue": "12/1/2025",
      "fsip_lastinvoiced": "2025-12-01T13:02:42Z",
      "fsip_internalnote": null,
      "fsip_escalationfrequency": null,
      "fsip_name": "35 West 131 Street",
      "fsip_workorderconsolidationtype@OData.Community.Display.V1.FormattedValue": "By Contract",
      "fsip_workorderconsolidationtype": 683440000,
      "fsip_addalldevicescontractbillings@OData.Community.Display.V1.FormattedValue": "No",
      "fsip_addalldevicescontractbillings": false,
      "fsip_lastescalationlettersent": null,
      "fsip_otminoradjustmentscbservice@OData.Community.Display.V1.FormattedValue": "No",
      "fsip_otminoradjustmentscbservice": false,
      "fsip_duration": null,
      "lcd_daystoexpire@OData.Community.Display.V1.FormattedValue": "12.00",
      "lcd_daystoexpire": 12.0000000000,
      "fsip_3rdyearescalation": null,
      "fsip_invoicingmethod@OData.Community.Display.V1.FormattedValue": "Work Order Billing",
      "fsip_invoicingmethod": 683440001,
      "lcd_cat5fullloadbillable@OData.Community.Display.V1.FormattedValue": "Yes",
      "lcd_cat5fullloadbillable": 802290000,
      "fsip_cancelon@OData.Community.Display.V1.FormattedValue": "12/31/2025",
      "fsip_cancelon": "2025-12-31",
      "fsip_originalcontractstartdate@OData.Community.Display.V1.FormattedValue": "9/1/2025",
      "fsip_originalcontractstartdate": "2025-09-01",
      "fsip_contractnumber": "MC-0003130",
      "fsip_exclusions": null,
      "_fsip_product_value": null,
      "fsip_quantity": null,
      "fsip_usediscountaspercentage@OData.Community.Display.V1.FormattedValue": "Amount",
      "fsip_usediscountaspercentage": false,
      "fsip_contractlanguage": null,
      "fsip_currentcontractyear": null,
      "lcd_originalcontractamount_base": null,
      "_modifiedonbehalfby_value": null,
      "fsip_fiveyearsafetytest@OData.Community.Display.V1.FormattedValue": "No",
      "fsip_fiveyearsafetytest": false,
      "fsip_closedate@OData.Community.Display.V1.FormattedValue": "12/31/2025",
      "fsip_closedate": "2025-12-31",
      "fsip_invoiceamount_base": null,
      "versionnumber@OData.Community.Display.V1.FormattedValue": "124,813,711",
      "versionnumber": 124813711,
      "fsip_description": null,
      "fsip_activeon": null,
      "fsip_billingenddate": null,
      "fsip_activemmr_base@OData.Community.Display.V1.FormattedValue": "$0.00",
      "fsip_activemmr_base": 0.0000000000,
      "statuscode@OData.Community.Display.V1.FormattedValue": "Cancelled",
      "statuscode": 2,
      "fsip_testbillable@OData.Community.Display.V1.FormattedValue": "No",
      "fsip_testbillable": false,
      "createdon@OData.Community.Display.V1.FormattedValue": "10/29/2025 11:52 AM",
      "createdon": "2025-10-29T11:52:27Z",
      "fsip_holdnote": null,
      "fsip_grossmargin_base@OData.Community.Display.V1.FormattedValue": "$1,708.00",
      "fsip_grossmargin_base": 1708.0000000000,
      "_fsip_serviceaddress_value": null,
      "fsip_activemmr@OData.Community.Display.V1.FormattedValue": "$0.00",
      "fsip_activemmr": 0.0000000000,
      "lcd_braketestbillable@OData.Community.Display.V1.FormattedValue": "Yes",
      "lcd_braketestbillable": 802290000,
      "fsip_1styearescalation": null,
      "fsip_currentactualprofitpercent": null,
      "fsip_lastinvoicerollup_date@OData.Community.Display.V1.FormattedValue": "1/12/2026 8:46 PM",
      "fsip_lastinvoicerollup_date": "2026-01-12T20:46:52Z",
      "fsip_billinginprogress@OData.Community.Display.V1.FormattedValue": "No",
      "fsip_billinginprogress": false
    },
    {
      "@odata.etag": "W/\"126387355\"",
      "lcd_cancellationnotes": null,
      "fsip_po": null,
      "fsip_billingfrequency": null,
      "lcd_cat1annualprice": "875",
      "fsip_expireson": null,
      "fsip_won@OData.Community.Display.V1.FormattedValue": "No",
      "fsip_won": false,
      "fsip_schedulinginprogress@OData.Community.Display.V1.FormattedValue": "No",
      "fsip_schedulinginprogress": false,
      "_fsip_sortbyaccount_value@OData.Community.Display.V1.FormattedValue": "The Wavecrest Management Team Ltd",
      "_fsip_sortbyaccount_value": "963a6f48-a5b5-f011-bbd3-6045bd09d0fc",
      "fsip_invoiced@OData.Community.Display.V1.FormattedValue": "$1,341.00",
      "fsip_invoiced": 1341.0000000000,
      "fsip_currentannualamount_base": null,
      "fsip_currentcontractstartdate@OData.Community.Display.V1.FormattedValue": "10/29/2025",
      "fsip_currentcontractstartdate": "2025-10-29",
      "fsip_nextescalationdate": null,
      "fsip_billingstarton": null,
      "fsip_costs_base@OData.Community.Display.V1.FormattedValue": "$0.00",
      "fsip_costs_base": 0.0000000000,
      "fsip_nextcontractbillingdate@OData.Community.Display.V1.FormattedValue": "2/1/2026",
      "fsip_nextcontractbillingdate": "2026-02-01",
      "fsip_4thyearescalation": null,
      "fsip_invoiced_date@OData.Community.Display.V1.FormattedValue": "1/12/2026 8:46 PM",
      "fsip_invoiced_date": "2026-01-12T20:46:52Z",
      "fsip_billingfrequencycode": null,
      "lcd_cat5fullloadprice": "1550",
      "_fsip_copydevicesfromcontract_value": null,
      "statecode@OData.Community.Display.V1.FormattedValue": "Active",
      "statecode": 0,
      "fsip_regulartimecbservice@OData.Community.Display.V1.FormattedValue": "No",
      "fsip_regulartimecbservice": false,
      "fsip_costs_date@OData.Community.Display.V1.FormattedValue": "1/12/2026 8:46 PM",
      "fsip_costs_date": "2026-01-12T20:46:52Z",
      "_fsip_copydevicesfrombuildinglocation_value": null,
      "lcd_originalcontractamount": null,
      "fsip_closedstatus": null,
      "_fsip_customerid_value@OData.Community.Display.V1.FormattedValue": "The Wavecrest Management Team Ltd",
      "_fsip_customerid_value": "963a6f48-a5b5-f011-bbd3-6045bd09d0fc",
      "fsip_contractservicelevelcode": null,
      "fsip_invoiceamount": null,
      "_modifiedby_value@OData.Community.Display.V1.FormattedValue": "# SCRIBE INTEGRATION",
      "_modifiedby_value": "910423db-6a8d-ef11-ac21-000d3a326f08",
      "modifiedon@OData.Community.Display.V1.FormattedValue": "1/5/2026 12:59 PM",
      "modifiedon": "2026-01-05T12:59:41Z",
      "lcd_cancelationnotifyoffice@OData.Community.Display.V1.FormattedValue": "No",
      "lcd_cancelationnotifyoffice": 802290001,
      "lcd_autorenewal": null,
      "fsip_billingnotecb": null,
      "fsip_lastinvoiced_state@OData.Community.Display.V1.FormattedValue": "1",
      "fsip_lastinvoiced_state": 1,
      "fsip_costs_state@OData.Community.Display.V1.FormattedValue": "1",
      "fsip_costs_state": 1,
      "fsip_percentageoramount": null,
      "fsip_escalationamount_base": null,
      "fsip_closecontract@OData.Community.Display.V1.FormattedValue": "No",
      "fsip_closecontract": false,
      "overriddencreatedon": null,
      "lcd_cat1annualbillable@OData.Community.Display.V1.FormattedValue": "Yes",
      "lcd_cat1annualbillable": 802290000,
      "fsip_activemmr_date@OData.Community.Display.V1.FormattedValue": "1/12/2026 8:46 PM",
      "fsip_activemmr_date": "2026-01-12T20:46:52Z",
      "fsip_specialconditions": null,
      "fsip_currentcontractenddate@OData.Community.Display.V1.FormattedValue": "10/29/2026",
      "fsip_currentcontractenddate": "2026-10-29",
      "lcd_servicefrequencywords": "Monthly",
      "fsip_cleanpithoistwaycartops@OData.Community.Display.V1.FormattedValue": "No",
      "fsip_cleanpithoistwaycartops": false,
      "fsip_5thyearescalation": null,
      "fsip_totalcontract": null,
      "_owningteam_value": null,
      "fsip_autorenew@OData.Community.Display.V1.FormattedValue": "No",
      "fsip_autorenew": false,
      "fsip_escalationpercent": null,
      "exchangerate@OData.Community.Display.V1.FormattedValue": "1.0000000000",
      "exchangerate": 1.000000000000,
      "fsip_excludefromcontractescalations@OData.Community.Display.V1.FormattedValue": "No",
      "fsip_excludefromcontractescalations": false,
      "fsip_annualsafetytest@OData.Community.Display.V1.FormattedValue": "No",
      "fsip_annualsafetytest": false,
      "fsip_nextservicedate@OData.Community.Display.V1.FormattedValue": "2/28/2026",
      "fsip_nextservicedate": "2026-02-28T11:00:00Z",
      "fsip_onhold@OData.Community.Display.V1.FormattedValue": "No",
      "fsip_onhold": false,
      "fsip_currentannualamount": null,
      "_createdby_value@OData.Community.Display.V1.FormattedValue": "Barbara Oliveira",
      "_createdby_value": "554d6842-59b6-ef11-b8e9-000d3a5a6b66",
      "fsip_activemmr_state@OData.Community.Display.V1.FormattedValue": "1",
      "fsip_activemmr_state": 1,
      "fsip_2ndyearescalation": null,
      "_fsip_wagecategory_value": null,
      "fsip_maintenancecontractid": "2669956c-d6b4-f011-bbd3-000d3a302e4a",
      "fsip_contractreviewdate": null,
      "fsip_lastinvoicerollup_state@OData.Community.Display.V1.FormattedValue": "1",
      "fsip_lastinvoicerollup_state": 1,
      "fsip_invoiced_state@OData.Community.Display.V1.FormattedValue": "1",
      "fsip_invoiced_state": 1,
      "fsip_2ndyearescalation_base": null,
      "fsip_5thyearescalation_base": null,
      "fsip_proratedequipment": null,
      "_fsip_originatingcontract_value": null,
      "lcd_runcancelflow@OData.Community.Display.V1.FormattedValue": "No",
      "lcd_runcancelflow": 802290001,
      "fsip_nextbillingdate": null,
      "lcd_createcontractbilling": null,
      "fsip_lastinvoicerollup@OData.Community.Display.V1.FormattedValue": "1/1/2026",
      "fsip_lastinvoicerollup": "2026-01-01",
      "fsip_billingnote": null,
      "_fsip_salesperson_value@OData.Community.Display.V1.FormattedValue": "Bill Appelbaum",
      "_fsip_salesperson_value": "caf5f82b-0baa-ec11-9840-000d3a302927",
      "fsip_invoiceconsolidationtype@OData.Community.Display.V1.FormattedValue": "By Contract",
      "fsip_invoiceconsolidationtype": 683440002,
      "fsip_4thyearescalation_base": null,
      "_fsip_billtocustomer_value@OData.Community.Display.V1.FormattedValue": "The Wavecrest Management Team Ltd",
      "_fsip_billtocustomer_value": "963a6f48-a5b5-f011-bbd3-6045bd09d0fc",
      "fsip_costs@OData.Community.Display.V1.FormattedValue": "$0.00",
      "fsip_costs": 0.0000000000,
      "_owningbusinessunit_value@OData.Community.Display.V1.FormattedValue": "LCD Elevator",
      "_owningbusinessunit_value": "c9e85d8b-8fa0-ec11-b400-000d3a58d68e",
      "fsip_legacycontract": null,
      "fsip_printbillingnote@OData.Community.Display.V1.FormattedValue": "Yes",
      "fsip_printbillingnote": true,
      "timezoneruleversionnumber@OData.Community.Display.V1.FormattedValue": "4",
      "timezoneruleversionnumber": 4,
      "fsip_grossmargin@OData.Community.Display.V1.FormattedValue": "$1,341.00",
      "fsip_grossmargin": 1341.0000000000,
      "fsip_payssafetyequipment": null,
      "_ownerid_value@OData.Community.Display.V1.FormattedValue": "Barbara Oliveira",
      "_ownerid_value": "554d6842-59b6-ef11-b8e9-000d3a5a6b66",
      "_fsip_primarybuildinglocation_value@OData.Community.Display.V1.FormattedValue": "2029 Second Avenue",
      "_fsip_primarybuildinglocation_value": "eb1aa1b7-d442-f011-b4cb-0022480876c8",
      "fsip_lastinvoiced_date@OData.Community.Display.V1.FormattedValue": "1/12/2026 8:46 PM",
      "fsip_lastinvoiced_date": "2026-01-12T20:46:52Z",
      "fsip_invoiced_base@OData.Community.Display.V1.FormattedValue": "$1,341.00",
      "fsip_invoiced_base": 1341.0000000000,
      "importsequencenumber": null,
      "fsip_escalationamount": null,
      "fsip_1styearescalation_base": null,
      "_owninguser_value": "554d6842-59b6-ef11-b8e9-000d3a5a6b66",
      "_transactioncurrencyid_value@OData.Community.Display.V1.FormattedValue": "US Dollar",
      "_transactioncurrencyid_value": "28c060c5-d1a0-ec11-b400-000d3a58d68e",
      "_fsip_productcb_value": null,
      "fsip_visitfrequency@OData.Community.Display.V1.FormattedValue": "30",
      "fsip_visitfrequency": 683440000,
      "fsip_3rdyearescalation_base": null,
      "_fsip_project_value": null,
      "_fsip_division_value@OData.Community.Display.V1.FormattedValue": "Maintenance",
      "_fsip_division_value": "9316e0ff-55a5-ec11-9840-000d3a5c16ba",
      "_fsip_contracttype_value@OData.Community.Display.V1.FormattedValue": "Limited Service",
      "_fsip_contracttype_value": "f13ce9c0-42a9-ec11-9840-000d3a307669",
      "fsip_sendescalationletter@OData.Community.Display.V1.FormattedValue": "No",
      "fsip_sendescalationletter": false,
      "lcd_braketestprice": "850",
      "utcconversiontimezonecode": null,
      "_createdonbehalfby_value": null,
      "fsip_numberofvisits": "1",
      "fsip_totalcontract_base": null,
      "fsip_grossmarginpercent@OData.Community.Display.V1.FormattedValue": "100.00",
      "fsip_grossmarginpercent": 100.00,
      "fsip_certificateofinsurance@OData.Community.Display.V1.FormattedValue": "No",
      "fsip_certificateofinsurance": false,
      "fsip_permitfeesbillable@OData.Community.Display.V1.FormattedValue": "No",
      "fsip_permitfeesbillable": false,
      "fsip_billingendon": null,
      "fsip_lastinvoiced@OData.Community.Display.V1.FormattedValue": "1/5/2026",
      "fsip_lastinvoiced": "2026-01-05T12:56:43Z",
      "fsip_internalnote": null,
      "fsip_escalationfrequency": null,
      "fsip_name": "2029 Second Avenue",
      "fsip_workorderconsolidationtype@OData.Community.Display.V1.FormattedValue": "By Contract",
      "fsip_workorderconsolidationtype": 683440000,
      "fsip_addalldevicescontractbillings@OData.Community.Display.V1.FormattedValue": "No",
      "fsip_addalldevicescontractbillings": false,
      "fsip_lastescalationlettersent": null,
      "fsip_otminoradjustmentscbservice@OData.Community.Display.V1.FormattedValue": "No",
      "fsip_otminoradjustmentscbservice": false,
      "fsip_duration": null,
      "lcd_daystoexpire@OData.Community.Display.V1.FormattedValue": "-290.00",
      "lcd_daystoexpire": -290.0000000000,
      "fsip_3rdyearescalation": null,
      "fsip_invoicingmethod@OData.Community.Display.V1.FormattedValue": "Work Order Billing",
      "fsip_invoicingmethod": 683440001,
      "lcd_cat5fullloadbillable@OData.Community.Display.V1.FormattedValue": "Yes",
      "lcd_cat5fullloadbillable": 802290000,
      "fsip_cancelon": null,
      "fsip_originalcontractstartdate@OData.Community.Display.V1.FormattedValue": "10/29/2025",
      "fsip_originalcontractstartdate": "2025-10-29",
      "fsip_contractnumber": "MC-0003131",
      "fsip_exclusions": null,
      "_fsip_product_value": null,
      "fsip_quantity": null,
      "fsip_usediscountaspercentage@OData.Community.Display.V1.FormattedValue": "Amount",
      "fsip_usediscountaspercentage": false,
      "fsip_contractlanguage": null,
      "fsip_currentcontractyear": null,
      "lcd_originalcontractamount_base": null,
      "_modifiedonbehalfby_value": null,
      "fsip_fiveyearsafetytest@OData.Community.Display.V1.FormattedValue": "No",
      "fsip_fiveyearsafetytest": false,
      "fsip_closedate": null,
      "fsip_invoiceamount_base": null,
      "versionnumber@OData.Community.Display.V1.FormattedValue": "126,387,355",
      "versionnumber": 126387355,
      "fsip_description": null,
      "fsip_activeon": null,
      "fsip_billingenddate": null,
      "fsip_activemmr_base@OData.Community.Display.V1.FormattedValue": "$447.00",
      "fsip_activemmr_base": 447.0000000000,
      "statuscode@OData.Community.Display.V1.FormattedValue": "Active",
      "statuscode": 683440001,
      "fsip_testbillable@OData.Community.Display.V1.FormattedValue": "No",
      "fsip_testbillable": false,
      "createdon@OData.Community.Display.V1.FormattedValue": "10/29/2025 2:49 PM",
      "createdon": "2025-10-29T14:49:15Z",
      "fsip_holdnote": null,
      "fsip_grossmargin_base@OData.Community.Display.V1.FormattedValue": "$1,341.00",
      "fsip_grossmargin_base": 1341.0000000000,
      "_fsip_serviceaddress_value": null,
      "fsip_activemmr@OData.Community.Display.V1.FormattedValue": "$447.00",
      "fsip_activemmr": 447.0000000000,
      "lcd_braketestbillable@OData.Community.Display.V1.FormattedValue": "Yes",
      "lcd_braketestbillable": 802290000,
      "fsip_1styearescalation": null,
      "fsip_currentactualprofitpercent": null,
      "fsip_lastinvoicerollup_date@OData.Community.Display.V1.FormattedValue": "1/12/2026 8:46 PM",
      "fsip_lastinvoicerollup_date": "2026-01-12T20:46:52Z",
      "fsip_billinginprogress@OData.Community.Display.V1.FormattedValue": "No",
      "fsip_billinginprogress": false
    },
    {
      "@odata.etag": "W/\"126387433\"",
      "lcd_cancellationnotes": null,
      "fsip_po": null,
      "fsip_billingfrequency": null,
      "lcd_cat1annualprice": null,
      "fsip_expireson": null,
      "fsip_won@OData.Community.Display.V1.FormattedValue": "No",
      "fsip_won": false,
      "fsip_schedulinginprogress@OData.Community.Display.V1.FormattedValue": "No",
      "fsip_schedulinginprogress": false,
      "_fsip_sortbyaccount_value@OData.Community.Display.V1.FormattedValue": "The Abeco Organization",
      "_fsip_sortbyaccount_value": "a5129b18-45a9-ec11-9840-000d3a307669",
      "fsip_invoiced@OData.Community.Display.V1.FormattedValue": "$1,875.00",
      "fsip_invoiced": 1875.0000000000,
      "fsip_currentannualamount_base": null,
      "fsip_currentcontractstartdate@OData.Community.Display.V1.FormattedValue": "11/5/2025",
      "fsip_currentcontractstartdate": "2025-11-05",
      "fsip_nextescalationdate": null,
      "fsip_billingstarton": null,
      "fsip_costs_base@OData.Community.Display.V1.FormattedValue": "$0.00",
      "fsip_costs_base": 0.0000000000,
      "fsip_nextcontractbillingdate@OData.Community.Display.V1.FormattedValue": "2/1/2026",
      "fsip_nextcontractbillingdate": "2026-02-01",
      "fsip_4thyearescalation": null,
      "fsip_invoiced_date@OData.Community.Display.V1.FormattedValue": "1/12/2026 8:46 PM",
      "fsip_invoiced_date": "2026-01-12T20:46:52Z",
      "fsip_billingfrequencycode": null,
      "lcd_cat5fullloadprice": null,
      "_fsip_copydevicesfromcontract_value": null,
      "statecode@OData.Community.Display.V1.FormattedValue": "Active",
      "statecode": 0,
      "fsip_regulartimecbservice@OData.Community.Display.V1.FormattedValue": "No",
      "fsip_regulartimecbservice": false,
      "fsip_costs_date@OData.Community.Display.V1.FormattedValue": "1/12/2026 8:46 PM",
      "fsip_costs_date": "2026-01-12T20:46:52Z",
      "_fsip_copydevicesfrombuildinglocation_value": null,
      "lcd_originalcontractamount": null,
      "fsip_closedstatus": null,
      "_fsip_customerid_value@OData.Community.Display.V1.FormattedValue": "The Abeco Organization",
      "_fsip_customerid_value": "a5129b18-45a9-ec11-9840-000d3a307669",
      "fsip_contractservicelevelcode": null,
      "fsip_invoiceamount": null,
      "_modifiedby_value@OData.Community.Display.V1.FormattedValue": "# SCRIBE INTEGRATION",
      "_modifiedby_value": "910423db-6a8d-ef11-ac21-000d3a326f08",
      "modifiedon@OData.Community.Display.V1.FormattedValue": "1/5/2026 12:59 PM",
      "modifiedon": "2026-01-05T12:59:42Z",
      "lcd_cancelationnotifyoffice@OData.Community.Display.V1.FormattedValue": "No",
      "lcd_cancelationnotifyoffice": 802290001,
      "lcd_autorenewal@OData.Community.Display.V1.FormattedValue": "Yes",
      "lcd_autorenewal": 802290000,
      "fsip_billingnotecb": null,
      "fsip_lastinvoiced_state@OData.Community.Display.V1.FormattedValue": "1",
      "fsip_lastinvoiced_state": 1,
      "fsip_costs_state@OData.Community.Display.V1.FormattedValue": "1",
      "fsip_costs_state": 1,
      "fsip_percentageoramount": null,
      "fsip_escalationamount_base": null,
      "fsip_closecontract@OData.Community.Display.V1.FormattedValue": "No",
      "fsip_closecontract": false,
      "overriddencreatedon": null,
      "lcd_cat1annualbillable@OData.Community.Display.V1.FormattedValue": "No",
      "lcd_cat1annualbillable": 802290001,
      "fsip_activemmr_date@OData.Community.Display.V1.FormattedValue": "1/12/2026 8:46 PM",
      "fsip_activemmr_date": "2026-01-12T20:46:52Z",
      "fsip_specialconditions": null,
      "fsip_currentcontractenddate@OData.Community.Display.V1.FormattedValue": "11/5/2026",
      "fsip_currentcontractenddate": "2026-11-05",
      "lcd_servicefrequencywords": "Monthly",
      "fsip_cleanpithoistwaycartops@OData.Community.Display.V1.FormattedValue": "No",
      "fsip_cleanpithoistwaycartops": false,
      "fsip_5thyearescalation": null,
      "fsip_totalcontract": null,
      "_owningteam_value": null,
      "fsip_autorenew@OData.Community.Display.V1.FormattedValue": "No",
      "fsip_autorenew": false,
      "fsip_escalationpercent": null,
      "exchangerate@OData.Community.Display.V1.FormattedValue": "1.0000000000",
      "exchangerate": 1.000000000000,
      "fsip_excludefromcontractescalations@OData.Community.Display.V1.FormattedValue": "No",
      "fsip_excludefromcontractescalations": false,
      "fsip_annualsafetytest@OData.Community.Display.V1.FormattedValue": "No",
      "fsip_annualsafetytest": false,
      "fsip_nextservicedate@OData.Community.Display.V1.FormattedValue": "2/5/2026",
      "fsip_nextservicedate": "2026-02-05T12:00:00Z",
      "fsip_onhold@OData.Community.Display.V1.FormattedValue": "No",
      "fsip_onhold": false,
      "fsip_currentannualamount": null,
      "_createdby_value@OData.Community.Display.V1.FormattedValue": "Barbara Oliveira",
      "_createdby_value": "554d6842-59b6-ef11-b8e9-000d3a5a6b66",
      "fsip_activemmr_state@OData.Community.Display.V1.FormattedValue": "1",
      "fsip_activemmr_state": 1,
      "fsip_2ndyearescalation": null,
      "_fsip_wagecategory_value": null,
      "fsip_maintenancecontractid": "82ab5bac-55ba-f011-bbd3-000d3a302e4a",
      "fsip_contractreviewdate": null,
      "fsip_lastinvoicerollup_state@OData.Community.Display.V1.FormattedValue": "1",
      "fsip_lastinvoicerollup_state": 1,
      "fsip_invoiced_state@OData.Community.Display.V1.FormattedValue": "1",
      "fsip_invoiced_state": 1,
      "fsip_2ndyearescalation_base": null,
      "fsip_5thyearescalation_base": null,
      "fsip_proratedequipment": null,
      "_fsip_originatingcontract_value": null,
      "lcd_runcancelflow@OData.Community.Display.V1.FormattedValue": "No",
      "lcd_runcancelflow": 802290001,
      "fsip_nextbillingdate": null,
      "lcd_createcontractbilling": null,
      "fsip_lastinvoicerollup@OData.Community.Display.V1.FormattedValue": "1/1/2026",
      "fsip_lastinvoicerollup": "2026-01-01",
      "fsip_billingnote": null,
      "_fsip_salesperson_value": null,
      "fsip_invoiceconsolidationtype@OData.Community.Display.V1.FormattedValue": "By Contract",
      "fsip_invoiceconsolidationtype": 683440002,
      "fsip_4thyearescalation_base": null,
      "_fsip_billtocustomer_value@OData.Community.Display.V1.FormattedValue": "The Abeco Organization",
      "_fsip_billtocustomer_value": "a5129b18-45a9-ec11-9840-000d3a307669",
      "fsip_costs@OData.Community.Display.V1.FormattedValue": "$0.00",
      "fsip_costs": 0.0000000000,
      "_owningbusinessunit_value@OData.Community.Display.V1.FormattedValue": "LCD Elevator",
      "_owningbusinessunit_value": "c9e85d8b-8fa0-ec11-b400-000d3a58d68e",
      "fsip_legacycontract": null,
      "fsip_printbillingnote@OData.Community.Display.V1.FormattedValue": "Yes",
      "fsip_printbillingnote": true,
      "timezoneruleversionnumber@OData.Community.Display.V1.FormattedValue": "4",
      "timezoneruleversionnumber": 4,
      "fsip_grossmargin@OData.Community.Display.V1.FormattedValue": "$1,875.00",
      "fsip_grossmargin": 1875.0000000000,
      "fsip_payssafetyequipment": null,
      "_ownerid_value@OData.Community.Display.V1.FormattedValue": "Barbara Oliveira",
      "_ownerid_value": "554d6842-59b6-ef11-b8e9-000d3a5a6b66",
      "_fsip_primarybuildinglocation_value@OData.Community.Display.V1.FormattedValue": "785 Flushing Avenue",
      "_fsip_primarybuildinglocation_value": "e05f2afb-52ba-f011-bbd3-000d3a597798",
      "fsip_lastinvoiced_date@OData.Community.Display.V1.FormattedValue": "1/12/2026 8:46 PM",
      "fsip_lastinvoiced_date": "2026-01-12T20:46:52Z",
      "fsip_invoiced_base@OData.Community.Display.V1.FormattedValue": "$1,875.00",
      "fsip_invoiced_base": 1875.0000000000,
      "importsequencenumber": null,
      "fsip_escalationamount": null,
      "fsip_1styearescalation_base": null,
      "_owninguser_value": "554d6842-59b6-ef11-b8e9-000d3a5a6b66",
      "_transactioncurrencyid_value@OData.Community.Display.V1.FormattedValue": "US Dollar",
      "_transactioncurrencyid_value": "28c060c5-d1a0-ec11-b400-000d3a58d68e",
      "_fsip_productcb_value": null,
      "fsip_visitfrequency@OData.Community.Display.V1.FormattedValue": "30",
      "fsip_visitfrequency": 683440000,
      "fsip_3rdyearescalation_base": null,
      "_fsip_project_value": null,
      "_fsip_division_value@OData.Community.Display.V1.FormattedValue": "Maintenance",
      "_fsip_division_value": "9316e0ff-55a5-ec11-9840-000d3a5c16ba",
      "_fsip_contracttype_value@OData.Community.Display.V1.FormattedValue": "Limited Service w/ Insp.",
      "_fsip_contracttype_value": "f33ce9c0-42a9-ec11-9840-000d3a307669",
      "fsip_sendescalationletter@OData.Community.Display.V1.FormattedValue": "No",
      "fsip_sendescalationletter": false,
      "lcd_braketestprice": null,
      "utcconversiontimezonecode": null,
      "_createdonbehalfby_value": null,
      "fsip_numberofvisits": "1",
      "fsip_totalcontract_base": null,
      "fsip_grossmarginpercent@OData.Community.Display.V1.FormattedValue": "100.00",
      "fsip_grossmarginpercent": 100.00,
      "fsip_certificateofinsurance@OData.Community.Display.V1.FormattedValue": "No",
      "fsip_certificateofinsurance": false,
      "fsip_permitfeesbillable@OData.Community.Display.V1.FormattedValue": "No",
      "fsip_permitfeesbillable": false,
      "fsip_billingendon": null,
      "fsip_lastinvoiced@OData.Community.Display.V1.FormattedValue": "1/5/2026",
      "fsip_lastinvoiced": "2026-01-05T12:56:43Z",
      "fsip_internalnote": null,
      "fsip_escalationfrequency": null,
      "fsip_name": "785 Flushing Avenue",
      "fsip_workorderconsolidationtype@OData.Community.Display.V1.FormattedValue": "By Contract",
      "fsip_workorderconsolidationtype": 683440000,
      "fsip_addalldevicescontractbillings@OData.Community.Display.V1.FormattedValue": "No",
      "fsip_addalldevicescontractbillings": false,
      "fsip_lastescalationlettersent": null,
      "fsip_otminoradjustmentscbservice@OData.Community.Display.V1.FormattedValue": "No",
      "fsip_otminoradjustmentscbservice": false,
      "fsip_duration": null,
      "lcd_daystoexpire@OData.Community.Display.V1.FormattedValue": "-297.00",
      "lcd_daystoexpire": -297.0000000000,
      "fsip_3rdyearescalation": null,
      "fsip_invoicingmethod@OData.Community.Display.V1.FormattedValue": "Work Order Billing",
      "fsip_invoicingmethod": 683440001,
      "lcd_cat5fullloadbillable@OData.Community.Display.V1.FormattedValue": "No",
      "lcd_cat5fullloadbillable": 802290001,
      "fsip_cancelon": null,
      "fsip_originalcontractstartdate@OData.Community.Display.V1.FormattedValue": "11/5/2025",
      "fsip_originalcontractstartdate": "2025-11-05",
      "fsip_contractnumber": "MC-0003135",
      "fsip_exclusions": null,
      "_fsip_product_value": null,
      "fsip_quantity": null,
      "fsip_usediscountaspercentage@OData.Community.Display.V1.FormattedValue": "Amount",
      "fsip_usediscountaspercentage": false,
      "fsip_contractlanguage": null,
      "fsip_currentcontractyear": null,
      "lcd_originalcontractamount_base": null,
      "_modifiedonbehalfby_value": null,
      "fsip_fiveyearsafetytest@OData.Community.Display.V1.FormattedValue": "No",
      "fsip_fiveyearsafetytest": false,
      "fsip_closedate": null,
      "fsip_invoiceamount_base": null,
      "versionnumber@OData.Community.Display.V1.FormattedValue": "126,387,433",
      "versionnumber": 126387433,
      "fsip_description": null,
      "fsip_activeon": null,
      "fsip_billingenddate": null,
      "fsip_activemmr_base@OData.Community.Display.V1.FormattedValue": "$625.00",
      "fsip_activemmr_base": 625.0000000000,
      "statuscode@OData.Community.Display.V1.FormattedValue": "Active",
      "statuscode": 683440001,
      "fsip_testbillable@OData.Community.Display.V1.FormattedValue": "No",
      "fsip_testbillable": false,
      "createdon@OData.Community.Display.V1.FormattedValue": "11/5/2025 2:42 PM",
      "createdon": "2025-11-05T14:42:42Z",
      "fsip_holdnote": null,
      "fsip_grossmargin_base@OData.Community.Display.V1.FormattedValue": "$1,875.00",
      "fsip_grossmargin_base": 1875.0000000000,
      "_fsip_serviceaddress_value": null,
      "fsip_activemmr@OData.Community.Display.V1.FormattedValue": "$625.00",
      "fsip_activemmr": 625.0000000000,
      "lcd_braketestbillable@OData.Community.Display.V1.FormattedValue": "No",
      "lcd_braketestbillable": 802290001,
      "fsip_1styearescalation": null,
      "fsip_currentactualprofitpercent": null,
      "fsip_lastinvoicerollup_date@OData.Community.Display.V1.FormattedValue": "1/12/2026 8:46 PM",
      "fsip_lastinvoicerollup_date": "2026-01-12T20:46:52Z",
      "fsip_billinginprogress@OData.Community.Display.V1.FormattedValue": "No",
      "fsip_billinginprogress": false
    },
    {
      "@odata.etag": "W/\"126416112\"",
      "lcd_cancellationnotes": null,
      "fsip_po": null,
      "fsip_billingfrequency": null,
      "lcd_cat1annualprice": null,
      "fsip_expireson": null,
      "fsip_won@OData.Community.Display.V1.FormattedValue": "No",
      "fsip_won": false,
      "fsip_schedulinginprogress@OData.Community.Display.V1.FormattedValue": "No",
      "fsip_schedulinginprogress": false,
      "_fsip_sortbyaccount_value@OData.Community.Display.V1.FormattedValue": "1630 Madison Ave Condominium Association",
      "_fsip_sortbyaccount_value": "298365b0-23ca-f011-bbd3-000d3a302e4a",
      "fsip_invoiced@OData.Community.Display.V1.FormattedValue": "$1,208.00",
      "fsip_invoiced": 1208.0000000000,
      "fsip_currentannualamount_base": null,
      "fsip_currentcontractstartdate@OData.Community.Display.V1.FormattedValue": "11/25/2025",
      "fsip_currentcontractstartdate": "2025-11-25",
      "fsip_nextescalationdate": null,
      "fsip_billingstarton": null,
      "fsip_costs_base@OData.Community.Display.V1.FormattedValue": "$0.00",
      "fsip_costs_base": 0.0000000000,
      "fsip_nextcontractbillingdate@OData.Community.Display.V1.FormattedValue": "2/1/2026",
      "fsip_nextcontractbillingdate": "2026-02-01",
      "fsip_4thyearescalation": null,
      "fsip_invoiced_date@OData.Community.Display.V1.FormattedValue": "1/12/2026 8:46 PM",
      "fsip_invoiced_date": "2026-01-12T20:46:52Z",
      "fsip_billingfrequencycode": null,
      "lcd_cat5fullloadprice": null,
      "_fsip_copydevicesfromcontract_value": null,
      "statecode@OData.Community.Display.V1.FormattedValue": "Active",
      "statecode": 0,
      "fsip_regulartimecbservice@OData.Community.Display.V1.FormattedValue": "No",
      "fsip_regulartimecbservice": false,
      "fsip_costs_date@OData.Community.Display.V1.FormattedValue": "1/12/2026 8:46 PM",
      "fsip_costs_date": "2026-01-12T20:46:52Z",
      "_fsip_copydevicesfrombuildinglocation_value": null,
      "lcd_originalcontractamount": null,
      "fsip_closedstatus": null,
      "_fsip_customerid_value@OData.Community.Display.V1.FormattedValue": "1630 Madison Ave Condominium Association",
      "_fsip_customerid_value": "298365b0-23ca-f011-bbd3-000d3a302e4a",
      "fsip_contractservicelevelcode": null,
      "fsip_invoiceamount": null,
      "_modifiedby_value@OData.Community.Display.V1.FormattedValue": "Alexander Buffolino",
      "_modifiedby_value": "721e05c5-9e60-ef11-bfe3-000d3a316b4e",
      "modifiedon@OData.Community.Display.V1.FormattedValue": "1/5/2026 3:12 PM",
      "modifiedon": "2026-01-05T15:12:14Z",
      "lcd_cancelationnotifyoffice@OData.Community.Display.V1.FormattedValue": "No",
      "lcd_cancelationnotifyoffice": 802290001,
      "lcd_autorenewal@OData.Community.Display.V1.FormattedValue": "Yes",
      "lcd_autorenewal": 802290000,
      "fsip_billingnotecb": null,
      "fsip_lastinvoiced_state@OData.Community.Display.V1.FormattedValue": "1",
      "fsip_lastinvoiced_state": 1,
      "fsip_costs_state@OData.Community.Display.V1.FormattedValue": "1",
      "fsip_costs_state": 1,
      "fsip_percentageoramount": null,
      "fsip_escalationamount_base": null,
      "fsip_closecontract@OData.Community.Display.V1.FormattedValue": "No",
      "fsip_closecontract": false,
      "overriddencreatedon": null,
      "lcd_cat1annualbillable@OData.Community.Display.V1.FormattedValue": "No",
      "lcd_cat1annualbillable": 802290001,
      "fsip_activemmr_date@OData.Community.Display.V1.FormattedValue": "1/12/2026 8:46 PM",
      "fsip_activemmr_date": "2026-01-12T20:46:52Z",
      "fsip_specialconditions": null,
      "fsip_currentcontractenddate@OData.Community.Display.V1.FormattedValue": "11/25/2026",
      "fsip_currentcontractenddate": "2026-11-25",
      "lcd_servicefrequencywords": "Monthly",
      "fsip_cleanpithoistwaycartops@OData.Community.Display.V1.FormattedValue": "No",
      "fsip_cleanpithoistwaycartops": false,
      "fsip_5thyearescalation": null,
      "fsip_totalcontract": null,
      "_owningteam_value": null,
      "fsip_autorenew@OData.Community.Display.V1.FormattedValue": "No",
      "fsip_autorenew": false,
      "fsip_escalationpercent": null,
      "exchangerate@OData.Community.Display.V1.FormattedValue": "1.0000000000",
      "exchangerate": 1.000000000000,
      "fsip_excludefromcontractescalations@OData.Community.Display.V1.FormattedValue": "No",
      "fsip_excludefromcontractescalations": false,
      "fsip_annualsafetytest@OData.Community.Display.V1.FormattedValue": "No",
      "fsip_annualsafetytest": false,
      "fsip_nextservicedate@OData.Community.Display.V1.FormattedValue": "2/1/2026",
      "fsip_nextservicedate": "2026-02-01T12:00:00Z",
      "fsip_onhold@OData.Community.Display.V1.FormattedValue": "No",
      "fsip_onhold": false,
      "fsip_currentannualamount": null,
      "_createdby_value@OData.Community.Display.V1.FormattedValue": "Andrea Larson",
      "_createdby_value": "1677a7e2-bab5-f011-bbd2-000d3a331dc8",
      "fsip_activemmr_state@OData.Community.Display.V1.FormattedValue": "1",
      "fsip_activemmr_state": 1,
      "fsip_2ndyearescalation": null,
      "_fsip_wagecategory_value": null,
      "fsip_maintenancecontractid": "cf91aafa-24ca-f011-bbd3-000d3a302e4a",
      "fsip_contractreviewdate": null,
      "fsip_lastinvoicerollup_state@OData.Community.Display.V1.FormattedValue": "1",
      "fsip_lastinvoicerollup_state": 1,
      "fsip_invoiced_state@OData.Community.Display.V1.FormattedValue": "1",
      "fsip_invoiced_state": 1,
      "fsip_2ndyearescalation_base": null,
      "fsip_5thyearescalation_base": null,
      "fsip_proratedequipment": null,
      "_fsip_originatingcontract_value": null,
      "lcd_runcancelflow@OData.Community.Display.V1.FormattedValue": "No",
      "lcd_runcancelflow": 802290001,
      "fsip_nextbillingdate": null,
      "lcd_createcontractbilling": null,
      "fsip_lastinvoicerollup@OData.Community.Display.V1.FormattedValue": "1/1/2026",
      "fsip_lastinvoicerollup": "2026-01-01",
      "fsip_billingnote": null,
      "_fsip_salesperson_value@OData.Community.Display.V1.FormattedValue": "Andrea Larson",
      "_fsip_salesperson_value": "1677a7e2-bab5-f011-bbd2-000d3a331dc8",
      "fsip_invoiceconsolidationtype@OData.Community.Display.V1.FormattedValue": "By Contract",
      "fsip_invoiceconsolidationtype": 683440002,
      "fsip_4thyearescalation_base": null,
      "_fsip_billtocustomer_value@OData.Community.Display.V1.FormattedValue": "1630 Madison Ave Condominium Association",
      "_fsip_billtocustomer_value": "298365b0-23ca-f011-bbd3-000d3a302e4a",
      "fsip_costs@OData.Community.Display.V1.FormattedValue": "$0.00",
      "fsip_costs": 0.0000000000,
      "_owningbusinessunit_value@OData.Community.Display.V1.FormattedValue": "LCD Elevator",
      "_owningbusinessunit_value": "c9e85d8b-8fa0-ec11-b400-000d3a58d68e",
      "fsip_legacycontract": null,
      "fsip_printbillingnote@OData.Community.Display.V1.FormattedValue": "Yes",
      "fsip_printbillingnote": true,
      "timezoneruleversionnumber@OData.Community.Display.V1.FormattedValue": "4",
      "timezoneruleversionnumber": 4,
      "fsip_grossmargin@OData.Community.Display.V1.FormattedValue": "$1,208.00",
      "fsip_grossmargin": 1208.0000000000,
      "fsip_payssafetyequipment": null,
      "_ownerid_value@OData.Community.Display.V1.FormattedValue": "Andrea Larson",
      "_ownerid_value": "1677a7e2-bab5-f011-bbd2-000d3a331dc8",
      "_fsip_primarybuildinglocation_value@OData.Community.Display.V1.FormattedValue": "1630 Madison Avenue",
      "_fsip_primarybuildinglocation_value": "14bc098a-28c6-f011-bbd3-000d3a597798",
      "fsip_lastinvoiced_date@OData.Community.Display.V1.FormattedValue": "1/12/2026 8:46 PM",
      "fsip_lastinvoiced_date": "2026-01-12T20:46:52Z",
      "fsip_invoiced_base@OData.Community.Display.V1.FormattedValue": "$1,208.00",
      "fsip_invoiced_base": 1208.0000000000,
      "importsequencenumber": null,
      "fsip_escalationamount": null,
      "fsip_1styearescalation_base": null,
      "_owninguser_value": "1677a7e2-bab5-f011-bbd2-000d3a331dc8",
      "_transactioncurrencyid_value@OData.Community.Display.V1.FormattedValue": "US Dollar",
      "_transactioncurrencyid_value": "28c060c5-d1a0-ec11-b400-000d3a58d68e",
      "_fsip_productcb_value": null,
      "fsip_visitfrequency@OData.Community.Display.V1.FormattedValue": "30",
      "fsip_visitfrequency": 683440000,
      "fsip_3rdyearescalation_base": null,
      "_fsip_project_value": null,
      "_fsip_division_value@OData.Community.Display.V1.FormattedValue": "Maintenance",
      "_fsip_division_value": "9316e0ff-55a5-ec11-9840-000d3a5c16ba",
      "_fsip_contracttype_value@OData.Community.Display.V1.FormattedValue": "Limited Service w/ Insp.",
      "_fsip_contracttype_value": "f33ce9c0-42a9-ec11-9840-000d3a307669",
      "fsip_sendescalationletter@OData.Community.Display.V1.FormattedValue": "No",
      "fsip_sendescalationletter": false,
      "lcd_braketestprice": null,
      "utcconversiontimezonecode": null,
      "_createdonbehalfby_value": null,
      "fsip_numberofvisits": "1",
      "fsip_totalcontract_base": null,
      "fsip_grossmarginpercent@OData.Community.Display.V1.FormattedValue": "100.00",
      "fsip_grossmarginpercent": 100.00,
      "fsip_certificateofinsurance@OData.Community.Display.V1.FormattedValue": "No",
      "fsip_certificateofinsurance": false,
      "fsip_permitfeesbillable@OData.Community.Display.V1.FormattedValue": "No",
      "fsip_permitfeesbillable": false,
      "fsip_billingendon": null,
      "fsip_lastinvoiced@OData.Community.Display.V1.FormattedValue": "1/5/2026",
      "fsip_lastinvoiced": "2026-01-05T12:56:43Z",
      "fsip_internalnote": null,
      "fsip_escalationfrequency": null,
      "fsip_name": "1630 Madison Avenue",
      "fsip_workorderconsolidationtype@OData.Community.Display.V1.FormattedValue": "By Contract",
      "fsip_workorderconsolidationtype": 683440000,
      "fsip_addalldevicescontractbillings@OData.Community.Display.V1.FormattedValue": "No",
      "fsip_addalldevicescontractbillings": false,
      "fsip_lastescalationlettersent": null,
      "fsip_otminoradjustmentscbservice@OData.Community.Display.V1.FormattedValue": "No",
      "fsip_otminoradjustmentscbservice": false,
      "fsip_duration": null,
      "lcd_daystoexpire@OData.Community.Display.V1.FormattedValue": "-317.00",
      "lcd_daystoexpire": -317.0000000000,
      "fsip_3rdyearescalation": null,
      "fsip_invoicingmethod@OData.Community.Display.V1.FormattedValue": "Work Order Billing",
      "fsip_invoicingmethod": 683440001,
      "lcd_cat5fullloadbillable@OData.Community.Display.V1.FormattedValue": "No",
      "lcd_cat5fullloadbillable": 802290001,
      "fsip_cancelon": null,
      "fsip_originalcontractstartdate@OData.Community.Display.V1.FormattedValue": "11/25/2025",
      "fsip_originalcontractstartdate": "2025-11-25",
      "fsip_contractnumber": "MC-0003143",
      "fsip_exclusions": "Maintenance does not include repair or replacement of electrical and mechanical parts of elevator equipment and apparatus which shall be performed only at additional cost billed at parts plus labor. If the required part is obsolete and no longer manufactured the owner will be responsible for the cost of this part plus the labor required to install and retrofit this part into the elevator system.",
      "_fsip_product_value": null,
      "fsip_quantity": null,
      "fsip_usediscountaspercentage@OData.Community.Display.V1.FormattedValue": "Amount",
      "fsip_usediscountaspercentage": false,
      "fsip_contractlanguage": null,
      "fsip_currentcontractyear": null,
      "lcd_originalcontractamount_base": null,
      "_modifiedonbehalfby_value": null,
      "fsip_fiveyearsafetytest@OData.Community.Display.V1.FormattedValue": "No",
      "fsip_fiveyearsafetytest": false,
      "fsip_closedate": null,
      "fsip_invoiceamount_base": null,
      "versionnumber@OData.Community.Display.V1.FormattedValue": "126,416,112",
      "versionnumber": 126416112,
      "fsip_description": null,
      "fsip_activeon": null,
      "fsip_billingenddate": null,
      "fsip_activemmr_base@OData.Community.Display.V1.FormattedValue": "$604.00",
      "fsip_activemmr_base": 604.0000000000,
      "statuscode@OData.Community.Display.V1.FormattedValue": "Active",
      "statuscode": 683440001,
      "fsip_testbillable@OData.Community.Display.V1.FormattedValue": "No",
      "fsip_testbillable": false,
      "createdon@OData.Community.Display.V1.FormattedValue": "11/25/2025 5:34 PM",
      "createdon": "2025-11-25T17:34:25Z",
      "fsip_holdnote": null,
      "fsip_grossmargin_base@OData.Community.Display.V1.FormattedValue": "$1,208.00",
      "fsip_grossmargin_base": 1208.0000000000,
      "_fsip_serviceaddress_value": null,
      "fsip_activemmr@OData.Community.Display.V1.FormattedValue": "$604.00",
      "fsip_activemmr": 604.0000000000,
      "lcd_braketestbillable@OData.Community.Display.V1.FormattedValue": "No",
      "lcd_braketestbillable": 802290001,
      "fsip_1styearescalation": null,
      "fsip_currentactualprofitpercent": null,
      "fsip_lastinvoicerollup_date@OData.Community.Display.V1.FormattedValue": "1/12/2026 8:46 PM",
      "fsip_lastinvoicerollup_date": "2026-01-12T20:46:52Z",
      "fsip_billinginprogress@OData.Community.Display.V1.FormattedValue": "No",
      "fsip_billinginprogress": false
    },
    {
      "@odata.etag": "W/\"126045954\"",
      "lcd_cancellationnotes": null,
      "fsip_po": null,
      "fsip_billingfrequency": null,
      "lcd_cat1annualprice": null,
      "fsip_expireson": null,
      "fsip_won@OData.Community.Display.V1.FormattedValue": "No",
      "fsip_won": false,
      "fsip_schedulinginprogress@OData.Community.Display.V1.FormattedValue": "No",
      "fsip_schedulinginprogress": false,
      "_fsip_sortbyaccount_value@OData.Community.Display.V1.FormattedValue": "Laudate LLC",
      "_fsip_sortbyaccount_value": "4517ff17-4684-f011-b4cb-00224809dc40",
      "fsip_invoiced@OData.Community.Display.V1.FormattedValue": "$0.00",
      "fsip_invoiced": 0.0000000000,
      "fsip_currentannualamount_base": null,
      "fsip_currentcontractstartdate@OData.Community.Display.V1.FormattedValue": "12/4/2025",
      "fsip_currentcontractstartdate": "2025-12-04",
      "fsip_nextescalationdate": null,
      "fsip_billingstarton": null,
      "fsip_costs_base@OData.Community.Display.V1.FormattedValue": "$0.00",
      "fsip_costs_base": 0.0000000000,
      "fsip_nextcontractbillingdate": null,
      "fsip_4thyearescalation": null,
      "fsip_invoiced_date@OData.Community.Display.V1.FormattedValue": "1/12/2026 8:46 PM",
      "fsip_invoiced_date": "2026-01-12T20:46:52Z",
      "fsip_billingfrequencycode": null,
      "lcd_cat5fullloadprice": null,
      "_fsip_copydevicesfromcontract_value": null,
      "statecode@OData.Community.Display.V1.FormattedValue": "Active",
      "statecode": 0,
      "fsip_regulartimecbservice@OData.Community.Display.V1.FormattedValue": "No",
      "fsip_regulartimecbservice": false,
      "fsip_costs_date@OData.Community.Display.V1.FormattedValue": "1/12/2026 8:46 PM",
      "fsip_costs_date": "2026-01-12T20:46:52Z",
      "_fsip_copydevicesfrombuildinglocation_value": null,
      "lcd_originalcontractamount": null,
      "fsip_closedstatus": null,
      "_fsip_customerid_value@OData.Community.Display.V1.FormattedValue": "Laudate LLC",
      "_fsip_customerid_value": "4517ff17-4684-f011-b4cb-00224809dc40",
      "fsip_contractservicelevelcode": null,
      "fsip_invoiceamount": null,
      "_modifiedby_value@OData.Community.Display.V1.FormattedValue": "# SCRIBE INTEGRATION",
      "_modifiedby_value": "910423db-6a8d-ef11-ac21-000d3a326f08",
      "modifiedon@OData.Community.Display.V1.FormattedValue": "12/31/2025 5:37 PM",
      "modifiedon": "2025-12-31T17:37:58Z",
      "lcd_cancelationnotifyoffice@OData.Community.Display.V1.FormattedValue": "No",
      "lcd_cancelationnotifyoffice": 802290001,
      "lcd_autorenewal@OData.Community.Display.V1.FormattedValue": "No",
      "lcd_autorenewal": 802290001,
      "fsip_billingnotecb": null,
      "fsip_lastinvoiced_state@OData.Community.Display.V1.FormattedValue": "1",
      "fsip_lastinvoiced_state": 1,
      "fsip_costs_state@OData.Community.Display.V1.FormattedValue": "1",
      "fsip_costs_state": 1,
      "fsip_percentageoramount": null,
      "fsip_escalationamount_base": null,
      "fsip_closecontract@OData.Community.Display.V1.FormattedValue": "No",
      "fsip_closecontract": false,
      "overriddencreatedon": null,
      "lcd_cat1annualbillable@OData.Community.Display.V1.FormattedValue": "No",
      "lcd_cat1annualbillable": 802290001,
      "fsip_activemmr_date@OData.Community.Display.V1.FormattedValue": "1/12/2026 8:46 PM",
      "fsip_activemmr_date": "2026-01-12T20:46:52Z",
      "fsip_specialconditions": null,
      "fsip_currentcontractenddate@OData.Community.Display.V1.FormattedValue": "12/4/2026",
      "fsip_currentcontractenddate": "2026-12-04",
      "lcd_servicefrequencywords": "Monthly",
      "fsip_cleanpithoistwaycartops@OData.Community.Display.V1.FormattedValue": "No",
      "fsip_cleanpithoistwaycartops": false,
      "fsip_5thyearescalation": null,
      "fsip_totalcontract": null,
      "_owningteam_value": null,
      "fsip_autorenew@OData.Community.Display.V1.FormattedValue": "No",
      "fsip_autorenew": false,
      "fsip_escalationpercent": null,
      "exchangerate@OData.Community.Display.V1.FormattedValue": "1.0000000000",
      "exchangerate": 1.000000000000,
      "fsip_excludefromcontractescalations@OData.Community.Display.V1.FormattedValue": "No",
      "fsip_excludefromcontractescalations": false,
      "fsip_annualsafetytest@OData.Community.Display.V1.FormattedValue": "No",
      "fsip_annualsafetytest": false,
      "fsip_nextservicedate@OData.Community.Display.V1.FormattedValue": "2/4/2026",
      "fsip_nextservicedate": "2026-02-04T12:00:00Z",
      "fsip_onhold@OData.Community.Display.V1.FormattedValue": "No",
      "fsip_onhold": false,
      "fsip_currentannualamount": null,
      "_createdby_value@OData.Community.Display.V1.FormattedValue": "Barbara Oliveira",
      "_createdby_value": "554d6842-59b6-ef11-b8e9-000d3a5a6b66",
      "fsip_activemmr_state@OData.Community.Display.V1.FormattedValue": "1",
      "fsip_activemmr_state": 1,
      "fsip_2ndyearescalation": null,
      "_fsip_wagecategory_value": null,
      "fsip_maintenancecontractid": "f8e82a24-31d1-f011-bbd3-000d3a302e4a",
      "fsip_contractreviewdate": null,
      "fsip_lastinvoicerollup_state@OData.Community.Display.V1.FormattedValue": "0",
      "fsip_lastinvoicerollup_state": 0,
      "fsip_invoiced_state@OData.Community.Display.V1.FormattedValue": "1",
      "fsip_invoiced_state": 1,
      "fsip_2ndyearescalation_base": null,
      "fsip_5thyearescalation_base": null,
      "fsip_proratedequipment": null,
      "_fsip_originatingcontract_value": null,
      "lcd_runcancelflow@OData.Community.Display.V1.FormattedValue": "No",
      "lcd_runcancelflow": 802290001,
      "fsip_nextbillingdate": null,
      "lcd_createcontractbilling": null,
      "fsip_lastinvoicerollup": null,
      "fsip_billingnote": null,
      "_fsip_salesperson_value@OData.Community.Display.V1.FormattedValue": "Barbara Oliveira",
      "_fsip_salesperson_value": "554d6842-59b6-ef11-b8e9-000d3a5a6b66",
      "fsip_invoiceconsolidationtype@OData.Community.Display.V1.FormattedValue": "No Consolidation",
      "fsip_invoiceconsolidationtype": 683440000,
      "fsip_4thyearescalation_base": null,
      "_fsip_billtocustomer_value@OData.Community.Display.V1.FormattedValue": "Laudate LLC",
      "_fsip_billtocustomer_value": "4517ff17-4684-f011-b4cb-00224809dc40",
      "fsip_costs@OData.Community.Display.V1.FormattedValue": "$0.00",
      "fsip_costs": 0.0000000000,
      "_owningbusinessunit_value@OData.Community.Display.V1.FormattedValue": "LCD Elevator",
      "_owningbusinessunit_value": "c9e85d8b-8fa0-ec11-b400-000d3a58d68e",
      "fsip_legacycontract": null,
      "fsip_printbillingnote@OData.Community.Display.V1.FormattedValue": "Yes",
      "fsip_printbillingnote": true,
      "timezoneruleversionnumber@OData.Community.Display.V1.FormattedValue": "4",
      "timezoneruleversionnumber": 4,
      "fsip_grossmargin@OData.Community.Display.V1.FormattedValue": "$0.00",
      "fsip_grossmargin": 0.0000000000,
      "fsip_payssafetyequipment": null,
      "_ownerid_value@OData.Community.Display.V1.FormattedValue": "Barbara Oliveira",
      "_ownerid_value": "554d6842-59b6-ef11-b8e9-000d3a5a6b66",
      "_fsip_primarybuildinglocation_value@OData.Community.Display.V1.FormattedValue": "24 Woodbine Avenue",
      "_fsip_primarybuildinglocation_value": "65c5fb0c-7d83-f011-b4cc-0022480876c8",
      "fsip_lastinvoiced_date@OData.Community.Display.V1.FormattedValue": "1/12/2026 8:46 PM",
      "fsip_lastinvoiced_date": "2026-01-12T20:46:52Z",
      "fsip_invoiced_base@OData.Community.Display.V1.FormattedValue": "$0.00",
      "fsip_invoiced_base": 0.0000000000,
      "importsequencenumber": null,
      "fsip_escalationamount": null,
      "fsip_1styearescalation_base": null,
      "_owninguser_value": "554d6842-59b6-ef11-b8e9-000d3a5a6b66",
      "_transactioncurrencyid_value@OData.Community.Display.V1.FormattedValue": "US Dollar",
      "_transactioncurrencyid_value": "28c060c5-d1a0-ec11-b400-000d3a58d68e",
      "_fsip_productcb_value": null,
      "fsip_visitfrequency@OData.Community.Display.V1.FormattedValue": "30",
      "fsip_visitfrequency": 683440000,
      "fsip_3rdyearescalation_base": null,
      "_fsip_project_value": null,
      "_fsip_division_value@OData.Community.Display.V1.FormattedValue": "Maintenance",
      "_fsip_division_value": "9316e0ff-55a5-ec11-9840-000d3a5c16ba",
      "_fsip_contracttype_value@OData.Community.Display.V1.FormattedValue": "Free Maintenance (Warranty)",
      "_fsip_contracttype_value": "fd3ce9c0-42a9-ec11-9840-000d3a307669",
      "fsip_sendescalationletter@OData.Community.Display.V1.FormattedValue": "No",
      "fsip_sendescalationletter": false,
      "lcd_braketestprice": null,
      "utcconversiontimezonecode": null,
      "_createdonbehalfby_value": null,
      "fsip_numberofvisits": "1",
      "fsip_totalcontract_base": null,
      "fsip_grossmarginpercent": null,
      "fsip_certificateofinsurance@OData.Community.Display.V1.FormattedValue": "No",
      "fsip_certificateofinsurance": false,
      "fsip_permitfeesbillable@OData.Community.Display.V1.FormattedValue": "No",
      "fsip_permitfeesbillable": false,
      "fsip_billingendon": null,
      "fsip_lastinvoiced": null,
      "fsip_internalnote": null,
      "fsip_escalationfrequency": null,
      "fsip_name": "24 Woodbine Avenue",
      "fsip_workorderconsolidationtype@OData.Community.Display.V1.FormattedValue": "By Contract",
      "fsip_workorderconsolidationtype": 683440000,
      "fsip_addalldevicescontractbillings@OData.Community.Display.V1.FormattedValue": "No",
      "fsip_addalldevicescontractbillings": false,
      "fsip_lastescalationlettersent": null,
      "fsip_otminoradjustmentscbservice@OData.Community.Display.V1.FormattedValue": "No",
      "fsip_otminoradjustmentscbservice": false,
      "fsip_duration": null,
      "lcd_daystoexpire@OData.Community.Display.V1.FormattedValue": "-326.00",
      "lcd_daystoexpire": -326.0000000000,
      "fsip_3rdyearescalation": null,
      "fsip_invoicingmethod@OData.Community.Display.V1.FormattedValue": "Work Order Billing",
      "fsip_invoicingmethod": 683440001,
      "lcd_cat5fullloadbillable@OData.Community.Display.V1.FormattedValue": "No",
      "lcd_cat5fullloadbillable": 802290001,
      "fsip_cancelon": null,
      "fsip_originalcontractstartdate@OData.Community.Display.V1.FormattedValue": "12/4/2025",
      "fsip_originalcontractstartdate": "2025-12-04",
      "fsip_contractnumber": "MC-0003149",
      "fsip_exclusions": null,
      "_fsip_product_value": null,
      "fsip_quantity": null,
      "fsip_usediscountaspercentage@OData.Community.Display.V1.FormattedValue": "Amount",
      "fsip_usediscountaspercentage": false,
      "fsip_contractlanguage": null,
      "fsip_currentcontractyear": null,
      "lcd_originalcontractamount_base": null,
      "_modifiedonbehalfby_value": null,
      "fsip_fiveyearsafetytest@OData.Community.Display.V1.FormattedValue": "No",
      "fsip_fiveyearsafetytest": false,
      "fsip_closedate": null,
      "fsip_invoiceamount_base": null,
      "versionnumber@OData.Community.Display.V1.FormattedValue": "126,045,954",
      "versionnumber": 126045954,
      "fsip_description": null,
      "fsip_activeon": null,
      "fsip_billingenddate": null,
      "fsip_activemmr_base@OData.Community.Display.V1.FormattedValue": "$0.00",
      "fsip_activemmr_base": 0.0000000000,
      "statuscode@OData.Community.Display.V1.FormattedValue": "Active",
      "statuscode": 683440001,
      "fsip_testbillable@OData.Community.Display.V1.FormattedValue": "No",
      "fsip_testbillable": false,
      "createdon@OData.Community.Display.V1.FormattedValue": "12/4/2025 4:49 PM",
      "createdon": "2025-12-04T16:49:09Z",
      "fsip_holdnote": null,
      "fsip_grossmargin_base@OData.Community.Display.V1.FormattedValue": "$0.00",
      "fsip_grossmargin_base": 0.0000000000,
      "_fsip_serviceaddress_value": null,
      "fsip_activemmr@OData.Community.Display.V1.FormattedValue": "$0.00",
      "fsip_activemmr": 0.0000000000,
      "lcd_braketestbillable@OData.Community.Display.V1.FormattedValue": "No",
      "lcd_braketestbillable": 802290001,
      "fsip_1styearescalation": null,
      "fsip_currentactualprofitpercent": null,
      "fsip_lastinvoicerollup_date@OData.Community.Display.V1.FormattedValue": "1/12/2026 8:46 PM",
      "fsip_lastinvoicerollup_date": "2026-01-12T20:46:52Z",
      "fsip_billinginprogress@OData.Community.Display.V1.FormattedValue": "No",
      "fsip_billinginprogress": false
    },
    {
      "@odata.etag": "W/\"126408011\"",
      "lcd_cancellationnotes": null,
      "fsip_po": null,
      "fsip_billingfrequency": null,
      "lcd_cat1annualprice": "875",
      "fsip_expireson": null,
      "fsip_won@OData.Community.Display.V1.FormattedValue": "No",
      "fsip_won": false,
      "fsip_schedulinginprogress@OData.Community.Display.V1.FormattedValue": "No",
      "fsip_schedulinginprogress": false,
      "_fsip_sortbyaccount_value@OData.Community.Display.V1.FormattedValue": "2278 BPE LLC",
      "_fsip_sortbyaccount_value": "be986c45-32d1-f011-bbd3-000d3a302e4a",
      "fsip_invoiced@OData.Community.Display.V1.FormattedValue": "$731.16",
      "fsip_invoiced": 731.1600000000,
      "fsip_currentannualamount_base": null,
      "fsip_currentcontractstartdate@OData.Community.Display.V1.FormattedValue": "12/4/2025",
      "fsip_currentcontractstartdate": "2025-12-04",
      "fsip_nextescalationdate": null,
      "fsip_billingstarton": null,
      "fsip_costs_base@OData.Community.Display.V1.FormattedValue": "$0.00",
      "fsip_costs_base": 0.0000000000,
      "fsip_nextcontractbillingdate@OData.Community.Display.V1.FormattedValue": "2/1/2026",
      "fsip_nextcontractbillingdate": "2026-02-01",
      "fsip_4thyearescalation": null,
      "fsip_invoiced_date@OData.Community.Display.V1.FormattedValue": "1/12/2026 8:46 PM",
      "fsip_invoiced_date": "2026-01-12T20:46:52Z",
      "fsip_billingfrequencycode": null,
      "lcd_cat5fullloadprice": "1550",
      "_fsip_copydevicesfromcontract_value": null,
      "statecode@OData.Community.Display.V1.FormattedValue": "Active",
      "statecode": 0,
      "fsip_regulartimecbservice@OData.Community.Display.V1.FormattedValue": "No",
      "fsip_regulartimecbservice": false,
      "fsip_costs_date@OData.Community.Display.V1.FormattedValue": "1/12/2026 8:46 PM",
      "fsip_costs_date": "2026-01-12T20:46:52Z",
      "_fsip_copydevicesfrombuildinglocation_value": null,
      "lcd_originalcontractamount": null,
      "fsip_closedstatus": null,
      "_fsip_customerid_value@OData.Community.Display.V1.FormattedValue": "2278 BPE LLC",
      "_fsip_customerid_value": "be986c45-32d1-f011-bbd3-000d3a302e4a",
      "fsip_contractservicelevelcode": null,
      "fsip_invoiceamount": null,
      "_modifiedby_value@OData.Community.Display.V1.FormattedValue": "# SCRIBE INTEGRATION",
      "_modifiedby_value": "910423db-6a8d-ef11-ac21-000d3a326f08",
      "modifiedon@OData.Community.Display.V1.FormattedValue": "1/5/2026 3:58 PM",
      "modifiedon": "2026-01-05T15:58:15Z",
      "lcd_cancelationnotifyoffice@OData.Community.Display.V1.FormattedValue": "No",
      "lcd_cancelationnotifyoffice": 802290001,
      "lcd_autorenewal@OData.Community.Display.V1.FormattedValue": "Yes",
      "lcd_autorenewal": 802290000,
      "fsip_billingnotecb": null,
      "fsip_lastinvoiced_state@OData.Community.Display.V1.FormattedValue": "1",
      "fsip_lastinvoiced_state": 1,
      "fsip_costs_state@OData.Community.Display.V1.FormattedValue": "1",
      "fsip_costs_state": 1,
      "fsip_percentageoramount": null,
      "fsip_escalationamount_base": null,
      "fsip_closecontract@OData.Community.Display.V1.FormattedValue": "No",
      "fsip_closecontract": false,
      "overriddencreatedon": null,
      "lcd_cat1annualbillable@OData.Community.Display.V1.FormattedValue": "Yes",
      "lcd_cat1annualbillable": 802290000,
      "fsip_activemmr_date@OData.Community.Display.V1.FormattedValue": "1/12/2026 8:46 PM",
      "fsip_activemmr_date": "2026-01-12T20:46:52Z",
      "fsip_specialconditions": null,
      "fsip_currentcontractenddate@OData.Community.Display.V1.FormattedValue": "12/4/2026",
      "fsip_currentcontractenddate": "2026-12-04",
      "lcd_servicefrequencywords": "Monthly",
      "fsip_cleanpithoistwaycartops@OData.Community.Display.V1.FormattedValue": "No",
      "fsip_cleanpithoistwaycartops": false,
      "fsip_5thyearescalation": null,
      "fsip_totalcontract": null,
      "_owningteam_value": null,
      "fsip_autorenew@OData.Community.Display.V1.FormattedValue": "No",
      "fsip_autorenew": false,
      "fsip_escalationpercent": null,
      "exchangerate@OData.Community.Display.V1.FormattedValue": "1.0000000000",
      "exchangerate": 1.000000000000,
      "fsip_excludefromcontractescalations@OData.Community.Display.V1.FormattedValue": "No",
      "fsip_excludefromcontractescalations": false,
      "fsip_annualsafetytest@OData.Community.Display.V1.FormattedValue": "No",
      "fsip_annualsafetytest": false,
      "fsip_nextservicedate@OData.Community.Display.V1.FormattedValue": "2/4/2026",
      "fsip_nextservicedate": "2026-02-04T12:00:00Z",
      "fsip_onhold@OData.Community.Display.V1.FormattedValue": "No",
      "fsip_onhold": false,
      "fsip_currentannualamount": null,
      "_createdby_value@OData.Community.Display.V1.FormattedValue": "Barbara Oliveira",
      "_createdby_value": "554d6842-59b6-ef11-b8e9-000d3a5a6b66",
      "fsip_activemmr_state@OData.Community.Display.V1.FormattedValue": "1",
      "fsip_activemmr_state": 1,
      "fsip_2ndyearescalation": null,
      "_fsip_wagecategory_value": null,
      "fsip_maintenancecontractid": "c4a6b438-32d1-f011-bbd3-000d3a302e4a",
      "fsip_contractreviewdate": null,
      "fsip_lastinvoicerollup_state@OData.Community.Display.V1.FormattedValue": "1",
      "fsip_lastinvoicerollup_state": 1,
      "fsip_invoiced_state@OData.Community.Display.V1.FormattedValue": "1",
      "fsip_invoiced_state": 1,
      "fsip_2ndyearescalation_base": null,
      "fsip_5thyearescalation_base": null,
      "fsip_proratedequipment": null,
      "_fsip_originatingcontract_value": null,
      "lcd_runcancelflow@OData.Community.Display.V1.FormattedValue": "No",
      "lcd_runcancelflow": 802290001,
      "fsip_nextbillingdate": null,
      "lcd_createcontractbilling": null,
      "fsip_lastinvoicerollup@OData.Community.Display.V1.FormattedValue": "1/1/2026",
      "fsip_lastinvoicerollup": "2026-01-01",
      "fsip_billingnote": null,
      "_fsip_salesperson_value": null,
      "fsip_invoiceconsolidationtype@OData.Community.Display.V1.FormattedValue": "By Contract",
      "fsip_invoiceconsolidationtype": 683440002,
      "fsip_4thyearescalation_base": null,
      "_fsip_billtocustomer_value@OData.Community.Display.V1.FormattedValue": "2278 BPE LLC",
      "_fsip_billtocustomer_value": "be986c45-32d1-f011-bbd3-000d3a302e4a",
      "fsip_costs@OData.Community.Display.V1.FormattedValue": "$0.00",
      "fsip_costs": 0.0000000000,
      "_owningbusinessunit_value@OData.Community.Display.V1.FormattedValue": "LCD Elevator",
      "_owningbusinessunit_value": "c9e85d8b-8fa0-ec11-b400-000d3a58d68e",
      "fsip_legacycontract": null,
      "fsip_printbillingnote@OData.Community.Display.V1.FormattedValue": "Yes",
      "fsip_printbillingnote": true,
      "timezoneruleversionnumber@OData.Community.Display.V1.FormattedValue": "4",
      "timezoneruleversionnumber": 4,
      "fsip_grossmargin@OData.Community.Display.V1.FormattedValue": "$731.16",
      "fsip_grossmargin": 731.1600000000,
      "fsip_payssafetyequipment": null,
      "_ownerid_value@OData.Community.Display.V1.FormattedValue": "Barbara Oliveira",
      "_ownerid_value": "554d6842-59b6-ef11-b8e9-000d3a5a6b66",
      "_fsip_primarybuildinglocation_value@OData.Community.Display.V1.FormattedValue": "2278 Bronx Park East",
      "_fsip_primarybuildinglocation_value": "e2d26c25-1caa-ec11-9840-000d3a307669",
      "fsip_lastinvoiced_date@OData.Community.Display.V1.FormattedValue": "1/12/2026 8:46 PM",
      "fsip_lastinvoiced_date": "2026-01-12T20:46:52Z",
      "fsip_invoiced_base@OData.Community.Display.V1.FormattedValue": "$731.16",
      "fsip_invoiced_base": 731.1600000000,
      "importsequencenumber": null,
      "fsip_escalationamount": null,
      "fsip_1styearescalation_base": null,
      "_owninguser_value": "554d6842-59b6-ef11-b8e9-000d3a5a6b66",
      "_transactioncurrencyid_value@OData.Community.Display.V1.FormattedValue": "US Dollar",
      "_transactioncurrencyid_value": "28c060c5-d1a0-ec11-b400-000d3a58d68e",
      "_fsip_productcb_value": null,
      "fsip_visitfrequency@OData.Community.Display.V1.FormattedValue": "30",
      "fsip_visitfrequency": 683440000,
      "fsip_3rdyearescalation_base": null,
      "_fsip_project_value": null,
      "_fsip_division_value@OData.Community.Display.V1.FormattedValue": "Maintenance",
      "_fsip_division_value": "9316e0ff-55a5-ec11-9840-000d3a5c16ba",
      "_fsip_contracttype_value@OData.Community.Display.V1.FormattedValue": "Limited Service",
      "_fsip_contracttype_value": "f13ce9c0-42a9-ec11-9840-000d3a307669",
      "fsip_sendescalationletter@OData.Community.Display.V1.FormattedValue": "No",
      "fsip_sendescalationletter": false,
      "lcd_braketestprice": "850",
      "utcconversiontimezonecode": null,
      "_createdonbehalfby_value": null,
      "fsip_numberofvisits": "1",
      "fsip_totalcontract_base": null,
      "fsip_grossmarginpercent@OData.Community.Display.V1.FormattedValue": "100.00",
      "fsip_grossmarginpercent": 100.00,
      "fsip_certificateofinsurance@OData.Community.Display.V1.FormattedValue": "No",
      "fsip_certificateofinsurance": false,
      "fsip_permitfeesbillable@OData.Community.Display.V1.FormattedValue": "No",
      "fsip_permitfeesbillable": false,
      "fsip_billingendon": null,
      "fsip_lastinvoiced@OData.Community.Display.V1.FormattedValue": "1/5/2026",
      "fsip_lastinvoiced": "2026-01-05T15:58:05Z",
      "fsip_internalnote": null,
      "fsip_escalationfrequency": null,
      "fsip_name": "2278 Bronx Park East",
      "fsip_workorderconsolidationtype@OData.Community.Display.V1.FormattedValue": "By Contract",
      "fsip_workorderconsolidationtype": 683440000,
      "fsip_addalldevicescontractbillings@OData.Community.Display.V1.FormattedValue": "No",
      "fsip_addalldevicescontractbillings": false,
      "fsip_lastescalationlettersent": null,
      "fsip_otminoradjustmentscbservice@OData.Community.Display.V1.FormattedValue": "No",
      "fsip_otminoradjustmentscbservice": false,
      "fsip_duration": null,
      "lcd_daystoexpire@OData.Community.Display.V1.FormattedValue": "-326.00",
      "lcd_daystoexpire": -326.0000000000,
      "fsip_3rdyearescalation": null,
      "fsip_invoicingmethod@OData.Community.Display.V1.FormattedValue": "Work Order Billing",
      "fsip_invoicingmethod": 683440001,
      "lcd_cat5fullloadbillable@OData.Community.Display.V1.FormattedValue": "Yes",
      "lcd_cat5fullloadbillable": 802290000,
      "fsip_cancelon": null,
      "fsip_originalcontractstartdate@OData.Community.Display.V1.FormattedValue": "12/4/2025",
      "fsip_originalcontractstartdate": "2025-12-04",
      "fsip_contractnumber": "MC-0003150",
